original_time,start_time,end_time,speech,price_change,volatility
2023-09-20 18:30:00,2023-09-20 18:30:00,2023-09-20 18:40:00," Good afternoon, everyone. My colleagues and I remain squarely focused on our dual mandate to promote maximum employment and stable prices for the American people. We understand the hardship that high inflation is causing, and we remain strongly committed to bringing inflation back down to our 2 percent goal. Price stability is the responsibility of the Federal Reserve. Without price stability, the economy does not work for anyone. In particular, without price stability, we will not achieve a sustained period of strong labor market conditions that benefit all. Since early last year, the FOMC has significantly tightened the stance of monetary policy. We've raised our policy interest rate by 5.25 percentage points and have continued to reduce our securities holdings at a brisk pace. We've covered a lot of ground, and the full effects of our tightening have yet to be felt. Today, we decided to leave our policy interest rate unchanged and to continue to reduce our securities holdings. Looking ahead, we are in a position to proceed carefully in determining the extent of additional policy firming that may be appropriate. Our decisions will be based on our ongoing assessments of the incoming data and the evolving outlook and risks. I will have more to say about monetary policy after briefly reviewing economic developments. Recent indicators suggest that economic activity has been expanding at a solid pace, and so far this year, growth in real GDP has come in above expectations. Recent readings on consumer spending have been particularly robust. Activity in the housing sector has picked up somewhat that would remain well below levels of a year ago, largely reflecting higher mortgage rates. Higher interest rates also appear to be weighing on business fixed investment. In our summary of economic projections, or SEP, committee participants revised up their assessments of real GDP growth, with the median for this year now at 2.1%. Participants expect growth to cool with the median projection falling to 1.5% next year. The labor market remains tight, but supply and demand conditions continue to come into better balance. Over the past three months, payroll job gains averaged 150,000 jobs per month, a strong pace that is nevertheless well below that scene earlier in the year. The unemployment rate ticked up in August, but remains low at 3.8%. The labor force participation rate has moved up since late last year, particularly for individuals aged 25 to 54 years. Nominal wage growth has shown some signs of easing, and job vacancies have declined so far this year. Although the jobs to workers gap has narrowed, labor demand still exceeds the supply of available workers. FOMC participants expect the rebalancing in the labor market to continue, easing upward pressures on inflation. The median unemployment rate projection in the SEP rises from 3.8% at the end of this year to 4.1% over the next two years. Inflation remains well above our longer run goal of 2%. Based on the consumer price index, or CPI, and other data, we estimate that total PCE prices rose 3.4% over the 12 months ending in August. In that excluding the volatile food and energy categories, core PCE prices rose 3.9%. Inflation has moderated somewhat since the middle of last year, and longer term inflation expectations appear to remain well anchored, as reflected in a broad range of surveys of households, businesses, and forecasters, as well as measures from financial markets. Nevertheless, the process of getting inflation sustainably down to 2% has a long way to go. The median projection in the SEP for total PCE inflation is 3.3% this year, falls to 2.5% next year, and reaches 2% in 2026. The Fed's monetary policy actions are guided by our mandate to promote maximum employment and stable prices for the American people. My colleagues and I are acutely aware that high inflation imposes significant hardship as it erodes purchasing power, especially for those least able to meet the higher costs of essentials, like food, housing, and transportation. We are highly attentive to the risks that high inflation poses to both sides of our mandate, and we are strongly committed to returning inflation to our 2% objective. As I noted earlier, since early last year, we have raised our policy rate by 5.25%. We see the current stance of monetary policy as restrictive, putting downward pressure on economic activity, hiring, and inflation. In addition, the economy is facing headwinds from tighter credit conditions for households and businesses. In light of how far we have come in tightening policy, the committee decided at today's meeting to maintain the target range for the federal funds rate at 5.25% and to continue the process of significantly reducing our securities holdings. We are committed to achieving and sustaining a stance of monetary policy that is sufficiently restrictive to bring inflation down to our 2% goal over time. In our SEP, FOMC participants wrote down their individual assessments of an appropriate path for the federal funds rate based on what each participant judges to be the most likely. Sorry, the most likely scenario going forward. If the economy evolves as projected, the median participant projects at the appropriate level of the federal funds rate will be 5.6% at the end of this year, 5.1% at the end of 2024, and 3.9% at the end of 2025. Compared with our June summary of economic projections, the median projection is unrevised for the end of this year, but has moved up by a half percentage point at the end of the next two years. These projections, of course, are not a committee's decision or plan if the economy does not evolve as projected the path of policy will adjust as appropriate to foster our maximum employment and price stability goals. We will continue to make our decisions meeting by meeting based on the totality of the incoming data and their implications for the outlook for economic activity and inflation as well as the balance of risks. Given how far we have come, we are in a position to proceed carefully as we assess the incoming data and the evolving outlook and risks. Real interest rates now are well above mainstream estimates of the neutral policy rate, but we are mindful of the inherent uncertainties in precisely gauging the stance of policy. We are prepared to raise rates further if appropriate, and we intend to hold policy at a restrictive level until we are confident that inflation is moving down sustainably toward our objective. In determining the extent of additional policy firming that may be appropriate to return inflation to 2% over time, the committee will take into account the cumulative tightening of monetary policy, the lags with which monetary sub-policy affects economic activity and inflation, economic and financial developments. We remain committed to bringing inflation back down to our 2% goal and keeping longer term inflation expectations well anchored. Reducing inflation is likely to require a period of below trend growth and some softening of labor market conditions. Restoring price stability is essential to set the stage for achieving maximum employment and stable prices over the longer run. To conclude, we understand that our actions affect communities, families and businesses across the country. Everything we do is in service to our public mission. We at the Fed will do everything we can to achieve our maximum employment and price stability goals. Thank you, and I look forward to your questions. Thank you, Colby Smith with the Financial Times. What makes the committee inclined to think that the Fed funds rate at this level is not yet sufficiently restrictive, especially when officials are forecasting a slightly more benign inflation outlook for this year. There's noted uncertainty about policy lags. Headwinds have emerged from the looming government shutdown, the end of federal childcare funding, resumption of student debt payments, things of that nature. So I guess I would characterize the situation a little bit differently. So we decided to maintain the target range for the federal funds rate where it is at five and a quarter to five and a half percent while continuing to reduce our security holdings. And we say we're committed to achieving and sustaining a stance of monetary policy that's sufficiently restrictive to bring down inflation at two percent of our time. We said that. But the fact that we decided to maintain the policy rate at this meeting doesn't mean that we've decided that we have or have not at this time reached that stance of monetary policy that we're seeking. If you looked at the SEP, as you obviously will have done, you will see that majority of participants believe that it is more likely than not that we will be appropriate for us to raise rates.",0.001513884809182764,0.0034598163809867
2023-09-20 18:30:00,2023-09-20 18:40:00,2023-09-20 18:50:00, more time in the two remaining meetings this year. Others believe that we have already reached that. So it's something where we're by by we're not making a decision by by deciding to about that question by deciding to just maintain the rate and await further data. So right now it's still an open question about sufficiently restrictive you're not saying today that we've reached this level. We're not saying no. No clearly we are just what we decided it was maintain the policy rate and await further data. We want to see convincing evidence really that we have reached the appropriate level and then you know we're we're seeing progress and we welcome that but you know we need to see more progress before we'll be willing to to reach that conclusion. And just on the 2024 projections what's behind that shallow path for interest rate cuts and the need for real rates to be 50 basis points higher. Right so I would say it this way for first of all interest rates real interest rates are positive now they're meaningfully positive and that's a good thing we need a policy to be restrictive so that we can get inflation down to target okay and we need that we're going to need that to remain to be the case for some time. So I think you know remember that the of course the SEP is not a plan that is negotiated or discussed really as a plan it's accumulation really and what you see are the medians. It's accumulation of individual forecasts from 19 people and then what you're seeing are the medians so I wouldn't want to you know bestow upon it the idea that it's really a plan but what it reflects though is that economic activity has been stronger than we expected stronger than I think everyone expected and and so what you're what you're seeing is this is what people believe as of now will be appropriate to achieve what we're looking to achieve which is progress toward our toward our inflation goal as you see in the SEP. Hi Chair Powell Rachel Seagull from the Washington Post thanks for taking our questions how would you characterize the debate around another hike or holding study is it discussion around lag times fear of too much slowing too little slowing could you walk us through what this disagreement was about at the meeting. Yeah so the proposal at the meeting was to was to maintain our current policy stance and and I think there was obviously unanimous support for that but this of course is an SEP meeting and so people write down what they think and you've got you have some you saw I think seven wrote down no hike at this at this meeting or between now and the end of the year and I think 12 wrote down another single hike in one of the next two meetings that we have between the end of the year so it wasn't like we were arguing over that people just stating their positions and really what what people are saying is let's see how the data come in you know we want to see you know we want to see we want to see that that this these good inflation readings that we've been seeing for the last three months we want to see that it's more than just three months right we want to see you know the the labor market report that we received the last one that received was a good example of we do what we do want to see it was a combination of you know of across a broad range of indicators continuing rebalancing of the labor market so those are the two things those are two mandate variables and and that's that's the progress that we want to see but I think people they want to be convinced you know they want to be careful to not to jump to a conclusion really one way or the other but just be convinced that the data you know support that conclusion and that's why given how far we've come and how quickly we've come we're actually in a position to be able to proceed carefully as we assess the incoming data and the evolving outlooks and risks and make these decisions meeting by meeting and in your view what would I know nothing has been decided yet but what would one more hike at the end of the year due to the economy or to inflation on and on the other side what would no hike do if you could sort of game that out for us so you know you can make the argument that one hike one where the other won't matter but for us we're trying we obviously as a group it's a pretty tight cluster of of where we think that that policy stance might be but we're always going to be learning from data you know we've learned all through the course of the last year that actually we needed to go further than we had thought if you go back a year and what we thought what we wrote down it's actually gotten higher and higher so we don't really know and until and that's why again we've grown a position to proceed carefully at this point a year ago we proceeded pretty quickly to get rates up now now we're fairly close we think to where we need to get it's just a question of reaching the right stance I wouldn't attribute huge importance to one hike in macroeconomic terms nonetheless you know we need we need to get to a place where we're confident that we have a stance that will bring inflation down to 2% over time that's what we need to get to and we've been you know we've been moving toward it as we've gotten closer to it we slowed the pace at which we've moved I think that was appropriate and now that we're getting closer we again we have the ability to proceed carefully see please miss Ian be seen miss share I want to return to Colby's question here what is it saying about the committee's view of the inflation dynamic in the economy that you achieve the same forecast inflation rate for next year but need another half a point over the funds rate on it does it tell you that there's tell us that the committee believes inflation to be more persistent requires more medicine effectively and I guess a related question is if you're going to project a funds rate above the longer run rate for four years in a row at what point do we start to think hey maybe the longer rate or the neutral rate is actually higher thank you so I guess I would point more to rather than pointing to a sense of inflation having become more persistent I wouldn't think that's not we've seen inflation be more persistent over the course of the past year but I wouldn't say that's something that's appeared in the recent data it's more about stronger economic activity I would say so if I had to attribute one thing again we're we're picking a median here and trying to attribute one explanation but I think broadly stronger economic activity means means rates we have to do more with rates and that's what that that's what that meaning is telling you in terms of what the neutral rate can be you know we know it by its works we only know it by its works really we can't we can't you know the models and that we use you ultimately you only know when you get there and by by the way the economy reacts and again that's another reason why we're we're moving carefully now because you know there are lags here so that it may it may of course be that the that the neutral rate has risen you do see people you don't see the median moving but you do see people raising their estimates of the neutral rate and it's certainly plausible that the neutral rate is higher than then the longer run rate remember what we write down in the SCP is the longer run rate it is certainly possible that you know that the that the neutral rate at this moment is higher than that and that that's part of the explanation for why the economy has been more resilient than than expected. Let's go ahead Howard. Howard Shetty with Rodgers thank you so you've said several times that the economy needed a period of below trend growth to get inflation consistently back to 2 percent you kind of get that in 2024 a little bit 1.5 percent is just a touch below what's the estimate of potential so the fact that you're getting so much done at so much less cost does that represent a change in how you think inflation works and change in how you think the economy works a change in the mix of supply healing versus demand destruction that's necessary to achieve this. Yes of course it is a it is a good thing that we we've seen now meaningful rebalancing in the labor market without an increase in unemployment and that's that's because we're seeing that rebalancing in other places in for example job openings and in the jobs worker gap you've also seen supply side things so that's happening. I would say though we still I still think and I think broadly people still think that we'll have to be some softening in the labor market that can come through more supply as we've seen as well. Also remember the natural rate we think is coming down which is a supply side thing so that the gap between any given unemployment rate that's lower than that and the natural rate comes down that's a way for supply that's a way for the labor market to achieve a better balance. So all of those things are happening you're right in in the median forecast we don't see a big increase in unemployment we do see an increase and but that's that really is just playing forward the trends that we've been seeing that is not guaranteed there there may come a time when unemployment goes up more than that but that's that's really what we've been seeing is progress without higher unemployment for now. So just to to boil that down for a second you know we've gone from a very narrow path to a to a soft landing to something different would you call the soft landing now a baseline expectation? No no I would not do that I would just say what would I say about that I've always thought that the soft landing was was a plaza,-0.0026622146015702,0.0030656455389767
