,title,publishedAt,description,content,url
28,"Federal Reserve set to raise interest rates again, ramping up fight against inflation",2022-05-04T05:43:13Z,The Federal Reserve is expected to raise its benchmark interest rate by twice the usual amount this week as it steps up its fight against inflation,"World shares were mostly lower on Wednesday as investors waited for a decision by the Federal Reserve on interest rates.Central banks in many countries are raising rates as inflation squeezes businesses and consumers. To counter that, regulators are gradually increasing costs for borrowing that had dipped to record lows during the pandemic.Fed policymakers are expected to raise the U.S. central bank's benchmark rate by twice the usual amount this week, ramping up their fight against inflation that is at a four-decade high. The Fed already has raised its key overnight rate once, the first such increase since 2018, and Wall Street is expecting several big increases over the coming months.""All eyes are peering toward the FOMC meeting and a rate hike is an absolute given,"" Clifford Bennett, chief economist at ACY Securities, said in a commentary.Germany's DAX edged down 0.1% to 14,028.26 while the CAC 40 in Paris lost 0.2% to 6,465.03. Britain's FTSE 100 shed 0.3% to 7,536.42. The futures for the S&P 500 and the Dow industrials both were 0.2% higher.In Asian trading, Hong Kong's Hang Seng dropped 1.1% to 20,861.27 while the Kospi in Seoul lost 0.1% to 2,677.57. Australia's S&P/ASX 200 gave up 0.2% to 7,304.70.India's Sensex lost 1% to 56,425.88. Taiwan's benchmark rose and most other regional markets were closed, including those in Japan and mainland China.The higher lending rates may crimp economic growth as they come at a time when surging prices are squeezing consumers' capacity to spend.Market players might pick up bargains on the assumption that the rate increase has already been taken into account, Bennett said. But he added that ""this excludes the on-going shock to consumers and particularly mortgage holders that will reverberate in an accelerating fashion throughout the economy. This 'pain' process will likely continue for the next one to three years in the real world.""Adding to that are the uncertainties brought by Russia's invasion of Ukraine.Russian forces unleashed artillery fire on towns in eastern Ukraine, killing and wounding dozens of civilians, and were storming a bombed-out steel mill containing the last pocket of resistance in Ukraine's besieged port city of Mariupol as more than 100 civilians evacuated from the bombed-out plant reached relative safety in Ukrainian held territory.Oil prices rose as the European Union said it was preparing new sanctions against Russian energy over the war in Ukraine, though Slovakia and Hungary said they would oppose such measures.Newly proposed sanctions drafted by the EU's executive branch, the European Commission, could include a phased-in embargo on Russian oil. That could strain supplies and push prices still higher.Benchmark U.S. crude rose $2.81 to $105.22 per barrel in electronic trading on the New York Mercantile Exchange. It gave up $2.76 on Tuesday.Brent crude oil, the basis for pricing international oils, gained $2.70 to $107.67 per barrel.Wall Street advanced Tuesday on hopes that the Fed won't shock the markets with more aggressive monetary tightening plans than expected. Investors will be watching to see how Fed Chair Jerome Powell frames the future outlook, analysts said.The S&P 500 ended 0.5% higher and the Dow Jones Industrial Average rose 0.5%. The Nasdaq inched up 0.2%, while the Russell 2000 added 0.9%.Investors have been closely reviewing the latest round of company earnings to get more details on how inflation is impacting business and consumer activity.They also are getting some updates on the labor market, which was slow to recover from the pandemic initially, but has grown stronger. The Bureau of Labor Statistics reported on Tuesday that employers posted a record 11.5 million job openings in March, meaning the United States now has an unprecedented two job openings for every person who is unemployed.On Friday, the Labor Department is expected to report that the economy generated another 396,000 new jobs in April, according FactSet. That would mark an unprecedented 12th straight month that hiring has come in at roughly 400,000 or more.The U.S. dollar fell to 130.05 Japanese yen from 130.11 yen late Tuesday. The euro was unchanged at $1.0522.",https://abc7.com/federal-reserve-interest-rate-fed-decision-today/11816778/
29,Open to close as focus turns to Fed,2022-05-04T05:06:54Z,European markets were lower on Wednesday as global investors await a crucial monetary policy decision from the U.S. Federal Reserve.,"LONDON — European markets pulled back on Wednesday as global investors await a crucial monetary policy decision from the U.S. Federal Reserve .
The Fed will announce its big interest rate decision on Wednesday afternoon, with markets largely expecting the central bank to hike rates by half a percentage point as it looks to rein in inflation, along with announcing a plan to cut its balance sheet from June.
The pan-European Stoxx 600 slid 0.6% by late morning. Retail stocks slid 2.1% to lead losses while oil and gas stocks climbed 0.9%.
""I think it's more just about investors trying to understand at what point tightening monetary policy actually starts to affect the real economy and real demand.""
Sunil Krishnan, head of multi-asset funds at Aviva Investors, told CNBC on Wednesday that the Fed was the key driver of stock market fluctuations so far this year, and would likely remain so.
""I think it's perhaps less about academic thinking in terms of 'how do I change the discount rate when I value a company?'"" he said.
""I think it's more just about investors trying to understand at what point tightening monetary policy actually starts to affect the real economy and real demand.""
Corporate earnings remain a key driver of individual share price movement in Europe. Volkswagen, UniCredit, Enel, Siemens Healthineers, Fresenius and TeamViewer were among those reporting before the bell on Wednesday.",https://www.cnbc.com/2022/05/04/europe-markets-open-to-close-as-focus-turns-to-fed.html
30,Dow Jumps 900 Points After Federal Reserve Hikes Interest Rates By Half-Percentage Point,2022-05-04T04:00:00Z,Markets surged higher after a widely-anticipated rate hike from the Federal Reserve.,"Topline
The stock market surged higher on Wednesday after the Federal Reserve raised interest rates by 0.5% in a move widely-anticipated by investors, as the central bank continues on its path of aggressive monetary policy tightening in a bid to combat surging inflation.
Federal Reserve chair Jerome Powell. Alex Brandon/ASSOCIATED PRESS
Key Facts
Stocks moved higher following the Federal Reserve’s announcement: The Dow Jones Industrial Average was up 2.9%, over 900 points, while the S&P 500 rose 3.1% and the tech-heavy Nasdaq Composite 3.3%. Investors cheered what was a widely expected move from the Federal Reserve, which hiked interest rates by a half-percentage point—the largest increase in over two decades—as it looks to combat historically high levels of inflation. The central bank also indicated that it would begin reducing its $9 trillion balance sheet by offloading bonds each month: Starting in June, roughly $30 billion of Treasurys and $17.5 billion of mortgage-backed securities will be rolled off. Traders expect the Federal Reserve to continue aggressively raising interest rates in the next few months, and with the federal funds rate now at a range of 0.75% to 1%, current market expectations are for the rate to reach 3% by the end of 2022. The central bank’s announcement was “overall about as dovish as could be expected while still showing that the Fed is serious about fighting inflation,” according to Cliff Hodge, chief investment officer for Cornerstone Wealth. The benchmark 10-year Treasury yield, meanwhile, briefly surpassed 3% before paring back gains somewhat, trading just below its highest level since 2018.
Crucial Quote:
The Federal Reserve “delivered what it had promised in terms of the rate hike and the balance sheet taper—and markets are reacting accordingly,” with no major sell-off occurring after the announcement, points out Quincy Krosby, chief equity strategist for LPL Financial.
What To Watch For:
The “black hole of tech negativity” in markets, with tech stocks continuing to get “demolished” as investors “puke out of this sector,” according to Vital Knowledge founder Adam Crisafulli.
Key Background:
Stocks are rebounding from a brutal sell-off in April, with experts warning of continued volatility ahead. The Dow and S&P 500 both recorded their worst month since March 2020, down 4.9% and 8.8%, respectively, while the Nasdaq posted its worst month since 2008, falling over 13%.
Further Reading:
Fed Authorizes Biggest Interest Rate Hike In 22 Years To Fight Inflation Amid 'Violent' Stock Sell-Off (Forbes)
Markets Inch Higher—But Experts Warn Of ‘Continued Volatility’ After ‘Brutal’ Stock Selloff (Forbes)",https://www.forbes.com/sites/sergeiklebnikov/2022/05/04/dow-jumps-600-points-after-federal-reserve-hikes-interest-rates-by-half-percentage-point/
31,Fed Raises Key Rate by a Half-Point in Bid to Tame Inflation,2022-05-04T04:00:00Z,The Federal Reserve intensified its fight against the worst inflation in 40 years by raising its benchmark short-term interest rate by a half-percentage point.,"WASHINGTON (AP) — The Federal Reserve intensified its fight against the worst inflation in 40 years by raising its benchmark short-term interest rate by a half-percentage point Wednesday — its most aggressive move since 2000 — and signaling further large rate hikes to come.
The increase in the Fed’s key rate raised it to a range of 0.75% to 1%, the highest point since the pandemic struck two years ago.
The Fed also announced that it will start reducing its huge $9 trillion balance sheet, which consists mainly of Treasury and mortgage bonds. Those holdings more than doubled after the pandemic recession hit as the Fed bought trillions in bonds to try to hold down long-term borrowing rates. Reducing the Fed’s holdings will have the effect of further raising loan costs throughout the economy.
All told, the Fed’s credit tightening will likely mean higher loan rates for many consumers and businesses over time, including for mortgages, credit cards and auto loans.
Speaking at a news conference Wednesday, Chair Jerome Powell made clear that further large rate hikes are coming.
“There is a broad sense on the committee,” he said, referring to the Fed, “that additional (half-point) increases should be on the table in the next couple of meetings.”
With prices for food, energy and consumer goods accelerating, the Fed’s goal is to cool spending — and economic growth — by making it more expensive for individuals and businesses to borrow. The central bank hopes that higher borrowing costs will slow spending enough to tame inflation yet not so much as to cause a recession.
It will be a delicate balancing act. The Fed has endured widespread criticism that it was too slow to start tightening credit, and many economists are skeptical that it can avoid causing a recession.
In their statement Wednesday, the central bank’s policymakers said they are “highly attentive to inflation risks.” The statement also noted that Russia’s invasion of Ukraine is worsening inflation pressures by raising oil and food prices. It added that “COVID-related lockdowns in China are likely to exacerbate supply chain disruptions,” which could further boost inflation.
Inflation, according to the Fed’s preferred gauge, reached 6.6% last month, the highest point in four decades. Inflation has been accelerated by a combination of robust consumer spending, chronic supply bottlenecks and sharply higher gas and food prices, exacerbated by Russia’s war against Ukraine.
Starting June 1, the Fed said it would allow up to $48 billion in bonds to mature without replacing them, a pace that would reach $95 billion by September. At September’s pace, its balance sheet would shrink by about $1 trillion a year.
Powell has said he wants to quickly raise the Fed’s rate to a level that neither stimulates nor restrains economic growth. Fed officials have suggested that they will reach that point, which the Fed says is about 2.4%, by year’s end.
The Fed’s credit tightening is already having some effect on the economy. Sales of existing homes sank 2.7% from February to March, reflecting a surge in mortgage rates related, in part, to the Fed’s planned rate hikes. The average rate on a 30-year mortgage has jumped 2 percentage points just since the start of the year, to 5.1%.
Yet by most measures, the overall economy remains healthy. This is especially true of the U.S. job market: Hiring is strong, layoffs are few, unemployment is near a five-decade low and the number of job openings has reached a record high.
Powell has pointed to the widespread availability of jobs as evidence that the labor market is tight – “to an unhealthy level” that would tend to fuel inflation. The Fed char is betting that higher rates can reduce those openings, which would presumably slow wage increases and ease inflationary pressures, without triggering mass layoffs.
For now, with hiring robust — the economy has added at least 400,000 jobs for 11 straight months — and employers grappling with labor shortages, wages are rising at a roughly 5% annual pace. Those pay raises are driving steady consumer spending despite spiking prices. In March, consumers increased their spending 0.2% even after adjusting for inflation.
Even if the Fed’s benchmark rate were to go as high as 2.5% by year’s end, Powell said last month, the policymakers may still tighten credit further — to a level that would restrain growth — “if that turns out to be appropriate.”
Financial markets are pricing in a rate as high as 3.6% by mid-2023, which would be the highest in 15 years. Shrinking the Fed’s balance sheet will add another layer of uncertainty surrounding how much the Fed’s actions may weaken the economy.
Complicating the Fed’s task is a slowdown in global growth. COVID-19 lockdowns in China are threatening to cause a recession in the world’s second-largest economy. And the European Union is facing higher energy prices and supply chain disruptions after Russia’s invasion of Ukraine.
What’s more, other central banks around the world are also raising rates, a trend that could further imperil global growth. On Thursday, the Bank of England is expected to raise its key rate for the fourth straight time. The Reserve Bank of Australia increased its rate Tuesday for the first time in 11 years.
And the European Central Bank, which is grappling with slower growth than in the United States or the United Kingdom, may raise rates in July, economists expect.",https://www.snopes.com/ap/2022/05/04/fed-raises-key-rate-by-a-half-point-in-bid-to-tame-inflation/
32,Fed's Powell: 75 basis point rate hike not being 'actively considered',2022-05-04T04:00:00Z,"Federal Reserve Chair Jerome Powell on Wednesday said central bank officials are not ""actively"" considering a rate hike of three-quarters of a percentage point at coming monetary policy meetings.","Federal Reserve Chair Jerome Powell testifies before the Senate Banking Committee in Washington, U.S., March 3, 2022. Tom Williams/Pool via REUTERS
May 4 (Reuters) - Federal Reserve Chair Jerome Powell on Wednesday said central bank officials are not ""actively"" considering a rate hike of three-quarters of a percentage point at coming monetary policy meetings.
""A 75 basis point increase is not something that the committee is actively considering,"" Powell said in response to a question at a press conference following the Fed's latest meeting, at which it decided to lift rates by half a percentage point and signaled more increases are coming.
Interest rate futures markets had been assigning a significant probability to the Fed lifting rates by three quarters of a point at its next meeting in June.
Register now for FREE unlimited access to Reuters.com Register
Reporting By Dan Burns Editing by Chizu Nomiyama
Our Standards: The Thomson Reuters Trust Principles.",https://www.reuters.com/world/us/feds-powell-75-basis-point-rate-hike-not-being-actively-considered-2022-05-04/
33,"Fed raises rates half a percentage point, its largest increase since 2000",2022-05-04T04:00:00Z,"The Federal Reserve raised interest rates by a half-percentage point and announced a plan to shrink its massive bond holdings, decisive measures aimed at tamping down the fastest inflation in four decades.","The quick pullback of monetary help is a sign that the central bank is getting serious about cooling down the economy and job market as rapid inflation persists and as officials grow nervous that it could become more permanent. Prices have been climbing at the fastest pace in 40 years for months now.
Wednesday’s move marked the Fed’s largest interest rate increase since 2000, and by shrinking its nearly $9 trillion balance sheet at the same time, the Fed is rapidly withdrawing support from the economy. Together, the policies are likely to ricochet through markets and the economy as money becomes more expensive to borrow.
The Federal Reserve raised interest rates by a half-percentage point and announced a plan to shrink its massive bond holdings, decisive measures aimed at tamping down the fastest inflation in four decades.
Advertisement
At a news conference after the decision Wednesday, Fed Chair Jerome Powell said that “inflation is much too high” and that the Fed is “moving expeditiously to bring it back down.”
Get Innovation Beat Boston Globe tech reporters tell the story of the region's technology and innovation industry, highlighting key players, trends, and why they matter. Enter Email Sign Up
He noted that policymakers could continue increasing rates by larger than normal increments as they did Wednesday.
“There is a broad sense on the committee that additional 50 basis point increases should be on the table at the next couple of meetings,” Powell said.
Policymakers spent much of 2021 hoping that inflation would ease on its own as supply shortages moderated and as the economy evened out after early pandemic disruptions. But normalcy has yet to return, and inflation has only accelerated. Now, fresh pandemic-related lockdowns in China and the war in Ukraine are further elevating prices for goods, food, and fuel. At the same time, workers are in short supply, and wages are rising rapidly in the United States, feeding into higher prices for services as consumer demand remains strong.
The “lockdowns in China are likely to exacerbate supply chain disruptions,” and the invasion of Ukraine “and related events are creating additional upward pressure on inflation and are likely to weigh on economic activity,” the Federal Open Market Committee statement for May said. “The committee is highly attentive to inflation risks.”
Advertisement
The Fed reiterated that “inflation remains elevated, reflecting supply and demand imbalances related to the pandemic, higher energy prices and broader price pressures.”
Fed officials have decided that they no longer have the luxury of waiting for inflation to moderate on its own and are expected to continue raising rates at their meetings throughout the year, with many investors expecting large increases in June and July. Some officials have even signaled that a 0.75 percentage point move could be possible, although Powell said that such a big increase is “not something the committee is actively considering.”
While the Fed acknowledged that inflation may remain fast as China supply disruptions and the war in Ukraine exacerbate price pressures, some analysts doubted that would warrant an even larger move.
“What they are trying to do is tell the market: Inflation could be higher in the near term,” Gennadiy Goldberg, a rates strategist at TD Securities, said of the Fed’s Ukraine and China references. “It doesn’t suggest that they should be hiking 75 basis points, because this isn’t the type of inflation the Fed can control.”
Deciding how quickly to remove policy support is a fraught exercise. Central bankers are hoping to move decisively enough to arrest the pop in prices without curbing growth so aggressively that they tip the economy into a painful recession. Yet engineering a so-called soft landing is likely to be a challenge.
Advertisement
Powell nodded to that balancing act, saying, “I do expect that this will be very challenging. It’s not going to be easy.” But he added, “I think we have a good chance to have a soft or soft-ish landing.”
The Fed plans to shrink its balance sheet starting in June by allowing securities to mature without reinvestment. It said Wednesday that it will ultimately let up to $60 billion in Treasury debt expire each month, along with $35 billion in mortgage-backed debt. That plan will have phased in fully as of September.
The Fed’s plan to reduce its holdings is likely to take steam out of financial markets and could help to cool the housing market as it lifts longer-term borrowing costs, reinforcing the effect of the central bank’s interest rate increases. The Fed’s anticipated moves have already begun to push mortgage rates higher.",https://www.bostonglobe.com/2022/05/04/business/fed-raises-rates-half-percentage-point-its-largest-increase-since-2000/
34,Fed jumps into field of financial land mines,2022-05-04T04:00:00Z,There’s a lot that could blow up in the Federal Reserve’s face. The U.S. central bank has little choice but to hike interest rates and shrink its balance sheet to fight inflation. But Chair Jay Powell’s moves make markets more vulnerable to shocks and could even tip the American economy into a recession.,"U.S. Federal Reserve Chair Jerome Powell testifies during the Senate Banking Committee hearing titled ""The Semiannual Monetary Policy Report to the Congress"", in Washington, U.S., March 3, 2022.
WASHINGTON, May 4 (Reuters Breakingviews) - There’s a lot that could blow up in the Federal Reserve’s face. The U.S. central bank has little choice but to hike interest rates and shrink its balance sheet to fight inflation. But Chair Jay Powell’s moves make markets more vulnerable to shocks and could even tip the American economy into a recession.
With inflation read more at a 40-year high, the Fed is rushing along the path to a more normal monetary policy. A central bank committee on Wednesday is expected to raise the official cost of borrowing by 0.5 percentage points, its biggest hike since 2000. It also will likely announce the start of reducing its $9 trillion balance sheet. That will probably mean eventually rolling off $95 billion in Treasury and agency mortgage-backed securities every month.
The shift makes the financial system more vulnerable to financial tremors read more . Take the $24 trillion Treasury market, where glitches exposed by the pandemic-induced selloff have yet to be fixed. In early 2020, a frantic “dash for cash” left the key financial market short of liquidity, prompting the Fed to step in. The central bank’s holdings of government bonds have more than doubled since February 2020 to reach about $5.8 trillion.
Register now for FREE unlimited access to Reuters.com Register
Liquidity problems could quickly resurface as the Fed sheds such assets. The Treasury market has sold off because of the central bank’s hawkish tone and worries about how that could hurt the economy. The ICE BofA Treasury Index is down 9% this year.
Bigger-than-expected rate hikes are another danger. A good chunk of investors project a series of 0.5 percentage point increases at the next Fed meetings, according to the CME FedWatch tool. But persistent inflation means markets now reckon there’s a 20% probability of the Fed raising rates by 0.75 percentage points in June, something the central bank hasn’t done since 1994. Over the last 60 years, tighter monetary policy has tended to be followed by a recession, according to Piper Sandler.
Meanwhile, the Fed is at the mercy of factors that could upset the American economy and throw its plans off track. Major turns in the war in Ukraine read more or additional supply-chain disruptions from Covid-19 lockdowns in China are possible hurdles. That all increases the risk of collateral damage as Powell navigates a field of financial land mines.
Follow @GinaChon on Twitter
(The author is a Reuters Breakingviews columnist. The opinions expressed are their own.)
CONTEXT NEWS
- The U.S. Federal Reserve is scheduled to conclude its two-day meeting on May 4. The Federal Open Market Committee is expected to raise the target range for the federal funds interest rate to between 0.75% to 1%, an increase of 0.5 percentage points.
- The Fed is also expected to announce the start of reducing its $9 trillion balance sheet. At the March meeting, FOMC participants generally agreed that maximum monthly reductions of about $60 billion for Treasury securities and about $35 billion for agency mortgage-backed securities would likely be appropriate. Those caps may be phased in.
Register now for FREE unlimited access to Reuters.com Register
Editing by Peter Thal Larsen and Sharon Lam
Our Standards: The Thomson Reuters Trust Principles.
Opinions expressed are those of the author. They do not reflect the views of Reuters News, which, under the Trust Principles, is committed to integrity, independence, and freedom from bias.",https://www.reuters.com/breakingviews/fed-jumps-into-field-financial-land-mines-2022-05-04/
