,title,publishedAt,description,content,url
8,"Stock market advances; SM Prime, Converge up",2022-05-04T12:15:00Z,The stock market bounced back Wednesday on profit taking ahead of what is expected to be the biggest Federal Reserve interest rate hike in more than two decades.,"The stock market bounced back Wednesday on profit taking ahead of what is expected to be the biggest Federal Reserve interest rate hike in more than two decades.
The Philippine Stock Exchange Index rose 81.65 points, or 1.2 percent, to 6,802.73 on a value turnover of P6.9 billion. Losers, however, beat gainers, 124 to 64, with 54 issues unchanged.
SM Prime Holdings Inc. of the Sy Group advanced 5 percent to P36.75, while noodles maker Monde Nissin Corp. climbed 3.7 percent to P13.90.
Fiber broadband provider Converge ICT Solutions Inc. increased 3.3 percent to P28.20, but Globe Telecom Inc., the second-biggest telecommunications firm, fell 2.3 percent to P2,222.
The rest of Asian equities fell in Asian trade Wednesday in nervous trading.
ADVERTISEMENT
With inflation showing little sign of easing from its 40-year highs, the US central bank has set itself on a hawkish course of tightening this year, sending shivers through world markets.
The prospect of higher borrowing costs has been compounded by a range of crises including the war in Ukraine, elevated oil prices and China’s COVID lockdowns that have strangled crucial global supply chains.
The Fed now has to walk a fine line between getting control of surging prices and making sure it does not knock the recovery in the world’s top economy off course.
“The Fed remains very focused on bringing inflation down, however, any further hawkish pivots will likely be tempered to some extent by the desire to achieve a soft landing,” said Blerina Uruci at T. Rowe Price.
The Fed is expected to announce a half-percentage point lift Wednesday—its biggest since 2000—but boss Jerome Powell’s post-meeting news conference will be closely watched for an idea about future hikes.
Speculation was swirling that 75 basis points could be on the table at some point this year.
“Powell will fall back to ‘we are not on pre-set rate hikes’ or something along those lines—’we go in with an open mind each meeting and will talk it over and we’ll see where we go from there’,” said Tony Farren, managing director at Mischler Financial Group.
“The market would take that as hawkish. For his comments to seem dovish, he’d have to shut down the talk of 75 basis points. And while I don’t think he’ll endorse it, I don’t think he’ll shut it down.”
After a broadly positive lead from Wall Street, Asian markets struggled in holiday-thinned trade.
Hong Kong, Sydney, Seoul, Mumbai and Singapore slipped, but Taipei rose while Wellington was flat.
Tokyo, Shanghai, Jakarta, Kuala Lumpur and Bangkok were closed.
Oil prices rose after European Commission president Ursula von der Leyen on Wednesday said the European Union would impose a gradual Russian oil ban in retaliation for the war in Ukraine.
The news offset the expected hit to demand from China’s coronavirus lockdowns, including in the country’s biggest city, Shanghai.
A huge release of crude from reserves by dozens of countries including the United States has also helped keep prices tempered.
Investors are waiting for a meeting Thursday of OPEC and other major producers including Russia, where they will discuss whether or not to lift output more than expected. With AFP
Please enable JavaScript to view the comments powered by Disqus.",https://manilastandard.net/business/business-stocks/314225907/stock-market-advances-sm-prime-converge-up.html
9,U.S. Federal Reserve expected to step up inflation fight with big interest rate hike,2022-05-04T11:57:46Z,A policy statement is due to be released at 2 p.m. EDT on Wednesday following the end of the Federal Reserve’s latest two-day meeting,"An eagle tops the Federal Reserve building's facade in Washington, on July 31, 2013.Jonathan Ernst/Reuters
The Federal Reserve on Wednesday is expected to raise interest rates by half of a percentage point and announce the start of reductions to its $9-trillion balance sheet as U.S. central bankers intensify efforts to bring down high inflation.
Fed policy-makers have widely telegraphed a double-barrelled decision that would lift the Fed’s short-term target policy rate to a range between 0.75 per cent and 1 per cent, and set in motion a plan to trim its portfolio of Treasuries and mortgage-backed securities (MBS) by as much $95-billion a month.
The policy statement is due to be released at 2 p.m. EDT (1800 GMT) following the end of the Fed’s latest two-day meeting.
Markets have priced in further rate increases through this year and into next, including at least a couple more half-percentage-point hikes, as traders bet the central bank moves much more quickly than it had anticipated it would in March to get borrowing costs up to where they will start actively curbing inflation.
With no fresh Fed economic or policy rate projections due until the central bank’s June meeting, most clues on how far and how fast it is prepared to go will come from Fed Chair Jerome Powell’s news conference, which starts at 2:30 p.m. EDT.
The Fed began its current round of policy tightening in mid-March with a quarter-percentage-point rate hike, smaller than many policy-makers had wanted given inflation had hit a 40-year high, but calibrated so as not to inject more uncertainty into global markets roiled by Russia’s Feb. 24 invasion of Ukraine.
In the weeks since that decision, inflation has gained new steam as the war pushed up oil and food prices and China’s strict lockdowns to combat the spread of COVID-19 further disrupted supply chains.
Data on the U.S. labour market also suggests increasing labour market tightness, with employment costs surging as businesses struggle to hold onto workers. A record number of job openings may also translate to higher wages that could also feed through to inflation.
All that is ratcheting up the pressure on the Fed to act more decisively to rein things in.
“Powell will continue to have a strong incentive to sound hawkish,” Piper Sandler economist Roberto Perli said this week. “The Fed’s focus these days is 100 per cent on bringing inflation down, and hawkish expectations help that cause.”
In the run-up to this week’s meeting, Powell has said he wants to get rates “expeditiously” to what Fed policy-makers regard as a “neutral” range of 2.25 per cent-2.5 per cent, and then higher if needed.
Most of his colleagues appear to be on board with at least the first part of that plan.
The aim would be to lift borrowing costs high enough and fast enough that households slow spending and businesses pare hiring in response, reducing inflation that is now about three times the Fed’s 2 per cent target.
But the central bank wants to avoid raising rates so high or so fast that it short-circuits the labour market and trips up the economy. The U.S. unemployment rate has only just dropped to 3.6 per cent, near the pre-pandemic level, and any large reversal could be a prelude to a recession.
The Fed has managed “soft landings” infrequently in the past, analysts say, and at this point has allowed inflation to rise so much faster than interest rates that it may have already missed its chance to do so.
And while it is expected to raise rates rather quickly now to compensate, the inflation path will also depend on a number of factors beyond the Fed’s control, including the evolution of the pandemic, the war in Ukraine, and ongoing supply and labour shortages connected to both.
The Fed’s plan to reduce its balance sheet will also be a focus on Wednesday. While the broad outlines were disclosed about three weeks ago in minutes of the Fed’s March meeting, investors expect to learn details of the speed and extent of the plan, including possible MBS sales at some point in the future.
Be smart with your money. Get the latest investing insights delivered right to your inbox three times a week, with the Globe Investor newsletter. Sign up today.",https://www.theglobeandmail.com/business/international-business/us-business/article-us-federal-reserve-expected-to-step-up-inflation-fight-with-big/
10,Stock market news live updates: Stock futures drift higher as traders brace for Fed decision,2022-05-04T11:39:48Z,"U.S. stock futures opened little changed Tuesday evening, with investors looking ahead to the Federal Reserve's latest monetary policy decision against the backdrop of elevated inflation and a still-tight U.S. labor market. Contracts on the S&P 500 and Nasdaq gained, while Dow futures dipped.","U.S. stock futures edged higher Wednesday morning, with investors looking ahead to the Federal Reserve's latest monetary policy decision against the backdrop of elevated inflation and a still-tight U.S. labor market.
Contracts on the S&P 500, Dow and Nasdaq each rose in pre-market trading. Treasury yields steadied, and the benchmark 10-year yield hovered just below 3%, or near its highest level since late 2018.
Investors are awaiting the Federal Reserve's monetary policy statement and press conference from Chair Jerome Powell later Wednesday afternoon. The central bank is widely expected to raise interest rates by 50 basis points for the first time since 2000. Such a hike would be double the 25 basis-point increase the Fed unleashed in mid-March, which itself had been the first rate hike since 2018. This would bring the target range for the federal funds rate between 0.75% and 1.00%, compared to the current range of between 0.25% and 0.50%.
Expectations for this supersized rate hike have built for weeks now amid market participants, especially given commentary from key Federal Reserve officials appearing to support such a move. Powell said during a public appearance with the International Monetary Fund earlier this month that he believed it would be ""appropriate ... to be moving a little more quickly"" on raising rates, and that 50 basis points were ""on the table"" for May. And the Fed is also expected to use the May meeting to announce the start of quantitative tightening, or rolling assets off the central bank's $9 trillion balance sheet.
Prospects of higher interest rates have stirred up volatility in equity markets, which had grown accustomed over the past two years to ultra-low interest rates and generally easy-money monetary policies. At the same time, however, many pundits have suggested the Fed allowed its pandemic-era supportive policies to run too long, allowing inflation to soar to the fastest rates since the 1980s. And after GDP growth turned negative in the U.S. in the first three months of the year, a lingering question remains whether the Fed will now be able to tighten policies without tipping the economy into a deep downturn.
Story continues
""Because the market has priced in a 50 basis point rate hike at the Federal Reserve's May meeting, the focus will immediately shift to just how many half-point hikes the Fed expects to initiate over the balance of 2022,"" Danielle DiMartino Booth, CEO and chief strategist of Quill Intelligence, wrote in an email Tuesday. ""The Fed would shock markets if it failed to deliver on more aggressive policy via a 50 basis point rate hike on Wednesday.""
""The Federal Reserve's credibility is on the line, given the surge in inflation, which has proved to be anything but transitory,"" Booth added. ""Interest rates are too low and markets have been way too accustomed to almost unlimited liquidity from the Fed's bond purchases. Powell's greatest folly would be to insist that the economy is very strong in the face of overwhelming evidence that it is slowing and slowing fast.""
—
7:39 a.m. ET: Uber posts better-than-expected quarterly results, guidance
Uber (UBER) posted estimates-topping first-quarter results and current-quarter guidance Wednesday morning, with the ride-hailing company signaling it was working through driver shortages while maintaining solid profitability.
Revenue more than doubled during the first quarter to reach $6.9 billion, topping estimates for $6.1 billion, according to Bloomberg-compiled data. Adjusted EBITDA increased to $168 million, also coming in ahead of the $135 million expected. Trips during the first quarter increased by 18% over last year to reach 17.1 billion, underscoring the ongoing recovery in rider demand.
For the current quarter, Uber said it sees gross bookings coming in between $28.5 million and $29.5 billion, and adjusted EBITDA of between $240 million and $270 million.
Uber shares pared losses in early trading following the results. Earlier during the overnight session, Uber shares had slumped in sympathy with Lyft's stock, which slid after the ride-hailing company offered a current-quarter revenue and profit forecast that fell short of analyst expectations.
Uber was previously scheduled to report its quarterly results after market close on Wednesday, but after Lyft's report, ""rescheduled to provide a more timely update on the company’s performance and guidance before the market opens,"" according to a statement.
—
7:29 a.m. ET Wednesday: Stock futures gain
Here's where markets were trading ahead of the opening bell
S&P 500 futures ( ES=F ) : +16.75 points (+0.4%) to 4,186.00
Dow futures ( YM=F ) : +122 points (+0.37%) to 33,155.00
Nasdaq futures ( NQ=F ): +44.75 points (+0.34%) to 13,132.25
Crude ( CL=F ) : +$3.88 (+3.79%) to $106.29 a barrel
Gold ( GC=F ) : -$4.30 (-0.23%) to $1,866.30 per ounce
10-year Treasury (^TNX): +0.4 bps to yield 2.962%
—
6:01 p.m. ET Tuesday: Stock futures open mixed
Here's where markets were trading Tuesday evening:
S&P 500 futures ( ES=F ) : +1.5 points (+0.04%) to 4,170.75
Dow futures ( YM=F ) : -2 points (-0.01%) to 33,031.00
Nasdaq futures (NQ=F): +22.75 points (+0.17%) to 13,110.25
NEW YORK, NEW YORK - APRIL 28: Traders work on the floor of the New York Stock Exchange (NYSE) on April 28, 2022 in New York City. The Dow Jones Industrial Average was up in morning trading as markets continued to move through a period of volatility over inflation concerns and the war in Ukraine. (Photo by Spencer Platt/Getty Images)
—
Emily McCormick is a reporter for Yahoo Finance. Follow her on Twitter.
Read the latest financial and business news from Yahoo Finance
Follow Yahoo Finance on Twitter, Instagram, YouTube, Facebook, Flipboard, and LinkedIn",https://ca.finance.yahoo.com/news/stock-market-news-live-updates-may-4-2022-221335159.html
11,EMERGING MARKETS-Indian shares lead EM lower after surprise RBI rate hike ahead of Fed,2022-05-04T11:25:15Z,"MSCI's index of developing world shares deepened losses in its third straight session of declines, down 0.6%. Indian shares posted their worst session in two months, while the 10-year benchmark bond yield jumped to 7.41%, its highest level since May 2019, after the Reserve Bank of India hiked the key interest rate by 40 basis points in an off-cycle meeting to rein in inflation.","Indian shares slumped 2.3% and yields on the benchmark 10-year bond jumped after a surprise interest rate hike which came just hours ahead of a much-awaited monetary policy decision by the U.S. Federal Reserve.
Emerging markets shares were already jittery ahead of the Fed decision as investors look for clues on its thinking about the future pace of hikes, with a 50 basis point increase already priced in. MSCI's index of developing world shares deepened losses in its third straight session of declines, down 0.6%.
Indian shares posted their worst session in two months, while the 10-year benchmark bond yield jumped to 7.41%, its highest level since May 2019, after the Reserve Bank of India hiked the key interest rate by 40 basis points in an off-cycle meeting to rein in inflation. The rupee briefly hit 76.18 a dollar, before trading back at levels before the decision. It was last at 76.34.
""Looking ahead, further rate hikes look nailed on. After all, the rise in headline inflation (in India) has further to run... We now expect the repo rate to end this year at 5.65%,"" said Shilan Shah, senior India economist at Capital Economics. The impact on the equity market is likely to be negative in the short term, said Sujan Hajra, chief economist at Anand Rathi Securities.
Further curbing risk appetite, the European Union proposed a phased oil embargo on Russia in its sixth sanctions package over Moscow's invasion of Ukraine. The proposal also included sanctions on Russia's top bank and banning its broadcasters from European airwaves. But Russia's rouble jumped to around two-year highs against both the dollar and the euro, supported by strong capital controls. The offshore rouble was at around 66 to the dollar. In Moscow it was at around 68, recovering sharply over two months from its all-time low of 121 per dollar hit in March.
With more sanctions against Russian oil spurring global crude prices, oil-importing countries such as India, the Philippines, and Turkey face more pain. In more central bank news, Pakistan named Murtaza Syed, a deputy governor of the bank as its new chief as the country restarts talks with the International Monetary Fund (IMF) on a stalled $6 billion program.
Syed will take over upon the expiry of the three-year term of incumbent Reza Baqir, Finance Minister Miftah Ismail said on Wednesday. Pakistan markets were closed for Eid-ul-Fitr.
For GRAPHIC on emerging market FX performance in 2022, see http://tmsnrt.rs/2egbfVh For GRAPHIC on MSCI emerging index performance in 2022, see https://tmsnrt.rs/2OusNdX For TOP NEWS across emerging markets
For CENTRAL EUROPE market report, see For TURKISH market report, see
For the RUSSIAN market report, see",https://www.devdiscourse.com/article/business/2025077-emerging-markets-indian-shares-lead-em-lower-after-surprise-rbi-rate-hike-ahead-of-fed
12,Federal Reserve expected to deliver heavy blow to control rising inflation,2022-05-04T11:01:00Z,The Federal Reserve on Wednesday will conclude a two-day policy meeting and is expected to move against surging inflation -- including possibly making its highest interest rate hike in decades.,"1/5
American flags hang outside the New York Stock Exchange on Wall Street in New York City. The policy meeting on Wednesday is expected to deliver the Fed's biggest blow yet against rising inflation in the United States. File Photo by John Angelillo/UPI | License Photo
May 4 (UPI) -- The Federal Reserve on Wednesday will conclude a two-day policy meeting and is expected to move against surging inflation -- including possibly making its highest interest rate hike in decades. The Fed last met in the middle of March when it raised rates by a quarter-point. It was the first time it raised the federal funds rate since 2018 and followed two years of rate decreases and emergency actions to counter the COVID-19 pandemic. Advertisement
At the end of its meeting Wednesday, the Federal Open Markets Committee is expected by many analysts to order a rate hike of a half-point -- which would be its largest single hike in 22 years.
Many investors have said they also expect the Fed to make similar rate increases at each of its next three policy meetings -- in June, July and September.
Advertisement
The move would be the Fed's biggest punch yet against inflation, which rose over the 12 months ending in March by close to 7% -- the steepest clip since 1982.
Last week, the Commerce Department reported that the Personal Consumption Expenditures price index -- a top indicator of inflation -- rose by 6.6% and gross domestic product -- the total output of all goods and services -- shrank unexpectedly by 1.4% when most economists expected modest growth of about 1%.
The Federal Reserve's target range -- the clip by which it prefers to see inflation rise on an annual basis -- is 2%. The gauge in March indicated an inflationary surge at more than three times that rate.
Further, high demand has outpaced what businesses are able to deliver as some employers struggling to find enough workers to operate at normal efficiency.
The Labor Department said on Tuesday that job openings by the end of March reached 11.5 million -- a record -- against about 6.3 million separations. That means there are roughly two open positions for every unemployed adult in the United States.
Advertisement
In addition to hiking interest rates, the Fed is also expected to announce the start of a program to wind down its $9 trillion balance sheet by $95 billion per month, beginning in June.
Federal Reserve Chairman Jerome Powell said this week that the central bank is aiming for what economists call a ""soft landing"" as it seeks to raise interest rates to discourage spending enough to lower inflation without triggering a recession.
""That's our goal,"" he said. ""I don't think you'll hear anyone at the Fed say that's going to be straightforward or easy.""
In order to achieve this, Fed policymakers said at the March meeting that rates would need to rise nearly 2 points this year and even more in 2023. That would require the central bank to hike rates aggressively to start and then monitor the performance of the economy and adjust the pace of increases accordingly, Powell said at the International Monetary Fund forum last month.
""It is appropriate in my view to be moving a little more quickly,"" he said. ""I also think there's something in the idea of a front-end loading whatever accommodation one thinks is appropriate.""
Advertisement
While most expect a half-point increase Wednesday, economists at JPMorgan say there's a 20% chance that the Fed will go for a three-quarter-point hike, but the market did not price in that possibility heading into the meeting.
""It seems like they're dead set on hiking rates enough to kill inflation,"" Jim Caron, chief fixed income strategist on the global fixed income team at Morgan Stanley Investment Management, said according to CNBC. ""But that's the real debate.
""Are they trying to get target inflation by 2024? If they are, the wage inflation is pretty high and that will require even more tightening than the Fed is projecting.""
One thing seems certain -- the Fed will hike rates on Wednesday by some measure. Leaving them unchanged wouldn't do anything to address riding prices in the United States, which President Joe Biden has promised to get control of.
One of the primary drivers of inflation over the past year has been the rising cost of gas. AAA on Wednesday listed a national average of $4.23, which is 2 cents higher than it was Tuesday and about 10 cents higher than a week ago.
Advertisement
For a time in recent weeks, prices at the pump were going down -- the result of improving market conditions and policy actions by President Joe Biden. The ongoing war in Ukraine, and the U.S. embargo of Russian oil, and the onset of the busier summer driving season are causing prices to tick back up.
Rising rates, which would make it more expensive for Americans to take out a loan or carry a balance on a credit card, also raises the interest on buying a home.
Last month, Freddie Mac said that rates for a 30-year fixed-rate mortgage hit an average of more than 5% -- nearly 2% above from where they were a year ago. Home purchases have slowed across the country due to rising mortgage rates, limited inventory and in anticipation of the Fed's rate hike Wednesday.
As a result of the fluid market conditions, sales of existing homes have declined by close to 3%, the National Association of Realtors said according to the most recent data available.
However, in some of the nation's fastest-growing markets, such as New York's Hudson Valley, realtors have reported steady sales.
""In the past two months, interest rates have gone from 3.5% to 5.5%, which is a dramatic increase, and I don't see that that's affecting competition at all,"" Ryan Basten, a broker associate in Ulster County, N.Y., told The Washington Post. ""If it gets to 6, 7 or 8%, then people may have a knee-jerk reaction to that, but I haven't seen it yet.""
Advertisement
Biden is scheduled to make remarks about the Fed's decision on Wednesday afternoon. He will deliver the remarks in the Roosevelt Room of the White House at 2 p.m. EDT, which is the same time the Fed's rate hike will be announced.",https://www.upi.com/Top_News/US/2022/05/04/federal-reserve-inflation-economy-gas-prices/3971651629371/
13,Fed raises interest rates by half a percentage point,2022-05-04T10:21:42Z,The Federal Reserve is attempting to get a handle on the worst inflation America has seen in 40 years.,"New York (CNN Business) The Federal Reserve said Wednesday it is raising interest rates by a half-percentage point to get a handle on the worst inflation America has seen in 40 years.
It's the first time in 22 years that the central bank has hiked rates this much.
In March, it ramped up its benchmark borrowing rate for the first time since late 2018, increasing it by a quarter-percentage point.
The central bank cited high inflation, as well as the strong labor market in its post-meeting statement.
Americans are struggling with rising costs everywhere from the grocery store to the gas pump. And with the Russia-Ukraine conflict still raging, price pressures on food and energy are unlikely to abate any time soon.
Read More",https://edition.cnn.com/2022/05/04/economy/federal-reserve-interest-rate-hike/index.html
