id,sentence
164,"TORONTO — Losses in the energy sector helped lead Canada's main stock index lower in late-morning trading as it fell more than 100 points, while U.S. markets also fell ahead of the U.S. Federal Reserve's latest interest rate decision this afternoon."
165,"The S&P/TSX composite index was down 104.18 points at 20,663.20."
166,"In New York, the Dow Jones industrial average was down 256.31 points at 33,829.73."
167,"The S&P 500 index was down 12.01 points at 4,064.59, while the Nasdaq composite was down 28.03 points at 11,556.52."
168,The Canadian dollar traded for 75.02 cents US compared with 74.91 cents US on Tuesday.
169,The March crude contract was down 69 cents at US$78.18 per barrel and the March natural gas contract was down 12 cents at US$2.56 per mmBTU.
170,"The April gold contract was up US$1.40 at US$1,946.70 an ounce and the March copper contract was down eight cents at US$4.15 a pound."
171,"This report by The Canadian Press was first published Feb. 1, 2023."
172,"Companies in this story: (TSX:GSPTSE, TSX:CADUSD=X)
 The Canadian Press
 
 
 TORONTO — Losses in the energy sector helped lead Canada's main stock index lower in late-morning trading as it fell more than 100 points, while U.S. markets also fell ahead of the U.S. Federal Reserve's latest interest rate decision this afternoon."
173,"TORONTO — Losses in the energy sector helped lead Canada's main stock index lower in late-morning trading as it fell more than 100 points, while U.S. markets also fell ahead of the U.S. Federal Reserve's latest interest rate decision this afternoon."
174,"The S&P/TSX composite index was down 104.18 points at 20,663.20."
175,"In New York, the Dow Jones industrial average was down 256.31 points at 33,829.73."
176,"The S&P 500 index was down 12.01 points at 4,064.59, while the Nasdaq composite was down 28.03 points at 11,556.52."
177,The Canadian dollar traded for 75.02 cents US compared with 74.91 cents US on Tuesday.
178,The March crude contract was down 69 cents at US$78.18 per barrel and the March natural gas contract was down 12 cents at US$2.56 per mmBTU.
179,"The April gold contract was up US$1.40 at US$1,946.70 an ounce and the March copper contract was down eight cents at US$4.15 a pound."
180,"This report by The Canadian Press was first published Feb. 1, 2023."
181,"Companies in this story: (TSX:GSPTSE, TSX:CADUSD=X)
 The Canadian Press
 
 
 If the Federal Reserve really wants to move some of the mountain of cash now residing in its overnight reverse repo facility, technical changes in its rate control toolkit would do the trick, some central bank watchers say."
182,"NEW YORK, Feb 1 (Reuters) - If the Federal Reserve really wants to move some of the mountain of cash now residing in its overnight reverse repo facility, technical changes in its rate control toolkit would do the trick, some central bank watchers say."
183,"The tweaks they envision are not shifts in the federal funds target rate, the central bank’s main tool for influencing the economy to achieve its job and inflation goals."
184,"Instead, it comes down to changing the setting of two other rates relative to the fed funds range in a way that departs from recent practice but could nudge money market funds to seek another home for some of the $2 trillion a day now deposited at the Fed."
185,Those two rates exist to keep the market-driven fed funds rate in the desired range.
186,"One, called the reverse repo rate, sets a floor underneath short-term rates, while another, which pays deposit-taking banks to park cash at the Fed, sets the high end."
187,"The reverse repo facility takes in cash from money market funds and other eligible firms, and currently pays an annualized rate of 4.30% for overnight loans of cash, compared to the current federal funds rate range of between 4.25% and 4.5%."
188,The Fed is widely expected to raise the target rate to 4.5% to 4.75% at Wednesday's Federal Open Market Committee meeting.
189,"If it sticks to recent practice, it will raise the reverse repo and the interest on reserve balances rate, now at 4.4%, by the same 25 basis point increment."
190,"TWEAK NOW OR LATER
 But some Fed watchers say the central bank has a choice, one it could take this week or later."
191,"And if it does do a tweak now, it would be unlike past tweaks."
192,"Those adjustments happened purely to ensure control of the fed funds rate, while this sort of move would speak more directly to bigger monetary policy concerns around managing the size of its $8.5 trillion balance sheet."
193,The reverse repo facility has seen sustained inflows of over $2 trillion per day since last June and has failed to contract as many policymakers expected.
194,"On many days, the facility offers the highest overnight rate available to many firms, so it’s a no brainer for them to skip the private market and park cash at the Fed."
195,"“If [policymakers] wanted a small balance sheet, they could reduce the overnight [reverse repo rate]” relative to the federal funds rate “and that would drive money out of overnight [reverse repo,] drive it into reserves,” which would in turn give them more space to cut the size of their balance sheet, said William English, a finance professor at the Yale School of Management who is formerly a top Federal Reserve staff member."
196,"Given the strong chance of a quarter percentage point increase Wednesday, Bill Nelson, who is also a former top Fed staffer and now serves as chief economist with Bank Policy Institute, said the Fed could once again make the reverse repo rate match the bottom end of the new federal funds rate range, with the interest on reserves rate matching the top."
197,"Doing this change now ""would probably be easier to explain and less newsworthy than making the change at some other time or to some other configuration,” Nelson said."
198,"The Fed has tweaked the relative rate settings several times since adopting its so-called abundant-reserves approach after the financial crisis, and pursuing Nelson’s suggestion would mark the first time since June 2018 that the interest on reserves and reverse repo rates were set to match the upper and lower bounds of the fed funds range."
199,Some in the market fear rate control toolkit tweaks might create unneeded headaches if done too aggressively.
200,"Scott Skyrm, of money market trading firm Curvature Securities, warned that should the Fed straight up hold the reverse repo rate at 4.3%, which would be unlikely, ""it would create a severe dislocation in overnight rates…Imagine $2 trillion entering the repo market over a course of a few days.”
 Instead, Skrym expects the Fed to bump the two rates up by the same amount as the federal funds rate on Wednesday, in line with its recent practice."
201,"Reporting by Michael S. Derby; Editing by Dan Burns and Andrea Ricci
 Our Standards: The Thomson Reuters Trust Principles."
202,"U.S. job openings unexpectedly rose in December, showing demand for labor remains strong despite higher interest rates and mounting fears of a recession, which could keep the Federal Reserve on its policy tightening path."
203,"Summary Job openings increase 572,000 to 11 million in December
 Manufacturing activity slumps further in January
 Private payrolls increase by 106,000 in January
 WASHINGTON, Feb 1 (Reuters) - U.S. job openings unexpectedly rose in December, showing demand for labor remains strong despite higher interest rates and mounting fears of a recession, which could keep the Federal Reserve on its policy tightening path."
204,"There were 1.9 job openings for every unemployed person in December, the Labor Department's monthly Job Openings and Labor Turnover Survey, or JOLTS report, showed on Wednesday."
205,Signs of persistent labor tightness were unlikely to change expectations that the U.S. central bank would further slow the pace of its rate hikes when policymakers concluded a two-day meeting later on Wednesday.
206,"""This could well be the first recession in history without material job losses,"" said Christopher Rupkey, chief economist at FWDBONDS in New York."
207,"""It's a good thing for the Fed that inflation pressures are cooling because the labor market isn't cooling at all."""
208,"Job openings, a measure of labor demand, increased by 572,000 to a five-month high of 11.0 million on the last day of December."
209,Economists polled by Reuters had forecast 10.250 million job openings.
210,"Accommodation and food services led the increase in job openings, with unfilled jobs rising by 409,000."
211,Employment in the industry remains below its pre-pandemic level.
212,"There were 134,000 more openings in retail trade."
213,"Construction, which has been hammered by higher borrowing costs, had 82,000 additional vacancies."
214,The job openings rate up shot to 6.7% from 6.4% in November.
215,Hiring increased to 6.2 million from 6.0 million.
216,The hires rate rose to 4.0% from 3.9% in November.
217,"The gap between job openings and hiring suggests wage growth could remain elevated, though it cooled in the fourth quarter."
218,"JOLTS
 The U.S. central bank is expected to raise its policy rate by 25 basis points on Wednesday."
219,"The Fed last year raised its policy rate by 425 basis points from the near-zero level to a 4.25%-4.50% range, the highest since late 2007."
220,Aggressive monetary policy tightening has left economists expecting a recession by the second half of the year.
221,The housing market has slumped and the downturn in manufacturing is intensifying.
222,A separate report from the Institute for Supply Management (ISM) on Wednesday showed its manufacturing PMI dropped to 47.4 in January from 48.4 in December.
223,The third straight monthly contraction pushed the index to the lowest level since May 2020 and below the 48.7 mark viewed as consistent with a recession in the broader economy.
224,U.S. stocks were trading lower.
225,The dollar fell against a basket of currencies.
226,U.S. Treasury prices rose.
227,"ISM PMI
 LAYOFFS LOW
 Despite the deterioration in conditions, factories did not appear to be laying off workers in large numbers."
228,"That was reinforced by the JOLTS report, which showed layoffs climbing to 1.5 million in December from 1.4 million in November."
229,The layoffs rate edged up to 1.0% from 0.9% in November.
230,Workers also continued to voluntarily quit their jobs in December.
231,"The quits rates, which is viewed as a measure of labor market confidence, was unchanged at 2.7%."
232,"A third report showed private employment increased by 106,000 jobs last month after rising by 253,000 in December, well below economists' expectations for a gain of 178,000."
233,"The ADP National Employment report, however, attributed the weaker-than-expected private payrolls gain to bad weather in mid-January, including flooding in California."
234,"The ADP report, jointly developed with the Stanford Digital Economy Lab, was published ahead of the release on Friday of the Labor Department's more comprehensive and closely watched employment report for January."
235,The ADP report has been a poor predictor of private payrolls in the Labor Department employment report.
236,"""The muted increase in the ADP measure of private payroll employment will add to fears that the malaise in activity has spread to the labor market,"" said Paul Ashworth, chief North America economist at Capital Economics in Toronto."
237,"""We would still urge caution about relying too much on the ADP measure, particularly in January when firms purge payroll records of employees who may not have worked for months."""
238,"According to a Reuters survey of economists, nonfarm payrolls likely increased by 185,000 jobs in January after rising by 223,000 in December."
239,"Reporting by Lucia Mutikani; Editing by Chizu Nomiyama and Paul Simao
 Our Standards: The Thomson Reuters Trust Principles."
240,"The Federal Reserve raised its target interest rate by a quarter of a percentage point on Wednesday, yet continued to promise ""ongoing increases"" in borrowing costs as part of its still unresolved battle against inflation."
241,"NEW YORK, Feb 1 (Reuters) - The Federal Reserve raised its target interest rate by a quarter of a percentage point on Wednesday, yet continued to promise ""ongoing increases"" in borrowing costs as part of its still unresolved battle against inflation."
242,"The decision lifted the benchmark overnight interest rate to a range between 4.50% and 4.75%, a move widely anticipated by investors and flagged by U.S. central bankers ahead of this week's two-day policy session."
243,"MARKET REACTION:
 STOCKS: U.S. stocks fell after the Fed statement, but the Nasdaq recovered, last flat on the day."
244,BONDS: U.S. Treasury yields trimmed losses after the Fed decision; 10-year last down at 3.48%.
245,FOREX: The U.S. dollar pared losses after the Fed statement.
246,"COMMENTS:
 MICHELE RANERI, VICE PRESIDENT AND HEAD OF U.S. RESEARCH AND CONSULTING, TRANSUNION, CHICAGO
 ""This second consecutive lower hike serves as evidence that the Federal Reserve is signaling that significant progress has been made in tamping down inflation and that we have reached a point where rate hikes can be further scaled back."
247,"Consumers will likely continue to feel the double-edged effects of both continued inflation and high interest rates for at least a while longer and may seek to shed high interest-debt via personal loans or other lower-interest loan products."""
248,"ELLEN HAZEN, CHIEF MARKET STRATEGIST, F.L.PUTNAM INVESTMENT MANAGEMENT, WELLESLEY, MASSACHUSETTS
 ""The key thing the Fed is focused on is wages and we are seeing wage inflation continue to ameliorate if you look at both average hourly earnings and the employment cost index which just came out, wages are beginning to soften, but they are not softening enough to get inflation down to that 2% target."
249,"They are specifically looking at the non-housing services portion of the PCE and as long as wages are still growing at 5-ish% you are not going to see the Fed back off."""
250,"""One thing that struck me about the statement is that they had a very slightly dovish change in the language where they previously had talked about determining the pace of future increases and now they are talking about determining the extent of future increases."
251,"So they did 25, the market is pricing in two more 25s, that is probably right but the question is going to be what is the terminal rate, when do they stop and when do they start to cut again."
252,"But what they have said here is this is a little more dovish than it might have been because they are not talking about the pace anymore."""
253,"""This basically takes 50 off the table, not that it was necessarily on, but the language last time could have defended 50 and now that is off the table."
254,"They have to see those wages come down."""
255,"RYAN DETRICK, CHIEF MARKET STRATEGIST, CARSON GROUP, OMAHA
 ""The Fed threw no curve balls, as they did what was widely expected."
256,"The door is cracking open to end rate hikes, but they still have a chance for one more rate hike at the next meeting."""
257,"""The economy is still growing, which is comforting as (the Fed is) not worried of an impending recession."""
258,"""Investors should be happy that we likely have a Fed that is going to end hikes fairly soon as the inflation data continues to show major improvements, which is exactly what the Fed needs to take their foot off the pedal."""
259,"""Yesterday's Employment Cost Index was an improvement, and Powell said he needed to see employment costs improve before he stops hiking rates."
260,"How close are we now with ending the rate hike cycle, when it’s clear employment costs are slowing?"""
261,"Compiled by the Global Finance & Markets Breaking News Team
 Our Standards: The Thomson Reuters Trust Principles."
262,"Stock indexes fell on Wednesday ahead of the Federal Reserve's decision on interest rates later in the day, while an upbeat outlook from Advanced Micro Devices lifted chipmakers."
263,"Stock indexes fell on Wednesday ahead of the Federal Reserve’s decision on interest rates later in the day, while an upbeat outlook from Advanced Micro Devices lifted chipmakers."
264,"The Dow Jones Industrial Average plummeted 327 points, or 1%, to 33,754, the Nasdaq slid 0.4% and the S&P 500 was down 0.5%."
265,"The Fed is widely seen as raising its target interest rate by a quarter of a percentage point in its first policy meeting of the year, after the rapid increases in 2022 to tame decades-high inflation."
266,Investors will also parse Chair Jerome Powell’s news conference for clues on the trajectory of future rate hikes.
267,"Money markets are betting on one more 25 basis point (bps) hike in March, and a terminal rate of 4.9% in June."
268,"“Consensus is that the Fed is going to talk very hawkish today even though it’s only doing 25 basis points,” said Thomas Hayes, chairman at investment firm Great Hill Capital."
269,"Recent readings have indicated that inflation is easing, with the Fed also looking at data that will determine the resilience of the labor market and the pace of wage growth."
270,Investors will parse Chair Jerome Powell’s news conference for clues on the trajectory of future rate hikes.
271,"AP
 Meanwhile, the ADP National Employment report showed fewer-than-expected private job additions in January, while another piece of data showed US job openings unexpectedly rose in December."
272,The readings came ahead of the Labor Department’s comprehensive report on nonfarm payrolls for January due on Friday.
273,"Separately, data showed US manufacturing contracted further in January as higher interest rates stifled demand for goods."
274,Advanced Micro Devices added 7.1% as the semiconductor maker said it expects its business to improve in the second half of the year.
275,Snap tumbled 11.9% after the social media company said it expects current-quarter revenue to decline by as much as 10%.
276,Facebook parent Meta Platforms added 0.4% ahead of reporting fourth-quarter results after the bell.
277,Videogame publisher Electronic Arts slumped 11% on lowering its annual bookings forecast.
278,"With nearly 200 companies in the S&P 500 having reported fourth-quarter earnings, about 70% have topped Wall Street expectations."
279,"Analysts now see earnings of S&P 500 firms declining 2.4% for the quarter, per Refinitiv estimates."
280,American labor market remains hot despite the Federal Reserve's efforts to cool it down.
281,"U.S. job openings unexpectedly rose in December, a sign the American labor market remains hot and a blow to the Federal Reserve's efforts to cool it down."
282,"Openings in December rose to 11 million, up from 10.4 million in November, the Labor Department said Wednesday."
283,Economists had expected job openings to drop slightly in December.
284,The rate of layoffs and employees quitting both ticked up slightly that month.
285,"""With 76.4 million Americans starting new jobs, 2022 is the year with the largest number of completed hires on record,""Julia Pollak, chief economist at ZipRecruiter, said in a note."
286,"By contrast, layoffs last year came in at just three-quarters of their typical level—despite a spate of layoff announcements from tech companies."
287,The American job market has been surprisingly resilient throughout this period of economic uncertainty.
288,"The latest figures put additional pressure on the Federal Reserve, which has been trying to slow the labor market with interest-rate hikes."
289,"Combating inflation that last year hit a four-decade high, the Federal Reserve has hiked its benchmark rate seven times since March and is expected to announce another rate increase later Wednesday."
290,"Employers created 375,000 jobs a month in 2022 — the second most in Labor Department records dating back to 1940 — and likely added another 185,000 last month, according to a survey of forecasters by the data firm FactSet."
291,January's hiring numbers come out Friday.
292,U.S. stocks fell on Wednesday ahead of the Federal Reserve monetary policy decision later in the day.
293,U.S. stocks fell on Wednesday ahead of the Federal Reserve monetary policy decision later in the day.
294,"Investors parsed a host of economic data that gave mixed signals, while also weighing quarterly results from major companies."
295,"The tech-heavy Nasdaq Composite (COMP.IND) was 0.49% lower to 11,528.09 points in morning trade, while the benchmark S&P 500 (SP500) slipped 0.53% to 4,055.14 points."
296,"The Dow (DJI) underperformed the other two averages, falling 0.98% to 33,751.48 points."
297,The blue-chip index was weighed down by a fall in shares of Amgen.
298,"All 11 S&P sectors were trading in the red, with Energy falling the most and Health Care falling the least."
299,"Wall Street's three major indices closed out the month of January in the previous session with hefty gains, after slumping in 2022."
300,"Following the gloom and doom of last year, investors have piled back into equities with the hopes that the Fed is at the end of or nearing the end of its policy tightening cycle."
301,The markets are widely expecting the central bank to slow down its pace of rate hikes to a 25 basis point increase today.
302,The bigger question on the mind of investors is whether this will be the Fed's final rate hike.
303,Chair Jerome Powell's post-decision comments should throw some light on that matter.
304,"""After a very positive January, the start of February today marks a pivotal three days for markets that have the potential to decisively set the tone for the weeks ahead,"" Deutsche Bank's Jim Reid wrote."
305,"""The last time we had a big round of central bank meetings like this in December, the rate hikes themselves were much as expected, but the hawkish rhetoric alongside them led to a big selloff,"" Reid said."
306,"""Nevertheless, the mood going into this round is much more optimistic, with the S&P 500 closing at a 2-month high after the US Employment Cost Index numbers showed labor costs grew by less-than-expected."""
307,"The benchmark S&P 500 (SP500) ended more than 6% higher for January on Tuesday, hitting the so-called ""January Indicator Trifecta"" which gives the index close to a 100% historical probability of posting gains in 2023 as a whole."
308,"On Wednesday, a deluge of economic data especially on the labor market painted a mixed picture of the U.S. economy."
309,"On the one hand, ADP's January private payrolls data moderated, while on the other, December JOLTS data showed an unexpected climb in job openings."
310,"""The survey response rate for this (JOLTS) data has collapsed, making the quality questionable,"" UBS' Paul Donovan said."
311,"""The vacancy number does not report actual vacancies, only externally advertised vacancies."
312,"Hiring rates are very high, suggesting a lot of the 'vacancy' rise post pandemic has been about people changing company."""
313,"Additionally, the S&P Global manufacturing PMI for January came in at 46.9 compared to the forecasted 46.8 figure and 46.8 prior level."
314,"Turning to the bond markets, yields were slightly lower."
315,The 10-year Treasury yield (US10Y) fell 3 basis points to 3.50% and the 2-year yield (US2Y) fell 1 basis point to 4.20%.
316,Earnings news was also in the spotlight on Wednesday.
317,Amgen (AMGN) slipped after a mixed quarterly report.
318,"Meanwhile, Electronic Arts (EA) and Match Group (MTCH) were among the top percentage losers on the S&P 500 (SP500) after disappointing results."
319,"Conversely, Stryker (SYK), Advanced Micro Devices (AMD) and Altria (MO) were among the top S&P percentage gainers after their financial reports."
320,Class A shares of Snap (SNAP) slumped more than 13% after its weak earnings and guidance.
321,Traders will be looking ahead to results from Facebook-parent Meta (META) after the closing bell.
322,"Among other active stocks, Baidu (BIDU) was among the top percentage gainers on the Nasdaq Composite (COMP.IND) after asset manager BlackRock (BLK) disclosed an increased stake in the Chinese tech company."
323,"U.S. stock indexes fell on Wednesday ahead of the Federal Reserve's decision on interest rates later in the day, while an upbeat outlook from Advanced Micro Devices lifted chipmakers."
324,"The Fed is widely seen as raising its target interest rate by a quarter of a percentage point in its first policy meeting of the year, after the rapid increases in 2022 to tame decades-high inflation."
325,"U.S. stock indexes fell on Wednesday ahead of the Federal Reserve's decision on interest rates later in the day, while an upbeat outlook from Advanced Micro Devices lifted chipmakers."
326,"The Fed is widely seen as raising its target interest rate by a quarter of a percentage point in its first policy meeting of the year, after the rapid increases in 2022 to tame decades-high inflation."
327,Investors will also parse Chair Jerome Powell's news conference for clues on the trajectory of future rate hikes.
328,"Money markets are betting on one more 25 basis point (bps) hike in March, and a terminal rate of 4.9% in June."
329,"""Consensus is that the Fed is going to talk very hawkish today even though it's only doing 25 basis points,"" said Thomas Hayes, chairman at investment firm Great Hill Capital."
330,"Recent readings have indicated that inflation is easing, with the Fed also looking at data that will determine the resilience of the labor market and the pace of wage growth."
331,"Meanwhile, the ADP National Employment report showed fewer-than-expected private job additions in January, while another piece of data showed U.S. job openings unexpectedly rose in December."
332,The readings came ahead of the Labor Department's comprehensive report on nonfarm payrolls for January due on Friday.
