id,sentence
735,Policy-makers are adamant they will not make what they consider to be the crucial error of pausing further rate hikes until they are convinced inflation is on a durable path back to the 2 per cent goal.
736,"Some analysts do expect the Fed to remove from its policy statement the current, open-ended promise of “ongoing increases” in interest rates, a phrase used since the central bank began its tightening cycle in March."
737,"Any new language, however, would still leave the door open for further increases depending on incoming economic data, particularly on inflation and jobs."
738,"The expected move to 25-basis-point rate increases will be a “hawkish downshift,” BNP Paribas economists wrote ahead of this week’s policy meeting."
739,"“While we expect the Fed to downshift the pace of tightening to 25bp increments … we also anticipate a hawkish resolve … policy-makers are encouraged by recent developments, but appear to remain united in the need to ‘keep at it’ with respect to reducing inflation pressures.”
 The Fed’s meeting this week, its first of 2023, will not include new economic forecasts from policy-makers, the most explicit way for them to signal where rates may be headed this year."
740,"As of December, policy-makers’ median forecast was for the Fed’s target interest rate to peak in a range between 5.00 per cent and 5.25 per cent, an outlook that would imply a pause in the policy tightening after two more quarter-percentage-point increases."
741,"Traders of futures that settle to the Fed’s policy rate see the path somewhat differently, with the benchmark rate peaking in the 4.75 per cent-5.00 per cent range, and the central bank cutting that rate to around 4.4 per cent by December."
742,This week's Federal Reserve meeting will be remembered more for what policymakers say than what they do.
743,"Federal Reserve Board Chairman Jerome Powell holds a news conference following the announcement that the Federal Reserve raised interest rates by half a percentage point, at the Federal Reserve Building in Washington, U.S., December 14, 2022."
744,"Evelyn Hockstein | Reuters
 This week's Federal Reserve meeting will be remembered more for what policymakers say than what they do."
745,"That's because markets have priced in a near-100% certainty — 98.9% to be exact, as of Tuesday afternoon — that the Federal Open Market Committee will announce a 0.25 percentage point interest rate increase when the two-day policy meeting wraps up Wednesday afternoon, according to CME Group data."
746,"While there's often strong market consensus heading into FOMC meetings, it's rarely this high."
747,What markets are unsure of is where the Fed goes from here.
748,"Traders are betting the central bank will hike a quarter point once more in March then stop, pause for several months, and then start cutting toward the end of the year."
749,"Conscious that the fight against inflation is far from over, despite some encouraging data lately, Chairman Jerome Powell could push back on the idea of a looser Fed so soon in the future."
750,Fed projections released in December indicate no cuts this year and continued rate hikes.
751,"""He is on a very tight monetary policy tightrope, where he can't allow the market to think this is the endgame,"" said Quincy Krosby, chief global strategist for LPL Financial."
752,"""It's prudent for him to be careful."
753,It would be almost reckless for him to have the market believe that they're just about finished and inflation is where they want it.
754,"Inflation is certainly not where they want it."""
755,"With the careful communication path Powell must walk in mind, here's what to expect when the FOMC's post-meeting statement is released at 2 pm ET:
 Rates
 Over the past few weeks, Fed officials have been explicit in stating that, at the very least, they can start approving smaller moves than the four consecutive 0.75 percentage point increases approved in 2022."
756,"That began in December with a 0.5-point move, and will continue with this highly anticipated move."
757,"That will take the fed funds rate to a target range of 4.5%-4.75%, the highest since October 2007."
758,"The funds rate is what banks use as a benchmark for overnight borrowing, but it flows through to many consumer credit instruments like car loans, mortgages and credit cards."
759,"Though some Fed officials, such as St. Louis Fed President James Bullard, have suggested the rate hike could be half a point, there's virtually no chance of that happening."
760,A quarter point is a lock.
761,"The statement
 For the most part, the post-meeting statement has changed little except for a few notable tweaks."
762,There is some speculation that the statement could get adjusted a bit more to add uncertainty of how much more aggressive the Fed wants to get.
763,"One key phrase that has been part of each statement since the hikes began in March 2022 is that committee members feel ""ongoing increases in the target range will be appropriate."""
764,"That language could get softened, and it's likely the first place market participants will look for the Fed to tip its hand to acknowledge that the rate-hiking cycle is nearing an end."
765,"watch now
 There won't be any ""dot plot"" this meeting of individual members' rate expectations, nor will there be an update to the Summary of Economic Projections on GDP, unemployment and inflation."
766,So any hints about the future policy path will have to come first from the statement.
767,"""They'll likely do another 25 at the March meeting and that's when the cycle comes to end,"" Tom Porcelli, chief U.S. economist at RBC Capital Markets, wrote in a client note."
768,"""We see incredibly limited scope for the Fed to plausibly justify keeping this cycle going deeper into the year with what will already be a very restrictive policy stance in the face of what are likely mounting economic challenges to the backdrop."""
769,"Powell presser
 
 
 Brent crude futures dipped 11 cents to $85.35 a barrel at 0949 GMT, while U.S. West Texas Intermediate crude futures rose 8 cents to $78.95
 Oil prices were broadly stable as the market is looking towards a meeting of OPEC and its allies as well as a Federal Reserve rate decision and U.S. government data on crude and fuel stockpiles on Wednesday."
770,"Brent crude futures dipped 11 cents, or 0.1 per cent, to $85.35 a barrel at 0949 GMT."
771,"West Texas Intermediate (WTI) U.S. crude futures rose 8 cents, or 0.1 per cent, to $78.95 a barrel."
772,"Tamer U.S. rate hike expectations helped lower the dollar index, which supported oil prices as a weaker greenback makes the commodity cheaper for buyers holding other currencies, according to Stephen Brennock, analyst at PVM."
773,The Federal Reserve is expected to deliver its decision at 1900 GMT.
774,"All eyes will be on a meeting of key ministers of the Organization of the Petroleum Exporting Countries and allies including Russia, known as OPEC+, where producers are expected to stick with output targets agreed in November."
775,"OPEC’s oil output fell in January, as Iraqi exports dropped and Nigeria’s output did not recover, with the 10 OPEC members pumping 920,000 barrels per day (bpd) below their targeted volumes under the OPEC+ agreement, a Reuters survey found."
776,"The shortfall was bigger than the deficit of 780,000 bpd in December."
777,"Separately, data from the American Petroleum Institute industry group showed U.S. crude stocks rose about 6.3 million barrels, more than expected, in the week ended Jan. 27, according to market sources."
778,Government stockpile data is due at 1530 GMT.
779,"“Commercial storage in North America is ample,” said Norbert Ruecker, economist at the bank Julius Baer."
780,"“The improved market mood has lifted prices of late, but this support should remain temporary."
781,"We see lower prices longer term, in line with the futures market’s expectations.”
 WTI is trading in contango, which means front-month delivery contracts are trading higher than later deliveries, indicating current oversupply."
782,"Brent is in a shallow backwardation, the opposite market structure."
783,The Federal Reserve is expected to raise interest rates for the eighth time in 11 months at the conclusion of its first monetary policy meeting of 2023 on Wednesday.
784,"New York CNN —
 The Federal Reserve is expected to raise interest rates for the eighth time in 11 months at the conclusion of its first monetary policy meeting of 2023 on Wednesday."
785,But the meeting could also mark a pivotal turning point for the central bank’s decision making: a return to normal.
786,"The Fed is expected to slow the pace of rate hikes to a quarter percentage point, down from a half point in December."
787,"That would raise the interest rate that banks charge each other for overnight borrowing to a range of 4.5% to 4.75%, the highest since October 2007."
788,"It would also return the central bank to a more traditional, gentler pace of increases after a turbulent period of historically large hikes that upended markets, households and the economy."
789,"Now that inflation pressures have eased in recent months, consumer spending and hiring have slowed, and wage increases have moderated, many analysts believe the central bank could even stop raising rates — and possibly cut them later this year."
790,Others say it’s premature to assume a rate hike pause is on the horizon.
791,"Going the distance
 The key question facing Fed watchers this meeting is how the central bank will signal the path forward for the rest of the year."
792,"Will Fed Chair Jerome Powell dampen expectations and reiterate that the fight against inflation still has “a ways to go,” or will Fed officials signal that they’re ready to ease up on rate hikes?"
793,"Since the last Fed meeting in December, two economic trends have made the case for slowing rate hikes: Recent data on wage growth and inflation have been encouraging and economic growth signals have become concerning."
794,"Consumer confidence data indicates uncertainty about the future, and recession fears have risen, especially among CEOs."
795,"That might sound like bad news, but it means that the Fed’s mission to cool the economy and stall price increases is working."
796,"In December, Powell outlined how he hopes to win his ongoing fight against inflation: Limit economic growth and rebalance the labor market, which he said would allow inflation to return to a growth rate of about 2%."
797,"Fed officials have said that while they believe they’re on the correct path, they still think there’s a long way to go until they reach their 2% inflation target."
798,"The Consumer Price Index shows that while inflation continued to cool in the most recent reading, annual price growth is still at a historically high 6.5%."
799,"“Passing peak inflation is welcome and policymakers appear to have increased confidence that inflation is on a path lower, but the Fed is not yet convinced that inflationary pressures will dissipate quickly,” wrote Bank of America economists in a recent note."
800,Policymakers are unlikely to declare victory in their inflation fight just yet.
801,"“This first meeting of the year will no doubt be a very interesting one as it will set the tone for the rest of year,” wrote EY Parthenon Chief Economist Gregory Daco in a recent note."
802,"“But, rather than a slow waltz, we anticipate an infernal tango as the Fed and markets try to find synchronized rhythms once again.”
 The Federal Open Market Committee is expected to announce its latest policy decision on Wednesday at 2 p.m."
803,ET.
804,Fed Chair Jerome Powell will follow the announcement with a press conference beginning at 2:30 p.m.
805,ET.
806,The Federal Reserve is widely expected to raise rates by a quarter percentage point at the conclusion of its two-day Open Markets Committee meeting at 2 pm ET.
807,That would mark the smallest rate hike since March 2022.
808,"A couple with a dog look at the front window of a real estate agency displaying a selection of properties to buy or rent, in Oxford, on January 30."
809,"(Adrian Dennis/AFP/Getty Images)
 Investors are becoming increasingly confident that major central banks will change course soon."
810,"They expect rates set by the Fed, the Bank of England and the ECB to reach their peak by this spring."
811,"At that point, they’re expected to hold rates steady while they assess the impact on inflation."
812,"One challenge, though, is that the full impact is unlikely to become apparent until next year."
813,"Take the housing market, which is very sensitive to changes in interest rates and is closely monitored by central bankers."
814,"In the United Kingdom, more than 1.4 million households need to renew fixed-rate mortgages this year."
815,Most had been set at interest rates below 2%.
816,"When their mortgage costs rise, they could pull back spending."
817,"That could ease inflation, but also boost the risk of recession."
818,(The United Kingdom is the only Group of Seven economy that the IMF predicts will shrink this year.)
819,Another major unknown is the job market.
820,"The Fed wants to cool hiring and wage increases, which can drive up inflationary pressures."
821,"It has acknowledged that “there’s going to be a bit of pain to achieve the inflation target,” seeing job losses as the “lesser of two evils,” Rossiter said."
822,"After a roaring start to the year, digital assets look vulnerable to giving up some gains."
823,The Federal Reserve's decision on interest rates will be a major catalyst.
824,Bitcoin and other cryptocurrencies were on pause Wednesday as traders awaited a key decision on interest rates from the Federal Reserve.
825,"After the best January for Bitcoin in a decade, bad news out of the central bank has the potential to start February off on a sour note."
826,"The price of Bitcoin has risen less than 1% over the past 24 hours, hovering around $23,000."
827,"The largest digital asset has roared higher to start the year, gaining 40% as cryptos benefited from an improvement in investors’ appetite for risk."
828,"While Bitcoin remains at just a third of its late-2021 high, traders are increasingly optimistic that the bottom of a brutal bear market already has been hit—in the wake of the shock bankruptcy of FTX in November—and that cryptos are poised to march higher."
829,Corporate finance executives looking to cut their debt costs this year are likely to find one popular tool isn’t as attractive as it was when the Federal Reserve was aggressively raising interest rates in 2022.
830,Corporate finance executives looking to cut their debt costs this year are likely to find one popular tool isn’t as attractive as it was when the Federal Reserve was aggressively raising interest rates in 2022.
831,"Demand for so-called cross-currency swaps rose last year after the U.S. central bank moved faster than monetary-policy makers abroad to lift rates and cool down the economy, according to investment bankers and advisers."
832,"Under a cross-currency swap, a company exchanges principal and interest payments on its debt into another currency."
833,"A key goal of the transaction is to swap into a currency with lower rates, allowing a company to reduce its interest costs."
834,"Market dynamics, however, are shifting."
835,"The Fed, which is set to announce its next rate decision on Wednesday, has signaled that it plans to slow the pace of hikes amid signs inflation has begun to fall from four-decade highs."
836,"By contrast, central bankers in Europe have said they have more work to do to tamp down rising prices."
837,The European Central Bank and Bank of England are scheduled on Thursday to announce their latest rate-hike decisions.
838,"The Bank of Japan in January kept short-term rates unchanged, despite pressure from investors."
839,"Swaps can lose their appeal to companies when the gap between interest rates in two countries, or central banks, narrows."
840,"That has begun to happen, for instance, between the U.S. and the European Union."
841,"The estimated savings on a five-year swap of a U.S. bond with a 2% coupon into euros was 0.98 percentage point last month, according to Chatham Financial, a financial risk advisory firm."
842,"That is down from 1.34 percentage points in December and 1.93 percentage points in May, when the spread between the two was at its widest in 2022, according to Chatham."
843,"Corporate advisers said they expect cross-currency swap volumes to decline in the months ahead, assuming market expectations for future rate increases hold steady."
844,"“I would expect to see, in general, less activity,” said Amol Dhargalkar, managing partner and chairman at Chatham Financial, noting that savings are declining and many companies already took advantage of the market."
845,"A Manhattan Coach store Photo: ANDREW KELLY/REUTERS
 Still, for companies that used cross-currency swaps in 2022, the savings reaped by keeping interest costs under control weren’t insignificant."
846,"New York-based Tapestry Inc., which owns fashion brands including Coach and Kate Spade, expects to pay between $30 million and $35 million in net interest expenses during its 2023 fiscal year as a result of cross-currency swaps executed last year."
847,"During the prior fiscal year ended July 2, the company’s interest expenses totaled $58.7 million."
848,"Tapestry in May essentially swapped out the entire value of its $1.2 billion U.S. bond portfolio so that it could take advantage of wide differentials in rates between the U.S. and other jurisdictions, with about half going into euros and the other half into Japanese yen."
849,"Under the terms of the contracts, Tapestry makes semiannual interest payments of 2.4% and 2.7% in euros and 0.1% and minus 0.3% in Japanese yen."
850,"By comparison, the company’s most recent bond issuance in December 2021 carried a 3.05% coupon."
851,"Tapestry considered issuing debt in Europe instead of doing a cross-currency swap, but decided against it given the company’s relatively small presence in the region and the need for a roadshow to educate investors, executives said."
852,"The company generates less than 5% of its total revenue in Europe, the company said."
853,"Tapestry has only issued debt in the U.S.
 Scott Roe, chief financial and operating officer of Tapestry Photo: Tapestry Inc.
 “Our name is not as well known in Europe given the relative size."
854,"So as an early entree [into the region], this makes a lot of sense,” Chief Financial and Operating Officer Scott Roe said, discussing the company’s decision to move forward with a swap."
855,"For many U.S. companies, the combination of a strong U.S. dollar and rising interest rates for much of last year created a lucrative scenario to enter into cross-currency swaps, said Bob Stark, global head of market strategy at Kyriba, a treasury management software provider."
856,"Swaps can also provide finance chiefs at global companies more predictability in their cash flows by protecting them from currency volatility, Mr. Stark said."
857,The value of the dollar last year strengthened against other currencies as a result of the Fed’s aggressive steps to tackle inflation.
858,"Demand for cross-currency swaps, while elevated in 2022, has been robust since a hedge accounting rule was adopted in 2017 by the Financial Accounting Standards Board, bankers and advisers said."
859,That rule made it easier for companies to use cross-currency swaps and recognize the interest savings on their financial statements.
860,Newsletter Sign-up WSJ | CFO Journal The Morning Ledger provides daily news and insights on corporate finance from the CFO Journal team.
861,"PREVIEW
 Companies don’t need to enter into swaps at the time they issue debt, but instead can opportunistically take advantage of interest-rate differentials when it makes sense for them to do so."
862,"“That was a huge part of the volume in 2022,” said Paula Comings, managing director and co-head of foreign exchange sales at U.S. Bancorp."
863,"Mirion Technologies Inc., a provider of radiation measurement and detection systems, said in November it expects savings of roughly $2 million a year as a result of a cross-currency swap it entered into in October."
864,"The Atlanta-based company expects to spend $42 million on net interest costs in 2022, which includes some of the savings from its recently executed swap."
865,"Under the terms of the company’s swap, Mirion exchanged a $115.6 million loan carrying a fixed rate of 7.66%, and in return received a €115.7 million loan carrying a fixed rate of 5.83%, according to a regulatory filing."
866,The swap expires in March 2026.
867,"The swap is aimed in part at helping the company reduce the effects of currency volatility on the company’s results, Chief Executive Thomas Logan said on a Nov. 1 earnings call."
868,"“Foreign exchange continues to be a headwind,” Mr. Logan said."
869,"Third-quarter revenue rose 12%, to just over $160 million."
870,Its net loss held steady at about $47 million.
871,The company declined to comment beyond its latest quarterly results.
872,"Write to Kristin Broughton at Kristin.Broughton@wsj.com
 
 
 Stocks bounced back from two days of losses as traders tracked a Wall Street surge fueled by data pointing to slowing US inflation and hopes the Federal Reserve’s rate hike drive is coming to an end."
873,Stocks bounced back from two days of losses as traders tracked a Wall Street surge fueled by data pointing to slowing US inflation and hopes the Federal Reserve’s rate hike drive is coming to an end.
874,"The PSE index, the 30-company benchmark of the Philippine Stock Exchange, jumped 242 points, or 3.57 percent, to close at 7,035.76 Wednesday as all six subsectors posted gains."
875,"The broader all-share index also went up by 96 points, or 2.70 percent, to settle at 3,687.17, on a value turnover of P9 billion."
876,"Gainers outnumbered losers, 143 to 49, while 43 issues were unchanged."
877,"All ten most active stocks ended in the green, led by PLDT Inc. which climbed 6.41 percent to P1,428.00 and International Container Terminal Services Inc. which gained 5.40 percent to P218.60."
878,Most Asian markets also traded higher Wednesday.
879,The gains will provide some relief to investors after January’s rally appeared to have hit the buffers this week on lingering concerns about the economic outlook.
880,"ADVERTISEMENT
 Expectations the Fed will hike borrowing costs by just 25 basis points on Wednesday were ramped up after a key gauge of wage increases came in below forecasts."
881,"“The employment cost index is closely watched by the Fed as it compositionally adjusts wages growth, unlike other more timely measures,” said National Australia Bank’s Tapas Strickland."
882,"“More important for the Fed is one of the subcomponents, the wages and salaries for private sector workers excluding incentive paid occupations, which rose 0.9 percent on-quarter from 1.2 previously.”
 He added that the reading was “a notable deceleration and in quarter annualized terms would be equivalent to 3.6-3.7 percent."
883,"That is close to being consistent with at-target inflation if repeated next quarter.”
 The ECI reading came as another report showed a slowdown in the US housing market as well as a dip in consumer confidence, suggesting the Fed’s tightening campaign is beginning to kick in."
884,"While they indicate the world’s top economy is slowing, hope is building that the data will allow the central bank to wind down its rate hikes."
885,"“We’re getting closer to the terminal rate,” Sassan Ghahramani, of SGH Macro Advisors, told Bloomberg Television."
886,“Data that has come out does not justify 50-basis-point hikes.
887,"If anything, I’d say it’s virtually a 100 percent certainty they do 25.”
 OANDA’s Edward Moya added: “Wall Street is slowly growing confident that this week’s Fed rate hike might end up being the last one in this tightening cycle.”
 All three main indexes on Wall Street ended more than one percent higher, helped by strong earnings from big-ticket firms including ExxonMobil and General Motors."
888,"And Asia picked up the baton, with Hong Kong, Tokyo, Shanghai, Sydney, Seoul, Singapore, Wellington, Taipei, Mumbai, Bangkok and Jakarta all in positive territory."
889,"Mumbai managed to rally around 1.9 percent, despite more heavy selling of tycoon Gautam Adani’s business empire, which has now lost around a third—or $76 billion—of its value after allegations of massive accounting fraud from a US investment group."
890,"Worst-hit was Adani Total Gas, which saw trading suspended again after another 10 percent drop, while flagship Adani Enterprises shed more than five percent."
891,The losses came even after a stock sale in the firm Tuesday was oversubscribed.
892,"London, Paris and Frankfurt all opened on the front foot."
893,"With an eye on Wednesday’s post-meeting news conference at the Fed, SPI Asset Management’s Stephen Innes said: “The running assumption is that the Fed doesn’t want the market bossing them into a less hawkish policy corner, and in the Q&A, the pushback comes from Powell."
894,"“But without doubt… reporters will try to coax out the word pause from Powell, and if there is any whiff of that word, risk assets will take flight.” With AFP
 Please enable JavaScript to view the comments powered by Disqus."
895,U.S. Treasury yields declined on Wednesday as investors awaited the Federal Reserve’s latest interest rate decision.
896,At 4:31 a.m.
897,"ET, the yield on the benchmark 10-year Treasury was down by just over five basis points to 3.4772%."
898,The 2-year Treasury yield was last trading at 4.1929% after falling by more than one basis point.
