,title,publishedAt,description,content,url
34,Fed's Powell: Don't assume Fed can thwart default fallout,2021-09-22T04:00:00Z,"The Federal Reserve may not be able to shield the economy and financial markets from the effects of a U.S. debt default, the central bank's chief said on Wednesday as he urged Congress to raise the country's debt limit to avoid that catastrophic risk.","Federal Reserve Chair Jerome Powell adjusts his tie as he arrives to testify before a Senate Banking, Housing and Urban Affairs Committee hearing on “The Semiannual Monetary Policy Report to the Congress” on Capitol Hill in Washington, U.S., July 15, 2021. REUTERS/Kevin Lamarque/File Photo
Sept 22 (Reuters) - The Federal Reserve may not be able to shield the economy and financial markets from the effects of a U.S. debt default, the central bank's chief said on Wednesday as he urged Congress to raise the country's debt limit to avoid that catastrophic risk.
“It’s just very important that the debt ceiling be raised in a timely fashion so that the United States can pay its bills as and when they come due,” Fed Chair Jerome Powell said. “The failure to do that could result in severe damage to the economy and financial markets, and it’s just not something we should contemplate.”
Asked at a press conference following the Fed's latest monetary policy meeting if the central bank is dusting off an emergency response to a U.S. default first devised about a decade ago, Powell said: ""No one should assume the Fed or anyone else can fully protect the markets or the economy in the event of a failure.""
U.S. lawmakers in Congress are at loggerheads over the federal government's $28.4 trillion debt ceiling.
The Senate could see a vote next week on raising Washington's borrowing authority and keeping the government funded, the chamber's No. 2 Democrat said on Wednesday, with a House Democrat warning Republican opposition could lead to a historic default on the nation's debt. read more
Failing to raise or suspend it by Sept. 30 could trigger a third partial shutdown of the federal government in the past decade. Failure to do so by mid-October could lead to a far-more disastrous and first-ever U.S. debt default that could plunge the United States into recession and cause lasting damage to the economy.
Republicans oppose any increase as part of a pressure campaign to force Democrats to slim President Joe Biden's proposed $3.5 trillion domestic spending package. Democrats say the debt ceiling debate has nothing to do with the Biden administration's agenda. read more
Powell declined to say whether he had liaised with Treasury Department officials or lawmakers about contingency plans. The nation faced a similar debt ceiling scare in 2013, and at the time Fed policymakers - including Powell, then just a Fed board member - mapped out potential responses to counter stress in financial markets. read more
The blueprint covered a litany of actions the Fed could take to limit the fallout of any default, including prioritizing payments and expanding its asset purchases to include defaulted Treasuries.
The timing of the current stand off over the issue could not be worse for the Fed in that regard. At their two-day meeting ended Wednesday, officials agreed a slowdown in the current purchase pace of $120 billion a month of Treasuries and mortgage-backed securities ""may soon be warranted"" given ongoing improvements in the economy and progress toward its goals of price stability and maximum employment. read more
Reporting by Dan Burns; Editing by Leslie Adler and Marguerita Choy
Our Standards: The Thomson Reuters Trust Principles.",https://www.reuters.com/business/feds-powell-dont-assume-fed-can-thwart-default-fallout-2021-09-22/
35,"Dow, S&P 500 post best daily gain in 2 months even as Fed says tapering of asset purchases coming soon",2021-09-22T04:00:00Z,"U.S. stock indexes closed higher Wednesday, with the S&P 500 and the Dow industrials notching their best daily gains in about two months, as Federal Reserve...","U.S. stock indexes closed higher Wednesday, with the S&P 500 and the Dow industrials notching their best daily gains in about two months, as Federal Reserve Chairman Jerome Powell signaled the central bank may announce a pullback of its bond purchases in November and could start to raise interest rates in 2022, with both moves largely expected by market participants. Subsiding fears around embattled Chinese property development company Evergrande, which rattled investors on Monday, also helped set a more bullish tone on Wall Street. But investors are also watching developments in the U.S. Congress on raising the federal debt ceiling. The Dow Jones Industrial Average rose by about 338 points, or 1%, to reach 34,258, representing the best point and percentage gain for the blue-chip index since July 20; while the S&P 500 index SPX, +0.95% climbed 1% to 4,395, marking the best day since July 23. The Nasdaq Composite Index COMP, +1.02% , meanwhile, also rose 1% to 14,896 for its best day since Aug. 27, FactSet data show. In corporate news, shares of Stitch Fix Inc. rallied nearly 16% on Wednesday after reporting quarterly results.",https://www.marketwatch.com/story/dow-sp-500-post-best-daily-gain-in-2-months-even-as-fed-says-tapering-of-asset-purchases-coming-soon-2021-09-22
36,"Dow rises over 400 points, adding to rally as Federal Reserve says reducing asset purchases 'may soon be warranted'",2021-09-22T04:00:00Z,"The Dow industrials and the broader market held onto early sharp gains on Wednesday after the Federal Reserve kept rates unchanged, as expected, and...","The Dow industrials and the broader market held onto early sharp gains on Wednesday after the Federal Reserve kept rates unchanged, as expected, and indicated that tapering of asset purchases ""may soon be warranted,"" without providing specific details on timing and pace. The Dow Jones Industrial Average DJIA, +0.82% was trading 449 points higher, or 1.3%, at 34,359, the S&P 500 index SPX, +0.69% traded 1.2% up at 4,405, while the Nasdaq Composit Index COMP, +0.64% advanced 1% at 14,895. The Fed decision will be followed by a news conference with Chairman Jerome Powell at 2:30 p.m. Eastern Time. The Fed has been buying $80 billion worth of Treasurys and $40 billion worth of mortgage-backed securities each month since last summer to keep long-term interest rates low and spur demand. Since the summer, the Fed has been talking about slowing down the purchases. The central bank has been guarded, worried there could be a repeat of the ""taper tantrum"" that roiled global financial markets in 2013. The formal announcement could come at the November 2-3 meeting or December 14-15, economists said.",https://www.marketwatch.com/story/dow-rises-nearly-500-points-adding-to-rally-as-federal-reserve-says-reducing-asset-purchases-may-soon-be-warranted-2021-09-22
37,Stocks find fleeting relief in Evergrande deal; Fed looms,2021-09-22T04:00:00Z,"Stocks found relief on Wednesday after teetering developer China Evergrande said it would be able to pay a coupon on one of its bonds, easing some market jitters, however, the Federal Reserve's looming policy decision kept investors cautious.","The German share price index DAX graph is pictured at the stock exchange in Frankfurt, Germany, September 21, 2021. REUTERS/Staff
SINGAPORE, Sept 22 (Reuters) - Stocks found relief on Wednesday after teetering developer China Evergrande said it would be able to pay a coupon on one of its bonds, easing some market jitters, however, the Federal Reserve's looming policy decision kept investors cautious.
China fell on its first day of trade after a two-day holiday. However, a cash injection from the People's Bank of China kept falls far smaller than feared with blue chips (.CSI300) off 0.7% and Shanghai Composite (.SSEC) reversing losses to trade up 0.3%.
That weighed on MSCI's broadest index of Asia-Pacific shares outside Japan (.MIAPJ0000PUS), which fell 0.3%, however, Australia (.AXJO) was higher.
Japan's Nikkei dropped 0.6%. Hong Kong markets were shut.
Evergrande's main unit, Hengda Real Estate, said it had settled interest payments due Thursday on a yuan bond with investors, which helped lift sentiment and trim losses. read more
""I think the market is still a little bit cagey,"" said Rob Carnell, Asia-Pacific head of research at ING in Singapore.
""It's Evergrande today, who will it be tomorrow? That's probably why we haven't seen a substantial and perhaps prolonged rally as a result of this,"" he said.
The news sent S&P 500 futures , U.S. Treasury yields and the Australian dollar higher, before shedding some of those gains as traders were left with few details and as Evergrande made no mention of dollar bond interest also due on Thursday.
S&P 500 futures were last up 0.2%. European futures inched up 0.3%. After rising, safe-haven 10-year U.S. Treasury yields eased back to flat at 1.3311%.
Globally, markets had also already started to calm as analysts downplayed the threat of Evergrande's troubles becoming a ""Lehman moment"" and setting off a financial crisis.
European markets rallied on Tuesday and on Wall Street the S&P 500 (.SPX) fared little worse than flat, sitting about 4% below a record made early in the month.
Focus now seems to be shifting to trying to gauge Beijing's so-far muted response amid worries about the consequences for an economy that is slowing and financial markets reeling from months of disruptive and radical reform.
""(The) Evergrande debacle is further stoking concern over the fallout from China's broadening crackdown,"" analysts at Rabobank said in a note to clients, pointing out new rules on everything from online gaming to developers debt levels.
""As a consequence, Evergrande can perhaps be seen not so much as a potential crisis trigger but rather a symptom of a broader policy shift which threatens Chinese growth as politics dominate economic considerations.""
In currency markets, the Aussie rose slightly, having given up some of its early-session blip while the safe-haven yen was a tad weaker.
Moves were capped ahead of Wednesday's Fed meeting, however, and the dollar was flat against the euro, with the risk of a hawkish Fed supporting the dollar.
Most analysts think the Fed will not go into detail about its tapering plans but say risks lie in board members' ""dot plot"" of rates projections. read more
""Even though a tapering announcement is not expected, the dot plot may deliver a hawkish surprise and require Powell to be dovish and push back in the press conference,"" said National Australia Bank's director of economics and markets Tapas Strickland.
The outcome of the Fed's meeting is announced at 1800 GMT with a news conference half an hour later.
In commodities, copper hovered near a month low and oil prices found support from a relaxation of inbound travel rules, likely to boost airline fuel demand.
Brent crude futures were last up 1% at $75.13 a barrel and U.S. crude rose 1.1% to $71.28. Gold was supported at $1,776.1 an ounce.
Reporting by Tom Westbrook in Singapore and Anushka Trivedi in Bengaluru; editing by Richard Pullin and Sam Holmes
Our Standards: The Thomson Reuters Trust Principles.",https://www.reuters.com/business/global-markets-wrapup-3-pix-2021-09-22/
38,Stocks edge higher on Wall Street ahead of Fed statement,2021-09-22T04:00:00Z,Stocks edged higher on Wall Street in morning trading Wednesday ahead of an anticipated update from the Federal Reserve on how and when it might begin easing its extraordinary support measures for the economy.,"Stocks edge higher on Wall Street ahead of Fed statement
Stocks edged higher on Wall Street in morning trading Wednesday ahead of an anticipated update from the Federal Reserve on how and when it might begin easing its extraordinary support measures for the economy.
The S&P 500 rose 0.8% as of 10:02 a.m. Eastern. The Dow Jones Industrial Average rose 332 points, or 1%, to 34,252 and the Nasdaq rose 0.5%.
Gains within the S&P 500 were broad and could potentially break a four-day losing streak if they hold. Roughly 85% of stocks in the index rose. Banks and technology companies led the gains. A mix of health care and communications companies fell.
Smaller stocks did slightly better than the broader market. The Russell 2000 rose 1.1%.
The yield on the 10-year Treasury note held steady at 1.32%. Crude oil prices rose 1.7%.
Much of the weakness for communications companies came from Facebook. The social media company fell 4.2% after its oversight board said it will review an internal system that exempted high-profile users from some or all of its rules.
FedEx slumped 8.4% after it reported sharply higher costs even as demand for shipping increased. A wide range of industrial and other companies have been dealing with higher costs because of a mix of labor and supply chain problems.
Investors’ key focus on Wednesday is the Fed’s statement on interest rate policy. The central bank has been buying bonds to keep interest rates low since the pandemic sapped the economy 18 months ago. It has signaled that it will eventually reduce those purchases, but the breadth and timing is still unknown.
Wall Street has been trying to gauge how the slowdown in the economic recovery will affect the Fed’s decision-making process. The broader market has been choppy as that question lingers amid rising cases of COVID-19 because of the highly contagious delta variant.
Investors have also been concerned about heavily indebted Chinese real estate developers and the damage they could do if they default and send ripple effects through markets. Evergrande, one of China’s biggest private sector conglomerates, said it will make a payment due Thursday, potentially easing some of those concerns.
European markets were mostly higher and Asian markets were mixed. Markets in South Korea and Hong Kong were closed for holidays.",https://www.wbrz.com/news/stocks-edge-higher-on-wall-street-ahead-of-fed-statement
39,Fed policymakers see upward march in interest rates starting next year,2021-09-22T04:00:00Z,"Half of Federal Reserve policymakers now expect to start raising interest rates next year and think rates should rise to at least 1% by the end of 2023, reflecting a growing consensus that gradually tighter policy will be needed to keep inflation in check.","The Federal Reserve building is set against a blue sky in Washington, U.S., May 1, 2020. REUTERS/Kevin Lamarque/File Photo
Sept 22 (Reuters) - Half of Federal Reserve policymakers now expect to start raising interest rates next year and think rates should rise to at least 1% by the end of 2023, reflecting a growing consensus that gradually tighter policy will be needed to keep inflation in check.
The swifter pace of interest rate hikes from policymakers' last set of projections in June comes amid the fastest economic recovery in U.S. history after a brief recession last year and robust debate at the Fed about balancing its maximum employment and 2% average inflation goals.
The Fed on Wednesday kept its benchmark overnight lending rate in the current target range of 0% to 0.25%, where it has remained since March 2020 when the U.S. economy was buffeted by the onset of the pandemic.
The new economic projections released alongside the policy statement showed nine of 18 Fed policymakers now foresee a liftoff in interest rates next year, compared to seven in June. All but one saw at least one interest rate needed by the end of 2023, and nine saw the need to target rates at least as high as between 1% and 1.25% by then.
By 2024, the median rate forecast was for 1.8% - still below the 2.5% level they estimate neither stimulates nor restricts economic growth over the long run and therefore broadly accommodative of further job gains. That's despite policymakers' forecast for inflation to remain above the Fed's 2% target through 2024.
Combined, it's new fodder for understanding how the Fed intends to carry out its new policy framework, under which it will aim for inflation to remain moderately above its 2% target for ""some time.""
U.S. gross domestic product at the median is projected to grow 5.9% this year and 3.8% in 2022, compared to forecasts in June of 7.0% in 2021 and 3.3% next year.
The unemployment rate is seen falling to 4.8% this year and to 3.8% in 2022.
The pace of price increases is expected to rise to 4.2% this year, higher than forecast in June, although Fed policymakers see it declining to 2.2% in 2022 and 2.1% by 2024.
Reporting by Lindsay Dunsmuir and Ann Saphir; Editing by Paul Simao and Andrea Ricci
Our Standards: The Thomson Reuters Trust Principles.",https://www.reuters.com/business/fed-policymakers-see-upward-march-interest-rates-starting-next-year-2021-09-22/
40,Wall Street ends higher as Fed signals bond-buying taper soon,2021-09-22T04:00:00Z,"The three major U.S. stock indexes rose 1% on Wednesday as investors mostly took in stride the latest signals from the Federal Reserve, including clearing the way for the central bank to reduce its monthly bond purchases soon.","Summary Fed clears way to reduce monthly bond purchases soon
Indexes: Dow, S&P 500, Nasdaq up 1%
NEW YORK, Sept 22 (Reuters) - The three major U.S. stock indexes rose 1% on Wednesday as investors mostly took in stride the latest signals from the Federal Reserve, including clearing the way for the central bank to reduce its monthly bond purchases soon.
The S&P 500 registered its biggest daily percentage gain since July 23.
While trading was choppy following the Fed's latest policy statement and comments by Fed Chair Jerome Powell, stocks finished close to where they were before the central bank news.
In its statement, the central bank also suggested interest rate increases may follow more quickly than expected and said overall indicators in the economy ""have continued to strengthen."" read more
Stocks began the day higher as concerns eased over a default by China's Evergrande (3333.HK). Evergrande's main unit said it had negotiated a deal with bondholders to settle interest payments on a domestic bond. read more
Bank shares rose following the Fed news, with the S&P banks index (.SPXBK) ending up 2.1% on the day, and S&P 500 financials (.SPSY) up 1.6% and among the biggest gainers among sectors.
Some strategists viewed the Fed's comments as mixed.
1/5 Traders work on the floor of the New York Stock Exchange (NYSE) in New York City, U.S., September 22, 2021. REUTERS/Brendan McDermid Read More
""So they said we're going to probably start to taper, but they haven't said when and haven't said how much, so we're kind of back where we were a day ago,"" said Paul Nolte, portfolio manager at Kingsview Investment Management in Chicago.
""Those remain open questions,"" he said. ""Also, financial conditions remain very easy, and that's part of the reason why markets aren't going crazy at this point.""
The Dow Jones Industrial Average (.DJI) rose 338.48 points, or 1%, to 34,258.32, the S&P 500 (.SPX) gained 41.45 points, or 0.95%, to 4,395.64 and the Nasdaq Composite (.IXIC) added 150.45 points, or 1.02%, to 14,896.85.
Apple (AAPL.O) and other big technology-related names gave the S&P 500 its biggest boost.
On the downside, FedEx Corp (FDX.N) tumbled 9.1% after posting a lower quarterly profit and as the delivery firm cut its full-year earnings forecast. read more
Advancing issues outnumbered declining ones on the NYSE by a 3.88-to-1 ratio; on Nasdaq, a 2.38-to-1 ratio favored advancers.
The S&P 500 posted nine new 52-week highs and eight new lows; the Nasdaq Composite recorded 52 new highs and 66 new lows.
Volume on U.S. exchanges was 9.91 billion shares, compared with the 9.99 billion average for the full session over the last 20 trading days.
Reporting by Caroline Valetkevitch; additional reporting by Ambar Warrick and Medha Singh in Bengaluru; Editing by Maju Samuel and Lisa Shumaker
Our Standards: The Thomson Reuters Trust Principles.",https://www.reuters.com/business/wall-street-ends-higher-fed-signals-bond-buying-taper-soon-2021-09-22/
41,Fed plan for U.S. default would be step into abyss,2021-09-22T04:00:00Z,"The Federal Reserve could do without the latest arguments in Washington about the U.S. government’s borrowing limit. Failure to agree could leave Uncle Sam unable to pay its bills. If lawmakers allow any debt to go unpaid, the central bank would be in a seriously tough spot.","A pedestrian walks past the Federal Reserve Board building on Constitution Avenue in Washington, March 19, 2019. REUTERS/Leah Millis
WASHINGTON, Sept 22 (Reuters Breakingviews) - The Federal Reserve could do without the latest arguments in Washington about the U.S. government’s borrowing limit. Failure to agree could leave Uncle Sam unable to pay its bills. If lawmakers allow any debt to go unpaid, the central bank would be in a seriously tough spot.
Congress is once again playing a game of chicken. The $28 trillion borrowing limit went back into effect in August. If lawmakers don’t increase it soon, the government won’t be able to pay its bills starting sometime in October. Eventually, that could result in an actual debt default. The U.S. House of Representatives on Tuesday approved a measure to suspend the debt ceiling again through 2022. But that plan would require support from Senate Republicans, who have vowed to reject it.
The worst-case scenario is something the Fed has considered before. To contain a default, the central bank discussed accepting delinquent Treasuries as collateral for loans or even buying them in 2011 and 2013, when the debt limit was also in limbo, according to Reuters. Such measures would amount to enabling the government’s default while also, in effect, bailing out reckless lawmakers. That would make the Fed’s claim of political independence almost untenable. Back in 2013, then-Governor Jerome Powell, now the Fed chair, summed it up when he said the options were “loathsome.”
Even if the standoff gets nowhere near a default, the central bank could still be in an awkward spot. The Treasury would have to stop paying bills, including perhaps Social Security payments to retirees. The fiscal tensions could also bring a spike in interest rates, which would make mortgages and car loans more expensive. Meanwhile, the economic recovery from Covid-19 still faces speed bumps and the central bank is trying to gauge when to scale back its ongoing support, with the latest policy update expected on Wednesday.
The debt ceiling has already become a political football. It was a key reason why Standard & Poor’s downgraded the U.S. credit rating in 2011. It makes no sense for lawmakers to try to block already agreed spending by limiting the borrowing to pay for it. Yet some might be willing to take the risk of provoking a default. That would be potentially catastrophic for the U.S. economy – and also for the Fed.
Follow @GinaChon on Twitter
CONTEXT NEWS
- The U.S. central bank’s Federal Open Market Committee is set to announce its latest monetary policy moves on Sept. 22. One area of focus is when the committee will reduce its purchases of $120 billion in Treasury and mortgage-backed securities each month, a program that began in 2020 in response to the economic effects of the pandemic.
- Separately, the House of Representatives on Sept. 21 approved a measure to suspend the federal government’s borrowing limit until the end of 2022. The ceiling, suspended since 2019, went back into effect on Aug. 1, and a failure to increase it will leave the federal government unable to pay all of its bills starting sometime in October. The plan moves to the Senate, where Republicans have vowed to block it.
- U.S. Treasury Secretary Janet Yellen said that a government default on its debt obligations would result in a “permanently weaker nation.” In an opinion piece in the Wall Street Journal on Sept. 19, she urged Congress to raise or suspend the current borrowing limit of about $28.4 trillion.
Editing by Richard Beales and Amanda Gomez",https://www.reuters.com/breakingviews/fed-plan-us-default-would-be-step-into-abyss-2021-09-22/
