,title,publishedAt,description,content,url
14,Why everything changed for the Federal Reserve,2021-09-22T12:03:17Z,"Six weeks ago, the Federal Reserve was sending signals that it was time to start backing away from crisis-era support for the US economy.","A version of this story first appeared in CNN Business' Before the Bell newsletter. Not a subscriber? You can sign up right here
London (CNN Business) Six weeks ago, the Federal Reserve was sending signals that it was time to start backing away from crisis-era support for the US economy.
""It's not clear to me that we're really doing anything useful here,"" St. Louis Federal Reserve Bank President James Bullard said on Aug. 10 of the Fed's $120 billion in monthly bond purchases.
Dallas Fed President Robert Kaplan agreed. ""What I don't want to do is keeping running at this speed for too long, and then we're going to have to take more aggressive action down the road,"" he told CNBC around the same time.
But the picture has changed since then, and when the Fed makes its latest policy announcement on Wednesday , it's expected to reiterate that for now, at least, it's sitting tight.
""A no change decision at the upcoming [Fed] meeting looks a foregone conclusion,"" ING strategists wrote in a recent note to clients, pointing to Chair Jerome Powell's remarks at the Jackson Hole symposium last month, which indicated that the central bank is not in a rush to change course.
Breaking it down: Inflation is still running hot. The Personal Consumption Expenditures Price Index, the Fed's favorite measure, rose at a rate of 4.2% in the year ended July, the fastest pace since January 1991. That's more than double the central bank's 2% target.
PPG PPG Sherwin-Williams SHW This month, a number of companies have revised down their earnings expectations as a result of higher prices., which makes paints and coatings, said third quarter sales volumes would be $225 million to $275 million lower, citing supply chain problems and raw material inflation. Competitormade a similar announcement.
Some economic data also indicates the US economy is powering through the impact of the Delta variant. Counter to expectations, US retail sales increased last month as consumers shelled out on clothing, furniture and groceries.
Taken together, inflation readings and signs of economic resilience should be encouraging the Fed to act sooner rather than later. But Wall Street now thinks the central bank will make this call in November, with the tapering of bond purchases starting by near end.
Why? Simply because the situation remains murky. In August, spending at restaurants was flat month-over-month, indicating Delta concerns are having some effect on consumers. And the most recent US jobs report showed that just 235,000 positions were added in August, a major disappointment.
""Ultimately, the determination of the decision on tapering likely comes down to the pace of labor market improvement over coming months,"" Ellen Zentner, Morgan Stanley's chief US economist, said in a research note. She thinks the Fed will delay a tapering announcement until December so it can parse more jobs data.
Watch this space: With agreement that the Fed is on hold for the time being, the most market-sensitive moment of Wednesday's announcement is likely to be the release of the central bank's latest economic forecasts, as well as its ""dot plot,"" which tracks expectations for when interest rate hikes will kick in.
In the last update, seven out of 18 Fed officials said rate increases would likely start in 2022. ING thinks it's conceivable that ""one or two more bring their forecast forward"" to next year. ""We suspect the median stays at 2023 for now, but it will be a close call,"" the bank predicts.
Evergrande meets crucial debt deadline, but another looms
China's Evergrande Group will pay interest due Thursday on one of its bonds, but it's keeping rattled investors guessing about the fate of a second, bigger payment due this week.
The latest: The troubled Chinese real estate conglomerate said Wednesday in a filing with the Shenzhen Stock Exchange that issues regarding a payment on a domestic yuan bond have been ""settled through negotiations.""
Many questions remain unanswered, though, my CNN Business colleague Laura He reports. Evergrande did not elaborate on the terms of the payment. The amount of interest it owes on the bond is about 232 million yuan ($36 million), according to data from Refinitiv.
Interest worth $83.5 million on a dollar-denominated bond is also due Thursday, though the company has not said anything publicly about what will happen with that payment.
Remember: Evergrande is stumbling under $300 billion worth of liabilities, which are widely held by Chinese financial institutions, retail investors, home buyers and suppliers in construction, materials and design industries. Foreign investors also hold some of its debt.
In the last few weeks, the company warned investors twice that it could default if it's unable to raise money quickly.
It's not clear whether the company will actually default, or whether Beijing will intervene and orchestrate some other type of restructuring. But the company's failure would likely create aftershocks that could ripple through the financial market and the broader Chinese economy.
""There appears to be an acceptance that an Evergrande failure is more a matter of when and not if, and the real question is how any fallout is managed,"" Michael Hewson, chief market analyst at CMC Markets, said in a report Wednesday.
The debt debate is heading for a Senate showdown
The House of Representatives voted Tuesday to pass legislation to prevent a government shutdown at the end of the month and suspend the nation's borrowing limit. Now comes phase two: a showdown with Republicans who insist Democrats should act alone to stave off a looming debt crisis.
The backstory: Government funding is set to expire on Sept. 30. The bill the House approved would extend funding and keep the government open through Dec. 3, while shelving the country's debt limit until December 2022. But the bill now faces an uphill battle in the Senate.
Treasury Secretary Janet Yellen has warned of dire consequences if the debt ceiling isn't raised, barring the government from paying its bills as soon as next month.
""The US has never defaulted. Not once,"" she wrote in an op-ed in the Wall Street Journal published Sunday. ""Doing so would likely precipitate a historic financial crisis that would compound the damage of the continuing public health emergency.""
Goldman Sachs observed that ""investors are growing concerned about market spillovers"" from a political standoff in a note to clients on Tuesday. Yet the data indicates those fears may be overblown.
""History shows that US government shutdowns generally have not meaningfully impacted equity returns,"" the investment bank said.
Still, a possible debt crisis is far from the only issue provoking ""extreme fear"" on Wall Street, according to the CNN Business Fear & Greed Index. Combined with the situation surrounding Evergrande and uncertainty about the economy and the path of central bank action, the debt debate could trigger more volatility than usual in the days to come.
Up next
General Mills GIS BlackBerry BB KB Home KBH posts results before US markets open.andfollow after the close.
Also today:
Data on existing US home sales for August arrives at 10 a.m. ET.
The Federal Reserve's latest policy decision goes live at 2 p.m. ET, followed by a press conference with Chair Jerome Powell.
Coming tomorrow: The Bank of England wraps up its September meeting.",https://edition.cnn.com/2021/09/22/investing/premarket-stocks-trading/index.html
15,"US STOCKS-Futures rise as Evergrande concerns ease, Fed now in focus",2021-09-22T10:57:27Z,"U.S. stock index futures rose on Wednesday as concerns over China's Evergrande eased after the property developer negotiated a domestic bond payment deal, with investors now awaiting policy cues from the Federal Reserve later in the day.","(For a live blog on the U.S. stock market, click or type LIVE/ in a news window)
* Futures up: Dow 0.66%, S&P 0.59%, Nasdaq 0.38%
Sept 22 (Reuters) - U.S. stock index futures rose on Wednesday as concerns over China’s Evergrande eased after the property developer negotiated a domestic bond payment deal, with investors now awaiting policy cues from the Federal Reserve later in the day.
Evergrande’s main unit said it had negotiated a deal with bondholders to settle interest payments on a domestic bond, which helped calm fears of an imminent default that could unleash global financial chaos.
The S&P 500 has fallen for 10 of the past 12 sessions since hitting a record high, as fears of an Evergrande default exacerbated seasonally weak trends and saw investors pull out of stocks trading at lofty valuations.
Focus now turns to the Fed’s decision, due at 2 p.m. ET (1800 GMT) where the bank could possibly unveil plans to begin scaling back its massive coronavirus-related stimulus measures.
A raft of positive economic data in recent weeks has strengthened expectations for a taper announcement from the central bank by as soon as September.
Commodity-linked oil and metal stocks led gains in premarket trade, while a slight rise in Treasury yields supported major banks. However, most sectors were nursing steep losses in recent sessions.
U.S. S&P 500 E-minis were up 25.5 points, or 0.59%, at 06:26 a.m. ET. Dow E-minis were up 222 points, or 0.66%, with 50,454 contracts changing hands. Nasdaq 100 E-minis were up 57.75 points, or 0.38%.
The Nasdaq fell the least among its peers in recent sessions, as investors pivoted back into big technology names that had proven resilient through the pandemic.
Among individual stocks, Fedex Corp fell 5.8% on posting a lower quarterly profit and the delivery firm also cut its full-year earnings forecast. (Reporting by Ambar Warrick in Bengaluru; Editing by Shounak Dasgupta)",https://www.reuters.com/article/usa-stocks/us-stocks-futures-rise-as-evergrande-concerns-ease-fed-now-in-focus-idUSL4N2QO2CP
16,The Federal Reserve is meeting and all eyes are on its bond purchase plans.,2021-09-22T08:58:09Z,The Fed is expected to clearly signal that it will slow bond purchases later this year. But the meeting comes as stocks sink.,"The Fed is expected to clearly signal that it will slow bond purchases later this year. But the meeting comes as stocks sink.
Image The Fed chair, Jerome H. Powell, has been carefully telegraphing the central bank’s progress toward the so-called taper, in hopes that the Fed can avoid surprising and roiling markets. Credit... Brendan Mcdermid/Reuters
The Federal Reserve is finishing up its two-day policy meeting on Wednesday, and officials are expected to signal that they will soon slow their large bond-buying program — the central bank’s first step in weaning the economy off the support it has offered since shortly after the pandemic began.
This Fed meeting is shaping up to be among the most closely watched of the year. Central bank officials are in the process of teeing up their plans to slow large-scale purchases of government-backed debt, which they have been using to keep longer-term interest rates low and many types of borrowing cheap. The Fed has been carefully broadcasting its progress toward the so-called taper, in hopes that it can avoid surprising and roiling markets. Officials could provide further details on the expected timing and pace.
The Fed — which will release its policy statement at 2 p.m. — will also provide fresh economic projections. Those will include policymakers’ predictions of when they might lift their main interest rate from near-zero, a move that officials have signaled is still months or even years away.
“The Fed has been very clear on their intentions,” said Michelle Meyer, chief U.S. economist at Bank of America, noting that officials want to get moving on the bond program so that they can separate it from the path ahead for the federal funds rate. “That’s one of the reasons they want to get the taper underway — they just want it on the back burner.”
Most economists expect the Fed to formally announce the tapering plan at its November meeting, and few expect officials to signal a precise timeline this week. Instead, they will probably say that they hope to slow bond purchases before the end of the year, and may offer hints about how quickly the purchases will draw to a close.
“Their goal is just to keep inching toward the taper,” said Gennadiy Goldberg, senior U.S. rates strategist at TD Securities. “Why pre-commit yourself?” Indeed, there’s a reason for all the tiptoeing. In 2013, when a former Fed Chair suggested that a post-financial-crisis bond purchase program would slow, it roiled global markets in what became known as the “taper tantrum.” Jerome H. Powell, the current Fed chair, has managed to avoid a similar fate so far, but the stakes right now are particularly high. Markets have been rocky this week as investors have fretted about stress in China’s real estate sector and the Fed’s plans. That risk is probably not enough to dissuade central bankers from sticking to the course they have charted, economists said. “It’s taken some effort to get Fed officials all on the same page, and to get the Fed and the markets on the same page,” Michael Feroli, chief U.S. economist at JPMorgan, said in an email Monday. “I’d be surprised if they want to upend that for something that may be fleeting.” The Fed is also wrestling with more long-lasting questions about the economic outlook. Inflation has been elevated this year as the economy has begun to reopen from the pandemic and supply has struggled to keep pace with rapid consumer demand, and some measures of consumer inflation expectations are creeping higher. If that continues, rapid price gains could become more permanent. That would run counter to one of the Fed’s two main goals. The central bank is in charge of keeping inflation low and steady — it aims for 2 percent annual increases in prices on average over time — while fostering maximum employment. But full employment also remains elusive. Millions of jobs are still missing, even after months of historically rapid employment gains, and officials want to avoid lifting interest rates to cool off the economy before the labor market has fully healed. It’s difficult to know when that might be, because the economy has never recovered from pandemic-induced lockdowns before. Tapering bond purchases could give the Fed room to be nimble going forward, allowing it to lift interest rates relatively quickly if it appears that inflation is climbing in a way that is likely to be sustained. Officials have signaled that they would prefer not to lift interest rates before bond buying is brought to a close. After the Fed releases its statement, Mr. Powell will offer a statement and take questions from reporters at 2:30 p.m.
Read more",https://www.nytimes.com/live/2021/09/22/business/economy-stock-market-news
17,EMERGING MARKETS-Most bourses rise on Evergrande relief,2021-09-22T08:36:03Z,"Most emerging market bourses rose on Wednesday on temporary relief after indebted Chinese developer Evergrande said it would make a Thursday coupon payment, while focus was also on the U.S. Federal Reserve's policy decision for clues on tapering.","* Evergrande to make Thursday coupon payment
* China blue-chips, Taiwan stocks fall in catch-up trade
* S.Africa August inflation rises more than expected
* Russia to spend $34 bln from rainy day fund
* Fed in focus for tapering clues
Sept 22 (Reuters) - Most emerging market bourses rose on Wednesday on temporary relief after indebted Chinese developer Evergrande said it would make a Thursday coupon payment, while focus was also on the U.S. Federal Reserve’s policy decision for clues on tapering.
Shares in Russia, South Africa, Turkey and Poland rose between 0.6% and 1.5%.
An index of EM shares, however, fell 0.2% pressured by declines in China blue-chips and Taiwan stocks as they caught up with the global stumble after being closed for public holidays. EM debt spreads retreated from one month lows hit on Tuesday.
Hong Kong markets were closed, but Evergrande’s Frankfurt listing surged about 20% after its unit said a coupon payment totalling 232 million yuan ($35.88 million) on its Shenzhen-traded 5.8% September 2025 bond would be made on time.
But worries remained as Evergrande made no mention of an $83.53 million coupon payment on an offshore dollar bond also due on Thursday. Evergrande’s total debt stands at $305 billion.
“This is obviously a fluid situation that we will need to monitor closely... there could be some further impact,” Kevin Headland, senior investment strategist at Manulife Investment Management told the Reuters Global Markets Forum, adding that they don’t expect a default to lead to widespread contagion.
“We think emerging market equities are very attractive longer term, provided you understand the risk of shorter term volatility. The fundamentals are supportive of EM... These market events often create dislocations that provide opportunity.”
Later in the day, the Fed is expected to drop more hints on its future policy path, including when it will start tapering its bond buying and, eventually, raising interest rates.
The dollar was steady, lending some support to EM currencies. The onshore yuan rose from near four-week lows. China kept its benchmark lending rate for corporate and household loans unchanged, as expected.
Russia’s rouble climbed a healthy 0.8%, supported by rising oil prices.
Officials said Russia will spend around 2.5 trillion roubles ($34 billion) from its National Wealth Fund in the next three years to help revive economic growth leading up to elections in 2024. But the central bank has warned that spending from the Fund too freely could fan inflation further.
South Africa’s rand firmed 0.5% after losing more than 4.5% over the last six days, while Turkey’s lira was flat.
The central banks of both countries are expected to keep rates unchanged when they meet on Thursday. South Africa's inflation was 4.9% in August, above expectations and up from 4.6% in July. South Africa's central bank has a 3%-6% inflation target range. For GRAPHIC on emerging market FX performance in 2021, see tmsnrt.rs/2egbfVh For GRAPHIC on MSCI emerging index performance in 2021, see tmsnrt.rs/2OusNdX
For TOP NEWS across emerging markets
For CENTRAL EUROPE market report, see
For TURKISH market report, see
For RUSSIAN market report, see",https://www.reuters.com/article/emerging-markets/emerging-markets-most-bourses-rise-on-evergrande-relief-idUSL1N2QO0HU
18,Nikkei hits two-week low on caution before U.S. Fed meet,2021-09-22T07:03:50Z,"The Nikkei hit a more than two-week low on Wednesday as investors looked ahead warily to the outcome of a U.S. Federal Reserve meeting, seeking more clues on when policymakers will wind down stimulus and lift interest rates.","TOKYO, Sept 22 (Reuters) - The Nikkei hit a more than two-week low on Wednesday as investors looked ahead warily to the outcome of a U.S. Federal Reserve meeting, seeking more clues on when policymakers will wind down stimulus and lift interest rates.
The benchmark closed down 0.67% at 29,639.40, while the broader Topix slid 1.02% to end at 2,043.55, also the lowest since Sept. 6.
The Nikkei briefly changed course earlier in the day to trade higher after China Evergrande’s main unit, Hengda Real Estate Group, said it would pay some bond interest due on Thursday, allaying fears of an imminent collapse.
That still did not push the Nikkei above 30,000, after it lost that level on Tuesday, the start of a holiday-shortened week, according to Shigetoshi Kamada, general manager at the research department of Tachibana Securities.
“That is because investor focus is on the Fed meeting... how the interest rate projections will look like and whether the Fed will start tapering before the end of the year,” he said.
The outcome of the Fed’s two-day meeting is scheduled at 1800 GMT with a news conference half an hour later.
Japanese markets will be closed for another holiday on Thursday.
Trading houses led the decline in Japanese equities, dropping 2.37%. Itochu was the worst performer among the Topix’s 30 core names, losing 4.08%, while Mitsui & Co slid 2.86%.
Machinery makers also fell, with Daikin Industries shedding 2.94%.
Mizuho Financial slipped 1.22% after a report that the regulator would oversee system management at the banking group following a series of technical failures.
Peer Mitsubishi UFJ Financial Group gained 1.42% after it said it would pull back from U.S. retail banking with the $8 billion sale of MUFG Union Bank.
Some heavyweight names were among the other top gainers. Start-up investor SoftBank Group advanced 1.9% and Uniqlo clothing shop-owner Fast Retailing gained 1.78%. Nintendo rose 1.1%. (Reporting by Junko Fujita; Additional reporting by Kevin Buckland; Editing by Subhranshu Sahu and Devika Syamnath)",https://www.reuters.com/article/japan-stocks-close/nikkei-hits-two-week-low-on-caution-before-u-s-fed-meet-idUSL4N2QO1JL
19,Stocks find fleeting relief in Evergrande deal; Fed looms,2021-09-22T06:29:45Z,"Stocks found relief on Wednesday after teetering developer China Evergrande said it would be able to pay a coupon on one of its bonds, easing some market jitters, however, the Federal Reserve's looming policy decision kept investors cautious.","SINGAPORE (Reuters) - Stocks found relief on Wednesday after teetering developer China Evergrande said it would be able to pay a coupon on one of its bonds, easing some market jitters, however, the Federal Reserve’s looming policy decision kept investors cautious.
FILE PHOTO: An investor sits in front of a board showing stock information at a brokerage office in Beijing, China, December 7, 2018. REUTERS/Thomas Peter/File Photo
China fell on its first day of trade after a two-day holiday. However, a cash injection from the People’s Bank of China kept falls far smaller than feared with blue chips off 0.7% and Shanghai Composite reversing losses to trade up 0.3%.
That weighed on MSCI’s broadest index of Asia-Pacific shares outside Japan, which fell 0.3%, however, Australia was higher.
Japan’s Nikkei dropped 0.6%. Hong Kong markets were shut.
Evergrande’s main unit, Hengda Real Estate, said it had settled interest payments due Thursday on a yuan bond with investors, which helped lift sentiment and trim losses.
“I think the market is still a little bit cagey,” said Rob Carnell, Asia-Pacific head of research at ING in Singapore.
“It’s Evergrande today, who will it be tomorrow? That’s probably why we haven’t seen a substantial and perhaps prolonged rally as a result of this,” he said.
The news sent S&P 500 futures, U.S. Treasury yields and the Australian dollar higher, before shedding some of those gains as traders were left with few details and as Evergrande made no mention of dollar bond interest also due on Thursday.
S&P 500 futures were last up 0.2%. European futures inched up 0.3%. After rising, safe-haven 10-year U.S. Treasury yields eased back to flat at 1.3311%.
Globally, markets had also already started to calm as analysts downplayed the threat of Evergrande’s troubles becoming a “Lehman moment” and setting off a financial crisis.
European markets rallied on Tuesday and on Wall Street the S&P 500 fared little worse than flat, sitting about 4% below a record made early in the month.
Focus now seems to be shifting to trying to gauge Beijing’s so-far muted response amid worries about the consequences for an economy that is slowing and financial markets reeling from months of disruptive and radical reform.
“(The) Evergrande debacle is further stoking concern over the fallout from China’s broadening crackdown,” analysts at Rabobank said in a note to clients, pointing out new rules on everything from online gaming to developers debt levels.
“As a consequence, Evergrande can perhaps be seen not so much as a potential crisis trigger but rather a symptom of a broader policy shift which threatens Chinese growth as politics dominate economic considerations.”
In currency markets, the Aussie rose slightly, having given up some of its early-session blip while the safe-haven yen was a tad weaker. [FRX/]
Moves were capped ahead of Wednesday’s Fed meeting, however, and the dollar was flat against the euro, with the risk of a hawkish Fed supporting the dollar.
Most analysts think the Fed will not go into detail about its tapering plans but say risks lie in board members’ “dot plot” of rates projections.
“Even though a tapering announcement is not expected, the dot plot may deliver a hawkish surprise and require Powell to be dovish and push back in the press conference,” said National Australia Bank’s director of economics and markets Tapas Strickland.
The outcome of the Fed’s meeting is announced at 1800 GMT with a news conference half an hour later.
In commodities, copper hovered near a month low and oil prices found support from a relaxation of inbound travel rules, likely to boost airline fuel demand. [MET/L][O/R]
Brent crude futures were last up 1% at $75.13 a barrel and U.S. crude rose 1.1% to $71.28. Gold was supported at $1,776.1 an ounce. [GOL/]",https://www.reuters.com/article/global-markets/global-markets-stocks-find-fleeting-relief-in-evergrande-deal-fed-looms-idUSL4N2QO18E
