,title,publishedAt,description,content,url
0,"European shares rise on Evergrande relief, ahead of Fed meeting",2021-09-22T16:15:56Z,"European stocks rose on Wednesday after debt-laden developer China Evergrande said it would make some interest payments, while investors awaited a signal from the U.S. Federal Reserve on how and when it will rein in its massive stimulus.","(Reuters) -European stocks rose on Wednesday after debt-laden developer China Evergrande said it would make some interest payments, while investors awaited a signal from the U.S. Federal Reserve on how and when it will rein in its massive stimulus.
The German share price index DAX graph is pictured at the stock exchange in Frankfurt, Germany, September 22, 2021. REUTERS/Staff
Evergrande’s Frankfurt-listed shares jumped 41.0% after hitting multi-year lows in the previous session.
The property developer said it would make a coupon payment on its domestic bonds, offering relief to investors worried about payments default following financial troubles.
“It’s been another positive session for European stocks, as concerns about fallout from Evergrande continue to diminish, after this morning’s agreement on some of its domestic bond coupons,” said Michael Hewson, chief market analyst at CMC Markets.
“Despite this little wrinkle, markets appear to be working on the assumption that the problem has been contained, let’s hope they are right.”
The travel & leisure index rose 2.5% hitting a 14-week high, after Entain jumped 5.1% on revealing a $22.4 billion takeover proposal from Boston-based DraftKings.
Online betting group Flutter Entertainment gained 4.0% after it agreed to pay $200 million to the Commonwealth of Kentucky to settle a judgment reinstated last year.
The Europe-wide STOXX 600 index rose 1.0%, extending Tuesday’s bounce after its worst session in two months, with commodity-linked stocks and banks leading gains.
Meanwhile, the Federal Reserve is set to conclude its two-day policy meeting later in the day, with investors expecting it to clear the way for cuts to its monthly asset purchases later this year and update its inflation and growth projections.
“Fed Chair Jerome Powell will most probably be clear on the central bank’s commitment to start lowering bond purchases before year-end but short on details about the pace and the composition of tapering,” Unicredit analysts said in a note.
“An announcement like this would be in line with Powell’s presentation at the central bank symposium in Jackson Hole in late August and is unlikely to surprise investors.”
After seven straight months of gains, sentiment has soured across global equities in September on worries about China’s slowing growth, the fast-spreading Delta variant of COVID-19 and tighter monetary policies.
The STOXX 600 is down 1.6% so far this month and is set for its worst monthly performance in about a year.
Deutsche Post fell 1.5 after U.S. delivery firm FedEx Corp cut its full-year forecast after labour shortages crimped earnings and drove up costs.",https://www.reuters.com/article/europe-stocks/european-shares-rise-on-evergrande-relief-ahead-of-fed-meeting-idUSKBN2GI0IY
1,"European shares rise on Evergrande relief, ahead of Fed meeting",2021-09-22T16:15:56Z,"European stocks rose on Wednesday after debt-laden developer China Evergrande said it would make some interest payments, while investors awaited a signal from the U.S. Federal Reserve on how and when it will rein in its massive stimulus.","(Reuters) -European stocks rose on Wednesday after debt-laden developer China Evergrande said it would make some interest payments, while investors awaited a signal from the U.S. Federal Reserve on how and when it will rein in its massive stimulus.
The German share price index DAX graph is pictured at the stock exchange in Frankfurt, Germany, September 22, 2021. REUTERS/Staff
Evergrande’s Frankfurt-listed shares jumped 41.0% after hitting multi-year lows in the previous session.
The property developer said it would make a coupon payment on its domestic bonds, offering relief to investors worried about payments default following financial troubles.
“It’s been another positive session for European stocks, as concerns about fallout from Evergrande continue to diminish, after this morning’s agreement on some of its domestic bond coupons,” said Michael Hewson, chief market analyst at CMC Markets.
“Despite this little wrinkle, markets appear to be working on the assumption that the problem has been contained, let’s hope they are right.”
The travel & leisure index rose 2.5% hitting a 14-week high, after Entain jumped 5.1% on revealing a $22.4 billion takeover proposal from Boston-based DraftKings.
Online betting group Flutter Entertainment gained 4.0% after it agreed to pay $200 million to the Commonwealth of Kentucky to settle a judgment reinstated last year.
The Europe-wide STOXX 600 index rose 1.0%, extending Tuesday’s bounce after its worst session in two months, with commodity-linked stocks and banks leading gains.
Meanwhile, the Federal Reserve is set to conclude its two-day policy meeting later in the day, with investors expecting it to clear the way for cuts to its monthly asset purchases later this year and update its inflation and growth projections.
“Fed Chair Jerome Powell will most probably be clear on the central bank’s commitment to start lowering bond purchases before year-end but short on details about the pace and the composition of tapering,” Unicredit analysts said in a note.
“An announcement like this would be in line with Powell’s presentation at the central bank symposium in Jackson Hole in late August and is unlikely to surprise investors.”
After seven straight months of gains, sentiment has soured across global equities in September on worries about China’s slowing growth, the fast-spreading Delta variant of COVID-19 and tighter monetary policies.
The STOXX 600 is down 1.6% so far this month and is set for its worst monthly performance in about a year.
Deutsche Post fell 1.5 after U.S. delivery firm FedEx Corp cut its full-year forecast after labour shortages crimped earnings and drove up costs.",https://www.reuters.com/article/europe-stocks/update-2-european-shares-rise-on-evergrande-relief-ahead-of-fed-meeting-idUSL4N2QO1SW
2,The Federal Reserve is getting ready to roll back its massive stimulus,2021-09-22T16:00:00Z,"The Federal Reserve isn't ready to take its foot off the stimulus gas pedal just yet, but that soon might change.","(CNN) — The Federal Reserve isn't ready to take its foot off the stimulus gas pedal just yet, but that soon might change.
If the economic recovery continues to progress as expected, the Fed ""judges that a moderation in the pace of asset purchases may soon be warranted,"" according to the bank's policy update published Wednesday.
This raises the prospects of a November announcement that it will step on the brakes. But even if such a move was delayed until December or January, it wouldn't matter much to markets, which have already priced in a policy change, said Seema Shah, chief strategist at Principal Global Investors, in emailed comments.
The Fed could also lift interest rates as early as next year, according to updated projections, as opposed to waiting until 2023 as previous forecasts called for.
Taper time
When the pandemic started to wreak havoc on the US economy in early 2020, the Fed stepped in, slashing interest rates to near-zero and committing to buying $120 billion worth of Treasury and mortgage-backed securities every month. These purchases will be rolled back soon, it seems, in what is referred to as a ""taper.""
It's the Fed's job to keep prices stable and achieve maximum employment. Over the past months, Powell had said that more progress was needed on those fronts until a change in policies is warranted. But now his tone has changed: While the test for inflation is already met, the test for employment is ""all but met,"" Powell told reporters during Wednesday's press conference.
""For me it would not take a knock-out great [September] employment report,"" Powell added, even though other members of the policy committee still wanted to see further improvements.
Investors have long expected the Fed to clamp down on its monthly stimulus as the recovery was coming along nicely over the summer. But a disappointing August jobs report pushed those expectations back. Wednesday's announcement was thus in line with what investors predicted and the stock market continued its rally after it was published.
Roadblocks ahead
There are still a few hurdles that the economy, and the market, need to overcome.
In Washington, the debt ceiling debate is heating up as lawmakers try to find a way to keep the government from running out of cash.
""It's just very important that the debt ceiling be raised so that the United States can pay its bills when they come due,"" Powell said, adding that the damage to the economy and financial markets would be severe if there were a default. Nobody should assume the Fed could fully protect the economy against such a failure, he added.
Meanwhile, the recovery has hit some roadblocks recently as the Delta variant is leading to more infections and affecting people's willingness to be around others.
And as many economists began to factor the Delta effect into their winter forecasts for the economy, so has the Fed. Its projections see lower economic growth for 2021 with gross domestic product rising 5.9%, compared with the 7% it projected in June. The growth rate for 2022, however, was revised upwards to 3.8% from 3.3%.
Similarly, the Fed now expects unemployment to be slightly higher -- at 4.8% -- than previously thought at the end of this year. Similarly, inflation is also will likely be higher by year-end than projected in June, as it's taking longer for bottlenecks and shortages that drive up prices to abate. The personal consumption expenditure index, which is the Fed's preferred measure of inflation, is expected to be at 4.2% for the year rather than 3.4% previously forecast.
Spikes in inflation over the summer fueled the market view that the Fed would soon reign in its easy-money policies sooner rather than later to keep the economy from overheating.
This story was first published on CNN.com, ""The Federal Reserve is getting ready to roll back its massive stimulus.""",https://cnnphilippines.com/business/2021/9/23/Federal-Reserve-Powell-policy-update.html
3,The Federal Reserve is getting ready to roll back its massive stimulus,2021-09-22T16:00:00Z,"The Federal Reserve isn't ready to take its foot off the stimulus gas pedal just yet, but that soon might change.","(CNN) — The Federal Reserve isn't ready to take its foot off the stimulus gas pedal just yet, but that soon might change.
If the economic recovery continues to progress as expected, the Fed ""judges that a moderation in the pace of asset purchases may soon be warranted,"" according to the bank's policy update published Wednesday.
This raises the prospects of a November announcement that it will step on the brakes. But even if such a move was delayed until December or January, it wouldn't matter much to markets, which have already priced in a policy change, said Seema Shah, chief strategist at Principal Global Investors, in emailed comments.
The Fed could also lift interest rates as early as next year, according to updated projections, as opposed to waiting until 2023 as previous forecasts called for.
Taper time
When the pandemic started to wreak havoc on the US economy in early 2020, the Fed stepped in, slashing interest rates to near-zero and committing to buying $120 billion worth of Treasury and mortgage-backed securities every month. These purchases will be rolled back soon, it seems, in what is referred to as a ""taper.""
It's the Fed's job to keep prices stable and achieve maximum employment. Over the past months, Powell had said that more progress was needed on those fronts until a change in policies is warranted. But now his tone has changed: While the test for inflation is already met, the test for employment is ""all but met,"" Powell told reporters during Wednesday's press conference.
""For me it would not take a knock-out great [September] employment report,"" Powell added, even though other members of the policy committee still wanted to see further improvements.
Investors have long expected the Fed to clamp down on its monthly stimulus as the recovery was coming along nicely over the summer. But a disappointing August jobs report pushed those expectations back. Wednesday's announcement was thus in line with what investors predicted and the stock market continued its rally after it was published.
Roadblocks ahead
There are still a few hurdles that the economy, and the market, need to overcome.
In Washington, the debt ceiling debate is heating up as lawmakers try to find a way to keep the government from running out of cash.
""It's just very important that the debt ceiling be raised so that the United States can pay its bills when they come due,"" Powell said, adding that the damage to the economy and financial markets would be severe if there were a default. Nobody should assume the Fed could fully protect the economy against such a failure, he added.
Meanwhile, the recovery has hit some roadblocks recently as the Delta variant is leading to more infections and affecting people's willingness to be around others.
And as many economists began to factor the Delta effect into their winter forecasts for the economy, so has the Fed. Its projections see lower economic growth for 2021 with gross domestic product rising 5.9%, compared with the 7% it projected in June. The growth rate for 2022, however, was revised upwards to 3.8% from 3.3%.
Similarly, the Fed now expects unemployment to be slightly higher -- at 4.8% -- than previously thought at the end of this year. Similarly, inflation is also will likely be higher by year-end than projected in June, as it's taking longer for bottlenecks and shortages that drive up prices to abate. The personal consumption expenditure index, which is the Fed's preferred measure of inflation, is expected to be at 4.2% for the year rather than 3.4% previously forecast.
Spikes in inflation over the summer fueled the market view that the Fed would soon reign in its easy-money policies sooner rather than later to keep the economy from overheating.
This story was first published on CNN.com, ""The Federal Reserve is getting ready to roll back its massive stimulus.""",https://www.cnnphilippines.com/business/2021/9/23/Federal-Reserve-Powell-policy-update.html
4,"Fed likely to open bond-buying 'taper' door, but hedge on outlook",2021-09-22T15:20:48Z,The Federal Reserve is expected to clear the way on Wednesday for reductions to its monthly asset purchases later this year and show in updated projections whether higher-than-expected inflation or a resurgent coronavirus pandemic is weighing more on the economic outlook.,"WASHINGTON (Reuters) - The Federal Reserve is expected to clear the way on Wednesday for reductions to its monthly asset purchases later this year and show in updated projections whether higher-than-expected inflation or a resurgent coronavirus pandemic is weighing more on the economic outlook.
FILE PHOTO: Federal Reserve Chair Jerome Powell testifies during a U.S. House Oversight and Reform Select Subcommittee hearing on the coronavirus crisis, on Capitol Hill in Washington, U.S., June 22, 2021. Graeme Jennings/Pool via REUTERS/File Photo
Fed policymakers, who are wrapping up their latest two-day meeting, have been handed a conflicting set of developments since late July - signs of a slowdown in the service sector, a COVID-19 surge that has eclipsed that of last summer and weak job growth in August, all alongside still strong inflation - and been conflicted among themselves about how to react.
Officials have for the most part said the economic recovery will continue and allow the U.S. central bank to proceed with plans to reduce its $120 billion in monthly purchases of Treasuries and mortgage-backed securities by the end of 2021, and wind them down fully over the first half of next year.
But forecasters and outside analysts expect the Fed to hedge on exactly when the “taper” might begin, and tie it to a rebound in job growth following the disconcertingly tepid report in August, when only 235,000 jobs were created.
The Fed is due to release its latest policy statement and economic projections at 2 p.m. EDT (1800 GMT), with Fed Chair Jerome Powell holding a news conference half an hour later to discuss the outcome.
The statement will likely acknowledge that the economy has taken another step towards the “substantial further progress” the Fed has said it wants to see in the labor market before reducing its bond purchases, Jefferies economists Aneta Markowska and Thomas Simons said in an analysis. While August job growth was disappointing, U.S. nonfarm payrolls swelled by just over 1 million in July and have increased an average 716,000 since May.
Still, high-frequency data and alternate employment indicators have hinted that upcoming jobs gains may disappoint as well, and the Jefferies analysts said the first actual reduction in asset purchases will likely be “conditional on a solid September employment gain.”
The U.S. job market remains about 5.3 million positions short of where it was before the pandemic.
More then 60% of economists who responded to a Reuters poll said they expected the tapering of the bond purchases to begin in December.
Fed officials, however, may decide they need more time to assess the risk from a handful of evolving issues before deciding to push ahead with the reduction in the bond-buying program. Financial markets have been roiled in the last week by concerns about spillover effects from the potential collapse of a large Chinese property developer, China Evergrande Group, and the S&P 500 index kicked off the week with its largest daily loss in four months.
Meanwhile, U.S. lawmakers appear no closer to resolving a partisan standoff in Congress over lifting the federal debt ceiling, with the potential for a partial shutdown of the federal government rising by the day.
INFLATION WATCH
When the bond-buying taper does come, it will mark the start of a shift away from the measures put in place in March 2020 to help the economy through the pandemic, and towards more normal monetary policies that will eventually include higher interest rates.
Powell, who is likely to learn before the Fed’s Nov. 2-3 policy meeting whether President Joe Biden wants to nominate him for a second term as head of the central bank, has emphasized in several high-profile speeches, including at a Kansas City Fed research conference last month, that the eventual start of the bond-buying taper is unrelated to the debate over interest rates. It is a point he is likely to reiterate on Wednesday.
Policymakers’ new economic and interest rate projections, however, will provide some sense of how fast rate hikes may follow the taper, and in particular whether a bout of high inflation has officials penciling in an initial increase for next year.
The Fed’s preferred measure of inflation as of July was about 4.2% on an annualized basis. That is double the central bank’s 2% target and enough in the minds of some officials to meet the central bank’s new promise to let inflation run moderately above that target for a while to be sure it is reached on average, a precursor to raising rates.
Leaning in the other direction: The surge of COVID-19 infections driven by the Delta variant of the coronavirus.
Since June, when the Fed noted the positive impact of COVID-19 vaccinations and said the economy’s performance appeared to be separating from the pandemic, the seven-day average of new daily infections had ballooned five-fold to 66,000 by the central bank’s July 27-28 meeting. It has roughly doubled again since then.
Some measures of service activity have dipped, prompting forecasters to mark down their outlooks for economic growth this year.
The Fed may well follow suit.",https://www.reuters.com/article/usa-fed/wrapup-2-fed-flags-bond-buying-taper-soon-rate-hike-shifts-to-2022-idUSL1N2QN1LU
5,GLOBAL MARKETS-Stocks rebound as Evergrande jitters ease; dollar slips ahead of Fed,2021-09-22T14:48:20Z,"U.S. and European stocks churned higher on Wednesday as market jitters around property developer China Evergrande eased, while the dollar index edged lower ahead of a U.S. Federal Reserve meeting.","U.S. and European stocks churned higher on Wednesday as market jitters around property developer China Evergrande eased, while the dollar index edged lower ahead of a U.S. Federal Reserve meeting. MSCI's gauge of stocks across the globe gained 0.62%, bouncing back for a second day after it logged its biggest one-day percentage drop in two months on Monday.
Wall Street's main indexes moved higher in early Wednesday trade following solid gains for markets in Europe. China Evergrande agreed to settle interest payments on a domestic bond, while the Chinese central bank injected cash into the banking system, soothing investors' fears of imminent contagion from the debt-laden property developer that had pressured equities and other riskier assets at the start of the week.
""Right or wrong, people I think are starting to show signs that they think maybe this pullback has reached its worst point,"" said Randy Frederick, vice president of trading and derivatives for Charles Schwab in Austin, Texas. ""It wasn't entirely the Evergrande situation, but it seems like that was one of the biggest pieces of it."" On Wall Street, the Dow Jones Industrial Average rose 361.36 points, or 1.07%, to 34,281.2, the S&P 500 gained 37.02 points, or 0.85%, to 4,391.21 and the Nasdaq Composite added 88.66 points, or 0.6%, to 14,835.06.
The pan-European STOXX 600 index rose 0.93%, with bank stocks surging. With a number of central banks around the world meeting this week, the Bank of Japan (BOJ) offered a bleaker view on exports and output as Asian factory shutdowns caused supply bottlenecks, but maintained its optimism that robust global growth would keep the economic recovery on track. BOJ Governor Haruhiko Kuroda also brushed aside fears that the debt problems of Evergrande could disrupt the global financial system.
Investors were closely watching the Fed, with the U.S. central bank expected to clear the way on Wednesday for reductions to its monthly asset purchases later this year. The dollar index fell 0.102%, with the euro up 0.16% to $1.1742. The Japanese yen weakened 0.32% versus the greenback at 109.56 per dollar.
Benchmark U.S. 10-year notes last rose 1/32 in price to yield 1.3209%, from 1.324% late on Tuesday. Oil prices climbed after industry data showed U.S. crude stocks fell more than expected last week after two hurricanes, highlighting tight supply as demand improves.
U.S. crude rose 1.93% to $71.85 per barrel and Brent was at $75.77, up 1.9% on the day. Spot gold dropped 0.1% to $1,773.31 an ounce, after three sessions of gains.
(This story has not been edited by Devdiscourse staff and is auto-generated from a syndicated feed.)",https://www.devdiscourse.com/article/business/1740182-global-markets-stocks-rebound-as-evergrande-jitters-ease-dollar-slips-ahead-of-fed
