,title,publishedAt,description,content,url
1,U.S. President-elect Donald Trump is reportedly in...,11/7/24,U.S. President-elect Donald Trump is reportedly inclined to allow Jerome Powell to complete his term...,"U.S. President-elect Donald Trump is reportedly inclined to allow Jerome Powell to complete his term as Federal Reserve Chair. Although Trump's decision is not final, his current stance aligns with the consensus of his economic team that Powell should remain in his position until his term ends in 2026.",
2,U.S. President-elect Donald Trump is reportedly in...,11/7/24,U.S. President-elect Donald Trump is reportedly inclined to let Jerome Powell finish his term as cha...,"U.S. President-elect Donald Trump is reportedly inclined to let Jerome Powell finish his term as chair of the Federal Reserve, according to sources from inside Trump's camp speaking to CNN.",
3,"Although Trump has not finalized his decision, the...",11/7/24,"Although Trump has not finalized his decision, the prevailing sentiment among his economic team is t...","Although Trump has not finalized his decision, the prevailing sentiment among his economic team is that Powell should continue leading the central bank.",
4,"Powell's term is scheduled to expire in May 2026, ...",11/7/24,"Powell's term is scheduled to expire in May 2026, giving him ample time to contribute to the Federal...","Powell's term is scheduled to expire in May 2026, giving him ample time to contribute to the Federal Reserve's ongoing policies and strategies under Trump's influence.",
5,(With inputs from agencies.),11/7/24,(With inputs from agencies.),(With inputs from agencies.),
6,President-elect Donald Trump is likely to allow Fe...,11/7/24,President-elect Donald Trump is likely to allow Federal Reserve Chair Jerome Powell to serve out the...,"President-elect Donald Trump is likely to allow Federal Reserve Chair Jerome Powell to serve out the remainder of his term, which expires in May 2026, according to a senior adviser to Trump requesting anonymity to describe private conversations.",
7,Washington CNN —,11/7/24,Washington CNN —,Washington CNN —,
8,President-elect Donald Trump remains likely to all...,11/7/24,President-elect Donald Trump remains likely to allow Federal Reserve Chair Jerome Powell to serve ou...,"President-elect Donald Trump remains likely to allow Federal Reserve Chair Jerome Powell to serve out the remainder of his term, which expires in May 2026, according to a senior adviser to Trump who requested anonymity to describe private conversations.",
9,The adviser cautioned that Trump could always chan...,11/7/24,"The adviser cautioned that Trump could always change his mind, but his present view — and that of Tr...","The adviser cautioned that Trump could always change his mind, but his present view — and that of Trump’s economic team — is that Powell should remain atop the central bank as it pursues its policy of cutting interest rates. Trump in July told Bloomberg he had intended to keep Powell in his role at least for the duration of his term.",
10,"Still, Powell was peppered with questions about hi...",11/7/24,"Still, Powell was peppered with questions about his job security during his first post-election pres...","Still, Powell was peppered with questions about his job security during his first post-election press conference Thursday. Powell issued a terse “No” in response to a question about whether he would leave his Fed post before his term is up if President-elect Donald Trump asked him to. Powell later clarified that he believes Trump cannot fire him.",
11,"”Not permitted under the law,” Powell said.",11/7/24,"”Not permitted under the law,” Powell said.","”Not permitted under the law,” Powell said.",
12,"Trump appointed Powell, a Republican former privat...",11/7/24,"Trump appointed Powell, a Republican former private equity executive who served on the central bank’...","Trump appointed Powell, a Republican former private equity executive who served on the central bank’s governing board, to its top spot in 2018.",
13,President Joe Biden reappointed him to a second fo...,11/7/24,President Joe Biden reappointed him to a second four-year term.,President Joe Biden reappointed him to a second four-year term.,
14,"Gary Cohn, the Goldman Sachs alum who served as ec...",11/7/24,"Gary Cohn, the Goldman Sachs alum who served as economic policy director during Trump’s first admini...","Gary Cohn, the Goldman Sachs alum who served as economic policy director during Trump’s first administration, is said to want the job, but former Trump officials have said the fact that Cohn resigned in protest over Trump’s steel tariffs makes it highly unlikely he’d get it.",
15,Among the names mentioned by sources in touch with...,11/7/24,"Among the names mentioned by sources in touch with the Trump transition are Kevin Warsh, who served ...","Among the names mentioned by sources in touch with the Trump transition are Kevin Warsh, who served for five years on the bank’s board of governors and advised Trump during his first term; as well as Trump’s former chief economist Kevin Hassett.",
16,"In July, before Trump was elected, the Fed chair w...",11/7/24,"In July, before Trump was elected, the Fed chair was asked whether he intended to serve out the rema...","In July, before Trump was elected, the Fed chair was asked whether he intended to serve out the remainder of his term, and he said, unequivocally, “Yes.”",
17,Trump has frequently aired frustrations with Powel...,11/7/24,Trump has frequently aired frustrations with Powell and occasionally threatened to remove the Fed ch...,"Trump has frequently aired frustrations with Powell and occasionally threatened to remove the Fed chair from his post, which no president has ever done.",
18,Trump has also criticized what he perceives as a l...,11/7/24,"Trump has also criticized what he perceives as a lack of transparency by the Fed, which conducts its...","Trump has also criticized what he perceives as a lack of transparency by the Fed, which conducts its policy deliberations in private and releases the notes from those discussions weeks later. CNN has reported that Trump aides have suggested he would like real-time release of those minutes and economic reports and for the meetings to be conducted on-camera.",
19,Trump’s fraught history with Powell,11/7/24,Trump’s fraught history with Powell,Trump’s fraught history with Powell,
20,Trump and Powell clashed several times during his ...,11/7/24,"Trump and Powell clashed several times during his first term, with the president-elect threatening t...","Trump and Powell clashed several times during his first term, with the president-elect threatening to fire him from the post on several occasions.",
21,"In 2018, Trump said he was considering replacing P...",11/7/24,"In 2018, Trump said he was considering replacing Powell with a new Fed chair after the central bank ...","In 2018, Trump said he was considering replacing Powell with a new Fed chair after the central bank raised interest rates. A president, however, cannot easily remove a Fed chair once confirmed unless they break the law.",
22,After markets tanked at the onset of the pandemic ...,11/7/24,"After markets tanked at the onset of the pandemic in March 2020, Trump told reporters he had the “ri...","After markets tanked at the onset of the pandemic in March 2020, Trump told reporters he had the “right to remove (Powell) as chairman,” adding that “he has, so far, made a lot of bad decisions, in my opinion.”",
23,"More recently, Trump also said the Fed chair is am...",11/7/24,"More recently, Trump also said the Fed chair is among the easiest jobs in the government. “You show ...","More recently, Trump also said the Fed chair is among the easiest jobs in the government. “You show up to the office once a month and you say, ‘Let’s flip a coin,’ and everybody talks about you like you’re a god,” Trump said last month at an event hosted by the Economic Club of Chicago.",
24,President-elect Donald Trump appointed Jerome Powe...,11/7/24,President-elect Donald Trump appointed Jerome Powell to lead the Federal Reserve in November 2017. P...,President-elect Donald Trump appointed Jerome Powell to lead the Federal Reserve in November 2017. President Joe Biden reappointed him five years later for another term as Fed Chair that is set to expire in 2026. Drew Angerer/Getty Images/File,
25,Trump also said his prior threats to remove Powell...,11/7/24,Trump also said his prior threats to remove Powell “because he was keeping the rates too high” cause...,Trump also said his prior threats to remove Powell “because he was keeping the rates too high” caused the Fed chair to lower rates “too much.”,
26,While the Fed chair has the most clout at Federal ...,11/7/24,"While the Fed chair has the most clout at Federal Open Market Committee meetings, they are not the o...","While the Fed chair has the most clout at Federal Open Market Committee meetings, they are not the only official to determine where interest rates should be. At every monetary policy meeting there are 11 other Fed officials who vote on interest rate moves.",
27,The Federal Reserve is confident that inflation is...,11/7/24,The Federal Reserve is confident that inflation is nearing its 2% target and may cut its benchmark r...,The Federal Reserve is confident that inflation is nearing its 2% target and may cut its benchmark rate by 25 bps. This will be the second rate cut by Fed this year following a 50 bps cut in September.,
28,US Federal Reserve November Meet: The United State...,11/7/24,US Federal Reserve November Meet: The United States Federal Reserve (US Fed) chairman Jerome Powell ...,"US Federal Reserve November Meet: The United States Federal Reserve (US Fed) chairman Jerome Powell is widely expected to announce a rate cut by a quarter of a percentage point as the two-day monetary policy meeting concludes on Thursday, November 7.",
29,The Federal Open Market Committee or the FOMC at i...,11/7/24,The Federal Open Market Committee or the FOMC at its last meeting in September had announced a rate ...,"The Federal Open Market Committee or the FOMC at its last meeting in September had announced a rate cut by 50 basis points (bps) for the first time in four years. This time, analysts and investors are pencilling in a smaller rate cut of 25 bps.",
30,"Apart from the announcement of the rate decision, ...",11/7/24,"Apart from the announcement of the rate decision, investors across the globe will be keenly eyeing P...","Apart from the announcement of the rate decision, investors across the globe will be keenly eyeing Powell’s commentary on the economic outlook.",
31,When & Where to Watch Fed Policy Decision? The US ...,11/7/24,When & Where to Watch Fed Policy Decision? The US Fed is slated to announce its decision at 2 pm EST...,When & Where to Watch Fed Policy Decision? The US Fed is slated to announce its decision at 2 pm EST on November 7 or 12.30 am IST on November 8.,
32,The announcement will be followed by a press confe...,11/7/24,The announcement will be followed by a press conference from Fed chair Jerome Powell at 2.30 pm EST ...,The announcement will be followed by a press conference from Fed chair Jerome Powell at 2.30 pm EST (1 am IST).,
33,You can watch the announcement live on the Fed's w...,11/7/24,You can watch the announcement live on the Fed's website or YouTube channel.,You can watch the announcement live on the Fed's website or YouTube channel.,
34,The next and the last Federal Reserve meeting for ...,11/7/24,The next and the last Federal Reserve meeting for the calendar year 2024 is scheduled to take place ...,The next and the last Federal Reserve meeting for the calendar year 2024 is scheduled to take place on December 17-18.,
35,Expectations From Fed Policy Outcome As per a Reut...,11/7/24,"Expectations From Fed Policy Outcome As per a Reuters report, the Fed is widely expected to reduce i...","Expectations From Fed Policy Outcome As per a Reuters report, the Fed is widely expected to reduce its benchmark policy rate by 25 bps on Thursday to a range between 4.5% and 4.75%.",
36,"However, the outlook for further rate cuts gets mu...",11/7/24,"However, the outlook for further rate cuts gets murkier following the re-election of Donald Trump as...","However, the outlook for further rate cuts gets murkier following the re-election of Donald Trump as the next President of the United States as some of the new policies by the Republican leader are expected to reverse or stall the slowdown in inflation.",
37,Fed is now expected to wrap up its rate-cutting cy...,11/7/24,"Fed is now expected to wrap up its rate-cutting cycle by the middle of next year, leaving the policy...","Fed is now expected to wrap up its rate-cutting cycle by the middle of next year, leaving the policy rate in the range of 3.75% to 4%, which is significantly above the roughly 2.9% level Fed officials projected as of September, suggested a Reuters report.",
38,What Happened at September Fed meeting? During its...,11/7/24,"What Happened at September Fed meeting? During its September meeting, US Federal Reserve officials c...","What Happened at September Fed meeting? During its September meeting, US Federal Reserve officials cut rates by 50 bps for the first time since the pandemic. Further, the Fed officials indicated that they expect the interest rate to decrease by another 50 basis points by the end of this year, followed by a full 1% reduction in 2025, and a final 0.5% cut in 2026, bringing the rate to a range of 2.75% to 3.00%.",
39,Also Read | How US Fed rate cuts affect Indian sto...,11/7/24,Also Read | How US Fed rate cuts affect Indian stock market,Also Read | How US Fed rate cuts affect Indian stock market,
40,"In its policy statement, the Fed said its policyma...",11/7/24,"In its policy statement, the Fed said its policymakers are increasingly confident that inflation is ...","In its policy statement, the Fed said its policymakers are increasingly confident that inflation is moving steadily toward the 2% target. They also noted that the risks to meeting their employment and inflation goals are now more balanced.",
41,Wall Street indexes climbed as investors await the...,11/7/24,Wall Street indexes climbed as investors await the Federal Reserve's interest-rate decision. Donald ...,"Wall Street indexes climbed as investors await the Federal Reserve's interest-rate decision. Donald Trump's second presidential win sparked a rally, and the market anticipates a rate cut. The S&P 500 marked historical gains post-election. Many speculate on future economic strategies and central bank actions.",
42,"Wall Street's main indexes surged on Thursday, bui...",11/7/24,"Wall Street's main indexes surged on Thursday, building on gains in anticipation of the Federal Rese...","Wall Street's main indexes surged on Thursday, building on gains in anticipation of the Federal Reserve's upcoming decision on interest rates. The rally was fueled by Donald Trump's surprising re-election as U.S. president.",
43,Investors are mostly expecting a 25-basis-point ra...,11/7/24,"Investors are mostly expecting a 25-basis-point rate cut, but they will scrutinize the central bank'...","Investors are mostly expecting a 25-basis-point rate cut, but they will scrutinize the central bank's comments for future guidance on monetary policy. Expectations that Trump will reduce corporate taxes and loosen regulations have already buoyed major indexes.",
44,With U.S. weekly jobless claims showing little cha...,11/7/24,"With U.S. weekly jobless claims showing little change, and potential Republican control of Congress,...","With U.S. weekly jobless claims showing little change, and potential Republican control of Congress, market action also focused on policy impacts. Meanwhile, sector-specific shifts were notable, including a decline in financial stocks and a rise in communication services.",
45,(With inputs from agencies.),11/7/24,(With inputs from agencies.),(With inputs from agencies.),
46,The Bank of England cut interest rates from 5% to ...,11/7/24,"The Bank of England cut interest rates from 5% to 4.75%, impacting the FTSE 100 index. The expected ...","The Bank of England cut interest rates from 5% to 4.75%, impacting the FTSE 100 index. The expected rate cut follows a new government budget projected to increase inflation and economic growth. The pound rose, affecting exports while market focus shifts to the Federal Reserve's policy decision.",
47,The FTSE 100 index dipped on Thursday after the Ba...,11/7/24,"The FTSE 100 index dipped on Thursday after the Bank of England (BoE) moved to lower interest rates,...","The FTSE 100 index dipped on Thursday after the Bank of England (BoE) moved to lower interest rates, which was anticipated, amidst forecasts of increased inflation and economic growth following the introduction of the new government's budget.",
48,The Monetary Policy Committee opted to reduce rate...,11/7/24,"The Monetary Policy Committee opted to reduce rates to 4.75% from 5%, meeting investors' expectation...","The Monetary Policy Committee opted to reduce rates to 4.75% from 5%, meeting investors' expectations. The central bank noted that the recent budget from finance minister Rachel Reeves, entailing higher tax, spending, and borrowing, could elevate the inflation rate by nearly half a percentage point.",
49,Market attention now shifts to the Federal Reserve...,11/7/24,"Market attention now shifts to the Federal Reserve's upcoming decision, with expectations of a 25 ba...","Market attention now shifts to the Federal Reserve's upcoming decision, with expectations of a 25 basis point rate cut. Despite some market fluctuations post-U.S. presidential election results, the FTSE 250 index found support, while individual companies including BT and Rolls-Royce experienced declines.",
50,(With inputs from agencies.),11/7/24,(With inputs from agencies.),(With inputs from agencies.),
51,U.S. stocks were mixed on Thursday as investors wa...,11/7/24,U.S. stocks were mixed on Thursday as investors waited for the Federal Reserve's decision on interes...,"U.S. stocks were mixed on Thursday as investors waited for the Federal Reserve's decision on interest rates, due later in the day.",
52,U.S. stocks were mixed on Thursday while investors...,11/7/24,U.S. stocks were mixed on Thursday while investors awaited the Federal Reserve's decision on interes...,"U.S. stocks were mixed on Thursday while investors awaited the Federal Reserve's decision on interest rates, scheduled for later in the day.",
53,"The S & P 500 gained 0.4 percent in early trading,...",11/7/24,"The S & P 500 gained 0.4 percent in early trading, although its momentum slowed significantly after ...","The S & P 500 gained 0.4 percent in early trading, although its momentum slowed significantly after a sharp rise the day before following Donald Trump's presidential victory.",
54,"The Dow Jones Industrial Average fell 62 points, o...",11/7/24,"The Dow Jones Industrial Average fell 62 points, or 0.1 percent, while the Nasdaq composite rose 0.7...","The Dow Jones Industrial Average fell 62 points, or 0.1 percent, while the Nasdaq composite rose 0.7 percent.",
55,"McKesson, a health care services company, led the ...",11/7/24,"McKesson, a health care services company, led the market's gain, jumping 8.1 percent after reporting...","McKesson, a health care services company, led the market's gain, jumping 8.1 percent after reporting stronger-than-expected quarterly profits.",
56,The company benefited from growth in its pharmaceu...,11/7/24,The company benefited from growth in its pharmaceutical business and raised its profit forecast for ...,The company benefited from growth in its pharmaceutical business and raised its profit forecast for the year.,
57,Trader Edward McCarthy works on the floor of the N...,11/7/24,"Trader Edward McCarthy works on the floor of the New York Stock Exchange, Nov. 6, 2024. U.S. stocks ...","Trader Edward McCarthy works on the floor of the New York Stock Exchange, Nov. 6, 2024. U.S. stocks were mixed on Nov. 7, 2024, ahead of the Federal Reserve’s announcement about what it will do... Trader Edward McCarthy works on the floor of the New York Stock Exchange, Nov. 6, 2024. U.S. stocks were mixed on Nov. 7, 2024, ahead of the Federal Reserve’s announcement about what it will do with interest rates. More Richard Drew/AP",
58,How Will the Interest Rate Cut Impact Americans?,11/7/24,How Will the Interest Rate Cut Impact Americans?,How Will the Interest Rate Cut Impact Americans?,
59,The key focus for the market was the Fed's decisio...,11/7/24,The key focus for the market was the Fed's decision. Most analysts expect the central bank to reduce...,The key focus for the market was the Fed's decision. Most analysts expect the central bank to reduce interest rates for the second consecutive month.,
60,The Fed began its rate-cutting cycle in September ...,11/7/24,"The Fed began its rate-cutting cycle in September to support the job market, after bringing inflatio...","The Fed began its rate-cutting cycle in September to support the job market, after bringing inflation close to its two percent target.",
61,A report on Thursday showed a slight increase in t...,11/7/24,A report on Thursday showed a slight increase in the number of U.S. workers applying for unemploymen...,"A report on Thursday showed a slight increase in the number of U.S. workers applying for unemployment benefits, though the figure met economists' expectations.",
62,Another report also showed a modest increase in wo...,11/7/24,"Another report also showed a modest increase in worker productivity over the summer, which could hel...","Another report also showed a modest increase in worker productivity over the summer, which could help curb inflation, though the gain was smaller than forecast.",
63,Trump's victory raised uncertainties about how his...,11/7/24,Trump's victory raised uncertainties about how his policies might affect the economy.,Trump's victory raised uncertainties about how his policies might affect the economy.,
64,Investors are particularly concerned about his pus...,11/7/24,Investors are particularly concerned about his push for tariffs and other measures that could drive ...,Investors are particularly concerned about his push for tariffs and other measures that could drive inflation higher.,
65,A board above the trading floor of the New York St...,11/7/24,A board above the trading floor of the New York Stock Exchange shows the closing number for the Dow ...,"A board above the trading floor of the New York Stock Exchange shows the closing number for the Dow Jones Industrial Average, November. 6, 2024. Overseas, London's FTSE 100 was flat after the Bank of... A board above the trading floor of the New York Stock Exchange shows the closing number for the Dow Jones Industrial Average, November. 6, 2024. Overseas, London's FTSE 100 was flat after the Bank of England cut its interest rate by 0.25 percent. More Richard Drew/AP",
66,How Have International Markets Reacted?,11/7/24,How Have International Markets Reacted?,How Have International Markets Reacted?,
67,"As a result, expectations for future interest rate...",11/7/24,"As a result, expectations for future interest rate cuts have been revised downward. This shift has b...","As a result, expectations for future interest rate cuts have been revised downward. This shift has been one of the factors driving the S & P 500 to multiple record highs this year.",
68,"In individual stocks, Lyft surged 28.4 percent aft...",11/7/24,"In individual stocks, Lyft surged 28.4 percent after reporting better-than-expected sales and profit...","In individual stocks, Lyft surged 28.4 percent after reporting better-than-expected sales and profits. Qualcomm rose 2.8 percent after surpassing analysts' profit forecasts.",
69,"In contrast, British chipmaker Arm Holdings report...",11/7/24,"In contrast, British chipmaker Arm Holdings reported solid earnings but issued disappointing guidanc...","In contrast, British chipmaker Arm Holdings reported solid earnings but issued disappointing guidance, causing its U.S.-listed shares to drop one percent.",
70,"Match Group, the parent company of the Tinder app,...",11/7/24,"Match Group, the parent company of the Tinder app, saw a significant drop, falling 18 percent after ...","Match Group, the parent company of the Tinder app, saw a significant drop, falling 18 percent after missing revenue expectations due to continued underperformance of Tinder.",
71,"Overseas, London's FTSE 100 was flat after the Ban...",11/7/24,"Overseas, London's FTSE 100 was flat after the Bank of England cut its interest rate by 0.25 percent...","Overseas, London's FTSE 100 was flat after the Bank of England cut its interest rate by 0.25 percent.",
72,"In Asia, Japan's Nikkei 225 fell 0.3 percent amid ...",11/7/24,"In Asia, Japan's Nikkei 225 fell 0.3 percent amid concerns about potential trade tensions under a Tr...","In Asia, Japan's Nikkei 225 fell 0.3 percent amid concerns about potential trade tensions under a Trump administration.",
73,"Neil Newman, head of strategy for Astris Advisory ...",11/7/24,"Neil Newman, head of strategy for Astris Advisory Japan, said worries about Trump's tariffs could af...","Neil Newman, head of strategy for Astris Advisory Japan, said worries about Trump's tariffs could affect market sentiment, especially in the early stages of his presidency.",
