,title,publishedAt,description,content,url
300,"My top 10 things to watch Thursday, Nov. 7 1. It's...",11/7/24,"My top 10 things to watch Thursday, Nov. 7 1. It's Fed Day. Two days after the election. Wow, what a...","My top 10 things to watch Thursday, Nov. 7 1. It's Fed Day. Two days after the election. Wow, what a week. To those who say we don't need another interest rate cut, I say that you have not been listening to companies' post-earnings conference calls. Manufacturing has been weak, and there's a freight recession. 2. Wall Street was extending its Trump victory-fueled rally that took the Dow , the S & P 500 , and the Nasdaq to new heights Wednesday. At least early Thursday, bond yields were lower after jumping on a belief that Donald Trump's policies as president would heat up the economy and risk higher inflation. 3. Guggenheim downgraded solar company Array Technologies to neutral from buy. The analysts cited concerns Trump's stance on energy transition. Array is a competitor of Club name Nextracker . I don't think Trump is against solar and Nextracker has all-American products, which the incoming president should like. 4. Argus and Jefferies downgraded Palantir to hold. I think these analysts are wrong and they're misjudging the Pentagon's new best friend in Trump who favors spending on a strong military. Palantir has lots of military contracts. 5. Stephens raised its Builders FirstSource price target to $200 per share from $178. The analysts kept their overweight buy rating on the building materials company. This is an interesting call because the group got hammered Wednesday on Trump tariffs concerns. 6. KeyBanc raised its Walmart price target by $1 to $88 a share and kept its overweight buy rating. It seems like meaningless a move but the retailing giant, which provides low prices and value, is a winner in a Trump regime. 7. Lyft shares surged more than 20% in response to the ride-hailing company's better-than-expected third-quarter revenue and rosy current quarter bookings guidance. Demand from commuters boosted the results. It's a surprising report after last week's print from Uber, which lacked the upside. 8. Shares of Qualcomm jumped 5.5% after the company reported better-than-expected quarterly results because of auto and telco and industrial. The semiconductor maker is firing on all cylinders as it has become more than just wireless. 9. Arm Holdings shares were going the other way, down 4%, after the company beat the quarter but failed to raise guidance. I'm not sure why, but the chip designer is perceived as too tied to auto and not enough smartphone growth? I'll ask Arm CEO Rene Haas why at 10 a.m. ET on CNBC. 10. E.l.f. Beauty hiked its full-year sales and earnings outlook after posting stronger-than-expected quarterly results, sending shares higher. Still the best house in the worst neighborhood. On the other hand, Coty lowered its comparable sales guidance, and Barclays downgraded the stock to a sell-equivalent rating in response. Analysts said the company is being too aggressive to achieve its targets. Bad sign and terrible category. Sign up for my Top 10 Morning Thoughts on the Market email newsletter for free (See here for a full list of the stocks at Jim Cramer's Charitable Trust.) As a subscriber to the CNBC Investing Club with Jim Cramer, you will receive a trade alert before Jim makes a trade. Jim waits 45 minutes after sending a trade alert before buying or selling a stock in his charitable trust's portfolio. If Jim has talked about a stock on CNBC TV, he waits 72 hours after issuing the trade alert before executing the trade. THE ABOVE INVESTING CLUB INFORMATION IS SUBJECT TO OUR TERMS AND CONDITIONS AND PRIVACY POLICY , TOGETHER WITH OUR DISCLAIMER . NO FIDUCIARY OBLIGATION OR DUTY EXISTS, OR IS CREATED, BY VIRTUE OF YOUR RECEIPT OF ANY INFORMATION PROVIDED IN CONNECTION WITH THE INVESTING CLUB. NO SPECIFIC OUTCOME OR PROFIT IS GUARANTEED.",
301,"My top 10 things to watch Thursday, Nov. 7",11/7/24,"My top 10 things to watch Thursday, Nov. 7","My top 10 things to watch Thursday, Nov. 7",
302,Federal Reserve Chair Jerome Powell made clear he’...,11/7/24,Federal Reserve Chair Jerome Powell made clear he’s ready to defend the US central bank; Donald Trum...,Federal Reserve Chair Jerome Powell made clear he’s ready to defend the US central bank; Donald Trump names his new chief of staff. How the day unfolded.,
303,"5.09PM – Nov 8, 2024",11/7/24,"5.09PM – Nov 8, 2024","5.09PM – Nov 8, 2024",
304,Thanks very much for reading our live coverage of ...,11/7/24,Thanks very much for reading our live coverage of the US election. Here are the biggest developments...,Thanks very much for reading our live coverage of the US election. Here are the biggest developments of the day:,
305,Trump’s win puts focus on immigration enforcement:...,11/7/24,Trump’s win puts focus on immigration enforcement: Donald Trump recaptured the White House after pro...,"Trump’s win puts focus on immigration enforcement: Donald Trump recaptured the White House after promising policies that included a militarised, mass deportation of undocumented immigrants – a costly undertaking that would probably face immediate legal and logistic challenges.",
306,Donald Trump to ‘rip off band-aid’ in massive tax ...,11/7/24,Donald Trump to ‘rip off band-aid’ in massive tax overhaul: The president-elect is planning to push ...,Donald Trump to ‘rip off band-aid’ in massive tax overhaul: The president-elect is planning to push aggressive taxation cuts and steep tariffs through Congress when he takes office.,
307,Powell ready to defend the Fed against Trump: US F...,11/7/24,Powell ready to defend the Fed against Trump: US Federal Reserve chairman Jerome Powell made clear h...,"Powell ready to defend the Fed against Trump: US Federal Reserve chairman Jerome Powell made clear he’s ready to defend the central bank from political pressure following the re-election of Donald Trump, saying he wouldn’t resign if asked and insisting the incoming president doesn’t have the power to fire him or other officials.",
308,Trump calls new chief of staff ‘ice maiden’: The p...,11/7/24,Trump calls new chief of staff ‘ice maiden’: The president-elect had mentioned Susie Wiles several t...,Trump calls new chief of staff ‘ice maiden’: The president-elect had mentioned Susie Wiles several times in his victory speech.,
309,You can read more in-depth coverage of the electio...,11/7/24,You can read more in-depth coverage of the election here.,You can read more in-depth coverage of the election here.,
310,WASHINGTON (AP) — Federal Reserve officials are po...,11/7/24,WASHINGTON (AP) — Federal Reserve officials are poised Thursday to reduce their key interest rate fo...,"WASHINGTON (AP) — Federal Reserve officials are poised Thursday to reduce their key interest rate for a second straight time, responding to a steady slowdown of the inflation pressures that exasperated many Americans and contributed to Donald Trump's presidential election victory.",
311,WASHINGTON (AP) — Federal Reserve officials are po...,11/7/24,WASHINGTON (AP) — Federal Reserve officials are poised Thursday to reduce their key interest rate fo...,"WASHINGTON (AP) — Federal Reserve officials are poised Thursday to reduce their key interest rate for a second straight time, responding to a steady slowdown of the inflation pressures that exasperated many Americans and contributed to Donald Trump's presidential election victory.",
312,Yet the Fed's future moves are now more uncertain ...,11/7/24,"Yet the Fed's future moves are now more uncertain in the aftermath of the election, given that Trump...","Yet the Fed's future moves are now more uncertain in the aftermath of the election, given that Trump's economic proposals have been widely flagged as potentially inflationary. His election has also raised the specter of meddling by the White House in the Fed's policy decisions, with Trump having proclaimed that as president he should have a voice in the central bank's interest rate decisions.",
313,The Fed has long guarded its status as an independ...,11/7/24,The Fed has long guarded its status as an independent institution able to make difficult decisions a...,"The Fed has long guarded its status as an independent institution able to make difficult decisions about borrowing rates, free from political interference. Yet during his previous term in the White House, Trump publicly attacked Chair Jerome Powell after the Fed raised rates to fight inflation, and he may do so again.",
314,The economy is also clouding the picture by flashi...,11/7/24,"The economy is also clouding the picture by flashing conflicting signals, with growth solid but hiri...","The economy is also clouding the picture by flashing conflicting signals, with growth solid but hiring weakening. Even so, consumer spending has been healthy, fueling concerns that there is no need for the Fed to reduce borrowing costs and that doing so might overstimulate the economy and even re-accelerate inflation.",
315,Financial markets are throwing yet another curve a...,11/7/24,Financial markets are throwing yet another curve at the Fed: Investors have sharply pushed up Treasu...,"Financial markets are throwing yet another curve at the Fed: Investors have sharply pushed up Treasury yields since the central bank cut rates in September. The result has been higher borrowing costs throughout the economy, thereby diminishing the benefit to consumers of the Fed's half-point cut in its benchmark rate, which it announced after its September meeting.",
316,"The average U.S. 30-year mortgage rate, for exampl...",11/7/24,"The average U.S. 30-year mortgage rate, for example, fell over the summer as the Fed signaled that i...","The average U.S. 30-year mortgage rate, for example, fell over the summer as the Fed signaled that it would cut rates, only to rise again once the central bank actually cut its benchmark rate.",
317,Broader interest rates have risen because investor...,11/7/24,"Broader interest rates have risen because investors are anticipating higher inflation, larger federa...","Broader interest rates have risen because investors are anticipating higher inflation, larger federal budget deficits, and faster economic growth under a President-elect Trump. In what Wall Street has called the “Trump trade,” stock prices also soared Wednesday and the value of bitcoin and the dollar surged. Trump had talked up cryptocurrencies during his campaign, and the dollar would likely benefit from higher rates and from the across-the-board increase in tariffs that Trump has proposed.",
318,Trump's plan to impose at least a 10% tariff on al...,11/7/24,"Trump's plan to impose at least a 10% tariff on all imports, as well as significantly higher taxes o...","Trump's plan to impose at least a 10% tariff on all imports, as well as significantly higher taxes on Chinese goods, and to carry out a mass deportation of undocumented immigrants would almost certainly boost inflation. This would make it less likely that the Fed would continue cutting its key rate. Annual inflation as measured by the central bank's preferred gauge fell to 2.1% in September.",
319,Story Continues,11/7/24,Story Continues,Story Continues,
320,The Federal Reserve cut interest rates by a quarte...,11/7/24,The Federal Reserve cut interest rates by a quarter of a percentage point on Thursday.,The Federal Reserve cut interest rates by a quarter of a percentage point on Thursday.,
321,The Fed is expected cut interest rates by a quarte...,11/7/24,The Fed is expected cut interest rates by a quarter of a percentage point.,The Fed is expected cut interest rates by a quarter of a percentage point.,
322,The Federal Reserve cut interest rates by a quarte...,11/7/24,The Federal Reserve cut interest rates by a quarter of a percentage point on Thursday.,The Federal Reserve cut interest rates by a quarter of a percentage point on Thursday.,
323,"Federal Reserve cuts interest rates, days after el...",11/7/24,"Federal Reserve cuts interest rates, days after election of Trump The Federal Reserve cut interest r...","Federal Reserve cuts interest rates, days after election of Trump The Federal Reserve cut interest rates by a quarter of a percentage point on Thursday.",
324,"Federal Reserve cuts interest rates, days after el...",11/7/24,"Federal Reserve cuts interest rates, days after election of Trump The Federal Reserve cut interest r...","Federal Reserve cuts interest rates, days after election of Trump The Federal Reserve cut interest rates by a quarter of a percentage point on Thursday.",
325,"Federal Reserve cuts interest rates, days after el...",11/7/24,"Federal Reserve cuts interest rates, days after election of Trump The Federal Reserve cut interest r...","Federal Reserve cuts interest rates, days after election of Trump The Federal Reserve cut interest rates by a quarter of a percentage point on Thursday.",
326,The Federal Reserve cut interest rates by a quarte...,11/7/24,"The Federal Reserve cut interest rates by a quarter of a percentage point on Thursday, setting the l...","The Federal Reserve cut interest rates by a quarter of a percentage point on Thursday, setting the latest path for borrowing costs just two days after the victory of President-Elect Donald Trump.",
327,The move comes two months after the Fed cut its be...,11/7/24,The move comes two months after the Fed cut its benchmark interest rate a half of a percentage point...,"The move comes two months after the Fed cut its benchmark interest rate a half of a percentage point, dialing back its yearslong fight against inflation and delivering relief for borrowers saddled with high costs.",
328,"The Federal Open Market Committee (FOMC), a policy...",11/7/24,"The Federal Open Market Committee (FOMC), a policymaking body at the Fed, has forecast further inter...","The Federal Open Market Committee (FOMC), a policymaking body at the Fed, has forecast further interest rate cuts.",
329,The exterior of the Federal Reserve Bank of New Yo...,11/7/24,"The exterior of the Federal Reserve Bank of New York is shown on Aug. 20, 2024 in New York. AP Photo...","The exterior of the Federal Reserve Bank of New York is shown on Aug. 20, 2024 in New York. AP Photo/Peter Morgan",
330,"By the end of 2024, interest rates will fall anoth...",11/7/24,"By the end of 2024, interest rates will fall another half of a percentage point from their current l...","By the end of 2024, interest rates will fall another half of a percentage point from their current level of between 4.75% and 5%, according to FOMC projections. Interest rates will drop another percentage point over the course of 2025, the projections further indicated.",
331,"In recent months, the U.S. has inched closer to a ...",11/7/24,"In recent months, the U.S. has inched closer to a ""soft landing,"" in which inflation returns to norm...","In recent months, the U.S. has inched closer to a ""soft landing,"" in which inflation returns to normal and the economy averts a recession.",
332,Government data released last week showed robust e...,11/7/24,"Government data released last week showed robust economic growth over a recent three-month period, a...","Government data released last week showed robust economic growth over a recent three-month period, alongside a continued cooldown of inflation.",
333,"U.S. hiring slowed in October, but fallout from hu...",11/7/24,"U.S. hiring slowed in October, but fallout from hurricanes and labor strikes likely caused an underc...","U.S. hiring slowed in October, but fallout from hurricanes and labor strikes likely caused an undercount of the nation's workers, U.S. Bureau of Labor Statistics data on Friday showed.",
334,"Since 2021, the Fed has sought to rein in inflatio...",11/7/24,"Since 2021, the Fed has sought to rein in inflation with elevated interest rates. Even after the Fed...","Since 2021, the Fed has sought to rein in inflation with elevated interest rates. Even after the Federal Reserve cut its benchmark interest in September, it still stands at a historically high level.",
335,Inflation has cooled dramatically from a peak of a...,11/7/24,"Inflation has cooled dramatically from a peak of about 9% in 2022, hovering right near the Federal R...","Inflation has cooled dramatically from a peak of about 9% in 2022, hovering right near the Federal Reserve's target rate of 2%.",
336,The trajectory of inflation could shift in the com...,11/7/24,The trajectory of inflation could shift in the coming months. Trump's proposals of heightened tariff...,"The trajectory of inflation could shift in the coming months. Trump's proposals of heightened tariffs and the mass deportation of undocumented immigrants are widely expected to raise consumer prices, experts previously told ABC News.",
337,"To be sure, the Fed says it bases its decisions on...",11/7/24,"To be sure, the Fed says it bases its decisions on economic conditions and operates as an independen...","To be sure, the Fed says it bases its decisions on economic conditions and operates as an independent government body.",
338,When asked previously about the 2024 election at a...,11/7/24,"When asked previously about the 2024 election at a press conference in Washington, D.C., in December...","When asked previously about the 2024 election at a press conference in Washington, D.C., in December, Powell said, ""We don't think about politics.""",
339,The election of Trump appears to have delivered a ...,11/7/24,The election of Trump appears to have delivered a boost for the stock market. The U.S. stock market ...,"The election of Trump appears to have delivered a boost for the stock market. The U.S. stock market soared at the open of trading on Wednesday, just hours after Trump declared victory.",
340,The Dow Jones Industrial Average climbed more than...,11/7/24,"The Dow Jones Industrial Average climbed more than 1,300 points, amounting to a nearly 3% rise in th...","The Dow Jones Industrial Average climbed more than 1,300 points, amounting to a nearly 3% rise in the index. The S &P 500 and the tech-heavy Nasdaq each jumped more than 2%.",
341,"Shares of Tesla, the electric vehicle company head...",11/7/24,"Shares of Tesla, the electric vehicle company headed by Trump ally Elon Musk, spiked about 14.5% in ...","Shares of Tesla, the electric vehicle company headed by Trump ally Elon Musk, spiked about 14.5% in early trading on Wednesday.",
342,The rate decision may seem like a footnote given t...,11/7/24,The rate decision may seem like a footnote given the uncertain economic terrain the U.S. central ban...,The rate decision may seem like a footnote given the uncertain economic terrain the U.S. central bank may soon be navigating under a second Trump administration,
343,Open this photo in gallery: A jogger runs past the...,11/7/24,"Open this photo in gallery: A jogger runs past the Federal Reserve building, in Washington, on Aug. ...","Open this photo in gallery: A jogger runs past the Federal Reserve building, in Washington, on Aug. 22, 2018.Chris Wattie/Reuters",
344,The U.S. Federal Reserve is expected to reduce its...,11/7/24,The U.S. Federal Reserve is expected to reduce its benchmark policy rate by a quarter of a percentag...,"The U.S. Federal Reserve is expected to reduce its benchmark policy rate by a quarter of a percentage point at the end of its policy meeting on Thursday, a decision that may seem a footnote given the uncertain economic terrain the central bank may soon be navigating under a second Trump administration.",
345,Former president and Republican nominee Donald Tru...,11/7/24,Former president and Republican nominee Donald Trump’s return-to-office victory in Tuesday’s U.S. el...,Former president and Republican nominee Donald Trump’s return-to-office victory in Tuesday’s U.S. election and possible GOP control of both houses of Congress puts into play policy changes from tariffs to tax cuts to stifled immigration that could rewrite the outlook for economic growth and inflation Fed policy-makers had expected to face next year.,
346,It may take months for the proposals to evolve and...,11/7/24,It may take months for the proposals to evolve and work through Congress even under full Republican ...,It may take months for the proposals to evolve and work through Congress even under full Republican control.,
347,But bond yields continued their recent rise in the...,11/7/24,"But bond yields continued their recent rise in the wake of Tuesday’s results, and investors now expe...","But bond yields continued their recent rise in the wake of Tuesday’s results, and investors now expect the Fed will end up cutting interest rates less than previously anticipated as they take stock of a new economic regime that may mean higher federal deficits, higher growth, and higher inflation in the short run, and also come with longer-term risks.",
348,"“You can see over time, the direction of budget de...",11/7/24,"“You can see over time, the direction of budget deficits, tariffs … can become a problem” for the Fe...","“You can see over time, the direction of budget deficits, tariffs … can become a problem” for the Fed to manage, said TSLombard Chief U.S. Economist Steven Blitz.",
349,After having free rein to raise interest rates to ...,11/7/24,"After having free rein to raise interest rates to fight inflation in a strong economy, the central b...","After having free rein to raise interest rates to fight inflation in a strong economy, the central bank may end up “in second position” keeping up with shifts in trade and global capital flows triggered by administration policies, facing both rising prices and pressure to keep unemployment low, Blitz said.",
350,Trump in his first term was open in calling for lo...,11/7/24,"Trump in his first term was open in calling for low interest rates, eventually branding Fed Chair Je...","Trump in his first term was open in calling for low interest rates, eventually branding Fed Chair Jerome Powell an “enemy” because of rate hikes he thought were unnecessarily stifling growth, a turbulent background to a relationship that will be closely watched in coming months.",
351,Trump promoted then-Fed Governor Powell to lead th...,11/7/24,"Trump promoted then-Fed Governor Powell to lead the Fed in 2018, and Powell was reappointed by Presi...","Trump promoted then-Fed Governor Powell to lead the Fed in 2018, and Powell was reappointed by President Joe Biden to a second term that runs through May 2026, which Powell has said he intends to complete.",
352,The Fed is widely anticipated to reduce its benchm...,11/7/24,The Fed is widely anticipated to reduce its benchmark policy rate by a quarter of a percentage point...,"The Fed is widely anticipated to reduce its benchmark policy rate by a quarter of a percentage point on Thursday to a range between 4.5 per cent and 4.75 per cent, a well-broadcast follow-up to the half-point reduction approved in September.",
353,"Market confidence in what happens next, however, h...",11/7/24,"Market confidence in what happens next, however, has begun to weaken, with the Fed now expected to e...","Market confidence in what happens next, however, has begun to weaken, with the Fed now expected to end its cutting cycle as soon as the middle of next year with a policy rate ending in the 3.75 per cent to 4 per cent range.",
354,That is a full percentage point above the roughly ...,11/7/24,That is a full percentage point above the roughly 2.9 per cent level Fed officials projected as of S...,That is a full percentage point above the roughly 2.9 per cent level Fed officials projected as of September.,
355,It is also well above the policy rate that caused ...,11/7/24,"It is also well above the policy rate that caused Trump to erupt against the Fed in his first term, ...","It is also well above the policy rate that caused Trump to erupt against the Fed in his first term, when the Fed’s benchmark rate peaked at around 2.4 per cent.",
356,But monetary policy has been tightened and is bein...,11/7/24,But monetary policy has been tightened and is being kept tight to return inflation to the central ba...,But monetary policy has been tightened and is being kept tight to return inflation to the central bank’s 2 per cent target – a process of “disinflation” the Fed feels is not yet complete and which Trump may want to see continue given how big a role rising prices played in the campaign.,
357,Yet the impact of Trump’s promised suite of econom...,11/7/24,Yet the impact of Trump’s promised suite of economic policies could be difficult for the central ban...,"Yet the impact of Trump’s promised suite of economic policies could be difficult for the central bank to parse if tariffs start to shift global supply patterns with an uncertain impact on prices, growth and jobs, and various tax cuts are rolled out with a similarly hard-to-predict impacts on incomes, consumer demand, and government deficits.",
358,Fed officials ahead of the election noted that the...,11/7/24,Fed officials ahead of the election noted that they don’t set monetary policy in reaction to proposa...,"Fed officials ahead of the election noted that they don’t set monetary policy in reaction to proposals from any administration, but take fiscal and regulatory decisions as a “given” and only respond to the economic outcomes those decisions generate.",
