title,publishedAt,description,content,url
Wall Street's major indexes conclude 2024 on a hig...,2024-12-31,"Wall Street's major indexes conclude 2024 on a high note, bolstered by economic resilience, Federal ...","Wall Street's major indexes conclude 2024 on a high note, bolstered by economic resilience, Federal Reserve rate cuts, and the AI revolution. The S&P 500, Dow, and Nasdaq near record highs, with significant gains in technology and energy stocks. Trump's presidential win propels small-cap and crypto stocks.",
"In the final trading session of 2024, Wall Street'...",2024-12-31,"In the final trading session of 2024, Wall Street's major indexes opened higher, extending a bullish...","In the final trading session of 2024, Wall Street's major indexes opened higher, extending a bullish trend that began over two years ago. This growth, driven by post-pandemic resilience, optimism from lower borrowing costs, and the AI surge, has led the S&P 500, Dow, and Nasdaq to nearly record-breaking levels.",
Interest rate cuts of nearly 100 basis points by t...,2024-12-31,Interest rate cuts of nearly 100 basis points by the Federal Reserve and a rally in technology stock...,"Interest rate cuts of nearly 100 basis points by the Federal Reserve and a rally in technology stocks have been pivotal, pushing equities to record highs. Notably, despite a smaller surge compared to last year, Nvidia still achieved a market value of $3 trillion, while Tesla regained its $1 trillion mark.",
Donald Trump's presidential victory further booste...,2024-12-31,"Donald Trump's presidential victory further boosted market confidence, with risk-taking improvement ...","Donald Trump's presidential victory further boosted market confidence, with risk-taking improvement and small-cap stocks recording gains. Meanwhile, inflationary concerns might influence the Federal Reserve's rate decision in 2025, as Bitcoin climbs to $100,000, strengthening crypto stocks like MicroStrategy.",
(With inputs from agencies.),2024-12-31,(With inputs from agencies.),(With inputs from agencies.),
The U.S. dollar is poised for an annual gain again...,2024-12-31,"The U.S. dollar is poised for an annual gain against major currencies, driven by expectations of hig...","The U.S. dollar is poised for an annual gain against major currencies, driven by expectations of higher interest rates by the Federal Reserve. The Japanese yen faces losses, impacted by interest rate differentials. Analysts predict U.S. policy changes under President-elect Trump to further influence economic growth and inflation.",
The U.S. dollar is on the path to achieving an ann...,2024-12-31,"The U.S. dollar is on the path to achieving an annual upswing against most major global currencies, ...","The U.S. dollar is on the path to achieving an annual upswing against most major global currencies, with the Japanese yen being one of its most significant detractors. This rally stems from the expectation that the Federal Reserve will maintain higher interest rates compared to other central banks, thereby allowing the American currency to excel.",
Traders have adjusted their forecasts to accommoda...,2024-12-31,Traders have adjusted their forecasts to accommodate a cautious stance from the Federal Reserve rega...,"Traders have adjusted their forecasts to accommodate a cautious stance from the Federal Reserve regarding rate cuts next year due to persistent inflation above the targeted 2% threshold. This outlook intertwined with anticipated policy changes by President-elect Donald Trump, which include business deregulation, tax cuts, tariffs, and stricter immigration policies, suggests amplified economic growth and price pressures.",
These factors prompted a rise in U.S. Treasury yie...,2024-12-31,"These factors prompted a rise in U.S. Treasury yields, consequently enhancing appetite for the U.S. ...","These factors prompted a rise in U.S. Treasury yields, consequently enhancing appetite for the U.S. dollar. As Lee Hardman, senior currency analyst at MUFG comments, the market has recalibrated to account for the potential inflationary consequences of the incoming administration's policy framework.",
(With inputs from agencies.),2024-12-31,(With inputs from agencies.),(With inputs from agencies.),
President-elect Donald Trump and Federal Reserve C...,2024-12-31,"President-elect Donald Trump and Federal Reserve Chair Jay Powell have clashed before, and there is ...","President-elect Donald Trump and Federal Reserve Chair Jay Powell have clashed before, and there is a chance they could do so again in 2025.",
President-elect Donald Trump and Federal Reserve C...,2024-12-31,"President-elect Donald Trump and Federal Reserve Chair Jay Powell have clashed before, and there is ...","President-elect Donald Trump and Federal Reserve Chair Jay Powell have clashed before, and there is a chance they will do so again in 2025.",
Their collision could unfold in multiple ways.,2024-12-31,Their collision could unfold in multiple ways.,Their collision could unfold in multiple ways.,
"If Trump’s economic policies cause more inflation,...",2024-12-31,"If Trump’s economic policies cause more inflation, it could force the Fed to tap the brakes and pull...","If Trump’s economic policies cause more inflation, it could force the Fed to tap the brakes and pull back any expected interest rate cuts. The new administration could make some new noise about limiting the Fed’s independence. Or Trump cost cutter Elon Musk — who recently said the central bank is ""absurdly overstaffed"" — could seek to overhaul the Fed’s workforce.",
The tensions between Trump and Powell were on disp...,2024-12-31,The tensions between Trump and Powell were on display for much of 2024. Trump on the campaign trail ...,"The tensions between Trump and Powell were on display for much of 2024. Trump on the campaign trail regularly weighed in with criticisms of Powell, offering that the president should ""have a say"" in Fed decisions and that Powell has ""gotten it wrong a lot.""",
"After Trump’s reelection win in November, Powell h...",2024-12-31,"After Trump’s reelection win in November, Powell himself aggressively rebuffed the possibility of be...","After Trump’s reelection win in November, Powell himself aggressively rebuffed the possibility of being removed before his term is up in May 2026.",
U.S. President Donald Trump looks on as his nomine...,2024-12-31,U.S. President Donald Trump looks on as his nominee for the chairman of the Federal Reserve Jerome P...,U.S. President Donald Trump looks on as his nominee for the chairman of the Federal Reserve Jerome Powell takes to the podium during a press event in the Rose Garden at the White House in 2017. (Photo by Drew Angerer/Getty Images) · Drew Angerer via Getty Images,
"""Not permitted under the law,"" the central bank ch...",2024-12-31,"""Not permitted under the law,"" the central bank chair said on Nov. 7 to reporters who asked about hi...","""Not permitted under the law,"" the central bank chair said on Nov. 7 to reporters who asked about his views on any legal authorities Trump might have in terms of firing or demoting him.",
"""No,"" he said at another point in a press conferen...",2024-12-31,"""No,"" he said at another point in a press conference on the question of whether he would leave, soun...","""No,"" he said at another point in a press conference on the question of whether he would leave, sounding perturbed.",
Trump and Powell appear to be making an effort to ...,2024-12-31,Trump and Powell appear to be making an effort to sound more conciliatory as inauguration day draws ...,Trump and Powell appear to be making an effort to sound more conciliatory as inauguration day draws closer.,
The president-elect said earlier this month on NBC...,2024-12-31,The president-elect said earlier this month on NBC's Meet the Press that he has no plans to remove P...,The president-elect said earlier this month on NBC's Meet the Press that he has no plans to remove Powell before the Federal Reserve chair's term is up in May 2026.,
That came just days after Powell said that he hope...,2024-12-31,That came just days after Powell said that he hoped for a good relationship with the new Trump White...,"That came just days after Powell said that he hoped for a good relationship with the new Trump White House and Trump’s nominee for Treasury secretary Scott Bessent, who earlier this year suggested in an interview that Trump could appoint a ""shadow chair"" to undermine Powell’s influence.",
'Not concerned',2024-12-31,'Not concerned','Not concerned',
Whether this recent detente can last is still an o...,2024-12-31,"Whether this recent detente can last is still an open question, especially if the Fed reaches a poin...","Whether this recent detente can last is still an open question, especially if the Fed reaches a point where it decides it has to start raising interest rates again.",
Powell and his colleagues this month said they exp...,2024-12-31,Powell and his colleagues this month said they expect inflation to remain more elevated than previou...,Powell and his colleagues this month said they expect inflation to remain more elevated than previously thought — predicting it will end 2025 at 2.5% instead of a prior forecast for 2.2%. That revision caused the central bank to scale back the number of rate cuts it expects to make next year to two from four previously.,
If Trump’s proposed policies from tariffs to tax c...,2024-12-31,"If Trump’s proposed policies from tariffs to tax cuts cause more inflation, that could force the Fed...","If Trump’s proposed policies from tariffs to tax cuts cause more inflation, that could force the Fed to pull back even more on any easing — or even consider rate hikes.",
Story Continues,2024-12-31,Story Continues,Story Continues,
