start_time,end_time,speech,price_change
2021-03-17 18:55:00,2021-03-17 19:00:00," Could you give us an idea of how you sort of feel about that tool of being able to come into particular part of the market and either operating doing an operation twist or something like that. Is that something you feel to be the top of your toolbox or something that you don't really prefer. You know, we the tools we have or the tools we have what I'm telling you is that the stance of monetary policy we have today we believe is appropriate. We think that our asset purchases in their current form which is to say you know across the curve 80 billion in treasuries 40 billion in mortgage back securities on net. We think that that's that's the right place for our asset purchases now we can we can change them of course in a number of different dimensions should we team at that appropriate but for now we think that our policy stance on that is appropriate. Thank you Rachel Segal. Hi, chair Powell. Thanks very much for taking my question. You've spoken about the pandemics disproportionate tool on black Americans Hispanic Americans Asian Americans and other groups in the labor market. I'm curious if you can speak to specific indicators that the Fed will be using to measure job gains for groups that have persistently higher rates of unemployment compared to white Americans. And relatedly since you've described vaccines as key to the economic recovery is the Fed concerned about lower vaccination rates in communities of color and what barriers do you think exists there. Thanks very much. So which measures so we do monitor and communicate very regularly about different labor market disparities in the labor market let's say so the African American unemployment rate is substantially elevated. And so is the Hispanic unemployment rate so we look at those and we see those as you know it's it's slack in the labor market it's it's sad to see because those disparities had really come down fair to record lows since we started keeping the data that way as recently as a year ago February of last year we had those those disparities quite low what happens in a downturn though is they move up at twice the speed of white unemployment. So we monitor those things we are tools of course affect unemployment generally but we're going to look at those as as a form of slack in the labor market and hope that you know that there's progress there and in this particular downturn of course was just direct hit on on a part of the economy that employs many minorities and lower paid workers the public facing workers in the service industries. In many cases don't have a lot of financial assets they're not tremendously well paid they might have other jobs and things like that so this was a direct hit on that part of the economy and it's the slowest part of the economy to recover so you know we like to see those people continue to get supported you know as we as the broader economy recovers which which is very much doing now in terms of disparate levels of vaccination that's some. There's a facts unfortunate facts there really not something we we have within our policy. Toolkit to address but it is it is true though that we the data we have suggests that there are significant disparities between different ethnic groups and you know but that's that's not for us that's for fiscal authorities and the government were generally to to work on. Thank you Gina Smialik. Hey, Chair Powell thanks for taking our questions and I was wondering if you could talk a little bit about how you see the fiscal policy support that has come down the line affecting the economy's potential in the longer term just in the sense that you've talked a lot about the potential for labor market scarring and how about my way on our sort of future prospects and I wonder whether you see that sort of working universe you know if we put people back into the market more quickly just that improve our chances. So I do think that fiscal policy overall will have really helped us to avoid much of the scarring that we were very very concerned about at the beginning and I think that's just the size and the speed with which Congress has delivered you know with the CARES Act and since then has is going to wind up very much accelerating the return to full employment. It's going to make a huge difference in people's lives and it has already as I mentioned in my remarks opening remarks the recovery has been faster than we expected part of that just is very hard to predict given we've never seen an event like this but part of it is just the strength of the fiscal response which I think will will look good over the years longer term. You know to really that's it that the first part of is about avoiding school.",0.0004528529737345
2021-03-17 19:00:00,2021-03-17 19:05:00," And I think we've not avoided all of the scarring, but we've probably avoided the worst cases there. And I hope we keep at it. We will keep at it with our policies, of course, to do whatever we can to make sure that continues. Longer term, though, what it takes to drive productive capacity per capita or per hour worked to raise living standards over time is investment. Investment in people's skills and aptitudes. Investment in plan and equipment. Investment in software. It takes a lot of investment to support a more productive economy and raise living standards. And that hasn't been the principal focus with these measures, our measures certainly. We don't have those tools, but what Congress has been doing has mainly been replacing lost income and beginning to support people as the economy returns to normal. But there should be a focus on a longer term focus, I think, would be healthy on the investment front. Thank you. James Politi. Thank you, Chair Powell. I wanted to ask a question about the eurozone. While the outlook for the US economy has much improved progress in the eurozone has been far less encouraging and it's showing signs of serious weakness due to the slower vaccination roll out and renewed lockdowns and restrictions. How worried are you about transatlantic economic divergence and the possibility that trouble in the eurozone and weakness in the eurozone could drag down the US recovery as it did in a way in the aftermath of the financial crisis? You're right. The pace of the recovery is, we're having diverging recoveries here as we did after the last crisis and in this case, as well as the other one, the US recovery is leading the global recovery. And, you know, we conduct policy, of course, here. Our focus is on, you know, our objectives are domestic ones. It's maximum employment and price stability here in the United States. We monitor developments abroad because they know that they can affect our outcomes. So, I think US demand, very strong US demand if, as the economy improves, is going to support global activity as well over time. That'll be through imports and, you know, when the US economy is strong, that strength tends to support global activity as well. So that's one thing. I don't worry in the near term. I mean, I'd love to see Europe going faster. I'd love to see the vaccine roll out going more smoothly. But I don't worry too much about us in the near term because we're on a very good track. Very strong fiscal support coming now, vaccination going quickly and cases coming down. I think we're in a good place. It's all ahead of us, but the data should get stronger fairly quickly here and remain strong for some time here. Thank you. Handling. Hi. Thanks so much for taking our questions. I wanted to ask if the Fed is planning on extending the same restrictions on bank dividends and sharey purchases that are currently in place into the second quarter. And if you're considering at all the scenario analysis and mid cycle stress tests that were in place last year, this year, and kind of what would make you consider doing something like that again. So we haven't made a decision on that. We're a couple weeks away from announcing that decision. I won't foreshadow it here today. I will say we're going to continue our data driven approach. You know that we restricted by-backs in dividends. We're the firms are preserving capital through 2020. The banks actually increased their level of capital and their level of reserves. And the December stress tests showed that banks are strong and well capitalized under our hypothetical recessions that we use in December, which were quite stringent. We're right in the middle of our 2021 stress test and we'll release those results before the end of June. And that layer is a very significant additional stress on top of the stress the banks have already absorbed over the past year with the unoplymering going to 11% and stock prices falling more than 50%. But all of that, the results of the stress test and the decision on distributions, all of that is to come fairly soon, as I mentioned. Thank you. Edward Lawrence.",0.0008675753155961
2021-03-17 19:05:00,2021-03-17 19:10:00," Thanks, Chair Boff, for taking these questions. You laid out the standards to lift off. And back in June of 2020, you said, you're not even thinking about raising rates. But I see seven members seeing lift off in 2023 and four next year. How much debate and how can you characterize that conversation? Has there been about moving off the lower bound earlier than signaled? Well, you know, it all depends. We've set out very clear criteria for lift off, right? Where we've said we want to see labor market conditions that are consistent with our estimates of maximum employment. And that doesn't just mean unemployment. It means a much broader set of criteria. We want inflation at 2% and not on a transitory basis. And we want inflation on track to be moderately to run moderately above 2% for something. Those are the three conditions. Everybody on the committee agrees to that, right? So it comes down to what's your projection for the economy. If you want it, people will have a range of assessments for how good the economy is going to be. And I would say that we're in a relatively highly uncertain situation. If you look at the uncertainty, people on the committee broadly say that uncertainty about the forecast is very high compared to the normal level. We haven't come out of a pandemic before. We haven't had this kind of fiscal support before totally and all up. So you're going to have different perspectives from committee participants about how fast growth will be, how fast the labor market will hear how fast. Sorry, inflation will move up. And those things are going to dictate where people write down an estimate of lift off. Of course, this isn't a decision to lift off now. We make that decision then, but it's an estimate based on assumptions about growth. And it's meant to be a tool to generally show the public how our objective function works, how we think about the future. It isn't meant to actually pin down a time when we might or might not lift off. We're not going to make that decision for some time. The chances are that the economy in that time and place will be very different from the one we think it'll be. So sometimes with the dots, I have to be sure to point out that they're not a committee forecast. You know this, but it's not a committee forecast. It's just compiling these projections really of individual people. We think it serves a useful purpose. It's not meant to actually be a promise or even a prediction of when the committee will act. That will be very much dependent on economic outcomes, which are highly uncertain. Thank you. We'll go to Brian Chung. Heather Sherman Powell, I wanted to elaborate a little bit on your commentary about the fiscal stimulus. So it sounds like you, I guess, see the case for even maybe more investment, at least from Congress, to support the more productive economy as you answer to Gina's question. So we just have $1.9 trillion in spending. So what do you see the fiscal space right now? Do you still, I guess maybe see the country in a place right now where it wouldn't be a concern? If there were to be more spending at this time. So Brian, it's not up to us to decide what Congress should spend money on or when I was answering Gina's question, which really was. How do we assure lack of damage to, if scarring, for example, or lack of damage to the productive capacity economy? And I think what's happened so far has done a pretty good job of that. But really, I wanted to make the longer run point that if to work on the productivity, on productivity over longer periods, that is, that is, comes down to a number of things. But one of those things is investment, investment in people, in their skills, education, aptitude, all of those things. I'm not, in any way, suggesting that that's something Congress should work on right now. Or that, you know, that's just not my, that's not our job. I'm just saying that, that is what, what fiscal policy can do that really monetary policy can't do is invest in the future productive capacity of the economy, raise potential growth. Those things are completely tools that Congress has. And again, I wasn't making a comment at all on the current fiscal setting. Thank you. Next to Michael Derby. Thank you for your question. I just wanted to get your, an updated view on your sense of your, your view on financial stability risks. And whether or not you see any pockets of excess out in financial markets that concern you either, you know, specifically to that, that area of the market or as in terms of like the threat that it could propose to propose to the overall economy. Or so, as you know, financial stability for us is, is a framework. It's not one thing. It's not a particular market or a particular asset or anything like that.",-0.0001884469459031
2021-03-17 19:10:00,2021-03-17 19:15:00," framework that we have, we report on it semi-annually, the board gets a report on it quarterly, and we monitor every day. And it has four pillars, and those are four key vulnerabilities. Asset valuations, debt owed by businesses and households, funding risk, and leverage among financial institutions, those four things. And I'll just quickly touch on them. So if you look at asset valuations, you can say that by some measures, some asset valuations are elevated compared to history. I think that's clear. In terms of households and businesses, households entered the crisis in very good shape by historical standards. Leveraging the household sector had been just kind of gradually moving down and down and down since the financial crisis. Now there was some negative effects on that. People lost their jobs and that sort of thing, but they've also gotten a lot of support now. So the damage hasn't been as bad as we thought. This is by the same token, it had a high debt load coming in. But many so-their revenues declined, but they've done so much financing, and there's a lot of cash on their balance sheets. So nothing in those two sectors really jumps out is really troubling. Short-term, I mentioned funding risk as the last one. So we saw, again, in this crisis breakdowns in parts of the short-term funding markets. They've been under tremendous amount of stress. And they've been quiet since the spring, and we shut down our facilities and all that. But we don't feel like we can let the moment pass without just saying again that those some aspects of the short-term funding markets and more broadly non-bank financial intermediation didn't hold up so well under great stress, under tremendous stress. And we need to go back and look at that. So a very high priority for us as regulators and supervisors is going to be to go back. And this will involve all the other regulatory agencies. It does involve all of them as well, and see if we can strengthen those things. So that's sort of a broader detailed look. Thank you. Michael McKee. Mr. Chairman, can you help me understand something about the SEP and your forecasts? The inflation that you're talking about for this year, say, is transitory. And by 2023, you're back down to 2.1%. There's no forecast for a rate increase for 2023. If you get to 3.5% unemployment, but inflation's only at 2.1%. Are you willing to leave rates at zero going forward from there, or roughly zero going forward from there? In other words, could we be in a jabtand-like situation? Are rates just stay low because inflation does? Well, again, I wouldn't read too much into the March 2021 SEP dot plot. Remember what it is. It's a compilation of individual projections by individual members. They're all making different assessments. They have different forecasts, economic forecasts. Some have more optimistic ones. And also remember that the SEP doesn't actually include all the things that go into maximum employment. Right? It only includes unemployment. So, I would just say we've sent out clear guidance. The message from the SEP that I would like to leave with people is we sent out clear guidance. I mentioned what it was. It's labor market conditions consistent with our estimates of maximum employment. And that's not just unemployment. It's all the other indicators, but overall totaling up to maximum employment. It's inflation at 2% and not on a transient basis. And inflation on track to exceed 2% moderately for some time. Those are the criteria. We're committed to robustly implementing that guidance. And that's what this says. That's really all it says. We're going to wait until those requirements are met. And again, the state of the economy in two or three years is highly uncertain. And I wouldn't want to focus too much on the exact timing of a potential rate increase that far in the future. I'm just wondering, before 2019, you were focused on the problems with having interest rates too low. How are you saying we're willing to live with it until we reach these goals, even if you get the future goal on maximum employment? So what I would say is we're committed to giving the economy the support that it needs to return as quickly as possible to a state of message.",-0.0013819707974165
2021-03-17 19:15:00,2021-03-17 19:20:00," maximum employment and price stability. And to the extent having rates low and support from monetary policy broadly to the extent that raises other questions, we think it's absolutely essential to maintain the strength and stability of the broader financial system. And to carefully monitor financial stability questions, if that's what you're getting at, we do that, we monitor them very carefully. I would point out that over the long expansion, longest in US history, 10 years and eight months, rates were very low for, they were at zero for seven years and then never got above 2.4% roughly. During that, we didn't see actually excess buildup of debt. We didn't see asset prices form into bubbles that would threaten the progress of the economy. We didn't see the things, we didn't see a housing bubble. The things that have tended to really hurt an economy and have in recent history hurt the US, we didn't see them build up despite very low rates. Part of that just is that you're in a low rate environment. You're in a much lower rate environment and the connection between low rates and the kind of financial instability issues is just not as tight as people think it is. That's not to say we ignore it, we don't ignore it. We watch it very carefully and we don't think there is a connection. I would say there is, but it's not quite so clear. We actually monitor financial conditions very, very broadly and carefully and we didn't do that before the global financial crisis 12 years ago. Now we do and we've also put a lot of time and effort into strengthening the large financial institutions that form the core of our financial system are much stronger, much more resilient. That's true of the banks. I think it's true of the CCP's. We want it to be true of other non-bank financial intermediation markets and institutions. So I think that's, you know, monetary policy should be to me for achieving our macroeconomic aims. Financial regulatory policy and supervision should be for strengthening the financial system so that it is strong and robust and can withstand the kinds of things that it couldn't, frankly. And we learned that in 2008, 910, this time around the regulated part of the financial system held up very well. We found some other areas that need strengthening and that's what we're working on now. Thank you. Yanikin, CNN. Thanks for taking my question. Geron Powell, could you talk to us a little bit about the relationship between the persistent and systemic unemployment and the expected increase in inflation? Does the former offset the ladder to some degree? I'm sorry, could you repeat that? You broke up there for a second. Oh no, I was hoping that wouldn't happen. Can you hear me now? Yes, yeah. Okay, great. I was asking if you could talk to us a little bit about the relationship between the persistent pandemic unemployment and the expected increase in inflation. I'm wondering whether the former offsets the ladder and to which degree you guys are monitoring this. You're asking about the relationship between unemployment and inflation? Is that the question? Yes, exactly. Okay. They offset each other, the persistent, systemic unemployment. Yeah. I think I'm hearing you're correctly. So I would say a couple things. There was a time when there was a tight connection between unemployment and inflation. That time is long gone. We had extremely low unemployment and not extremely low. We had low unemployment in 2018 and 19 and the beginning of 20 without having troubling inflation at all. We were 3.5%. We were bouncing around with unemployment, 3.5% to 4%. And it wasn't just unemployment. Participation was high. Wages were moving up. It was a very healthy thing. And we didn't see price inflation move up. There is a relationship between wage inflation and unemployment. But that has not, what happens is that when wages move up because unemployment is low, companies have been absorbing that increase into their margins rather than raising prices. And that seems to be a feature of late cycle behavior. So we're not, when we seek to achieve low unemployment, high levels of employment, which is our mandate, we think we have the freedom to do that based on the data.",-0.0002569458425609
