start_time,end_time,speech,price_change
2021-03-17 18:30:00,2021-03-17 18:35:00," Good afternoon. I would like to start by noting that it has been a full year since the pandemic arrived with force on our shores. Looking back, it was clear that addressing a fast-moving global pandemic would be plainly and primarily the realm of healthcare providers and experts, and we are grateful to them and to all the essential workers for their service and sacrifice. The danger to the U.S. economy was also clear. Congress provided by far the fastest and largest response to any post-war economic downturn, offering fiscal support for households, businesses, healthcare providers, and state and local governments. Here at the Federal Reserve, we rapidly deployed our full range of tools to provide relief and stability to ensure that the recovery will be as strong as possible and to limit lasting damage to the economy. We are strongly committed to achieving the monetary policy goals that Congress has given us, maximum employment and price stability. The economic fallout has been real and widespread, but with the benefit of perspective, we can say that some of the very worst economic outcomes have been avoided by swift and forceful action, from Congress, from across government, and in cities and towns across the country. More people held on to their jobs, more businesses kept their doors open, and more incomes were saved as a result of these swift and forceful policy actions. And while we welcome these positive developments, no one should be complacent. At the Fed, we will continue to provide the economy the support that it needs for as long as it takes. Today, the FOMC kept interest rates near zero and maintained our sizable asset purchases. These measures, along with our strong guidance on interest rates and on our balance sheet, will ensure that monetary policy will continue to deliver powerful support to the economy until the recovery is complete. The path of the economy continues to depend significantly on the course of the virus and the measures undertaken to control its spread. Since January, the number of new cases, hospitalizations, and deaths has fallen, and ongoing vaccinations offer hope for a return to more normal conditions later this year. In the meantime, continued observance of social distancing measures and wearing masks will help us reach that goal as soon as possible. The economic recovery remains uneven and far from complete, and the path ahead remains uncertain. Following the moderation in the pace of the recovery that began toward the end of last year, indicators of economic activity and employment have turned up recently, although the sectors of the economy most adversely affected by the resurgence of the virus and by greater social distancing remain weak. Household spending on goods has risen notably so far this year. In contrast, household spending on services remains low, especially in services that typically require people to gather closely, including travel and hospitality. The housing sector has more than fully recovered from the downturn, while business investment and manufacturing production have also picked up. The overall recovery in economic activity since last spring is due, importantly, to unprecedented fiscal and monetary policy actions, which have provided essential support to households, businesses, and communities. The recovery has progressed more quickly than generally expected, and forecasts from FOMC participants for economic growth this year have been revised up notably since our December summary of economic projections. In commenting on the stronger outlook, participants noted progress on vaccinations, as well as recent fiscal policy. As with overall economic activity, conditions in the labor market have turned up recently. Employment rose by 379,000 in February, as the leisure and hospitality sector recouped about two-thirds of the jobs that were lost in December and January. Nonetheless, employment in this sector is more than three million below its level at the onset of the pandemic. For the economy as a whole, employment is 9.5 million below its pre-pandemic level. The unemployment rate remains elevated at 6.2 percent in February. This figure understates the shortfall in employment, particularly as participation in the labor market remains notably below pre-pandemic levels. Looking ahead, FOMC participants project the unemployment rate to continue to decline. The median projection is 4.5 percent at the end of this year and moves down to 3.5 percent by the end of 2023. The economic downturn has not fallen equally on all Americans and those least able to shoulder the burden have been the hardest hit. In particular, the high level of joblessness has been especially severe-",0.0003668285772111887
2021-03-17 18:35:00,2021-03-17 18:40:00," for lower wage workers in the service sector and for African-Americans and Hispanics. The economic dislocation has upended many lives and created great uncertainty about the future. Overall inflation remains below our 2% longer on objective. Over the next few months, 12 month measures of inflation will move up as the very low readings from March and April of last year fall out of the calculation. Beyond these base effects, we could also see upward pressure on prices if spending rebounds quickly as the economy continues to reopen. Particularly if supply belt bottlenecks limit how quickly production can respond in the near term. However, these one-time increases in prices are likely to have only transient effects on inflation. The median inflation projection of FOMC participants is 2.4% this year and declines to 2% next year before moving back up by the end of 2023. The Fed's response to this crisis has been guided by our mandate to promote maximum employment and stable prices for the American people, along with our responsibilities to promote the financial the stability of the financial system. As we say in our statement on longer run goals in monetary policy strategy, we view maximum employment as a broad-based and inclusive goal. Our ability to achieve maximum employment in the years ahead depends importantly on having longer-term inflation expectations well-anchored at 2%. As the committee reiterated in today's policy statement with inflation running persistently below 2%, we will aim to achieve inflation moderately above 2% for some time so that inflation averages 2% over time and longer-term inflation expectations remain well-anchored at 2%. We expect to maintain an accommodative stance of monetary policy until these employment and inflation outcomes are achieved. With regard to interest rates, we continue to expect it will be appropriate to maintain the current 0 to 1.25% target range for the federal funds rate until labor market conditions have reached levels consistent with the committee's assessment of maximum employment and inflation has risen to 2% and is on track to moderately exceed 2% for some time. I would note that a transitory rise in inflation above 2% as seems likely to occur this year would not meet this standard. In addition, we will continue to increase our holdings of treasury securities by at least $80 billion per month and of agency mortgage-backed securities by at least $40 billion per month until substantial further progress has been made toward our maximum employment and price stability goals. The increase in our balance sheet since last March has materially eased financial conditions and is providing substantial support to the economy. The economy is a long way from our employment and inflation goals and it is likely to take some time for substantial further progress to be achieved. Our forward guidance for the federal funds rate along with our balance sheet guidance will ensure that the stance of monetary policy remains highly accommodative as the recovery progresses. Our guidance is outcome-based and ties the path of the federal funds rate and the balance sheet to progress toward reaching our employment and inflation goals. Overall, our interest rate and balance sheet tools are providing powerful support to the economy and will continue to do so. To conclude, we understand that our actions affect communities, families, and businesses across the country. Everything we do is in service to our public mission. We are committed to using our full range of tools to support the economy and to help assure that the recovery from this difficult period will be as robust as possible. Thank you. I look forward to your questions. Howard for Reuters. Hi, Chair Powell. And thanks for that. So could you talk us through how the forecast for 2021 map into the substantial further progress definition, you know, 2.4% of inflation, I understand that's considered transitory. That still seems like some progress there, 4.5% unemployment. Is it time to start talking about, talking about tapering yet? Not yet. So as you pointed out, we've said that we would continue asset purchases at this pace until we see substantial further progress. And that's actual progress, not forecast progress. So, and that's a difference from our past approach. So, and what we mean by that is is pretty straightforward. It is, we'll want to see that the labor markets have moved, labor market conditions have moved, you know, have made some",0.0029588791664558
2021-03-17 18:40:00,2021-03-17 18:45:00," substantial progress toward maximum employment and inflation has made substantial progress toward the 2% goal. That's what we're going to want to see. Now, that obviously includes an element of judgment. And when we see, we'll be carefully looking ahead. We also understand that we will want to provide as much advanced notice of any potential taper as possible. So when we see that we're on track, when we see actual data coming in that suggests that we're on track to perhaps achieve substantial for their progress, then we'll say so. And we'll say so well in advance of any decision to actually taper. If I could follow up on that, this shift in the dots, why wouldn't that suggest a weakening of the commitment here? I know a whole lot of people shifted into 2022, it seems. I don't see that at all. We have a range of perspectives on the committee. I welcome that. And we have, we debate things, we discuss things, and we always come together around a solution. But the strong bulk of the committee is not showing a rate increase during this forecast period. And as data improve, as the outlook improves very significantly since the December meeting, you would expect forecast to move up. It's probably not a surprise that some people would bring in their estimate of the appropriate time for a lift off. Nonetheless, the bulk of the committee, the largest part by far of the committee, is doesn't show a rate increase during this period. And again, part of that is wanting to see actual data rather than just a forecast at this point. We do expect that we'll begin to make faster progress on both spending labor markets and inflation as the year goes on because of the progress with the vaccines, because of the fiscal support that we're getting. We expect that to happen, but we'll have to see it first. Great. Thank you. Victoria. Hi, Chair Powell. I wanted to ask about the supplementary leverage ratio. There's been a lot of talk about what you all are going to do this month, which I'm happy to hear an update if you have one. But just sort of more broadly, do you think long term that the leverage ratio poses problems for implementing monetary policy at a time when the reserve supply is going to remain large? And if so, do you think that changes to the leverage ratio, including the SLR, are the way to deal with that problem? Victoria, we'll have something to announce on that in coming days. And I'm not going to expound upon your questions. Why don't you ask another question if you'd like to? Because that one I'm just going to say that works something in coming days. Sure. OK. Well, then I'll ask about unemployment. You know, the unemployment rate is you all have projections for the U6 rate, but you've also been really emphasizing the fact that that's not the only thing that you all are looking at. You're also looking at labor force participation and things like that. So are you all looking at ways of maybe adding to how you're projecting the unemployment rate to the summary of economic projections? Well, let me say, as we say in our statement, our longer-run goals in monetary policy strategy, we look to a range of indicators on labor market. We never only looked at the unemployment rate, which is the only indicator of labor market outcomes that's in the SEP. We look at a very broad range. You hear us talk all the time about participation, about employment to population, which is the combination of the two, about different measures of unemployment. So it wages. It's the job flows. It's all of those things. They go into an assessment disparities of various groups. All that goes into an assessment of maximum employment. The trying to incorporate all of that into the summary of economic projections would not be practical. Obviously, the thing that we do include is just the unemployment rate, and that's a very insufficient statistic. So it doesn't include a lot of other things that we do look at. And I wouldn't want to say that we're looking to include the other dozen things that we look at into the SEP. But from time to time, we do look at adding different things. But I would just say the SEP is a summary. It's one device. It's not going to include all of the things that we look at. I think you know the things that we look at, which we talk about them all the time. So we're not actually looking actively, and significantly broadening those indicators in the SEP right now. Thank you. Chris Ruggabur, Associate of Press. Thank you. Chair Powell, I wanted to ask you, if I have the forecast overall, your forecasting",0.0026475705388436
2021-03-17 18:45:00,2021-03-17 18:50:00," So, very low unemployment rate next year and in 2023, you have inflation or the Fed overall is in the SEP forecasting inflation at or above 2% by 2023. I get no rate hike in any of this forecast horizon. So, is this telling us that you see a higher inflation rate than what's projected or do not, as you've been talking about, is the unemployment rate insufficient or what is this telling us about the Fed's reaction function that it seems you're meeting the Fed's dual mandate by 2023. Yet, again, no rate hike expect. So I guess the first thing to say is that the SEP is not a committee forecast. It's not something we sit around and debate and discuss and approve and say this represents our reaction function as a committee. It's a compilation of projections from different people. Since we don't debate it or discuss it, it would be hard for me to say exactly why each participant did what they were going to do. So all I would say about this is that we laid out what I think is very clear guidance on lift-off. And it's really three things. Labor market conditions that are consistent with our estimates of maximum employment. And as I mentioned, we consider a wide range of indicators in assessing labor market conditions, not just the unemployment rate. Inflation that has reached 2% and not just on a transitory basis. And inflation is on track to run moderately above 2% for some time. The first two of those three are very much database. The third does have a little bit of an element of expectations in it. So we are very much determined to implement this guidance in a robust way. It is the guidance that we chose carefully to implement our new framework. And to meet these standards, we'll need to see data, as I mentioned. So what does this SEP really say? It says that we're committed to our framework and to the guidance we've provided to implement that framework. We will wait until the requirements set forth and that guidance are clearly met before considering a change in our policy rate. And the last thing I'll say is this. The state of the economy in two or three years is highly uncertain. And I wouldn't want to focus too much on the exact timing of a potential rate increase that far into the future. So that's how I would think about the SEP. Thank you. Paul Kiernan. Thank you, Chairman Powell. My question is twofold. One, how high are you comfortable letting inflation rise? There is some ambiguity in your new target, as you mentioned, expectations driven. And do you think that that ambiguity might cause markets to price in a lower tolerance for inflation than the Fed actually has, thereby causing financial conditions to tighten prematurely? Is that a concern? Thanks. So we've said we'd like to see inflation run moderately above 2% for some time. And we've resisted, basically, generally, the temptation to try to quantify that. Part of that just is talking about inflation is one thing. Actually having inflation run above 2% is the real thing. So over the years, we've talked about 2% inflation as a global. We haven't achieved it. So I would say we'd like to perform. That's what we'd really like to do is to get inflation moderately above 2%. I don't want to be too specific about what that means because I think it's hard to do that. And we haven't done it yet. When we're actually above 2%, we can do that. I would say this. Fundamental change in our framework is that we're not going to act preemptively based on forecasts for the most part. And we're going to wait to see actual data. And I think it will take people time to adjust to that and to adjust to that new practice. And the only way we can really build the credibility of that is by doing it. So that's how I would think about that. Thank you. Matthew Bosler. Hi, Chair Powell. This is Matthew Boser with Bloomberg News. So there's widespread presumption at this point that the US will reach herd immunity sometime this year. And all along, you've said that the path of the economy is going to be determined by the course of the virus. I'm curious, based on the projections that you released to the last year.",-0.0009179157026456
2021-03-17 18:50:00,2021-03-17 18:55:00," that show unemployment will still be above estimates of maximum employment through the end of next year and perhaps sometime into 2023. Do you think policymakers need to be doing more here to sort of align the herd immunity and full employment timelines if you will? Thank you. So on herd immunity, I'm really going to leave that question to the experts. We don't control that. We're not responsible for defining it. And we'll leave that whole discussion to the experts. I mean, what we're focused on is the part that we control, which is the support that we provide to the economy. And there we provided very clear guidance. And in the case of asset purchases, it's at their current level until we make substantial further progress. There is an element of judgment in that and therefore will supply clear communication well in advance of actually tapering. And we just went through the criteria for raising interest rates. They're very specific. And we're very much committed to having them fulfilled robustly. I would agree with you that the path of the virus continues to be very important. We have these new strains which can be very quite virulent. And we're not actually done yet. And we're clearly on a good path with cases coming down as I mentioned. But we're not done and I'd hate to see us take our eye off the ball before we actually finish the job. So that's how I would look at that. If I could just briefly follow up, how do you see sort of the disconnect in terms of an economy that is expected to be widely reopened this year? But full employment taking longer to achieve. Is it the case that factors related to the virus will still be with us over the coming years? Is that how to interpret the forecast? I think there's some of that. Sure, there'll be some of that. There'll still be some social distancing. People may be, for example, going into spaces that involve close contact with others. Some people will do that right away. Others will hold back. And so I think there'll be some of that. In addition, though, remember, there are 10 million people in the range of 10 million people who need to get back to work. And it's going to take some time for that to happen. It can happen maybe more quickly than it has in the past because it involves the reopening of a sector of the economy as opposed to stimulating aggregate demand and waiting for that to produce job demand for workers. This could be a different sort of a process and it could be quicker. We don't know that. But it's just a lot of people who need to get back to work and it's not going to happen overnight. It would be, it's going to take some time. No matter how well the economy performs, unemployment will take quite a time to go down. And so will participation. So that's all I can say. I think the faster the better, we'd love to see it come sooner rather than later. We'd welcome nothing more than that. But realistically, given the numbers, it's going to take some time. Thank you. Steve Leesman. Mr. Chairman, thank you. I wonder if you could kind of a three-parter here, but all related. Would you comment on the current level of the 10-year yield and some other long rates out there, whether or not you think they would have a negative effect on the economy? And if not, is there a level that would give you concern? And finally, the third part, other central bankers have expressed concern about what's happened to yields in their countries and even some taken action. But not you. Could you give us your general idea or orientation towards the idea of coming into the market and affecting a particular tenor of the bond market? Do you like that idea? Do you not like it? Is it the top of your toolbox or is it something that you think is the top of your toolbox? Sure. So we monitor a broad range of financial conditions. And we're always attentive to market developments, of course. We're still a long way from our goals. And it's important that financial conditions do remain accommodative to support the achievement of those goals. And if you look at various indexes of financial conditions, what you'll see is that they generally do show financial conditions overall to be highly accommodative. And that is appropriate. So that's how we look at it. I would add, as I've said, I would be concerned by disorderly conditions in markets or by a persistent tightening of financial conditions that threaten the achievement of our goals. We think the stance of our monetary policy remains appropriate. Our guidance on the federal funds rate and on asset purchases is providing strong support for the economy. And we're committed to maintaining that patiently accommodative stance until the job is well and truly done.",0.0005160218491203
