start_time,end_time,speech,price_change
2022-01-26 19:30:00,2022-01-26 19:35:00," Good afternoon. At the Federal Reserve, we are strongly committed to achieving the monetary policy goals that Congress has given us, maximum employment and price stability. Today, in support of these goals, the Federal Open Market Committee kept its policy interest rate near zero and stated its expectation that an increase in this rate would soon be appropriate. The committee also agreed to continue reducing its net asset purchases on the schedule we announced in December, bringing them to an end in early March. As I will explain, against a backdrop of elevated inflation and a strong labor market, our policy has been adapting to the evolving economic environment, and it will continue to do so. Economic activity expanded at a robust pace last year, reflecting progress on vaccinations and the reopening of the economy. Fiscal and monetary policy support and the healthy financial positions of households and businesses. Indeed, the economy has shown great strength and resilience in the face of the ongoing pandemic. The recent sharp rise in COVID cases associated with the Amichron variant will surely weigh on economic growth this quarter. High-frequency indicators point to reduced spending in COVID-sensitive sectors, such as travel and restaurants. An activity more broadly may also be affected as many workers are unable to report for work because of illness, quarantines, or caregiving needs. Fortunately, health experts are finding that the Amichron variant has not been as virulent as previous strains of the virus, and they expect that cases will drop off rapidly. If the wave passes quickly, the economic effects should as well, and we would see a return to strong growth. That said, the implications for the economy remain uncertain, and we have not lost sight of the fact that for many afflicted individuals and families, and for the health care workers on the front lines, the virus continues to cause great hardship. The labor market has made remarkable progress, and by many measures is very strong. Job gains have been solid in recent months, averaging 365,000 per month over the past three months. Over the past year, payroll employment has arisen by 6.4 million jobs. The unemployment rate has declined sharply, falling 2 percentage points over the past 6 months, to reach 3.9 percent in December. The improvements in labor market conditions have been widespread, including for workers at the lower end of the wage distribution, as well as for African-Americans and Hispanics. Labor demand remains historically strong. With constraints on labor supply, employers are having difficulties filling job openings, and wages are rising at their fastest pace in many years. While labor force participation has edged up, it remains subdued, in part reflecting the aging of the population and retirements. In addition, some who would otherwise would be seeking work report that they are out of the labor force because of factors related to the pandemic, including caregiving needs and ongoing concerns about the virus. The current wave of the virus may well prolong these effects. Over time, there are good reasons to expect some further improvements in participation and employment. Inflation remains well above our longer-run goal of 2 percent. Supply and demand and balances related to the pandemic and the reopening of the economy have continued to contribute to elevated levels of inflation. In particular, bottlenecks and supply constraints are limiting how quickly production can respond to higher demand in the near term. These problems have been larger and longer lasting than anticipated, exacerbated by waves of the virus. While the drivers of higher inflation have been predominantly connected to the dislocations caused by the pandemic, price increases have now spread to a broader range of goods and services. Wages have also risen briskly, and we are attentive to the risks that persistent real wage growth in excess of productivity could put upward pressure on inflation. Like most forecasters, we continue to expect inflation to decline over the course of the year. We understand that high inflation imposes significant hardship, especially on those least able to meet the higher costs of essentials like food, housing, and transportation. In addition, we believe that the best thing we can do to support continued labor market gains is to promote a long expansion, and that will require price stability. We're committed to our price stability goal. We will use our tools both to support the economy and a strong labor market and to prevent higher inflation from becoming entrenched.",-0.005735480655975387
2022-01-26 19:35:00,2022-01-26 19:40:00," and we'll be watching carefully to see whether the economy is evolving in line with expectations. The Fed's monetary policy actions have been guided by our mandate to promote maximum employment and stable prices for the American people. As I noted, the committee left the target range for the Federal Funds Raid unchanged and reaffirmed our plan announced in December to end asset purchases in early March. In light of the remarkable progress we've seen in the labor market and inflation that is well above our 2% longer run goal, the economy no longer needs sustained high levels of monetary policy support. That is why we are phasing out our asset purchases in WAG we expected will soon be appropriate to raise the target range for the Federal Funds Raid. Of course the economic outlook remains highly uncertain. Making appropriate monetary policy in this environment requires humility, recognizing that the economy evolves in unexpected ways. We'll need to be nimble so that we can respond to the full range of plausible outcomes. With this in mind, we will remain attentive to risks, including the risk that high inflation is more persistent than expected, and are prepared to respond as appropriate to achieve our goals. To provide greater clarity about our approach for reducing the size of the Federal Reserve's balance sheet, today the committee issued a set of principles that will provide a foundation for our future decisions. These high level principles clarify that the Federal Funds Raid is our primary means of adjusting monetary policy, and that reducing our balance sheet will occur after the process of raising interest rates has begun. Reductions will occur over time in a predictable manner, primarily through adjustments to reinvestments, so that securities roll off our balance sheet. Over time we intend to hold securities in the amounts needed for our ample reserves operating framework, and in the longer run we envision holding primarily treasury securities. Our decisions to reduce our balance sheet will be guided by our maximum employment and price stability goals. In that regard we will be prepared to adjust any of the details of our approach to balance sheet management in late of economic and financial developments. The committee has not made decisions regarding the specific timing, pace, or other details of shrinking the balance sheet, and we will discuss these matters in upcoming meetings and provide additional information at the appropriate time. To conclude, we understand that our actions affect communities, families, and businesses across the country. Everything we do is in service to our public mission. We at the Federal Reserve will do everything we can to achieve our maximum employment and price stability goals. Thank you, I look forward to your questions. Thank you for the first question. We'll go to Chris and we'll go to David. Thanks, Michelle, and thank you, Chair Powell. So, this expected that the Fed will hike rates, perhaps every other meeting, but certainly in the past, the Fed has hiked at every meeting. So I just wanted to ask, are rate hikes at consecutive meetings on the table this year? Is every meeting a live meeting? And on that note, would the Fed consider front-loading some of its rate hikes, even if it doesn't raise every meeting? Thank you. Thanks. So as I refer to in my opening statement, it is not possible to predict with much confidence exactly what path for our policy rate is going to prove appropriate. And so at this time, we haven't made any decisions about the path of policy. And I stress again that we'll be humble and nimble. We're going to have to navigate cross-currences and currents and actually two-sided risks now. And I'll say also that we're going to be guided by the data. In fact, what I'll say is that we're going to be led by the incoming data and the evolving outlook. We'll try to communicate as clearly as possible, moving steadily in transparency. Transparenely. So more to your question, we know that the economy is in a very different place than it was when we began raising rates in 2015. Specifically, the economy is now much stronger. The labor market is far stronger. Inflation is running well above our 2% target, much higher than it was at that time. And these differences are likely to have important implications for the appropriate pace of policy adjustments. Beyond that, we haven't made any decisions. Thank you. Let's go to Victoria Guida at Politico. Hi, Chair Powell. I wanted to ask you were talking about the health of the labor market. And I'm curious whether you would characterize where we're at right now as maximum employment and also along those same lines. Obviously,",0.0055359380339446
2022-01-26 19:40:00,2022-01-26 19:45:00," the rate hikes on the table this year. Do you think that the Fed can raise rates, bring inflation under control without hurting jobs and wages? Sorry, just getting both parts of your question written down. So I would say, and this view is widely held in the committee that both sides of the mandate are calling for us to move steadily away from the very highly accommodative policies we put in place during the challenging economic conditions that the economy faced earlier in the pandemic. And I would say that most FOMC participants agree that labor market conditions are consistent with maximum employment in a sense of the highest level of employment that is consistent with price stability. And that is my personal view. And again, very broad support on the committee for the judgment that it will soon be appropriate to raise the target range for the federal funds rate. The other thing is maximum employment will evolve over time and through the course of the business cycle. In the particular situation we're in now, it may well increase the level of maximum employment that's consistent with stable prices may increase. And we hope that it will as more people come back into the labor market, as participation gradually rises. And the policy path that we're broadly contemplating would be supportive of that outcome as well. So the thing about the labor market right now is that there are many millions of more job openings than there are unemployed people. So you ask whether we can raise rates and move to less accommodative and even tight financial conditions without hurting the labor market. I think there's quite a bit of room to raise interest rates without threatening the labor market. This is by so many measures a historically tight labor market. Record levels of job openings, of quits, wages are moving up at the highest pace they have in decades. If you look at surveys of workers, they find jobs. Plentyful look at surveys of companies, they find workers scarce. And all of those readings are at levels really that we haven't seen in a long time in some cases ever. So this is a very, very strong labor market. And my strong sense is that we can move rates up without having to severely undermine it. I also would point out that there are other forces at work this year, which should also help bring down inflation. We hope, including improvement on the supply side, which will ultimately come at the timing and pace of that are uncertain. And also, fiscal policy is going to be less supportive of growth this year, not of the level of economic activity, but the fiscal impulse to growth will be significantly lower. So there are multiple forces which should be working over the course of the year for inflation to come down. We do realize that the timing and pace of that are highly uncertain and that inflation has persisted longer than we thought. And of course, we're prepared to use our tools to assure that higher inflation does not become entrenched. Thank you. Let's go to Nick Timrose at the Wall Street Journal. Good afternoon, Chair Powell. Nick Timrose at the Wall Street Journal. I have a couple of questions on the balance sheet. The state much on the balance sheet today calls for significantly reducing your holdings. What does that mean? And then apart from moving sooner and faster to shrink the holdings, are there any other ways in which you and your colleagues are seriously thinking about recalibrating this process? And finally, how much disagreement is there around how you should use this tool, including active sales rather than passive sales, or changes in the composition of reinvestments? Thank you. So I'm afraid to tell you that those are all great questions and their questions that the committee is just turning to now. So we had a discussion, as you know, at the last meeting, an introductory discussion of the balance sheet and a team up of the issues at this meeting. We've gone through and carefully put together a set of principles at a high level. And those are meant to guide the actual decisions we'll make about the pace and about all of the questions that you're asking. And I expect that this process will be something that we spend time on in coming meetings. I can't tell you how many, I can't tell you how long it will take. And then at the appropriate time, we'll provide additional information. So I did the last cycle when we went through balance sheet issues. We did find that over the course of two or three meetings, for example, we did come to interesting and better answers we thought. So we're just in that process now. And at the next meeting, we'll be turning to more of the details that you're asking about.",-0.0085189296961732
2022-01-26 19:45:00,2022-01-26 19:50:00," I would say this, the balance sheet is much bigger. It has a shorter duration than the last time, and the economy is much stronger, and inflation is much higher. So, and I think that leads you to, and I've said this, being willing to move sooner than we did in the last time, and also perhaps faster. But beyond that, it's really not appropriate for me to speculate exactly what that would be. But I would point you to principle number one, which is the committee views changes in the target rate for the federal funds rate as its primary means of adjusting the stance of monetary policy. So, we do want the federal funds rate. We want to operationalize that, and we want the balance sheet to be declining in a predictable manner, and we want it to be declining primarily by adjusting reinvestments. So, if I could follow on that, raising rates and reducing the balance sheet both restrained the economy, both tied in monetary policy, how should we think about the relationship between the two? For example, how much passive runoff is equal to every quarter percentage point increase in your benchmark rate? So, again, we think of the balance sheet as moving in a predictable manner, sort of in the background, and that the active tool meeting to meeting is not both of them, it's the federal funds rate. There are rules of thumbs. I'm reluctant to land on one of them that equate this, and there's also an element of uncertainty around the balance sheet. I think we have a much better sense, frankly, of how rate increases affect financial conditions and hence economic conditions. Balance sheet is still a relatively new thing for the markets, and for us, so we're less certain about that. So, again, I think the pattern we'll follow is to arrive at a timing and a pace and composition and all those things, and then announce that with advanced notice, and it will start in the background, and then we'll look to have that just running in the background and have the interest rates again be the active tool of monetary policy. That's at least a plan. I can't tell you much more about any of the very good issues about size, pace, composition, those sorts of things. We'll be turning to all of those at coming meetings. Thank you. Thanks. Now we'll go to Neil Irwin. Thank you, Chair Powell, Neil Irwin from Axios. Glad to be back. Sorry, I was wondering if the volatility we've seen in financial markets in the last few weeks strikes us anything alarming, or that might affect the trajectory of policy, conversely to the degree that financial conditions have tightened some, might that be desirable in some ways in achieving your tightening goals? So, as you know, the ultimate focus that we have is on the real economy, maximum employment and price stability, and financial conditions matter to the extent that they have implications for achieving the dual mandate. And you also know that we look at broader financial conditions, not one or two things, one or two markets. And what we're always asking ourselves is, are we seeing changes that are both persistent and material enough of a change in financial conditions that they are inconsistent with the achievement of our goals? So, that's how we're looking at that. And I don't want to comment on today's financial conditions broadly, but we're not looking at any one market or so. So, that's how we're thinking. In terms of what we've seen, I would say this. We said, at our last meeting, we published this summary of economic projections, the median of which the median participant expected three rate increases this year. And, you know, it's six weeks, seven weeks later now. And you have seen that our communication channel with the markets is working, markets are now pricing in. Number of rate increases. Surveys show that market participants are expecting a balance sheet runoff to begin, you know, at the appropriate time, sometime later this year, perhaps, we haven't made that decision yet. So, we feel like the communications we have with market participants and with the general public are working, and that the financial conditions are reflecting in advance the decisions that we make. And monetary policy works significantly through expectations. So, that in and of itself is appropriate. Thank you. Let's go to Howard Schneider. You know, for a year or a high, thanks to your power, how are you? So for a year now, the statements reference the benchmarks for this initial interest rate increase. Now that we're approaching that moment, what are the benchmarks going to be for subsequent rate increases? I think that's going to be a good example. Thank you.",-0.0064902417843593
2022-01-26 19:50:00,2022-01-26 19:55:00, you can't stipulate the path but how should we think about the criteria for the next step? Well you're right we haven't gotten we haven't gotten to that point we haven't made a decision yet and we'll make that decision at the March meeting we'll make a decision whether to raise the federal funds rate I would say that the committee is is of a mind to to raise the federal funds rate at the March meeting assuming that conditions are appropriate for doing so we have we have our eyes on on the risks particularly around the world but we do expect some softening in the economy from Amichron but we think that that should be temporary and we think that the economy should the underlines make the economy should you know should should show through further quickly after that. If I could follow just on relating question the December steps had this copacetic sort of set of circumstances where inflation comes down without the federal funds rate ever getting over the estimate of neutral given development since then do you still think that's a credible narrative for the ultimate path of policy. I think that's highly uncertain and that we're committed using our tools to make sure that inflation high inflation that we're seeing does not become entrenched. So a number of factors would be it's not just monetary policy a number of factors are supporting a decline in inflation as I mentioned fiscal policy will be will providing significantly less of an impulse to growth we do expect this year although we do expect now that it will come slower than than we had expected and hoped that there will be relief on the supply side so that too should should lower these supply side bearers which are a big part of the story of why inflation it's like in addition monetary policy will be coming significantly less accommodative. So the question is you know we'll we'll be asking this question all year long and that will be our things turning out as we expect there's a case that for whatever reason the economy slows more and inflation slows more than expected we'll react to that if instead we see inflation at a higher level or more persistent level then we'll react to that and again we're we're well aware that this is a different economy than then existed during the last tightening cycle and our policies going to reflect those differences. Thank you let's go to Gina Smialing. Let's go to Gina. Okay let's go to Steve Leesman. Thank you. Thank you Mr. Chairman. I have one sort of technical question and one question on principle. The technical question is if you're going to discuss balance sheet at the next upcoming meetings and you won't begin balance sheet reduction until after you begin rate hikes it seems to technically mean that you won't or can't begin balance sheet reduction until the summer. Is that correct into the first thing? Second of all you suggested that that the um uh with balance sheet running in the background that you would possibly be raising rates and running off the balance sheet at the same time. That's sort of the technical question part of it. The principle question I have is you said it's going to be running in the background but the statement on on on balance sheet principles says the committee is prepared to adjust any of the details of its approach based based on the economic and financial developments which suggests there's something of a reaction function associated to the balance sheet and it won't be running in the background so could you give us any a sense of the discussion or a staff presentation on what is the reaction functions surrounding the balance sheet? Thanks. So let me let me let me start by talking about that last paragraph so you'll remember during the last cycle that uh this process of building up and then shrinking the balance sheet is a complicated one and it involves inevitably surprises and so during during the years during the prior cycle we amended our balance sheet principles a number of times. Now we didn't intend to do that it just events required us to do so so we got a pretty robust paragraph there that says we're free to do this at any time and it doesn't mean we're going to but if the situation turns out to be different than we had thought we're not going to be we're not going to stick with something that isn't working that that's all that saying it's meant to be quite a general statement rather than a hint. So I mean I I like to think that our you know our philosophy of the balance sheet is is embodied in these principles.,0.0034962622196664
