start_time,end_time,speech,price_change
2022-01-26 19:55:00,2022-01-26 20:00:00," So, you know, the idea that, for example, the Federal Funds Rate is the primary means of adjusting the stance of policy that will use the determine the timing and pace of reducing the size of the balance sheet to foster the dual mandate that will begin to reduce the size after we begin the process of raising rates. And on and on like that, I mean, those are all the things that try to describe how we will proceed. But maybe at a higher level to try to get at your question, you know, asset purchases were enormously important at the beginning of the recovery in terms of restoring market function as they were right after the in the critical phase of the global financial crisis. And then after they were a macroeconomic tool to support demand. And now the economy no longer needs this highly accommodative policy that we put in place. So it's time to stop asset purchases first. And then at the appropriate time start to shrink the balance sheet. Now the balance sheet is substantially larger than it needs to be. We've identified the end state as, you know, amounts needed to implement monetary policy efficiently, effectively in the ample reserves regime. So there's a substantial amount of shrinkage in the balance sheet to be done. That's going to take some time. We want that process to be orderly and predictable. So those are some of the ways I would think this lays out our, you know, the way we were thinking about this. In terms of the timing, I can't really help you. You know, it just says after we get underway. So we're, I would say we are, we're going to have another discussion at the next meeting. I guess we'll have at least one other discussion at the meeting after that. And, you know, we'll tell you as we make progress and we'll, you know, we'll start the process of allowing runoff and shrinking the balance sheet at what we find to be the appropriate time. I wish I could say more, but honestly, we haven't made those decisions and we actually haven't even really had the important discussions on a lot of the details that we will have at the coming meetings. Thank you. Let's go to Craig Torres. Chair Powell. Chair Powell, good afternoon, Michelle and chair Powell, Craig Torres from Bloomberg. Chair Powell, at the beginning of the conversation, you said risks are too cited. I'm wondering if you can elaborate on what are the risks to the elusive soft landing? Is fed policy a risk over tightening? Or what are the risks? And then second, chair Powell, I have a quick administrative question. You know, Robert Kaplan's disclosure of his securities transactions. In a couple months, chair Powell, or maybe sooner, you and I will file our tax returns and we'll list transactions and all kinds of things. And next to those transactions, we'll put dates. Bloomberg asked for the dates of Mr. Kaplan's transactions. The Dallas Fed is not giving us the dates. And I don't see why this is a matter for the inspector general or anybody else. I mean, why can't he give us the dates? Will you help us get the dates of those transactions? Thanks. So you asked about the risks first. So the one risk is that inflation risks are still to the upside in the views of most FOMC participants and certainly in my view as well. There's a risk that the high inflation we're seeing will be prolonged and there's a risk that it will move even higher. So we don't think that's the base case, but you ask what the risks are. And we have to be in a position with our monetary policy to address all of the plausible outcomes. And that calls for us to be in position. We have an expectation about the way the economy is going to be evolved, but we've got to be in a position to address different outcomes, including the one where inflation remains higher. And of course, that is a risk to the expansion. You know, we've been saying that what we need here is another long expansion, which is the kind of thing we saw over the last, which is the record long expansion. We saw labor force participation rise. We saw wages persistently higher for people at the lower end. And there really was no obvious imbalance in the economy that threatened that expansion it could have gone on for years were it not hit by the pandemic. So we'd love to find a way to get back to that. That's going to require price stability and that's going to require the Fed to tighten",0.0001833768853435
2022-01-26 20:00:00,2022-01-26 20:05:00," policy and do our part in getting inflation back down to our 2% goal. So I mentioned two-sided risks. You know, a couple of things. One, the COVID is not over and COVID can continue to evolve. And it's just we have to accept that it's not over and the risks to it can slow down growth. And that would be that's sort of a downside risk from a growth standpoint. Another point to, you know, another risk is just further problems in the supply chains, which could slow down activity. And you see the situation in China as a situation there where that's their no-COVID policy may cause more lockdowns. It's likely to and that may play into may play into more problems in supply chains. In addition, there's what's going on in Eastern Europe and things like that. So there's plenty of risk out there. And we, you know, we can't forget that there are risks on both sides. So that's there. That's what I would say. I know you've been all over this issue with my colleagues Craig on the issue of information. We don't have that information at the board. And, you know, I asked the inspector general to do an investigation. And that is out of my hands. I have playing no role in it. I seek to play no role in it. And I don't, I really, I can't help you here today on this issue. And I'm sorry I can't. Thank you. We'll go to Gina now. Thanks for taking our question to Chair Powell and the sorry for my tech issues. I wonder if you could tell us a little bit about where you're thinking on inflation stands today. You know, the last time we saw an SEP back in September, we saw that you and your colleagues were projecting that inflation would sort of sink back down quite close to target by the end of the year. And I wonder if you still think that projection from December is a reasonable one. And if you're thinking it's changed at all, I wonder how you're thinking about that. And I also wonder if you could talk a little bit about the pathway to getting to that deserteration. Like how do we get from here 7% CPI to where you expect to be at the end of the year. So I'd say, you know, since since the December meeting, I would say that the inflation situation is about the same, but probably slightly worse. I'd be inclined to raise my own estimate of 2022 core PCE inflation. Let's just go with that by a few tents today. But we're not writing down an SEP at this meeting, but I think it hasn't gotten better. It's probably gotten just a bit worse. And that's been the pattern. That's been the pattern. So I think if you look at the FOMC participants are there's a range there. And that range has been moving to the right for a year now. And by the way, if you look at other forecasters, essentially all other macro forecasters who do this for a living, you've seen the same pattern. So what do we think about that? Well, I think we wrote down rate increases in the December meetings, each of us individually. And I think to the extent the situation deteriorates further, our policy will have to address that. If it deteriorates meaningfully further, either in the time dimension or in the size of the inflation dimension. So that's how we're thinking about it. As I mentioned, though, I think it's part of this will be that we're the Fed moving away from a very highly accommodative policy to a substantially less accommodative policy. And then over time to a policy that's not accommodative in time. I don't know when that will be. That's those are the things that we're thinking about. That's that's part of it. Another part of it is that fiscal policy provided an impulse to growth over the last two years. That impulse will be less. In fact, will be will be negative this year. And so that's another thing. The other one is we will eventually get relief on the supply side. And you know, the ports will be cleared up. And there will be semiconductors and things like that. Now what what we're learning is it's just taking much longer. I think longer than expected. And that I think does raise raise the risk that in that high inflation will be more persistent. I do think will come off of the highs that we saw in the in the early part of this episode in the in the spring last year. But really what's the question is going to be what what is inflation running at. And so we'll be watching that. And I you know we our objective is to get inflation back down to 2%. And it's also to provide enough support to keep the labor market healthy. The labor market is very very very.",-0.0082737440410708
2022-01-26 20:05:00,2022-01-26 20:10:00," strong right now. And I think that that strength will continue. There's really a shortage of workers. We see it particularly among production and non-supervisory workers and people in the lowest quartile. You see very large wage increases. I mentioned some of the other indicators. So I think that's what we're looking at. And we're also, you know, we realize, I think, as everyone does, that this outlook is quite uncertain and that we're going to have to adapt it. And we're going to communicate as clearly as we can. But we're going to have to be adaptable and, you know, move as appropriate. Thank you. Thank you. Let's go to Cole B. Smith. Thank you, Michelle. Chair Powell, when you talk about being humble and nimble about the path for for monetary policy, does that also include the possibility of raising interest rates by larger increments and say doing a 50 basis points hike at some point if inflation does not moderate sufficiently? And should we interpret this approach as a departure from the gradual pace that we saw during the last hiking cycle? So as I mentioned, we have not made these decisions. We really haven't. And what I can tell you now, though, is that we fully appreciate that this is a different situation. If you look back to where we were in 2015, 16, 17, 18, when we were raising rates, inflation was very close to 2%, even below 2%. Unemployment was not at our estimates of the natural rate. And growth was, you know, in the 2% to 3% range. Right now, we have inflation running substantially above 2%, and, you know, more persistently than we would like. We have growth even in forecast, even in the somewhat reduced forecast for 2022. We still see growth higher than, substantially higher than what we estimate to be the potential growth rate. And we see a labor market where by so many measures, it is historically tight. I think the, you know, in a way, the least tight aspect of it is looking at the unemployment rate, which is still below our median estimate of maximum employment. If you look at things like quits and job openings, as I mentioned earlier, and wages, you're seeing, and just the ratio of job openings to unemployed, you're seeing a very, very tight labor market. Now, we also know that labor force participation is significantly lower. It's a percentage point and a half lower than it was in February of 2020. Maybe a percentage point of that is retirements. Some part of those retirements are related to COVID rather than just regular retirements. So we think there is a pool of people out there who could come back into the labor force. But it's not happening very quickly, and it may not continue to not happen very quickly as long as the pandemic is on. So that's how we think about that. We haven't made to your specific question. We really have not addressed those questions, and we'll begin to address them as we, as we move into the March meeting and meetings after that. Let's go to Rachel. Thank you, Michelle, and thank you, Chair Powell, for taking our questions. I'm wondering if you can talk to us about any metrics that the Fed uses to assess how inflation affects different groups of Americans, especially lower income earners. Are you worried that the Fed underestimates or can't effectively measure the impact of inflation on some of the most vulnerable households? Thank you. So it's more a matter of, I think the problem that we're talking about here is really that people are on fixed incomes who are living paycheck to paycheck. They're spending most or all of their of what they're earning on food, gasoline, rent, heating their heating, things like that, basic necessities. And so inflation right away, right away forces people like that to make very difficult decisions. So that's really the point. I don't, I'm not aware of inflation literally falling more on different socio-economic groups. That's not the point. The point is some people are just really prone to suffer more. I mean, for people who are economically well off inflation isn't good. It's bad. High inflation is bad, but they're going to be able to continue to eat and keep their homes and drive their cars and things like that. It's more, so that's really how I think of it. And, you know, we, we, um,",-0.0057892304136815
2022-01-26 20:10:00,2022-01-26 20:15:00," to control inflation for the benefit of all Americans, but part of it is just that it's particularly hard on people with fixed incomes and low incomes who spend most of their income on necessities, which are what you're experiencing high inflation now. Thank you. Let's go to Edward Lawrence. Thanks, Michelle. Thank you, Mr. Chairman for taking the question here. So year over year, inflations at 40 year high the input costs for producer pricing decks for all of 2021 was the highest on record. Some investors fear that the Fed might be moving too late. Now you said no decisions were made on the path of rate hikes, but was a rate hike more than 25 basis points discussed today. And as a follow that because I have problems with the mute button. As a follow that you testified that the supply chain issues could be worked up at the end of the year. You talked about that today. The CEO for the toll fox business today that the chip shortage will last into 2023. So today you said inflation will start to ease this year. I want to drill down and get a timeline that you see as to when we can see that relief. Thank you. So I would not say that I would expect the supply chain issues to be completely worked out by the end of the year. I do not expect them and I have not expected them. What I would say and I have been saying is that I expect progress to be made in the second half of this year, mainly progress because we're not making much progress. If you look at a ton of metrics, you can find some that suggest that delivery times or shorters and inventories and some industries moving up. Overall, we're not making progress and things like the semiconductor issue are going to be quite a long time. I would think they'll go more than through to 2023. In terms of being too late, I would just say this, our policy needs to be positioned to address the full range of plausible outcomes, as I said. Particularly the possibility that inflation will continue to run higher more persistently than we'd expected. We think we are positioned to make the changes in our policy to do that and we're committed to doing that. That's really where we are. In terms of your question about the size of rate increases, we haven't faced those decisions. We haven't made them. It isn't possible to sit down here today and tell you with any confidence what the precise path will be. But in as we work our way through this meeting by meeting, we are aware that this is a very different expansion. As I said a couple times with higher inflation, higher growth, a much stronger economy. And I think those differences are likely to be reflected in the policy that we implement. Thank you. Let's go to Mike McKee. Thank you, Mr. Chairman. I'd like to sort of weave some of the strands of your answers together and ask you as you start to reverse policy, what your goal is, are you going to be raising interest rates until you get inflation to 2%? Do you want to go below 2% so that on average you get a 2% inflation rate? And because you said we have to protect the employment part of your mandate, is there some sort of circuit breaker that would stop you from raising interest rates on the employment side? So no, there's nothing in our framework about having inflation run below 2%. So that we would do that, try to achieve that outcome. So the answer to that is no. What we're trying to do is keep inflation expectations well anchored at 2%. That's always the ultimate goal. And we do that in the service of having inflation, we get to that goal by having inflation average 2% over time. And if inflation doesn't average 2% over time, then it's not clear why inflation expectations would be anchored at 2%. So that's the way we think about that. What was the last part of your question? I was asking if you're protecting the employment side of the mandate, whether there's some sort of circuit breaker there. Nothing like that. I mean, I would say you have a tremendously strong labor market and you have growth this year at forecast to be well above potential. I mean, people are forecasting growth. You think potential growth is around two most forecasts are significantly above that for 2022. And that's even with policy becoming substantially less accommodative. So the labor market's going to be strong for some time. We're, we, we're, we're, we're, we're, we're, we're, we're, we're, we're, we're, we're, we're, we're, we're, we're, we're, we're, we're, we're, we're, we're, we're, we're, we're, we're, we're, we're, we're, we're, we're, we're, we're, we're, we're, we're, we're, we're, we're, we're, we're, we're, we're, we're, we're, we're, we're, we're, we're, we're, we're, we're, we're, we're, we're, we're, we're, we're, we're, we're, we're, we're, we're, we're, we're, we're, we're, we're, we're, we're, we're, we're, we're,",0.002835890283589
2022-01-26 20:15:00,2022-01-26 20:20:00," And ideally, what we're trying to achieve is inflation getting back down to 2 percent. And we're trying to do that in a process that accomplish that will also leave the labor market in a very strong position. And no one really knows what that will take. Again, I would say that it isn't just monetary policy that's helping inflation get down. It'll be supply side improvements and it'll be less fiscal impulse in all likelihood. So monetary policy will do our job. It is our job to get inflation down to 2 percent and a situation where the two goals can be in tension is a difficult one. But I don't really think they are here, though, because I think a really significant threat to further strengthening in the labor market in the form of higher participation over time is high inflation. And also high inflation is taking away the benefits of some of these large wage increases that we're seeing now. So we do hope to achieve, and our plan is to achieve both of those goals. If I could follow up, does the danger of tightening too much as policy works its way into the economy with a lag mean that you should go back to being more forecast dependent and making decisions rather than the state dependency you've been using as a framework for the last year and a half or so? What I see was particularly around the thought that if we saw a very strong labor market, we would wait to see actual inflation before we tightened. And so that was a very state dependent thought because for a long time we'd been tightening on the expectation of high inflation, which never appeared. And that was the case for a number of years. So in this particular situation, we will be clearly monitoring incoming data as well as the evolving outlook. Let's go to Michael Derby. Thank you for taking my question. When I ask you, with the benefit of hindsight and I realize I mean that is what it is, but do you feel that monetary policy and fiscal policy maybe did too much to react to the crisis and that part of the inflation problem that we're having right now is because the government in response collectively was more than what the economy ended up needing? So I think it's too soon to write that history really. But what I would say is this, if you remember what it felt like at the beginning of the pandemic, literally the global economy shutting down in large part, including our own economy and people going to their homes for weeks on end in masks and there are no vaccines and it could be a really long time to get them. And then you have economic activity drops by a shocking amount in one course. So there was a real risk of lasting damage. And I think Congress responded remarkably with the CARES Act, incredibly timely, very powerful. People will always be flaws in these things. But in real time, it was a remarkable achievement. And we responded and what we were able to do was, you know, stave off a collapse of the financial system at the beginning and make time for what really needed to happen, which was the income replacement and then the recovery that Congress enabled with the CARES Act. So now that was a lot of, that was a lot. And what we did was a lot. And you know, now, so what we have now is we have the strongest recovery of any country and we have a recovery that looks completely unlike other recoveries that we've had because we've put so much support behind the recovery. And we're managing the relatively high class problems that come with that, which are high inflation and labor shortage. So and these are serious problems, very serious problems that we, you know, we're working as hard as we can on. Was it too much? Again, I'm going to leave that to the historians. But in 25 years, we'll look back at this incident, which will be a, you know, two, three, four, five-year period and we'll say, you know, we'll have a much better basis to make a judgment about the actions that people took. It was all founded though in a very strong reaction to a, you know, to a unique historical event. And I guess I'll have to leave it that I look for, I hope I, I hope I'll be around to see how that looks in 25 years. Thank you. Thank you. Let's go to Genie. Thanks, Michelle. Chair Powell, some investors are expecting the yield curve could flatten or even",-0.0022251066196921
