original_time,start_time,end_time,speech,price_change,volatility
2022-11-02 18:30:00,2022-11-02 18:55:00,2022-11-02 18:56:00," of a gradual softening is happening. And maybe that's there, but it's not obvious to me, because wages aren't coming down. They're just moving sideways at an elevated level, both ECI and hourly earnings. We would love to see vacancies coming down, quits coming down. They are coming down. vacancies are below their all-time high, but not by as much as we thought, because the data series is volatile. We never take any one reading. We always look at two or three. So it's a mixed picture. I don't see the case for real softening just yet, but we look at, I guess I just showed you. We look at a very broad range of data on the labor market. So do you see wages as being a significant driver of inflation? You know, I think wages have an effect on inflation. And inflation has an effect on wages. I think that's always been the case. There's always a going back and forth. The question is, is that really elevated right now? I don't think so.",0.0,0.0044264109184802836
2022-11-02 18:30:00,2022-11-02 18:56:00,2022-11-02 18:57:00," I don't think wages are the principal story of why prices are going up. I don't think that. I also don't think that we see a wage price spiral. But again, it's not something you can, once you see it, you're in trouble. So we don't want to see it. We want wages to go up. We just want them to go up at a level that's sustainable and consistent with 2% inflation. And we do think that given the data that we have, that this labor market can soften without having to soften as much as history would indicate through the unemployment channel. It can soften through job openings declining. We think there's room for that, but we won't know that. That'll be discovered empirically. Thank you so much, Kayla Towsie from CNBC. Earlier last month, the United Nations warned that there could be a global recession.",0.0,0.0
2022-11-02 18:30:00,2022-11-02 18:57:00,2022-11-02 18:58:00," of Central Banks didn't change course, the new UK Prime Minister warned of a profound economic crisis there. And I'm wondering how the Fed is weighing international developments in light of a very strong economy here in the U.S. that would seem to be bucking those trends. So, of course, we keep close tabs on economic developments and also geopolitical developments that are relevant to the economy abroad. We're in very frequent contact with our foreign counterparts, both through the IMF meetings and the regular meetings with Central Banks that we have and I have won this weekend with many, many Central Bankers. So we're in touch with all of that. So I guess what it's clear, clearly a time, a difficult time in the global economy. We're seeing very high inflation in Europe significantly because of high interest.",-0.0003229616480809,0.0
2022-11-02 18:30:00,2022-11-02 18:58:00,2022-11-02 18:59:00, prices related to the war in Ukraine and you know we're seeing China's having issues with the zero-COVID policy and you know much slower growth than we're used to seeing. So we're seeing we see those difficulties. The strong dollar is a challenge for some countries but you know we have it and we take all of that into account in our models. We think about the spillovers and that sort of thing. Here in the United States we have a strong economy and we have an economy where inflation is running at 5 percent. Core PCE inflation which is a really good indicator of what's going on for us is the way we see it is running at 5.1 percent on a 12-month basis and sort of similar to that on a 36 and 9-month basis. So we know that we need to use our tools to get inflation of the control. The world's not going to be better off if we fail to do that. That's a task we need to do. Price stability in the United States is a good thing for the global economy over a long period of time.,0.0,0.0
2022-11-02 18:30:00,2022-11-02 18:59:00,2022-11-02 19:00:00," stability is the kind of thing that pays dividends for our economy for decades, hopefully, even though it may be difficult to get it back. Getting it back is something that provides value to the people we serve for the long run. The Fed has acknowledged in the past that the tools that you have don't affect things like energy and food prices that stem from some of those conflicts overseas, and there's some of the biggest pain points for consumers. So as you pursue the current path that you've outlined, is there a risk that some of those prices simply don't come down? So we don't directly affect, for the most part, food and energy prices, but the demand channel does affect them just at the margin. The thing about the United States is that we also have strong, in many other jurisdictions, the principle problem really is energy. In the United States, we also have a demand issue.",0.0,0.0
2022-11-02 18:30:00,2022-11-02 19:00:00,2022-11-02 19:01:00," imbalance between demand and supply, which you see in many parts of the economy. So our tools are well suited to work on that problem, and that's what we're doing. You're right, though. We don't, you know, the price of oil is set globally, and it's not something we can affect. I think by the actions that we take, though, we help keep, you know, longer term inflation expectations anchored and keep the public believing in 2 percent inflation by the things that we do, even at times when energy is part of the story of why inflation is high. Hi, Chair Powell, Janelle Marty with Bloomberg. So the Fed is facing two more ethics-related incidents with the revision of the financial statements from President Bostick and President Bullard speaking out a closed event. So some senators like Elizabeth Warren are saying that this is a sign of greater...",0.0,0.004315789473684175
2022-11-02 18:30:00,2022-11-02 19:01:00,2022-11-02 19:02:00," problems at the Fed? Could you talk about what this does to the public's trust in the bank and what the Fed is doing to prevent this kind of behavior from becoming common? Sure. So you're right. The public's trust is really the Fed's and any central banks, most important asset. And any time one of us, one of the policy makers, violates or fall short of those rules, we do risk undermining that trust. And we take that very seriously, we do. So at the beginning of our meeting yesterday, actually, we had a committee discussion of the full committee on the importance of holding ourselves individually and collectively accountable for knowing and following the high standard that's set out in our existing rules with respect to both personal investment activities and external communications. And we've taken a number of steps and I would just say we do understand how important those issues are. I would say that our new investment.",0.0,0.0
2022-11-02 18:30:00,2022-11-02 19:02:00,2022-11-02 19:03:00," program that we have is up now in running and actually was through that that the problems with President Boss six disclosures were discovered when he filed his new disclosures. That's, you know, we now have a central group here at the Board of Governors that looks into disclosures and follows them and approves people's disclosures and also all of their traits. And he traded anyone who has to make, who's covered, has to be approved, pre-approved. And there's a lag. It has to be pre-approved 45 days before it happens. So there's no ability to game market. So it's a really good system. It worked here. And we, I think we all said to each other today, yesterday, actually yesterday morning, we recommitted to each other into this institution to hold ourselves to the highest standards and avoid these problems. Do you have an update on the investigations that are pending? I don't. You know, as you know, I, I referred the...",0.0043645554161883,0.0
2022-11-02 18:30:00,2022-11-02 19:03:00,2022-11-02 19:04:00," matter concerning President Bostic to the Inspector General. Once that happens, I don't discuss it with the Inspector General with anybody. It's just the Inspector General has the ability to do investigations. We don't really have that. So that's what he's doing. Michael McKee from Bloomberg Television and Radio. Earlier this year, you touted the three month bill yield out to 18 months as the yield curve with 100% explanatory power. And you said, quote, if it's inverted, that means the Fed's going to cut, which means the economy is weak. That curve is only two basis points away from inversion now. So I'm wondering why you are so confident that you have not overtightened, particularly given that rates work with a leg. Well, so we do monitor the near term forward spread. You're right. And that's been our preferred measure. We think it, you know, just imp...",0.0,0.0
2022-11-02 18:30:00,2022-11-02 19:04:00,2022-11-02 19:05:00," empirically, it dominates the ones that people tend to look at, which is twos, tens, and things like that. So it's not inverted. And also, you have to look at why the rate curve is doing what it's doing. It can be doing that because it expects cuts or because it expects inflation to come down. In this case, if you're in a situation where the markets are pricing in significant declines in inflation, that's going to affect the forward curve. So yes, we monitor it. You're right. And that's what I would say. If I could follow up, you also said several meetings ago that the risk of doing too little outweighed the risk of doing too much. Is what you're trying to tell us today is that that risk assessment has changed a little bit? Well, what's happened is time has passed, and we've raised interest rates by 375 basis points. I would not change a word in that statement, though. I think until we get inflation down, you",0.0,0.0
2022-11-02 18:30:00,2022-11-02 19:05:00,2022-11-02 19:06:00," will be hearing that from me. Again, if we over tighten and we don't want to, we want to get this exactly right. But if we over tighten, then we have the ability with our tools, which are powerful, to, as we showed at the beginning of the pandemic episode, we can support economic activity strongly if that happens, if that's necessary. On the other hand, if you make the mistake in the other direction and you let this drag on, then it's a year or two down the road and you're realizing inflation behaving the way it can, you're realizing you didn't actually get it, you have to go back in. By then, the risk really is that it has become entrenched in people's thinking. And the record is that the employment costs, the cost to the people that we don't want to hurt, they go up with the passage of time. That's really how I look at it. So that isn't going to change. What has changed, though, you're right. We're farther along now. And I think as we're farther along, we're now focused on.",0.0,0.006580243508412455
2022-11-02 18:30:00,2022-11-02 19:06:00,2022-11-02 19:07:00," on that, you know, what's the place, what's the level we need to get to rates. And, you know, I don't know what we'll do when we get there, by the way. You know, it doesn't, we'll have to see. There's been no decision or discussion around exactly what steps we would take at that point. But the first thing is to find your way there. Thanks, Chris. We're getting there. Thank you. Chris Ruggabur, and Associated Press. Just to go back to housing for a minute, you mentioned the impact that right increases of hat on housing. Home sales are down 25% in the past year and so forth. But none of this is really showing up and, as you know, in the government's inflation measures. And as we go forward, private real-time data is clearly showing these hits to housing. Are you going to need to put a greater weight on that in order to ascertain things like whether there's overtightening going on? Or will you still focus as much on the more lagging government indicators? This is an interesting subject.",0.0,0.0
2022-11-02 18:30:00,2022-11-02 19:07:00,2022-11-02 19:08:00," So I start by saying I guess that the measure that's in the CPI and the PCE, it captures rents for all tenants, not just new leases. And that makes sense, actually, because for that reason, that conceptually, that's sort of the right target for monetary policy. And the same thing is true for owners equivalent rent, which comes off of, it's a re-weighting of tenant rents. And private measures are, of course, good at picking up the, you know, at the margin, the new leases. And, you know, they tell you a couple things. One thing is, once you, so I think right now, if you look at the pattern, a pattern of that series of the new leases, it was, it was very pro-cyclical. So rents went up much more than the CPI and PCE rents did. And now they're coming down faster. So what you, the implication is that there are still as people, as, as, as, as, as, as,",-0.0095615219690484,0.0
2022-11-02 18:30:00,2022-11-02 19:08:00,2022-11-02 19:09:00," as non-new leases roll over and become an expire, right? You still, they're still in the pipeline, there's still some significant rate increases coming. Okay, but at some point once you get through that, the new leases are going to tell you that what they're telling you is there will come a point at which, at which rent inflation will start to come down. But that point is well out from where we are now. So we're well aware of that of course, and we look at it. But I would say that in terms of the right way to think of that inflation really is to look at the measure that we do look at. But considering that we also know that at some point you'll see rents coming down. Great, we did. Just a quick follow. It looks like stock and bond markets are reacting positively to your announcements so far. Is that something you would wanted to see? Is that a problem or what have we got? What, how much that might affect your future policy to see this?",0.0,0.0
2022-11-02 18:30:00,2022-11-02 19:09:00,2022-11-02 19:10:00," positive reaction? You know, we're not targeting anyone or two particular things. You know, our message should be, what I'm trying to do is make sure that our message is clear, which is that we think we have a ways to go. We have some ground to cover with interest rates before we get to, before we get to that level of interest rates that we think is sufficiently restrictive. And putting that in the statement and identifying that as a goal is an important step. And that's meant to put that question really as the important one now going forward. I've also said that we think that the level of rates that we estimated in September, the incoming data suggests that that's actually going to be higher. And that's been the pattern. I mean, I would have little confidence that the forecast, if we made a forecast today, if we were doing an SCP today, you know, the pattern has been that one after another, they go up. And you know, that'll end one at ends, but there's no sense that, that, you know, that inflation is coming down to this.",0.0,0.0
2022-11-02 18:30:00,2022-11-02 19:10:00,2022-11-02 19:11:00," It just, if you look at the, I have a table of the, the last 12 months of 12 month readings. And there's really no pattern there. We're exactly where we were a year ago. So, okay. So, I would also say it's premature to discuss pausing. And it's not something that we're thinking about. That's really not a conversation to be had now. We have a ways to go. And the last thing I'll say is that, I would want people to understand our commitment to getting this done. And to not making the mistake of, of not doing enough or the mistake of withdrawing our strong policy and doing that too soon. So, I control those messages and that's my job. Edward. Edward Lawrence with Fox Business. Thank you, Fed Chairman. So, how big of a headwind is all the fiscal spending to what the Federal Reserve is trying to do to get inflation?",0.0,0.004724161461340642
2022-11-02 18:30:00,2022-11-02 19:11:00,2022-11-02 19:12:00," back to the 2% target. You know, in theory, it was a headwind this year, but I do think the broader context is that you have households that have these significant amounts of savings and can keep spending. Even in, so I think those two things do tend to wage to sort of counterbalance each other out. It appears consumer spending is still positive. It's at pretty modest growth levels. It's not shrinking, but, you know, people are, you know, the banks that deal with retail customers and many retailers will tell you that the consumers are still buying and they're still, you know, real, they're fine. So I don't know how big the fiscal headwinds are. And they haven't shown up in the way that we thought they would in restraining spending. So it must have to do with the savings that people have. What about the spending? There's tens of billions yet to be spent. I mean, from the inflation reduction act, I can rescue plan, CHIP SACS, by parts of infrastructure bill.",0.0,0.0
2022-11-02 18:30:00,2022-11-02 19:12:00,2022-11-02 19:13:00," Where, how does that go and plan your thinking about the future? You know, it's, um, demand is going to have some support from those savings. And also from the strong demand that's still in the labor market. We still see pretty significant demand and, and, um, a tightening labor market in some respects, although I think overall, I would say it's not really tightening or, or loosening. So we see those things and what those things tell us is that, you know, our job is going to require some resolve and some patience over time. We, we're going to have to stick with this. And, and, um, you know, that's just, we take, we take all that as a given, but we know what our objective is and we know what our tools can do. And, um, that's how we think about it. Thanks. We'll go to Nancy for the last question. Hi, Chair Powell, Nancy Marshall, Gensur from Marketplace. I'm wondering, has the window for a soft landing narrowed? Do you still think it's possible? Is it narrowed? Yes. Is it still possible? Yes.",-0.00029297386179339985,0.0
2022-11-02 18:30:00,2022-11-02 19:13:00,2022-11-02 19:14:00," I think we've always said it was going to be difficult, but I think to the extent rates have to go higher and stay higher for longer, it becomes harder to see the path that's narrowed. I would say the path is narrowed over the course of the last year, really. Hard to say. Hard to say. Again, I would say that the sort of array of data in the labor market is highly unusual and to many economists, there is a path to, there's an ordinarial that there's a relationship to GP going down and vacancies declining, translating into unemployment or there's Oaken's law. So all those things are relationships that are in the data and they're very real. There's a little bit different this time though because you have this tremendously high level of vacancies and we think on a very steep part of the beverage curve, all I would say is that the job losses may be",0.0,0.0
2022-11-02 18:30:00,2022-11-02 19:14:00,2022-11-02 19:15:00," turn out to be less than would be indicated by those traditional measures because job openings are so elevated and because the labor market is so strong. Again, that's going to be something we discover empirically. I think no one knows whether there's going to be a recession or not and if so, how bad that recession would be. And, you know, our job is to restore price stability so that we can have a strong labor market that benefits all over time and that's what we're going to do. Just real quickly, why do you feel like the window has narrowed? Because we haven't seen inflation coming down, the implication of inflation not coming down and what we would expect by now to have seen is that really as the supply side problems had resolved themselves, we would have expected goods inflation to come down by now, long since by now and it really hasn't, although it's actually it has come down but it's",0.0,0.0
2022-11-02 18:30:00,2022-11-02 19:15:00,2022-11-02 19:15:26," It's not to the extent we had hoped. At the same time, now you see services inflation, core services inflation moving up. And I just think that the inflation picture has become more and more challenging over the course of this year without question. That means that we have to have policy be more restrictive, and that narrows the path to a soft landing, I would say. Thanks very much.",0.0,0.004824677036646412
