original_time,start_time,end_time,speech,price_change,volatility
2022-11-02 18:30:00,2022-11-02 18:30:00,2022-11-02 18:31:00," Good afternoon. My colleagues and I are strongly committed to bringing inflation back down to our 2 percent goal. We have both the tools that we need and the resolve that will take to restore price stability on behalf of American families and businesses. Price stability is the responsibility of the Federal Reserve and serves as the bedrock of our economy. Without price stability, the economy does not work for anyone. In particular, without price stability, we will not achieve a sustained period of strong labor market conditions that benefit all. Today the FOMC raised our policy interest rate by 75 basis points and we continue to anticipate that ongoing increases will be appropriate. We are moving our policy stance purposefully to a level that will be sufficiently restrictive to return inflation to 2.",0.0,0.006347479143997068
2022-11-02 18:30:00,2022-11-02 18:31:00,2022-11-02 18:32:00," In addition, we're continuing the process of significantly reducing the size of our balance sheet. Restoring price stability will likely require maintaining a restrictive stance of policy for some time. I will have more to say about today's monetary policy actions after briefly reviewing economic developments. The U.S. economy has slowed significantly from last year's rapid pace. Real GDP rose at a pace of 2.6 percent last quarter, but is unchanged so far this year. Recent indicators point to modest growth of spending and production this quarter. Growth in consumer spending has slowed from last year's rapid pace in part reflecting lower real disposable income and tighter financial conditions. Activity in the housing sector has weakened significantly, largely reflecting higher mortgage rates. Higher interest rates and slower output growth also appear to be weighing on business fixed in...",0.0,0.0
2022-11-02 18:30:00,2022-11-02 18:32:00,2022-11-02 18:33:00," investment. Despite the slowdown in growth, the labor market remains extremely tight with the unemployment rate at a 50-year low. Job vacancies still very high, and wage growth elevated. Job gains have been robust, with employment rising by an average of 289,000 jobs per month over August and September. Although job vacancies have moved below their highs, and the pace of job gains has slowed from earlier in the year, the labor market continues to be out of balance, with demand substantially exceeding the supply of available workers. The labor force participation rate is little changed since the beginning of the year. Inflation remains well above our longer-run goal of 2 percent. Over the 12-month ending in September, total PCE prices rose 6.2 percent, excluding the volatile food and energy categories, core PCE prices rose 5.1 percent.",-0.0040789014582867,0.0
2022-11-02 18:30:00,2022-11-02 18:33:00,2022-11-02 18:34:00," inflation data again have come in higher than expected. Price pressures remained evident across a broad range of goods and services. Russia's war against Ukraine has boosted prices for energy and food and has created additional upward pressure on inflation. Despite elevated inflation, longer term inflation expectations appear to remain well anchored, as reflected in a broad range of surveys of households, businesses, and forecasters, as well as measures from financial markets. But that is not grounds for complacency. The longer the current bout of high inflation continues, the greater the chance that expectations of higher inflation will become entrenched. The Fed's monetary policy actions are guided by our mandate to promote maximum employment and stable prices for the American people. My colleagues and I are acutely aware that high inflation imposes significant hardship and as it erodes purchasing power, especially for those least able to meet the higher costs.",0.0,0.0
2022-11-02 18:30:00,2022-11-02 18:34:00,2022-11-02 18:35:00," of essentials like food, housing, and transportation. We are highly attentive to the risks that high inflation poses to both sides of our mandate, and we're strongly committed to returning inflation to our 2% objective. At today's meeting, the committee raised the target range for the federal funds rate by 75 basis points, and we are continuing the process of significantly reducing the size of our balance sheet, which plays an important role in firming the stance of monetary policy. With today's action, we've raised interest rates by three and three-quarters percentage points this year. We anticipate that ongoing increases in the target range for the federal funds rate will be appropriate, in order to attain a stance of monetary policy that is sufficiently restrictive to return inflation to 2% over time. Financial conditions have tightened significantly in response to our policy actions, and we are seeing the effects on demand in the most interest rate-sensitive sectors of the economy, such as housing.",0.0,0.0
2022-11-02 18:30:00,2022-11-02 18:35:00,2022-11-02 18:36:00," It will take time, however, for the full effects of monetary restraint to be realized, especially on inflation. That's why we say in our statement that in determining the pace of future increases in the target range, we will take into account the cumulative tightening of monetary policy and the lags with which monetary policy affects economic activity and inflation. At some point, as I've said in the last two press conferences, it will become appropriate to slow the pace of increases, as we approach the level of interest rates that will be sufficiently restrictive to bring inflation down to our 2 percent goal. There is significant uncertainty around that level of interest rates. Even so, we still have some ways to go. And incoming data, since our last meeting, suggests that the ultimate level of interest rates will be higher than previously expected. Our decisions will depend on the totality of incoming data and their implications for the outlook for economic activity and inflation. We will continue to make our decisions meeting by...",0.0,0.016770446339804217
2022-11-02 18:30:00,2022-11-02 18:36:00,2022-11-02 18:37:00," meeting and communicate are thinking as clearly as possible. We're taking forceful steps to moderate demand so that it comes into better alignment with supply. Our overarching focus is using our tools to bring inflation back down to our 2% goal and to keep longer term inflation expectations well anchored. Reducing inflation is likely to require a sustained period of below trend growth and some softening of labor market conditions. Having price stability is essential to set the stage for achieving maximum employment and stable prices in the longer run. The historical record caution strongly against prematurely loosening policy. We will stay the course until the job is done. To conclude, we understand that our actions affect communities, families and businesses across the country. Everything we do is in service to our public mission. We at the Fed will do everything we can to achieve our maximum employment and price stability goals. Thank you and I look.",0.0,0.0
2022-11-02 18:30:00,2022-11-02 18:37:00,2022-11-02 18:38:00," forward to your questions. Thank you, Colby. Thank you. Colby Smith with the Financial Times. On the need to slow the pace of rate increases at some point is a downshift contingent on a string of better inflation data specifically between now and let's say the December meeting. Or is that something that the Fed could potentially proceed with independent of that data given the lag defects that you mentioned? So a couple of things on that. We do need to see inflation coming down decisively and good evidence of that would be a series of down monthly readings. Of course, that's what we'd all love to see. But that's, I've never thought of that as the appropriate test for slowing the pace of increases or for identifying the appropriately restrictive level that we're aiming for. We need to bring our policy stance down to a level that's sufficiently restrictive to bring inflation down to our 2% objective over the medium term. How will we know that we've reached that level? Well, we'll take into",0.0083924382077974,0.0
2022-11-02 18:30:00,2022-11-02 18:38:00,2022-11-02 18:39:00," to account the full range of analysis and data that bear on that question, guided by our assessment of how much financial conditions have tightened. The effects of that tightening is actually having on the real economy and on inflation, taking into consideration lags, as I mentioned. We will be looking at real rates, for example, all across the yield curve and all other financial conditions. And as we make that assessment. Hi, Howard Schneider with Reuters. Look, I'm sure there's going to be tons of confusion out there about whether this means you're going to slow in December or not. Would you say that the bias right now is not for another 75 basis, when it agrees? So what I want to do is put that question of pace in the context of our broader tightening program, if I may, and talk about the statement language along the way. So I think you can think about our tightening program as really addressing three questions.",0.0,0.0
2022-11-02 18:30:00,2022-11-02 18:39:00,2022-11-02 18:40:00," The first of which was and has been how fast to go, the second is how high to raise our policy rate and the third will be eventually how long to remain at a restrictive level. So on the first question, how fast to tighten policy, it's been very important that we move expeditiously and we have clearly done so. We've moved three and three quarters percent since March, admittedly from a base of zero. It's a historically fast pace and that's certainly appropriate given the persistence and strength and inflation and the low level from which we started. So now we come to the second question which is how high to raise our policy rate and we're saying that we'd raise that rate to a level that's sufficiently restrictive to bring inflation to our two percent target over time and we put that into our post-meeting statement because that really does become the important question we think now is how far to go and I'll talk more about that. We think there's some ground to cover but before we meet that test and that's why we say that off.",0.0,0.0
2022-11-02 18:30:00,2022-11-02 18:40:00,2022-11-02 18:41:00," ongoing rate increases will be appropriate. And as I mentioned, incoming data between the meetings, both the strong labor market report, but particularly the CPI report, do suggest to me that we may ultimately move to higher levels than we thought at the time of the September meeting. That level is very uncertain, though, and I would say we're going to find it over time. Of course, with the lags between policy and economic activity, there's a lot of uncertainty. So we note that in determining the pace of future increases, we'll take into account the cumulative tightening of monetary policy, as well as the lags with the monetary policy affects economic activity and inflation. So I would say as we come closer to that level, move more into restrictive territory, the question of speed becomes less important than the second, third questions. And that's why I've said it the last two press conferences that at some point it will become appropriate to slow the pace of increases. So that time is coming, and it may come as soon as the next meeting or",0.0,0.009890138566321392
2022-11-02 18:30:00,2022-11-02 18:41:00,2022-11-02 18:42:00," the one after that. No decision has been made. It is likely we'll have a discussion about this at the next meeting, a discussion. To be clear, let me say again, the question of when to moderate the pace of increases is now much less important than the question of how high it erases rates and how long to keep monetary policy restricted, which really will be our principal focus. If I could follow up on that, to what degree was there an importance or a weight given to a need to signal this possibility now, given all the concerns really around the globe about fed policy sort of driving ahead and everybody else, you know, dealing with their own stress as a result? Well, I think I'm pleased that we have moved as fast as we have. I don't think we've over tightened. I think there's very difficult to make a case that our current level is too tight, given that inflation still runs well above the federal fund.",0.0,0.0
2022-11-02 18:30:00,2022-11-02 18:42:00,2022-11-02 18:43:00," rate. So I think that at this meeting, as the last two meetings, as I've mentioned, I've said that we, that there would come a point, and this was a meeting at which we had a discussion about what that might mean. And we did discuss this, and as I mentioned, we'll discuss it again in December. But there's no, I don't have any sense that we've over tightened or moved too fast. I think it's been good in a successful program. We, we, that we've gotten this far, this fast. Remember, though, that, that we still think there's a need for ongoing rate increases. And we have some ground left to cover here. And, and, and cover it, we will. Nick Temeros of the Wall Street Journal, Chair Powell, core BCE inflation on a three or six month annualized basis, and on a 12 month basis has been running in the high for close to 5%. Is there any reason to think you won't have to raise?",-0.0055625454393998,0.0
2022-11-02 18:30:00,2022-11-02 18:43:00,2022-11-02 18:44:00," rates at least above that level to be confident that you are imparting enough restraint to bring inflation down. So this is the question of does the policy rate need to get above the inflation rate? And I would say there are a range of views on that. That's the classic Taylor principle view. But I would think you'd look more at a forward looking measure of inflation to look at that. But I think the answer is we'll want to get the policy rate to a level where it is where the real interest rate is positive. We will want to do that. I do not think of it as the single and only touchstone though. I think you put some weight on that. You also put some weight on rates across the curve. Very few people borrow at the short end of the federal funds rate, for example. So households and businesses, if they're very meaningfully positive interest rates all across the curve for them, credit split respect.",0.0,0.0
2022-11-02 18:30:00,2022-11-02 18:44:00,2022-11-02 18:45:00, are larger so barring rates are significantly higher and I think financial conditions have tightened quite a bit so I would look at that as an important feature I'd put some weight on it but I wouldn't say it's it's it's something that that is the single dominant thing to look at. If I could follow up what is your best assessment or the staff's best assessment right now of the current rate of underlying inflation? I don't have a specific number for you there there are many many models that look at that and I mean one way to look at it is that it's a pretty stationary object and that when inflation runs above above that level for sure substantially above for some time you'll see it move up but the movement will be will be fairly gradual so I think that's what that's what the principal models would would tend to say but I wouldn't want to land on any one assessment there are many different as you know many different people publish an assessment of underlying inflation. Thank you.,0.0,0.0
2022-11-02 18:30:00,2022-11-02 18:45:00,2022-11-02 18:46:00," Hi, Chair Powell. Thank you for taking our questions. Gina Smiley with New York Times. I wonder, do you see any evidence at this stage that inflation is or is it risk of becoming entrenched? Is inflation becoming entrenched? So I guess I would start by pointing to expectations. So if we saw longer term expectations moving up, that would be very troubling. And they were moving up a little bit in the middle part of this year and they've moved now back down. That's one piece of data. Short term inflation expectation that moved up between the last meeting and this meeting. And we don't think those are as indicative, but they may be important in the wage setting process. There's a school of thought that believes that. So that's very concerning. I guess the other thing I would say is that the longer we have, we're now 18 months into this episode of high inflation. And we don't have a clearly identified.",0.0,0.007048241255092905
2022-11-02 18:30:00,2022-11-02 18:46:00,2022-11-02 18:47:00," scientific way of understanding at what point inflation becomes entrenched. And so, you know, the thing we need to do from a risk management standpoint is to use our tools forcefully but thoughtfully and get inflation under control, get it down to 2% get it behind us. That's what we really need to do and what we're strongly committed to doing. Hi, Chair Powell. Thank you for taking our questions, Rachel Seagal from the Washington Post. The statement points to the lag times. I'm wondering if you can walk us through how you judge those lag effects, what that timeline looks like over the coming months or even a year and where you would expect it to show up in different parts of the economy. Yeah, so, let me, the way I would think about that is, you know, it's a, it's a commonly, for a long time thought that monetary policy works with long and variable legs and that it works first on...",0.0,0.0
2022-11-02 18:30:00,2022-11-02 18:47:00,2022-11-02 18:48:00," financial conditions and then on economic activity and then perhaps later than that even on inflation. So that's been the thinking for a long time. There was an old literature that made those lags out to be fairly long. There's newer literature that says that they're shorter. And you know, the truth is we don't have a lot of data of inflation of this high in what is now the minor economy. One big difference now is that it used to be that you would raise the federal funds rate, financial conditions would react. And then that would affect economic activity and inflation. Now financial conditions react well before in expectation of monetary policy. That's the way it is moved for a quarter of a century in the direction of financial conditions than monetary policy because the markets are thinking what is the central bank going to do. And you know, there are plenty of economists that also think that once financial conditions change that the effects on the economy are actually faster than they would have been before.",-0.004762385712788999,0.0
2022-11-02 18:30:00,2022-11-02 18:48:00,2022-11-02 18:49:00," We don't know that. I guess the thing I would say is highly uncertain. Highly uncertain. And so from risk management standpoint, we do need, it would be irresponsible not to ignore them. But you want to consider them but not take them literally. So I think it's a very difficult place to be, but I would tend to be, want to be in the middle looking carefully at what's actually happening with the economy and trying to make good decisions from a risk management standpoint. Remembering, of course, that if we were to overtighten, we could then use our tools strongly to support the economy. Whereas if we don't get inflation under control because we don't tighten enough, now we're in a situation where inflation will become entrenched. And the cost, the employment costs in particular, will be much higher potentially. So from risk management standpoint, we want to be sure that we don't make the mistake of either failing to tighten enough or loosening policy too soon. And if I could follow up, should we?",0.0,0.0
2022-11-02 18:30:00,2022-11-02 18:49:00,2022-11-02 18:50:00," interpret the addition to the statement to mean that more weight is put into those log effects than they would have been after previous rate heights? So I think as we move now into restrictive territory, as we make these ongoing rate hikes and policy becomes more restrictive, it'll be appropriate now to be thinking more about log. Of course, we think about the lags are just sort of a basic part of monetary policy, but we will be thinking about them, but we won't be, you know, I think we'll be considering them, but because it's appropriate to do so. Let me say this, it's very premature to be thinking about pausing. So when they hear lags, they think about a paus, it's very premature in my view to think about or be talking about pausing our rate hike. We have a ways to go. Our policy, we need ongoing rate hikes to get to that level of sufficiently restrictive, and we don't, of course, we don't really know exactly where that is.",0.0,0.0
2022-11-02 18:30:00,2022-11-02 18:50:00,2022-11-02 18:51:00," because we have a sense and we'll write down in September, sorry, in the December meeting, a new summary of economic projections, which updates that, but I would expect us to continue to update it based on what we're seeing with incoming data. Thanks, Chair Powell and Neil Irwin-Vaxios. As you look around the economy, the clearest impact of your tightening so far has been on housing, maybe some venture fund attack companies. It's been relatively narrow in terms of labor market, consumer demand, a lot of sectors, you don't see a ton of effect. Is the pathway and channels through which monetary policy works, changing is it narrower than it used to be? And on housing in particular, are you at all worried that you're crimping housing supply in ways that might cause problems down the road? I don't know that the channels through which policy works have changed that much. I would say a big channel is the labor market and the labor market is just very, very strong, very strong. And household, of course, have strong balance sheets. So we go into this with how with, with,",0.0,0.012930124551403932
2022-11-02 18:30:00,2022-11-02 18:51:00,2022-11-02 18:52:00," strong labor market and excess demand in the labor market, as you can see through many different things, and also with households who have strong spending power built up. So it may take time. It may take resolve. It may take patience. It's likely to get inflation down. It may, I think you see from our forecast and others that it will take some time for inflation to come down. It'll take time, we think. So, sorry, was that getting to your question there? Housing. Housing, the housing part of it. Yeah, so we look at housing. Of course, housing is significantly affected by these higher rates, which are really back where they were before the global financial crisis. They're not historically high, but they're much higher than they've been. And you're seeing housing activity decline. You're seeing housing prices growing at a faster rate, and in some parts of the country declining. I would say housing market was very overheated for the couple of years after the pandemic, as demand increased.",0.0,0.0
2022-11-02 18:30:00,2022-11-02 18:52:00,2022-11-02 18:53:00," rates were low. We all know the stories of how overheated the housing market was. Prices going up, many, many bidders, no conditions, that kind of thing. So the housing market needs to get back into a balance between supply and demand. We're well aware that the was going on there. You know, from a financial stability standpoint, we didn't see in this cycle the kinds of poor credit underwriting that we saw before the global financial crisis. Housing credit was very carefully, much more carefully managed by the lenders. So it's a very different situation and doesn't present potential financial, doesn't appear to present financial stability issues. But no, we do understand that that's really where a very big effect of our policy. Victoria. Hi, Victoria Guida with Politico. I wanted to ask about the labor market. You mentioned early on again that job openings are",0.0096605397966953,0.0
2022-11-02 18:30:00,2022-11-02 18:53:00,2022-11-02 18:54:00," very high compared to available workers. And I'm just curious to what extent you do and don't draw a signal from that. So for example, if wage growth is slowing and if maybe the unemployment rate starts to take up, will that make you sort of decrease your focus on job openings? What do you see? Are wages what's really important? How are you thinking about the labor market as it relates to inflation? So we talk a lot about vacancies and the vacancy to unemployed rate, but it's just one, it's just another data series. It's been unusually important in this cycle because it's been so out of line, but so has quits, so have wages. So we look at a very wide range of data on the labor market. So I'd start with unemployment, which is typically the single statistic you would look to is at a 50-year low, 3.5%. We're getting really nothing in labor supply now. I think very small increase this year, which we had really thought we thought we would get that back most down, let's start.",0.0,0.0
2022-11-02 18:30:00,2022-11-02 18:54:00,2022-11-02 18:55:00," we would get some labor supply coming in. You mentioned wages, so I guess I would characterize that as sort of a mixed picture. It's true with average hourly earnings you see, so I would call it a flattening out at a level that's well above the level that would be consistent over time with 2% inflation, assuming a reasonable productivity. With the ECI reading this week, again, a mixed picture. The headline number was a disappointment. Let's just say it was high. It didn't show a decline. There's some raise of light inside that if you look at private sector workers, that did come down. The compensation did come down. But overall though, the broader picture is of an overheated labor market where demand substantially exceeds supply. Job creation still exceeds the level that would hold the market where it is. That's a picture. Do we see, we keep looking for signs that the beginning.",0.0,0.0
