original_time,start_time,end_time,speech,price_change,volatility
2022-09-21 18:30:00,2022-09-21 18:30:00,2022-09-21 18:31:00," Good afternoon. My colleagues and I are strongly committed to bringing inflation back down to our 2% goal. We have both the tools we need and the resolve that it will take to restore price stability on behalf of American families and businesses. This stability is the responsibility of the Federal Reserve and serves as the bedrock of our economy. Without price stability, the economy does not work for anyone. In particular, without price stability, we will not achieve a sustained period of strong labor market conditions that benefit all. Today, the FOMC raised its policy interest rate by 3-quarters of a percentage point, and we anticipate that ongoing increases will be appropriate. We are moving our policy stance purposefully to...",0.0,0.011475538982694794
2022-09-21 18:30:00,2022-09-21 18:31:00,2022-09-21 18:32:00," level that will be sufficiently restrictive to return inflation to 2%. In addition, we are continuing the process of significantly reducing the size of our balance sheet. I will have more to say about today's monetary policy actions after briefly reviewing economic developments. The U.S. economy has slowed from the historically high growth rates of 2021, which reflected the reopening of the economy following the pandemic recession. Recent indicators point to modest growth of spending and production. Growth in consumer spending has slowed from last year's rapid pace in part reflecting lower real disposable income and tighter financial conditions. Activity in the housing sector has weakened significantly in large part reflecting higher mortgage rates. Higher interest rates and slower output growth also appear to be weighing on business-fixed investment. While weaker economic growth abroad is restraining exports.",0.0,0.0
2022-09-21 18:30:00,2022-09-21 18:32:00,2022-09-21 18:33:00," As shown in our summary of economic projections, since June, FOMC participants have marked down their projections for economic activity, with the median projection for real GDP growth standing at just 0.2 percent this year and 1.2 percent next year, well below the median estimate of the longer run normal growth rate. Despite the slowdown in growth, the labor market has remained extremely tight with the unemployment rate near a 50-year low, job vacancies near historical highs and wage growth elevated. Job gains have been robust, with employment rising by an average of 378,000 jobs per month over the last three months. The labor market continues to be out of balance, with demand for workers substantially exceeding the supply of available workers. The labor force participation rate showed a welcome uptick in August, but has little changed since the beginning of the year. FOMC.",-0.0087786374280108,0.0
2022-09-21 18:30:00,2022-09-21 18:33:00,2022-09-21 18:34:00," participants expect supply and demand conditions in the labor market to come into better balance over time, easing the upward pressure on wages and prices. The median projection in the SEP for the unemployment rate rises to 4.4 percent at the end of next year, a half percentage point higher than in the June projections. Over the next three years, the median unemployment rate runs above the median estimate of its longer-run normal level. median remains well above our 2 percent longer-run goal. Over the 12 months ending in July, total PCE prices rose 6.3 percent, excluding the volatile food and energy categories core PCE prices rose 4.6 percent. In August, the 12 month change in consumer price index was 8.3 percent, and the change in the Core CPI was 6.3 percent. These pressures remain evident across a broad range of goods and services. Although gasoline prices have turned...",0.0,0.0
2022-09-21 18:30:00,2022-09-21 18:34:00,2022-09-21 18:35:00," down in recent months. They remain well above year earlier levels. In part, reflecting Russia's war against Ukraine, which has boosted prices for energy and food and has created additional upward pressure on inflation. The median projection in the SCP for total PCE inflation is 5.4% this year and falls to 2.8% next year, 2.3% in 2024, and 2% in 2025. Participants continue to see risks to inflation as weighted to the upside. Despite elevated inflation, longer term deflation expectations appear to remain well anchored, as reflected in a broad range of surveys of households, businesses, and forecasters, as well as measures from financial markets. But that is not grounds for complacency. The longer the current amount of high inflation continues, the greater the chance that expectations of higher inflation will become entrenched.",0.0,0.0
2022-09-21 18:30:00,2022-09-21 18:35:00,2022-09-21 18:36:00," The Fed's monetary policy actions are guided by our mandate to promote maximum employment and stable prices for the American people. My colleagues and I are acutely aware that high inflation imposes significant hardship as it erodes purchasing power, especially for those least able to meet the higher costs of essentials like food, housing, and transportation. We are highly attentive to the risks that high inflation poses to both sides of our mandate, and we are strongly committed to returning inflation to our 2% objective. At today's meeting, the committee raised the target range for the federal funds rate by 3.25% of a percentage point, bringing the target range to 3.25%. And we are continuing the process of significantly reducing the size of our balance sheet, which plays an important role in firming the stance of monetary policy. Overcoming months, we will be looking for compelling evidence that inflation is moving down, consistent with inflation returning to 2%.",0.0,0.005581201262290343
2022-09-21 18:30:00,2022-09-21 18:36:00,2022-09-21 18:37:00," We anticipate that ongoing increases in the target range for the federal funds rate will be appropriate. The pace of those increases will continue to depend on the incoming data and the evolving outlook for the economy. With today's action, we have raised interest rates by three percentage points this year. At some point, as the stance of monetary policy tightens further, it will become appropriate to slow the pace of increases while we assess how our cumulative policy adjustments are affecting the economy and inflation. We will continue to make our decisions meeting by meeting and communicate our thinking as clearly as possible. Restoring price stability will likely require maintaining a restrictive policy stance for some time. The historical record cautions strongly against prematurely loosening policy. As shown in the SEP, the median projection for the appropriate level of the federal funds rate is 4.4% at the end of this year. 1 percentage point higher than...",0.0,0.0
2022-09-21 18:30:00,2022-09-21 18:37:00,2022-09-21 18:38:00," projected in June. The median projection rises to 4.6% at the end of next year and declines to 2.9% by the end of 2025, still above the median estimate of its longer-run value. Of course, these projections do not represent a committee decision or plan, and no one knows with any certainty where the economy will be a year or more from now. We are taking forceful and rapid steps to moderate demand so that it comes into better alignment with supply. Our overarching focus is using our tools to bring inflation back down to our 2% goal and to keep longer term inflation expectations well anchored. Reducing inflation is likely to require a sustained period of below-trend growth, and there will very likely be some softening of labor market conditions. Restoring price stability is essential to set the stage for achieving maximum employment and stable prices over the longer run. We will keep at it until we're confident.",0.0108511389131174,0.0
2022-09-21 18:30:00,2022-09-21 18:38:00,2022-09-21 18:39:00," the job is done. To conclude, we understand that our actions affect communities, families, and businesses across the country. Everything we do is in service to our public mission. We at the Fed will do everything we can to achieve our maximum employment and price stability goals. Thank you and I look forward to your questions. Hi, Chair Powell. Thank you for taking our questions. Gina Smiley from the New York Times. I wonder if you could do that. I'm going to do that. I'm going to do that. I'm going to do that. I'm going to do that. I'm going to do that. I'm going to do that. I wonder if you could give us a little detail around how you'll know when to slow down these rate increases and how you'll eventually know when to stop. So I will answer your question directly, but I want to start here today by saying that my main message has not changed at all since Jackson Hole. The FOMC is strongly resolved to bring inflation down to 2%, and we will keep at it until the job is done. So the way we're thinking about this.",0.0,0.0
2022-09-21 18:30:00,2022-09-21 18:39:00,2022-09-21 18:40:00," is the overarching focus of the committee is getting inflation back down to 2% to accomplish that. We think we'll need to do two things in particular to achieve a period of growth below trend and also some softening in labor market conditions to foster a better balance between demand and supply in the labor market. So on the first committee's forecasts and those of most outside forecasters do show growth running below its longer-run potential this year and next year. On the second though, so far there's only modest evidence that the labor market is cooling off. Job openings are down a bit. As you know, quits are off their all-time highs. There's some signs that some wage measures may be flattening out but not moving up. Payroll gains have moderated but not much. And in light of the high inflation we're seeing, we think we'll need to, and in light of what I just said, we think that we'll need to bring our funds rate to a restrictive level.",0.0,0.0
2022-09-21 18:30:00,2022-09-21 18:40:00,2022-09-21 18:41:00," to keep it there for some time. So what will we be looking at, I guess, is your question. So we'll be looking at a few things. First, we'll want to see growth continuing to run below trend. We'll want to see movements in the labor market showing a return to a better balance between supply and demand. And ultimately, we'll want to see clear evidence that inflation is moving back down to 2%. So that's what we'll be looking for. In terms of reducing rates, I think we'd want to be very confident that inflation is moving back down to 2% before we would consider that. See. Thank you, Mr. Chairman, Steve Leesman, CNBC. Can you talk about how you factor in the variable lags on inflation and the extent to which the outlook for rate should be seen as linear in the sense that you keep raising rates?",0.0,0.01238204473176581
2022-09-21 18:30:00,2022-09-21 18:41:00,2022-09-21 18:42:00," Or can you envision a time when there's a pause to kind of look at what has been brought in the economy from the rate increases? Thank you. Sure. So of course, monetary policy does famously work with long and variable lags. The way I think of it is our policy decisions affect financial conditions immediately. In fact, financial conditions have usually been affected well before we actually announce our decisions. Then changes in financial conditions begin to affect economic activity fairly quickly within a few months. But it's likely to take some time to see the full effects of changing financial conditions on inflation. So we are very much mindful for that. And that's why I noted in my opening remarks that at some point as the stance of policy tightens further, it will become appropriate to slow the pace of rate hikes while we assess how our cumulative policy adjustments are affecting the economy and inflation. So that's how we think about that.",0.0,0.0
2022-09-21 18:30:00,2022-09-21 18:42:00,2022-09-21 18:43:00," Your second question, sorry, was. Is there a point in time that you could see pausing? Is it linear that you keep raising rates or is there, oh, sorry. I should know better than to not talk with my microphone. I should know better than to answer your second question. Oh, there you go. Is it linear? Do you keep raising rates or is there a pause that you could envision where you kind of figure out what has happened to the economy and give time to catch up in the real economy, the rate increase or is there a time to catch up in the real economy? Thank you. So I think it's very hard to say with precise certainty the way this is going to unfold. As I mentioned, what we think we need to do and should do is to move our policy rate to a restrictive level that's restrictive enough to bring inflation down to 2% where we have confidence of that. And what you see in the SCP numbers is people's views as of today, as of this meeting, as to the kind of levels that will be appropriate. Now those will evolve over time.",-0.013663463807383699,0.0
2022-09-21 18:30:00,2022-09-21 18:43:00,2022-09-21 18:44:00," And I think we'll just have to see how that goes. There is a possibility, certainly, that we would go to a certain level that we're confident in and stay there for a time. But we're not at that level. Clearly today we're just move, I think, probably into the very lowest level of what might be restrictive. And certainly, in my view, in the view of the committee, there's a ways to go. All right, Chair Powell, Rachel Seagull from Washington Post, thank you for taking our questions. The projections show the unemployment rate rising to 4.4% next year. And historically, that kind of rise in the unemployment rate would typically bring a recession with it. Should we interpret that to mean no soft landing? And is that kind of rise necessary to get inflation down? Right, so you're right. And in the SEP, there's what I would characterize it.",0.0,0.0
2022-09-21 18:30:00,2022-09-21 18:44:00,2022-09-21 18:45:00," as a relatively modest increase in the unemployment rate from a historical perspective, given the expected decline in inflation. Now, why is that? So really, that is what we generally expect because we see the current situation as outside of historical experience in a number of ways. And I'll mention a couple of those. First, and you know these, but first job openings are incredibly high relative to the number of people looking for work. It's plausible, I'll say, that job openings could come down significantly, and they need to, without as much of an increase in unemployment as has happened in earlier historical episodes. So that's one thing. In addition, in this cycle, longer-run inflation expectations have generally been fairly well anchored. And as I've said, there's no basis for complacency there. But to the extent that continues to be the case, that should make it easier to restore price stability. And I guess the third thing I would point to that's different this time.",0.0,0.0
2022-09-21 18:30:00,2022-09-21 18:45:00,2022-09-21 18:46:00," is that part of this inflation is caused by this series of supply shocks that we've had beginning with the pandemic and really with the reopening of the economy and more recently amplified and added to by Russia's invasion of Ukraine have all contributed to the sharp increase in inflation. So these are the kinds of events that are not really seen in prior business cycles. And in principle, if those things start to get better, and we do see some evidence of the beginnings of that, it's not much more than that, but it's good to see that. For example, commodity prices look like they may have peaked for now, supply chain disruptions are beginning to resolve. Those developments, if sustained, could help ease the pressures on inflation. So let me just say, how much these factors will turn out to really matter in this sequence of events, it remains to be seen. We have always understood that restoring price stability while achieving a relatively modest decline, a rather increase in unemployment and a soft landing.",0.0,0.01219385367375591
2022-09-21 18:30:00,2022-09-21 18:46:00,2022-09-21 18:47:00," would be very challenging. And we don't know. No one knows whether this process will lead to a recession or if so, how significant that recession would be. That's going to depend on how quickly wage and price inflation pressures come down, whether expectations remain anchored and whether, you know, also do we get more labor supply, which would help as well. In addition, the chances of a soft landing are likely to diminish to the extent that policy needs to be more restrictive or restrictive for longer. Nonetheless, we're committed to getting inflation back down to 2%, because we think that a failure to restore price stability would mean far greater pain later on. Just to follow as one's long thing, are vacancies still at the top of your list in terms of understanding the labor market and how much room there is there? Yes. Vacancies are still almost two to one ratio to unemployed people. That's that and quits are really very good ways to look at how tight the labor market is and how different.",0.0,0.0
2022-09-21 18:30:00,2022-09-21 18:47:00,2022-09-21 18:48:00," that is from other cycles, where generally the unemployment rate itself is a single best indicator. We think those things have for quite a time now, really added value in terms of understanding what the labor market is. Nick. Nick Temeros of the Wall Street Journal, you said not too long ago in describing the policy destination, there's still a way to go. But I imagine you have to have some idea about how you're thinking about your destination, whether it's a stopping point or a pausing point. And so I was wondering if you could discuss how you are thinking about as the data come in, where that destination is, how it's moving up if inflation doesn't perform as you expect. Do you want to have a policy rate, it's above the underlying inflation rate, for example? And do you have an estimate for where you think the underlying inflation rate might be?",0.0071910442293621,0.0
2022-09-21 18:30:00,2022-09-21 18:48:00,2022-09-21 18:49:00," in the economy right now? Well, so again, we believe that we need to raise our policy stance overall to a level that is restrictive. And by that, I mean, is meaningfully putting meaningful downward pressure on inflation. That's what we need to see in the stance of policy. We also know that there are long and variable legs, particularly, as they relate to inflation. And so it's a challenging assessment. So what do you look at? You look at broader financial conditions. As you know, you look at where rates are real and nominal. In some cases, you look at credit spreads, you look at financial conditions indexes. We also, I would think, and you see this in the, is this something we talked about today in the meeting and talk about in all of our meetings? And you see this, I think, in the committee forecast. You want to be at a place where real rates are positive across the entire yield curve. And I think that would be the case if you look at the numbers.",0.0,0.0
2022-09-21 18:30:00,2022-09-21 18:49:00,2022-09-21 18:50:00," that we're writing down and think about, measure those against some sort of forward looking assessment of inflation expectations. I think you would see at that time, you'd see positive real rates across the yield curve, and that is also an important consideration. Power. Hi, Howard Schneider with Rotors. Thanks for the opportunity. I just want to be clear on this steps. You say it's meeting by meeting, but it sure looks like we're going 75, 50, 25. Is 75 next month the baseline? So we make one decision for meeting, and the meeting decision we made today was to raise the federal funds rate by 75. You're right that a, you know, a, the median for, for the year ends.",0.0,0.0
2022-09-21 18:30:00,2022-09-21 18:50:00,2022-09-21 18:51:00," that suggests another 125 basis points in rate increases. But there's also, there's another fairly large group that saw 100 basis points addition to where we are today. So that would be 25 basis points less. So we're going to make that decision at the meeting. We didn't make that decision today. We didn't vote on that. I would say that we're committed to getting to a restrictive level for the federal funds rate and getting there pretty quickly. And that's what we're thinking about. So just as a follow up to that, I'm wondering about this sort of risk management considerations you're given. There's some discussion now of overdoing it. What's the incentive to continue front loading right now? Is it lack of progress on inflation seen in the CPI reports? Or is it a motivation to get as much done while the job market is still as strong as it is? So what we've seen is inflation has. Our expectation has been that we would begin to see inflation.",0.0,0.007035488979464627
2022-09-21 18:30:00,2022-09-21 18:51:00,2022-09-21 18:52:00," come down largely because of supply side healing. By now we would have thought that we've who have seen some of that. We haven't. We have seen some supply side healing but inflation has not really come down. If you look at core PCE inflation, which is a good measure of where inflation is running now, if you look at it on a 3, 6, and 12 month trailing annualized basis, you'll see that that inflation is at 4.8%, 4.5%, and 4.8%. So that's a pretty good summary of where we are with inflation. And that's not where we expected or wanted to be. So what that tells us is that we need to continue and we can keep doing these and we did today do another large increase as we approach the level that we think we need to get to. And we're still discovering what that level is but people are writing that down in their SEP where they think policy needs to be. So that's how we're thinking about it. Let's go to copy.",0.0,0.0
2022-09-21 18:30:00,2022-09-21 18:52:00,2022-09-21 18:53:00," Thank you. Thank you. COVID-19 is a financial time. Chair Powell, how should we interpret the fact that cornflation is still not forecast in the SEP to be back to target in 2025 and yet the dot plot projects cuts as early as 2024? And does that mean there's a level of inflation above the 2% target that the Fed is willing to tolerate? So I guess corn is at 2.1 in 2025 and the median and headline is at 2.0 so that's pretty close. I mean we write down our forecasts and we figure out what the median is and we publish it. So I would say that if actually if the economy followed this path this would be a pretty good outcome but you're right it is a 10 higher than 2%. Okay just as a quick follow up I mean if the concern is that underlying inflation is becoming more entrenched perhaps each.",-0.003750419508138,0.0
2022-09-21 18:30:00,2022-09-21 18:53:00,2022-09-21 18:54:00," month, then why forgo the more aggressive 100 basis point increased today, and does that risk having to do more later on? Yeah, so as we said, at the last press conference, and in between that one and this one, we said that we would make our decision based on the overall data coming in. So if you remember, we got a surprisingly low reading in July and that is surprisingly high reading for August. So I think you can't really never want to overreact too much to any one data point. So if you look at them together, and as I just mentioned, if you really, really look at this year's inflation, 36 and 12 month railing, you see inflation is running too high. It's running 4.5% or above. You don't need to know much more than that. If that's the one thing you know, you know that this committee is committed to getting to a meaningfully restrictive stance of policy and staying there until we feel confident that inflation is coming down. That's how we think about it.",0.0,0.0
2022-09-21 18:30:00,2022-09-21 18:54:00,2022-09-21 18:55:00," Victoria. Hi, Victoria Guido with Politico. I wanted to ask about the balance sheet. You all have left open the possibility that you might sell mortgage-backed securities, but we've seen significant slowing in the housing market. Mortgage rates have gone up significantly, and I'm just wondering whether conditions there might affect your plans for how quickly you have the runoff on the MBS side. So what we said, as you know, was that we would consider that once balance sheet runoff is well underway, I would say it's not something we're considering right now and not something I expect to be considering in the near term. It's just something I think we will turn to, but the time for turning to it has not come and is not close. Well, and what conditions in the housing market affect that decision? I think a number of things might affect that decision. The main thing is we're not considering that decision, and I don't expect that we will anytime soon.",0.0,0.0
2022-09-21 18:30:00,2022-09-21 18:55:00,2022-09-21 18:56:00," Thank you. Neil. Thanks. Neil, Erwin, and Thaxios. A number of commentators have come to the view, including over the World Bank, that simultaneous global tightening around the world is, creates a risk of a global recession that's worse than is necessary to bring inflation down. How do you see that risk? How do you think of coordination with your fellow central bankers? And is there much risk of overdoing it on a global level? So we, actually, my colleagues and I, a number of my FOMC colleagues and I just got back from one of our frequent trips to Basel, Switzerland, to meet with other senior central bank officials from around the world. We are in pretty regular contact and we exchange, of course, we all serve a domestic mandate, domestic objectives, in our case, the dual mandate, maximum employment and price stability. But we regularly discuss what we're seeing in terms of our own economy and international spillovers and it's a very ongoing constant kind of a process.",0.0,0.004296177437304343
