original_time,start_time,end_time,speech,price_change,volatility
2022-06-15 18:30:00,2022-06-15 19:21:00,2022-06-15 19:22:00," So, we have now experienced an extraordinary series of shocks if you think about it. The pandemic, the response, the reopening, inflation, followed by the war in Ukraine, followed by a shutdowns in China. You were in Ukraine potentially having effects for years here. So we're aware that a different set of forces are driving the economy. We have been obviously for quite a while. This is a different, these forces are different. Influations behaving differently. In our thinking, it really is a question of very strong demand, but you couldn't get this kind of inflation without a change on the supply side, which is there for anybody to see, which is these blockages and shortages and people dropping out of the labor force and things like that. That's how we're looking at it. We've done a lot of work internally on thinking about what all that means.",0.0,0.0
2022-06-15 18:30:00,2022-06-15 19:22:00,2022-06-15 19:23:00," the thing is you don't know whether those forces are, to what extent are they going to be sustained. In other words, will we go back to a world where it looks a little more like the old world, or are we really going to be in a world where major supply shocks go on and on? The history is you see these ways of supply shocks, as you did in the 70s, and then they go away. And there's a new normal and things settle down. But honestly, we don't know what that's going to be. In the meantime, we have to find Christability in this new world, and maximum employment, in this new world where clearly inflationary forces are, you're seeing them everywhere again. If you look around the world at where inflation levels are, it's absolutely extraordinary. It's not just here. In fact, we're sort of in the middle of the pack, although I think we have, of course, a different kind of inflation than other people have. And partly because our economy is stronger and more highly recovered. So that's what we're doing. We've done a lot of it.",-0.0030160781657937994,0.0
2022-06-15 18:30:00,2022-06-15 19:23:00,2022-06-15 19:24:00," and introspection and work on that. And sorry, on QT, we've communicated really clearly to the markets about what we're gonna do there. Market seems to be okay with it. We're phasing in. Treasury issuances down quite a lot, quite a lot from where it's been. So I have no reason to think, markets are forward looking and they've seen this coming. I have no reason to think it will lead to illiquidity and problems. It seems to be kind of understood and accepted at this point. Thanks for the last question. We'll get a market. Okay, right there. Mr. Chairman, Mark Hamrick with Bank Rate. Wonder what your assessment is about the outlook for the housing market given the years long increase in home prices and now the sharp rise in mortgage rates. And all that, of course, given the heightened sensitivity around the housing market given the fact that it was a trigger for the great financial crisis over a decade.",0.0,0.0
2022-06-15 18:30:00,2022-06-15 19:24:00,2022-06-15 19:25:00," go. Thank you. Sure. So rates were very low. A good place to start is that rates were very, very low for quite a while because of the pandemic and the need to do everything we could to support the economy went unemployment was 14% and the truth of unemployment rate was well higher than that. So that was rates are low and now they're coming back up to more normal or above levels. So in the meantime, while rates were low and while demand was really high, obviously demand for housing changed from wanting to live in urban areas to some extent to living in single-family homes in the suburbs famously and so the demand was just suddenly much higher. And so we saw prices moving up very, very strongly for the last couple of years. So that change is now and rates have moved up. We're well aware that rates, mortgage rates have moved up a lot and you're seeing a change.",0.0,0.0
2022-06-15 18:30:00,2022-06-15 19:25:00,2022-06-15 19:26:00," housing market, we're watching it to see what will happen. How much will it really affect residential investment? Not really sure. How much will it affect housing prices? Not really sure. Obviously, we're watching that quite carefully. You would think over time, so there's a tremendous amount of supply in the housing market of unfinished homes. And as those come online, whereas the supply of finished homes, the inventory of finished homes that are for sale, is incredibly low, historically low. So it's still a very tight market. So prices may keep going up for a while, even, in a world where rates are up. So it's a complicated situation. We watch it very carefully. I would say if you're a home buyer, somebody or a young person looking to buy a home, you need a bit of a reset. We need to get back to a place where supply and demand are back together, and where inflation is down low again.",0.0,0.0042022324359816746
2022-06-15 18:30:00,2022-06-15 19:26:00,2022-06-15 19:26:23," and mortgages or mortgage rates are low again. So this will be a process whereby we ideally, we do our work in a way that we're the housing market settles in a new place and housing availability and credit availability are at appropriate levels. So thank you very much.",0.0,0.0
