original_time,start_time,end_time,speech,price_change,volatility
2022-06-15 18:30:00,2022-06-15 18:55:00,2022-06-15 18:56:00," But right now, our policy rate is well below neutral. So soon enough, we'll have our policy rate. Let's assume the world works out about it like the SEP says, the policy rate will be up where we think it should be. And then the question would be, do you slow down? Does it make you, you know, you'll be making these judgments about, is it appropriate now to slow down from 50 to 25, let's say, or speed up? So that's the kind of thinking we'll be doing. And we'll be, again, we're looking ultimately, we're not going to declare victory until we see a series of these, you know, really see convincing evidence, compelling evidence that inflation is coming down. And that's what I mean by, that's what it would take for us to say, okay, we think this job is done. Because we saw, and frankly, we saw last year, inflation came down over the course of the summer and then turn right around and went back up. So I think we're going to be careful about declaring victory.",0.0,0.005805322871381607
2022-06-15 18:30:00,2022-06-15 18:56:00,2022-06-15 18:57:00," But again, the implementation of our policy is going to be flexible and sensitive to incoming data. Are you more concerned now that to bring down inflation, it's going to require more than just some pain at this point? So, again, I think that I do think that they're objective, and this is what's reflected in the SEP. But our objective really is to bring inflation down to 2% while the labor market remains strong. I think that what's becoming more clear is that many factors that we don't control are going to play a very significant role in deciding whether that's possible or not. And there I'm thinking, of course, of commodity prices, the war in Ukraine, supply chain, things like that where we really can't, the monetary policy stance doesn't affect.",0.0,0.0
2022-06-15 18:30:00,2022-06-15 18:57:00,2022-06-15 18:58:00," those things. So, but having said that, there is a, you know, there's a path, there's a path for us to get there. It's not getting easier. It's getting more challenging because of these external forces. And that path is to move demand down and you have a lot of surplus demand in, take, for example, in the labor market. So, you have two vague job vacancies essentially for every person's seek actively seeking a job. And that has led to a real imbalance in wage negotiating. You could get to a place where, where that ratio was, was a more, at a more normal level. And you wouldn't expect to see those wage pressures move back down to level. Well, people are still getting healthy wage increases, real wage increases, but at a level that's consistent with 2% inflation. So, that's, that's a possibility. And you could say the same thing about some of the product markets where there's just excess capacity.",0.0039371123326247,0.0
2022-06-15 18:30:00,2022-06-15 18:58:00,2022-06-15 18:59:00," And where the strong demand has gone into, sorry, where there's capacity constrained. So you effectively will think of as a vertical supply curve or close to it. So demand comes in, and it's very strong. And it shows up in higher prices, not higher quantities, not more cars, because they can't make the cars, because they don't have the semiconductors. So in principle, that could work in reverse. When demand comes down, you could see, and it's not guaranteed, but you could see prices coming down more than the typical economic relationships that you see in the textbooks would suggest, because of the unusual situation we're in on the supply side. So there's a pathway there. It is not going to be easy. And again, it's our objective. But as I mentioned, it's going to depend to some extent on factors we don't control. Rachel. Hi, Chair Powell. Thank you for taking our questions. Rachel Siegel from The Washington Post.",0.0,0.0
2022-06-15 18:30:00,2022-06-15 18:59:00,2022-06-15 19:00:00, So the new projection show the unemployment rate ticking up through 2024 is a higher unemployment rate Necessary in order to combat inflation and what is lost if the unemployment rate has to go up and people lose their jobs in order to control inflation Thank you So You're right in the in the SCP we have unemployment going up to four point the meeting is is 4.1% There of course a range of of of actual forecast and I would characterize that if you if you were to get inflation down to You know on its way down to 2% and the unemployment went up to rate went up to 4.1 percent that's still a you know historically low level You know we hadn't seen we hadn't seen rates unemployment rates below 4% Until a couple years ago for we'd seen it for like one year in the last 50 So the idea that you know three three point six percent is historically low,0.0,0.0
2022-06-15 18:30:00,2022-06-15 19:00:00,2022-06-15 19:01:00," in the last century. So a 4.1% unemployment rate with inflation and well on its way to 2%. I think that would be a successful outcome. So we're not looking to have a higher unemployment rate, but I would certainly look at that as a successful outcome. I think people lose on their jobs or anything. You know, we're not, again, we don't seek to put people out of work. Of course, we never think too many people are working and fewer people need to have jobs. But we also think that you really cannot have the kind of labor market we want without price stability. And we have to go back and establish price stability so we can have that kind of labor market. And that's a labor market where workers are getting wage increases, maybe the workers at the lower end of the spectrum are getting the biggest wage increases as they were before the pandemic. Where participation is high.",0.0,0.005608465608465621
2022-06-15 18:30:00,2022-06-15 19:01:00,2022-06-15 19:02:00," where there's lots of job opportunities, where it's just a really, I mean, the labor market we had before the pandemic was, that's what we want to get back to. And you see disparities between various groups at historic lows. We'd love to get back to that place. But to get there, it's not going to happen with, you know, with the levels of inflation we have. So we have to restore that. And it really isn't service in the medium and longer term of the kind of labor market we want. And hope to achieve. Hi, Chair Powell, Matthew Bosa with Bloomberg. So as you just mentioned, the committee is now projecting a half percentage point rise in the unemployment rate and the SEPs over the next couple years. And it removed a line from its policy statement about thinking that the labor market can remain strong while it tightens policy. You just mentioned that that is still your objective, though. So I'm wondering if you could explain why that line was removed from this.",0.0,0.0
2022-06-15 18:30:00,2022-06-15 19:02:00,2022-06-15 19:03:00," statement also whether this means that FOMC is trying to induce a recession now to bring inflation down. You're not trying to reduce the recession now. Let's be clear about that. We're trying to achieve 2% inflation consistent with a strong labor market. That's what we're trying to do. So let me talk about that sentence. Clearly it's our goal to bring about 2% inflation while keeping the labor market strong, right? And that's kind of what the SEP says. The SEP has inflation getting down to a little above 2% in 2024 with unemployment at 4.1%. So this is a strong labor market. This is a good labor market. And as I mentioned, there are pathways to do it. But those pathways have become much more challenging due to factors that are not under our control. Again, thinking here of the fallout from the war in Ukraine, which has brought a spike in prices of energy, food, fertilizer, industrial chemicals, and also just the supply chains more broadly, which have been larger or longer lasting than anticipated. So the SEP.",-0.0005854357161807001,0.0
2022-06-15 18:30:00,2022-06-15 19:03:00,2022-06-15 19:04:00," Sentence that we deleted said that we believe that appropriate monetary policy effectively alone can bring about the result of 2% inflation with a strong labor market. And so much of it is really not down to monetary policy. It just didn't, the sentences, it kind of says on its face that monetary policy alone can do this. And that's not, that just didn't seem appropriate so we took the sentence out. And given the new projections for the unemployment rate, could you talk a little bit about what accounts for such reduced confidence, again, say a month ago or three months ago that inflation will largely normalize on its own as these supply side issues get worked out? Thanks. Well, yeah, I think you've seen, again, we've been expecting progress. And we didn't get that. We got sort of the opposite. So I also think the situation really since the consequences of the Ukraine war become more and more clear what you're",0.0,0.0
2022-06-15 18:30:00,2022-06-15 19:04:00,2022-06-15 19:05:00," seeing is the situation getting more difficult. And you look around the world. I mean, lots of countries are looking at inflation of 10%. And it's largely due to commodities prices. But all over the world, you're seeing these effects. And we're seeing them here. Gas prices, all-time highs and things like that. That's not something we can do something about. So that is really, and by the way, headline inflation, headline inflation is important for expectations. People, the public's expectations, why would they be distinguishing between core inflation and headline inflation? Core inflation is something we think about because it is a better predictor of future inflation. But headline inflation is what people experience. They don't know what core is. Why would they have no reason to? So that's expectations are very much at risk due to high headline inflation. So it's become, the environment has become more difficult, clearly in the last four or five months.",0.0,0.0
2022-06-15 18:30:00,2022-06-15 19:05:00,2022-06-15 19:06:00," and hence the need for the policy actions that we took today. Hence our resolution to get rates up and ultimately get them to where we think they need to be in coming months. Thanks, Sherpile. Edward Lawrence with Fox Business. I want to ask you, you talked about CPI going to 8.6%. The retail sales surprised the market by falling and then revisions to the previous months were down. Are you hearing from contacts about consumers slowing spending or changing their habits? We're of course watching very, very carefully for that. Looking at the retail sales, the big store numbers and all that kind of thing. I think the fair summary of what we see is you see continuing shifts in consumption. You see some things getting sales going down. But overall spending is very strong. The consumers in really good shape financially, they're spending. There's no sign.",0.0,0.004043340380549761
2022-06-15 18:30:00,2022-06-15 19:06:00,2022-06-15 19:07:00," of a broader slowdown that I can see in the economy. People are talking about it a lot, consumer confidence is very low. That's probably related to gas prices. And also just stock prices, to some extent for other people. But that's what we're saying. We're not seeing a broad slowdown. We see job growth slowing, but it's still at quite robust levels. We see the economy slowing a bit, but still growth levels at healthy growth levels. So then as you are raising rates in this economy, how closely are you watching consumer spending, or is there something another indicator that you're watching more closely? It would be hard to much anything much more closely than we watch consumer spending, but we watch everything. We watch business fixed investment, which actually has softened a bit. And we watch, we're responsible for watching everything, but consumption is 60-some percent of the economy, so naturally we spend a lot of...",0.0,0.0
2022-06-15 18:30:00,2022-06-15 19:07:00,2022-06-15 19:08:00," time on that. And again, there's a lot going on. There are a lot of flows back and forth, but ultimately, it does appear that the U.S. economy is in a strong position and well position to deal with higher interest rates. Thank you, Mr. Chairman, Michael and Keith from Bloomberg Radio and Television. Are you targeting headline inflation now or core inflation? In other words, how far would you chase oil prices if they keep going up? If that's going to be the component that drives expectations, would you risk recession for a headline rate if the core rate is holding steady or starting to go down? So we're responsible for inflation in the law and inflation means headline inflation. So that's our ultimate goal. We, of course, like all central banks do, look very, very carefully at core inflation because it is...",-0.0040849876776616,0.0
2022-06-15 18:30:00,2022-06-15 19:08:00,2022-06-15 19:09:00," much better predictor and it's much better predictor where inflation is going and it's also more relevant to our tools. As I mentioned, the parts that don't go into core are mostly outside the scope of our tool. So we look at that. But the current situation is particularly difficult because of what I mentioned about expectations. We can't affect really, I mean, the energy prices are set by global commodity prices. And most of food, not all of it, but most food prices are pretty heavily influenced by global commodity prices too, also other things. So we can't really have much of an effect, but we have to be mindful of the potential effect on inflation expectations from headlines. So it's a very difficult situation to be in. And again, we can't do much about the difference between the elements that make up headline that are not in core. Could I just, as a follow-up, get a clarification on the SEP when the members gave...",0.0,0.0
2022-06-15 18:30:00,2022-06-15 19:09:00,2022-06-15 19:10:00," they're forecasts when they inserted into the record where they revised after the CPI or Michigan numbers came out. In other words, does the SEP as we have it now reflect the same factors that led you to go to a 75 basis point move? The SEP is of one piece. It reflects all of the economic readings. It also reflects the 75 basis point increase. This is important. So people had that in hand when their SEPs were submitted. So it's not in addition to what's in the SEP. Everyone's SEP reflects their thinking about this rate increase and what's going forward. Victoria. Hi. Victoria Guita from Politico. I wanted to ask about how you're measuring progress, especially since you've now started front loading rate hikes.",0.0,0.0
2022-06-15 18:30:00,2022-06-15 19:10:00,2022-06-15 19:11:00," more. You've talked about how you want to see inflation coming down over a series of reports. And I guess I'm curious whether you think inflation data itself is a really good indicator or whether you might be concerned that it's a lagging indicator or that it might send confusing signals given that as you've talked about, there are sort of supply and demand aspects. And I guess my question is, do you think that inflation will tell you, inflation data will tell you when you've gone to where you need to go or do you just feel like maybe it's better to overshoot than to undershoot? So I think the role that we can play, maybe the way to get us to say that the role that we can play is around demand, right? So, and we'll be able to see the areas that we can affect are those that are associated with excess demand. And we'll be able to see our effect on, for example, job openings in real time. So, in that...",0.0,0.006589916633584629
2022-06-15 18:30:00,2022-06-15 19:11:00,2022-06-15 19:12:00," that would tell us what's, that would tell us about wages. Wages are not principally responsible for the inflation that we're seeing, but going forward, they would be very important, particularly in the service sector. So, sorry, I'm not sure I'm getting to your question. My question is, is inflation data itself the best indicator for when you're getting to where you need to go or might it lead you to go too far? There's always a risk of going too far or going that far enough. And it's going to be a very difficult judgment to make or maybe not, maybe it'll be really clear. But we're, and we're quite mindful of the, of the dangers. I mean, but I will say the, the worst mistake we could make would be to fail, which it's not an option. You know, we have to restore price stability. We really do. Because everything, it's the bedrock of the economy. If you don't have price stability, the economy is really not going to work the way it's supposed to. It won't work for people, their wages will be being eaten up. So we want to get the job done.",0.0,0.0
2022-06-15 18:30:00,2022-06-15 19:12:00,2022-06-15 19:13:00," This inflation happened relatively recently. We don't think that it's affecting expectations in any kind of fundamental way. We don't think that we're seeing a wage price spiral. We think that the public generally sees us as very likely to be successful in getting inflation down to 2%. And that's critical. It's absolutely key to the whole thing that we sustain that confidence. So that's how we're thinking about it. Hi, Brian Chung with Yahoo Finance. I just want to expand on what you just said now about the general public feeling like you can get this done. When you talk about consumer sentiment being down, household inflation expectations being up, recession just broadly being dinner table talk, does the general feel among American households and also businesses square with your explanation of the economy given that the description of inflation and the statement didn't change between managers. The description of inflation, the statement didn't change between Matthew.",0.0033734384780723997,0.0
2022-06-15 18:30:00,2022-06-15 19:13:00,2022-06-15 19:14:00," Thanks. So, clearly, people don't like inflation a lot. And many people are experiencing it really for the first time, because we haven't had anything like this kind of inflation in 40 years. It's really something people don't like in their experiencing that, and that's showing up in their surveys and in all kinds of ways. We understand that, and we understand the hardship that people are experiencing from high inflation, and we're determined to do what we can to get inflation back down. So that's really what we're saying. I'm not clearly, it's an incredibly unpopular thing, and it's very painful for people. So, but I guess what I'm saying is the question, really critical question from the perspective of doing our job is making sure that the public does have confidence, that we have the tools and we'll use them and...",0.0,0.0
2022-06-15 18:30:00,2022-06-15 19:14:00,2022-06-15 19:15:00," They do work to bring inflation back down over time. It will take some time, we think, to get inflation back down. But we will do that. Chris. Thank you. Chris Regaber and Associated Press. You have talked about inflation a few times and mentioned oil prices, China lockdowns. But aside from rises in commodity prices, such as gas prices, we're also seeing stickier measures of inflation increasing, such as the Cleveland Feds median and trimmed means CPIs. I mean, how persistent do you see those underlying measures of inflation and where do you see those going in the near future? So as I mentioned, I think in my opening statement, inflation has started off in quite narrow, very directly pandemic-related areas, and it's spread now broadly across the economy and into the services sector as well. It was really an...",0.0,0.0
2022-06-15 18:30:00,2022-06-15 19:15:00,2022-06-15 19:16:00," good sector at the beginning. In particular, you're seeing in travel now, if you've flown on a plane lately. Plains are very full and plane tickets are very expensive. Some of that will be passed through of energy prices. But it's so you're experiencing services inflation. Shelter inflation is high. So it's a question. And you see the Cleveland measure going up. And many other measures are going up. So it's a time when we're not seeing progress. And we want to see progress. And that's really another part of why we did what we did today. And why the SEP looks like it does. Is that we see it as appropriate to get the policy rate up to restrictive levels, which would be in the thinking of the committee somewhere in the range of 3 to 3.5% by year end. And then after that, you see what the rest of the SEP says. So I hope that's responsive to your question. Nancy.",0.0,0.0035725627183233375
2022-06-15 18:30:00,2022-06-15 19:16:00,2022-06-15 19:17:00," high-tier pro-Nancy Marshall Gensers with Marketplace. Do you still think a soft-dish landing is possible? And how would you define that at this point, considering the revised projections for unemployment GDP inflation? So I think what's in the SEP would certainly qualify, we'll certainly need that test. If you see, you're looking at getting that back down to almost a 2% inflation by 2024, and the unemployment rate is still as low as 4.1%, that would call that as meeting that test. Do I still think that we can do that? I do. I think there's, I think there's, I don't want to be the handicap or here. That is our objective. I do think it's possible. Like I said, though, I think that events of the last few months have raised the degree of difficulty, created great challenges. And again, the answer to the question, can we still do it? There's a much bigger.",0.0,0.0
2022-06-15 18:30:00,2022-06-15 19:17:00,2022-06-15 19:18:00," chance now that it will depend on factors that we don't control, which is, you know, fluctuations and spikes in commodity prices could wind up taking that option out of our hands. So we just don't know. But we're focused on very, very focused on getting inflation back down to 2%, which we think is essential for the benefit of the public and also to put us on a path back to a sustainably strong labor market like the one we had before the pandemic. Thank you, Greg Robb from Market Watch. Chip, I was wondering if you could talk a little bit more, you know, economists are worried that you're kind of hitting the economy with a sledgehammer and that now there's even more risk of a recession than a 50-50 path of rates. So could you talk a little bit more about that and what evidence would get",0.0048462813965478,0.0
2022-06-15 18:30:00,2022-06-15 19:18:00,2022-06-15 19:19:00," you to stop rate Ix and maybe even reverse them? Sure. So as I mentioned, financial conditions have tightened over the last seven months. And that's a good thing, we think. But the federal funds rate, even after this increase, is at 1.6%. So it's hard to see how that is too high of a rate. And even if we did another, so we're going to get here by the end of the summer, somewhere in the twos, probably. Still, that's still a low rate. So that's not a rate that is calculated to bring a recession on. And by then, we'll have seen a whole lot more data. As I mentioned a couple times, the committee's views are around a modestly restrictive stance, which would be in the three and a half percent range by the end of this year. But that's conditioned on that being the appropriate thing to do. If we see data going in a different direction, it'll be reflective in our policy, as you see today.",0.0,0.0
2022-06-15 18:30:00,2022-06-15 19:19:00,2022-06-15 19:20:00," You know, we'll be watching if things go in a direction we don't expect, and we're going to adapt. And I would say this is a highly uncertain environment, extraordinarily uncertain environment. So again, we'll be determined and resolved, but flexible. Hey, Evan. Evan Reiser, Market News International. Thank you, Chair Powell. I was wondering if the Fed has initiated a review of the conduct of monetary policy over the last two years or so given the inflation. And will that be shared with the public? And then secondly, given the ill-equated and extraordinary volatility in financial markets, are you concerned that QT will make that worse? Sorry. What was your question on QT? Just given the ill-equated and extraordinary volatility in financial markets, whether QT will make things worse.",0.0,0.0
2022-06-15 18:30:00,2022-06-15 19:20:00,2022-06-15 19:21:00," Of course, we've been looking very carefully and hard at why inflation picked up so much more than expected last year and why it proved so persistent. It's hard to overstate the extent of interest we have in that question morning, noon, and night. But you have to understand the context. Really the context is this for decades before the pandemic and the reopening, you had a world where inflation was dominated by disinflationary forces such as declining population or aging demographics. Let's call it that globalization enabled by technology, other factors, low productivity. So that's how all the models work. Decades and decades of data. They look at that. It's a very flat Phillips curve work and the supply shocks tend to be transient.",0.0,0.006225864257113048
