original_time,start_time,end_time,speech,price_change,volatility
2022-06-15 18:30:00,2022-06-15 18:30:00,2022-06-15 18:31:00," Good afternoon. I will begin with one overarching message. We at the Fed understand the hardship that high inflation is causing. We're strongly committed to bringing inflation back down and we're moving expeditiously to do so. We have both the tools we need and the resolve that it will take to restore price stability on behalf of American families and businesses. The economy in the country have been through a lot over the past two and a half years and have proved resilient. It is essential that we bring inflation down if we are to have a sustained period of strong labor market conditions that benefit all. From the standpoint of our Congressional mandate to promote maximum employment and price stability, the current picture is plain to see. The labor market is extremely tight and inflation is much too high. Against this backdrop, today the federal",0.0,0.008868107062238019
2022-06-15 18:30:00,2022-06-15 18:31:00,2022-06-15 18:32:00," open market committee raised its policy interest rate by three-quarters of a percentage point, and anticipates that ongoing increases in that rate will be appropriate. In addition, we are continuing the process of significantly reducing the size of our balance sheet. I'll have more to say about today's monetary policy actions after briefly reviewing economic developments. Overall economic activity edged down in the first quarter as unusually sharp swings in inventories and net exports more than offset continued strong underlying demand. Recent indicators suggest that real GDP growth has picked up this quarter, with consumption spending remaining strong. In contrast, growth in business fixed investment appears to be slowing, and activity in the housing sector looks to be softening in part reflecting higher mortgage rates. The tightening in financial conditions that we've seen in recent months should continue to temper growth.",0.0,0.0
2022-06-15 18:30:00,2022-06-15 18:32:00,2022-06-15 18:33:00," and help bring demand into better balance with supply. As shown in our summary of economic projections, FOMC participants have marked down their projections for economic activity with the median projection for real GDP growth running below 2% through 2024. The labor market has remained extremely tight with the unemployment rate near a 50-year low, job vacancies at historical highs, and wage growth elevated. Over the past three months, employment rose by an average of 408,000 jobs per month, down from the average pace seen earlier in the year, but still robust. Improvements in labor market conditions have been widespread, including for workers at the lower end of the wage distribution, as well as for African-Americans and Hispanics. Labor demand is very strong, while labor supply remains subdued with the labor force participation rate a little changed since January.",0.0142323372601762,0.0
2022-06-15 18:30:00,2022-06-15 18:33:00,2022-06-15 18:34:00," FOMC participants expect supply and demand conditions in the labor market to come into better balance, easing the upward pressures on wages and prices. The median projection in the SEP for the unemployment rate rises somewhat over the next few years, moving from 3.7% at the end of this year to 4.1% in 2024, levels that are noticeably above the March projections. Inflation remains well above our longer run goal of 2% over the 12-month sending in April, total PCE prices rose 6.3%, excluding the volatile food and energy categories, core prices rose 4.9%. In May, the 12-month change in the consumer price index came in above expectations at 8.6%, and the change in the core CPI was 6%. The demand is strong, supply constraints have been larger and long lasting than anticipated, and price pressures have spread to a broad range of goods and services.",0.0,0.0
2022-06-15 18:30:00,2022-06-15 18:34:00,2022-06-15 18:35:00," The surge in prices of crude oil and other commodities that resulted from Russia's invasion of Ukraine is boosting prices for gasoline and food and is creating additional upward pressure on inflation. And COVID-related lockdowns in China are likely to exacerbate supply chain disruptions. FOMC participants have revised up their projections for inflation this year, particularly for total PCE inflation, given developments in food and energy prices. The median projection is 5.2% this year and falls to 2.6% next year and 2.2% in 2024. Participants continue to see risks to inflation as weighted to the upside. The Fed's monetary policy actions are guided by our mandate to promote maximum employment and stable prices for the American people. My colleagues and I are acutely aware that high inflation imposes significant hardship. A special",0.0,0.0
2022-06-15 18:30:00,2022-06-15 18:35:00,2022-06-15 18:36:00," on those least able to meet the higher costs of essentials, like food, housing, and transportation. We are highly attentive to the risks high inflation poses to both sides of our mandate, and we're strongly committed to returning inflation to our 2% objective. Against the backdrop of the rapidly evolving economic environment, our policy has been adapting, and it will continue to do so. At today's meeting, the committee raised the target range for the federal funds rate by three quarters of a percentage point, resulting in a one and a half percentage point increase in the target range so far this year. The committee reiterated that it anticipates that ongoing increases in the target range will be appropriate. And we are continuing the process of significantly reducing the size of our balance sheet, which plays an important role in firming the stance of monetary policy. Coming out of our last meeting in May, there was a broad sense on the committee that a half percentage point increase in the target range",0.0,0.01435996356427159
2022-06-15 18:30:00,2022-06-15 18:36:00,2022-06-15 18:37:00," should be considered at this meeting if economic and financial conditions evolved in line with expectations. We also stated that we were highly attentive to inflation risks and that we would be nimble in responding to incoming data and the evolving outlook. Since then, inflation has again surprised to the upside. Some indicators of inflation expectations have risen and projections for inflation this year have been revised up notably. In response to these developments, the committee decided that a larger increase in the target range was warranted at today's meeting. This continues our approach of expeditiously moving our policy rate up to more normal levels and it will help ensure that longer term inflation expectations remain well anchored at 2%. As shown in the SCP, the median projection for the appropriate level of the federal funds rate is 3.4% at the end of this year. A percentage point and a half higher than projected in March and 0.9%",0.0,0.0
2022-06-15 18:30:00,2022-06-15 18:37:00,2022-06-15 18:38:00," of its longer run value. The median projection rises further to 3.8% at the end of next year, and declines to 3.4% in 2024. Still above the median longer run value. Of course, these projections do not represent a committee plan or decision, and no one knows with any certainty where the economy will be a year or more from now. Overcoming months, we will be looking for compelling evidence that inflation is moving down. Consistent with inflation returning to 2%. We anticipate that ongoing rate increases will be appropriate. The pace of those changes will continue to depend on the incoming data and the evolving outlook for the economy. Clearly, today's 75 basis point increase is an unusually large one, and I do not expect moves of this size to be common. From the perspective of today, either a 50 basis point or a 75 basis point increase seems most likely at our next meeting. We will, however, make our-",0.0005758981255169007,0.0
2022-06-15 18:30:00,2022-06-15 18:38:00,2022-06-15 18:39:00, decisions meeting by meeting and will continue to communicate our thinking as clearly as we can. Our overarching focus is using our tools to bring inflation back down to our 2% goal and to keep longer term inflation expectations well anchored. Making appropriate monetary policy in this uncertain environment requires a recognition that the economy often evolves in unexpected ways. And has obviously surprised to the upside over the past year and further surprises could be in store. We therefore will need to be nimble in responding to incoming data and the evolving outlook. And we will strive to avoid adding uncertainty to what is already an extraordinarily challenging and uncertain time. We are highly attentive to inflation risks and determined to take the measures necessary to restore price stability. American economy is very strong and well positioned to handle tighter monetary policy.,0.0,0.0
2022-06-15 18:30:00,2022-06-15 18:39:00,2022-06-15 18:40:00," To conclude, we understand that our actions affect communities, families, and businesses across the country. Everything we do is in service to our public mission. We at the Fed will do everything we can to achieve our maximum employment and price stability goals. Thank you, and I look forward to your questions. Thank you, Howard Schneider, with Reuters. Two related questions, Chair Powell. Did you feel you boxed yourself in with the language you used at the last press conference on 50 basis point hikes in June and July? And would you please give us as detailed a sense you can of what role you played in reshaping market expectations so quickly on Monday? So, as you know, we always aim to provide as much clarity as we can about our policy intentions. We're subject to the inherent uncertainty in the economic outlook because we think monetary policy is more effective.",0.0,0.0
2022-06-15 18:30:00,2022-06-15 18:40:00,2022-06-15 18:41:00," when market participants understand how policy will evolve when they understand our objective function, our reaction function. And in the current highly unusual circumstances with inflation well above our goal, we think it's helpful to provide even more clarity than usual, again, subject to uncertainty and the outlook. So, and I think over the course of this year, financial markets have responded and have generally shown that they understand the path we're laying out. Of course, it remains data-dependent. And so, that's what we generally think about guidance and that's why we offer it. And of course, when we offered that guidance at the last meeting, I did say that it was subject to the economy performing about in line with expectations. I also said that if the economy performed, if data came in worse than expected, then we would...",0.0,0.014014598540145914
2022-06-15 18:30:00,2022-06-15 18:41:00,2022-06-15 18:42:00," consider moving even more aggressively. So we got the CPI data and also some data on inflation expectations late last week. And we thought for a while and we thought, well, this is the appropriate thing to do. So then the question is, what do you do? And do you wait six weeks to do it at the next meeting? And I think the answer is that's not where we are with this. So we decided we needed to go ahead. And so we did. And that's really how we made the decision. Thank you, Gina. Thanks for taking our questions. Gina, smile with the New York Times. You, I guess I wonder if you could describe for us a little bit how you're deciding how aggressive you need to be. So obviously, 75 today, what did 75 achieve that 50 wouldn't have and why not just go for a full percentage point at some point? Sure. So if you take it.",0.0,0.0
2022-06-15 18:30:00,2022-06-15 18:42:00,2022-06-15 18:43:00," step back what we're looking for is compelling evidence that inflationary pressures are abating, and that inflation is moving back down. And we'd like to see that in the form of a series of declining monthly inflation readings. That's what we're looking for. And by this point, we had actually been expecting to see clear signs of at least inflation flattening out and ideally beginning to decline. We've said that we'd be data dependent, focused on incoming data, highly attended inflation risks, the things that I mentioned to Howard moments ago. So contrary to expectations, inflation again, surprised to the upside. Some indicators of inflation expectations have risen and projections of this year have moved up notably. So we thought that strong action was warranted at this meeting and today we delivered that in the form of a 75 basis point. Rate hike as I mentioned. So what was the point of it really is this, we've been moving rates up expeditiously to more normal levels. And over the course of the seven months since we...",-0.0151109559269314,0.0
2022-06-15 18:30:00,2022-06-15 18:43:00,2022-06-15 18:44:00," since we pivoted and began moving in this direction, we've seen financial conditions tighten, and appropriately so. But the federal funds rate, even after this move, is at 1.6%. So, again, the committee is moving rates up expeditiously to more normal levels, and we came to the view that we'd like to do a little more front-end loading on that. So I think that the SEP gives you the levels that people think are appropriate at given points in time. This was really about the speed with which you would get there. So as I mentioned, we, 75 basis points today, I said the next meeting could, could well be about a decision between 50 and 75. That would put us at the end of the July meeting, you know, in that range, in that more normal range, and that's a desirable place to be, because you begin to have more optionality there about the speed with which you would proceed going forward. Just talking about the SEP for a second.",0.0,0.0
2022-06-15 18:30:00,2022-06-15 18:44:00,2022-06-15 18:45:00," what it really says is that committee participants widely would like to see policy at a modestly restricted, restrictive level at the end of this year. And that's six months from now. And so much data and so much can happen. So remember how highly uncertain this is. But so that is generally a range of three to three and a half percent. That's where people are. And that's what they want to see, knowing what they know now and understanding that we need to be, we need to show resolve, but also be flexible to incoming data as we see it. If things are better, we don't need to do that much. So, and if they're not, then we either do that much or possibly even more. But in any case, it will be very data dependent. Then you're looking at next year in what you're seeing is people see more, a bit more tightening in a range of maybe three and a half to four percent. And that's generally what people see as the appropriate path for getting inflation under control and starting back down and then getting back down to two percent. So 75 basis points seem like the right thing to do.",0.0,0.0
2022-06-15 18:30:00,2022-06-15 18:45:00,2022-06-15 18:46:00," with this meeting and that's what we did. Steve. Steve, Lee Smith, CMBC. Thank you for taking my question, Mr. Chairman. You have not used the phrase in a long time, monetary policy is in a good place, which is a phrase that you used to use often. Now that the committee is projecting 3.8% next year in terms of the funds rate, which is similar to where the market is now. The future is market of 4% funds right next year. Do you think that's a level that is going to be sufficiently high enough to deal with and bring down the inflation problem? And just as a follow-up, could you break that apart from me? How much of that is restrictive? And how much of that is a normal positive rate that ought to be embedded or not in your opinion in the funds rate? Thank you. Sure. So the question really is, how high does the rate really need to go? And this is, you know, the estimates on the committee are in that range of 3.5%.",0.0,0.0066824519863192934
2022-06-15 18:30:00,2022-06-15 18:46:00,2022-06-15 18:47:00," to 4%. And how do you think about that? Well, you can think about the longer run neutral rate. You can compare it to that. And we think that's in the mid-toes. You can look, frankly, at broader financial conditions. You can look at asset prices. You can look at the effect you're having on the economy. Rates, asset prices, credit spreads, all of those things go into that. You can also look at the yield curve and ask all along the yield curve, where is the policy rate? So for much of the yield curve now, real rates are positive. That's not true at the short end. At the short end of the yield curve in the early years, you have negative rates still. So that really is one data point. It's one part of financial conditions. So I think I have to look at it this way. We move the policy rate. That affects financial conditions, and that affects the economy. We have, of course, rigorous ways to think about it. But ultimately, it comes down to, do we...",0.0,0.0
2022-06-15 18:30:00,2022-06-15 18:47:00,2022-06-15 18:48:00," think financial conditions are in a place where they're having the desired effect on the economy. And that desired effect is we'd like to see, you know, demand moderating. Demand is very hot still in the economy. We'd like to see the labor market getting better and balanced between supply and demand. And that can happen both from supply and demand. Right now, there's demand is substantially higher than available supply, though. So we feel that there's a role for us in moderating demand. Those are the things we can affect with our policy tools. There are many things we can't affect. And those would be, you know, the things, the commodity price issues that we're having around the world due to the war in Ukraine and the fallout from that. And also just all of the supply side things that are still, you know, pushing upward on inflation. So that's really how I think I would think about it. But this 3.8% 4% get it done because they get the jobs done at raising the back of the inflation. I think it certainly.",-1.5189327749900224e-05,0.0
2022-06-15 18:30:00,2022-06-15 18:48:00,2022-06-15 18:49:00," in the range of plausible numbers. I think we'll know when we get there, really. I mean, honestly, that would be, you would have positive real rates. I think an inflation coming down by then. I think you'd have positive real rates across the curve. I think that the neutral rate is pretty low these days. So I would think it would. But we're going to find that out empirically. We're not going to be completely model driven about this. We're going to be looking at this, keeping our eyes open and reacting to incoming data, both on financial conditions and on what's happening in the economy. Thanks, Nick Temeros of the Wall Street Journal. Chirpel, you've said that you like your policy to work through expectations. And now, obviously, this decision was something quite different from how you and almost all of your colleagues had set those expectations during the intermeeting period. And I know you just said that what changed was really the inflation data, the inflation expectation.",0.0,0.0
2022-06-15 18:30:00,2022-06-15 18:49:00,2022-06-15 18:50:00," data, but I'm wondering on the inflation expectations data, was there something you saw that was unsettling enough to risk eroding the credibility of your verbal guidance by doing something so different from what you had socialized before? So if you look at a broad range of inflation expectations, so you've got the public, you've got surveys of the public and of experts and you've also got market-based. And I think if you look across that broad range of data, what you see is that expectations are still in the place, very much in the place where short-term inflation is going to be high, but comes down sharply over the next couple of years. That's really where inflation expectations are. And also, as you get away from this episode, they get back down close to 2%. And so this is really very important to us that that remained the case. And I think if you look for most measures most of the time, that's what you see.",0.0,0.0
2022-06-15 18:30:00,2022-06-15 18:50:00,2022-06-15 18:51:00," If we even see a couple of indicators that bring that into question, we take that very seriously. We do not take this for granted. We take it very seriously. So the preliminary Michigan reading, it's a preliminary reading. It might be revised nonetheless. It was quite eye catching and we noticed that. We also noticed that the index of common inflation expectations that the board has moved up after being pretty flat for a long time. So we're watching that and we're thinking this is something we need to take seriously. And that is one of the factors, as I mentioned, one of the factors in our deciding to move ahead with 75 basis points. Today was what we saw in inflation expectations. We're absolutely determined to keep them anchored at 2%. That was one of the reasons, the other was just the CPI reading. So if you saw a movement like that again, another tick up in inflation expectations, would that put a 75 or even 100 basis point increase in play at your next meeting? We're going to.",0.0,0.009572592913030139
2022-06-15 18:30:00,2022-06-15 18:51:00,2022-06-15 18:52:00," I'll just say we're going to react to the incoming data and appropriately, I think. So I wouldn't want to put a number on what that might be. The main thing is to get rates up. And then pretty soon we'll be in an area where we're, I think, because you get closer to the end of the year, you're in an arrange where you've got restrictive policy, which is appropriate. 40-year highs in inflation. We think that policy is going to need to be restrictive. And we don't know how restrictive. So I think that's how we'll take it. Hi, Chair Powell, Neil or one from Axios. Thanks for taking our questions. The late breaking kind of decision to go to 75 basis points, do you worry that that will make policy guidance a less effective tool in the future? And should we think of that as a kind of symmetrical reaction function if we start to get soft readings on inflation or if labor market starts to roll over? To take your second question first, yes. I mean, I think work.",0.0,0.0
2022-06-15 18:30:00,2022-06-15 18:52:00,2022-06-15 18:53:00," Again, we're going, we're resolved to take this on, but we're going to be flexible in the implementation of it. Sorry, and your question was guidance. So, again, the overall exercises that we try to be, provide as much clarity about our policy intentions as we can, because we think that makes monetary policy work better. There's always a tradeoff, because you have to live with that guidance. And so you do it, and it helps a lot of the time. I frankly think this year has been a demonstration of how well it can work. We, you know, with us having really just done a very little in the way of raising interest rates, financial conditions have tightened quite significantly through the expectations channel, as we've made it clear what our plans are. So I think that's been a very healthy thing to be happening. So, and I would hope that our, that it's always going to be any guidance that we give us always going to be subject to.",0.0020974919308639002,0.0
2022-06-15 18:30:00,2022-06-15 18:53:00,2022-06-15 18:54:00," things working out about as we expect. And in this particular situation, you know, we're looking for something specific and that is progress on inflation. We wanna see progress. We wanna see, inflation can't go down until it flattens out. And that's what we're looking to see. And if we don't see that, then that's the kind of thing that we'll call, even if we don't see progress for a longer period, that could cause us to react. But we will soon enough, we will be seeing some progress at some point and we'll react appropriately to that too. But I would like to think though, that our guidance is still credible, but it's always going to be conditional on what happens. This is an unusual situation to get, you know, some data late in during blackout, pretty close, very close to our meeting, very unusual to one that would actually change the outcome. So I've only seen in my 10 years plus here at the Fed, I've only seen something like that, even close to that one or two.",0.0,0.0
2022-06-15 18:30:00,2022-06-15 18:54:00,2022-06-15 18:55:00," times. So I don't think it's something that will come up a great deal. Thank you so much for taking our questions. Colby Smith of the Financial Times. On the clear and convincing threshold for the inflation trajectory, what is the level of realized inflation that meets that criteria and how is the committee thinking about the potential tradeoff of much higher unemployment than even forecasted in the SEP if inflation is not moderating at this acceptable pace? The second part I didn't get. If what's the potential tradeoff with higher unemployment than even what's forecasted in the SEP if inflation is not moderating at an acceptable pace? Right. So what we want to see is you know a series of declining monthly readings for inflation and we like to see inflation headed down. So but",0.0,0.0
