original_time,start_time,end_time,speech,price_change,volatility
2023-03-22 18:30:00,2023-03-22 18:30:00,2023-03-22 18:40:00," Good afternoon. Before discussing today's meeting, let me briefly address recent developments in the banking sector. In the past two weeks, serious difficulties at a small number of banks have emerged. History has shown that isolated banking problems, if left unaddressed, can undermine confidence in healthy banks and threaten the ability of the banking system as a whole to play its vital role in supporting the savings and credit needs of households and businesses. That is why, in response to these events, the Federal Reserve, working with the Treasury Department and the FDIC, took decisive actions to protect the U.S. economy and to strengthen public confidence in our banking system. These actions demonstrate that all depositors' savings and the banking system are safe. With the support of the Treasury, the Federal Reserve Board created the Bank Term Funding Program to ensure that banks that hold safe and liquid assets can, if needed, borrow reserves against those assets at par. This program, along with our longstanding discount window, is effectively meeting the unusual funding needs that some banks have faced and makes clear that ample liquidity in the system is available. Our banking system is sound and resilient with strong capital and liquidity. We will continue to closely monitor conditions in the banking system and are prepared to use all of our tools as needed to keep it safe and sound. In addition, we are committed to learning the lessons from this episode and to work to prevent episodes from events like this from happening again. Turning to the broader economy and monetary policy. Inflation remains too high and the labor market continues to be very tight. My colleagues and I understand the hardship that high inflation is causing and we remain strongly committed to bringing inflation back down to our 2 percent goal. Price stability is the responsibility of the Federal Reserve. Without price stability, the economy does not work for anyone. In particular, without price stability, we will not achieve a sustained period of strong labor market conditions that benefit all. The US economy slowed significantly last year, with real GDP rising at a below trend pace of 0.9 percent. Consumer spending appears to have picked up this quarter, although some of that strength may reflect the effects of swings in the weather across the turn of the year. In contrast, activity in the housing sector remains weak, largely reflecting higher mortgage rates. Higher interest rates and slower output growth also appear to be weighing on business fixed investment. Committee participants generally expect subdued growth to continue. As shown in our summary of economic projections, the median projection for real GDP growth stands at just 0.4 percent this year and 1.2 percent next year, well below the median estimate of the longer run normal growth rate. And nearly all participants see the risks to GDP growth as weighted to the downside. Yet the labor market remains extremely tight. Job gains have picked up in recent months with employment rising by an average of 351,000 jobs per month over the last three months. The unemployment rate remained low in February at 3.6 percent. The labor force participation rate has edged up in recent months and wage growth has shown some signs of easing. However, with job vacancy still very high, labor demand substantially exceeds the supply of available workers. FOMC participants expect supply and demand conditions in the labor market to come into better balance over time, easing upward pressures on wages and prices. The median unemployment rate projection in the SEP rises to 4.5 percent at the end of this year and 4.6 percent at the end of next year. Conflation remains well above our longer run goal of 2 percent. Over the 12 months ending in January, total PCE prices rose 5.4 percent, excluding the volatile food and energy categories. Core PCE, excluding those core PCE prices rose 4.7 percent. In February, the 12 month change in the CPI came in at 6 percent and the change in the core CPI was 5.5 percent. Inflation has moderated somewhat since the middle of last year, but the strength of these recent readings indicates that inflation pressures continue to run high. The median projection in the SEP for total PCE inflation is 3.3 percent for this year, 2.5 percent next year, and 2.1 percent in 2025. The process of getting inflation back down to 2 percent has a long way to go and is likely to be bumpy. Despite elevated inflation, longer term inflation expectations appear to remain well anchored, as reflected in a broad range of surveys of households, businesses, and forecasters, as well as measures from financial markets. The Fed's monetary policy actions are guided by our mandate to promote maximum employment and stable prices for the American people. My colleagues and I are acutely aware that high inflation imposes significant hardship as it erodes purchasing power, especially for those least able to meet the higher costs of essentials, like food, housing, and transportation. We are highly attentive to the risks that high inflation poses to both sides of our mandate, and we are strongly committed to returning inflation to our 2 percent objective. At today's meeting, the committee raised the target range for the federal funds rate by a quarter percentage point, bringing the target range to 4 and 3 quarters to 5 percent, and we are continuing the process of significantly reducing our securities holdings. Since our previous FOMC meeting, economic indicators have generally come in stronger than expected, demonstrating greater momentum in economic activity and inflation. We believe, however, that events in the banking system over the past two weeks are likely to result in tighter credit conditions for households and businesses, which would in turn affect economic outcomes. It is too soon to determine the extent of these effects, and therefore too soon to tell how monetary policy should respond. As a result, we no longer state that we anticipate that ongoing rate increases will be appropriate to quell inflation. Instead, we now anticipate that some additional policy affirming may be appropriate. We will closely monitor incoming data and carefully assess the actual and expected effects of tighter credit conditions on economic activity, the labor market, and inflation, and our policy decisions will reflect that assessment. In our SEP, each FOMC participant wrote down an appropriate path for the federal funds rate based on what that participant judges to be the most likely scenario going forward. If the economy evolves as projected, the median participant projects that the appropriate level of the federal funds rate will be 5.1% at the end of this year, 4.3% at the end of 2024, and 3.1% at the end of 2025. These are little changed from our December projections reflecting offsetting factors. These projections are not a committee decision or plan. If the economy does not evolve as projected, the path for policy will adjust as appropriate to foster our maximum employment and price stability goals. We will continue to make our meeting decisions, meeting by meeting based on the totality of the incoming data and their implications for the outlook for economic activity and inflation. We remain committed to bringing inflation back down to our 2% goal and to keep longer-term inflation expectations well anchored. Reducing inflation is likely to require a period of below trend growth and some softening in labor market conditions. Restoring price stability is essential to set the stage for achieving maximum employment and stable prices over the longer run. To conclude, we understand that our actions affect communities, families, and businesses across the country. Everything we do is in service to our public mission. We at the Fed will do everything we can to achieve our maximum employment and price stability goals. Thank you. I look forward to your questions. Thank you, Colby Smith with the Financial Times. How confident is the committee that the recent stress that we've seen and you've alluded to is contained at this point and that deposit flight among mid-size lenders in particular has ceased? Thanks. I guess our view is that the banking system is sound and it's resilient. It's got strong capital and liquidity. We took powerful actions with Treasury and the FDIC which demonstrate that all depositors savings are safe and that the banking system is safe. Deposit flows in the banking system have stabilized over the last week. And the last thing I'll say is that we've undertaken a thorough internal review that will identify where we can strengthen supervision and regulation. Okay. Just a quick follow up. I mean given all of the stress and the uncertainty that you've also alluded to in the statement, how seriously was a pause considered for this meeting? So we considered, we did consider that in the days running up to the meeting and you see the decision that we made which I'll say a couple things about. First it was supported by a very strong consensus and I'll be happy to explain why and really it is that the...",-0.0009251850370074,0.004259157187954073
2023-03-22 18:30:00,2023-03-22 18:40:00,2023-03-22 18:50:00," the intermeeting data on inflation and the labor market came in stronger than expected and really before the recent events we were clearly on track to continue with ongoing rate hikes. In fact as of a couple of weeks ago it looked like we'd need to raise rates over the course of the year more than we'd expected at the time of the SEP in December. It's time to December meeting. We are committed to restoring price stability and all of the evidence says that the public has confidence that we will do so that we'll bring inflation down to 2% over time. It is important that we sustain that confidence with our actions as well as our words. So we also assess as I mentioned that the events of the last two weeks are likely to result in some tightening and credit conditions for households and businesses and thereby way on demand on the labor market and on inflation. Such a tightening in financial conditions would work in the same direction as rate tightening. In principle as a matter of fact you can think of it as being the equivalent of a rate hike or perhaps more than that of course it's not possible to make that assessment today with any precision whatsoever. So our decision was to move ahead with a 25 basis point hike and to change our guidance as I mentioned from ongoing hikes to some additional hikes maybe some policy-firming may be appropriate. So going forward as I mentioned in assessing the need for further hikes will be focused as always on the incoming data and the evolving outlook and in particular on our assessment of the actual unexpected effects of credit tightening. Mr. Chairman can you explain the difference between ongoing rate increases and firming? Does firming imply a rate increase per se or could policy firm without you increasing rates? No I think it's meant to refer to our policy rate. Really I would focus on the words may and some as opposed to ongoing. So we clearly were what we were doing there was taking on board the on trying to reflect the uncertainty about what will happen. I mean it's possible that this will turn out to have very modest effects. These events will turn out to be very very modest effects on the economy in which case an inflation will continue to be strong in which case the you know the path will look might look different. It's also possible that this potential tightening will contribute significant tightening in credit conditions over time and in principle if that that that means that monetary policy may have less work to do we simply don't know. Do you have any concerns at the recent that we're hiking did today could further exacerbate the problem in the banks? No I mean we're with our monetary policy we're really focused on macroeconomic outcomes in particular we're focused on on this potential credit tightening and what can that produce in the way of tighter credit conditions. I think when we think about the situation in the banks we're focused on our financial stability tools in particular our lending facilities the debt sorry the discount window and also the new facility. Nick Timmeros of the Wall Street Journal at Sherpowell in your testimony two weeks ago you had indicated you thought the terminal rate would be higher obviously that was before the stress in the making sector and I realized there's a lot of uncertainty but can you can you explain it all to what extent your forecasts or those of your colleagues or those of the board staff incorporated today a material tightening of credit availability because of the stress in the banking sector or are you waiting to see it in the data before you incorporate that potential tightening into your forecasts? So you know we just come from an FOMC meeting and you know the people who write them in it will be very carefully counting but I'll tell you what I heard what I heard was significant number of people saying that they anticipated they would be some some tightening of credit conditions and that would really have the same effects as as our policies do and that therefore they were including that in their assessment and that if that did turn out not to be the case in principle you'd need more rate hikes so some people did reflect that in their in their FOMC in their SCP forecast I think there may also just have been remember this is 12 days ago you know we're trying to assess something that just is so recent and it's people you know it's very difficult there's so much uncertainty so December was a good place to start and we wound up with we wound up with very similar outcomes for December and it you know in a way the the early the data in the first part the first five weeks of the intermeeting period pointed to stronger inflation and stronger labor markets so that pointed to higher rates and then this this latter part kind of the possibility of of of of credit conditions tightening really really offset that effectively? To follow up have you considered all whether your primary tool the funds rate is going to be enough to sustain the kind of tighter financial conditions that you believe will be necessary without doing significant damage to the banking sector have you for example considered changing reserve requirements selling assets out of the system open market account as a way to better achieve tighter financial conditions that don't accelerate deposit erosion for example from banks? You know we know that we have other other tools in effect but no we think our monetary policy tool works and we think you know many many banks are rate hikes were well telegraphed to the market and many banks have managed to handle them. Victoria. Hi Victoria Guida with Politico I wanted to ask you along with the FDIC and the Treasury the Fed Board decided to invoke the systemic risk exception to allow uninsured depositors to be protected at these two banks. I was just wondering if you could speak to why that decision was made was it purely a confidence issue or were there a concern that there would be some sort of economic contagion or financial contagion from the failure of these banks? The issue was really not about those specific banks but about about the risk of of a contagion to to other banks and to the financial markets more broadly. That was the issue. Okay and then can you also just follow up can you speak to the role that you will be playing in the Fed's internal investigation on its supervision and regulation? So Vice Chair Barr is of course leading that review and he's responsible for it in his capacity as Vice Chair for supervision. We I realized you know right away that that there was going to be a need for a review. I mean the question we were all asking ourselves over that first week and was how did this happen? And so what we did was early Monday morning we sat down and said let's do this and he's he was obviously going to lead it in his capacity. So I don't you know my my role was to announce it and I get briefed on it but I'm not involved in in the work of it. Howard? Chair Powell Howard, Senator from Rooters. So I want to go back to your February press conference. You mentioned the word disinflation I believe nine or ten times. The process that you felt was I forget the word you used but gratefully underway or something like that. Is disinflation still occurring in the US today? Yes I mean what actually happened Howard was I got the question twelve times so it's a maybe it's a feature not a bug but so but yeah I absolutely the pros absolutely the same the story is intact so it's really three parts right. Goods inflation's been coming down now for six months it's proceeding more slowly than we would have liked but it's certainly proceeding. Housing services is really a matter of time passing we continue to see the new leases being signed at much lower levels of inflation so that's 44% of the of the core PC index where you've got a story that's ongoing where we didn't have in February and we still don't have now is a sign of progress in the non-housing services sector and that is you know that's just something that will have to come through through softening demand and perhaps some softening and labor market conditions we don't see that yet and that's that's of course 56% of the index so the story is pretty much the same I will say that the inflation data that we got to your point really pointed to stronger inflation if I could follow up on that I was curious why you don't see more coming from the credit crunch because it seems to me that's something that you'd actually welcome to a degree and expect and are you not seeing more coming from that because you don't know or because you just don't want to have another round of wishful thinking so it's really just a question of not knowing at this point there's a great deal of literature on the connection between tighter credit conditions economic activity hiring and inflation very large body of literature the question is how significant will this credit tightening be and how how sustained will it be that's that's the issue and we don't really see it yet it's so so people are making estimates you know people are publishing estimates and it's but it's very kind of rule of thumb guesswork almost at this point but we think it's it's potentially quite real and that argues for you know being alert as we go forward as we think about for the right hikes for us we'll be paying attention to the actual unexpected effects from that hi chair pal Gina smile come to your times thank you for taking our questions I wonder if you could talk a little bit I know that you've got your internal review coming but I wonder if you could talk a little bit about what",0.0040062096249186,0.005810313306118343
