original_time,start_time,end_time,speech,price_change,volatility
2023-03-22 18:30:00,2023-03-22 18:50:00,2023-03-22 19:00:00," you think happened with oversight at Silicon Valley Bank and whether this suggests that something about regulation and supervision needs to actually change going forward. And I wonder, you know, how can the American people have confidence that there aren't other weaknesses out there in the banking system given that this one got missed as you noted? So let me say what I think happened and then I'll come to the questions around supervision. So at a basic level, Silicon Valley Bank management failed badly. They grew the bank very quickly. They exposed the bank to significant liquidity risk and interest rate risk. Didn't hedge that risk. We now know that supervisors saw these risks and intervened. We know that the public saw all this. We know that SVB experienced an unprecedentedly rapid and massive bank room. So this is a very large group of connected depositors, concentrated group of connected depositors and a very, very fast run faster than the historical record would suggest. So as for us, so for our part, we're doing a review of supervision and regulation. My only interest is that we identify what went wrong here. How did this happen? Is the question. What went wrong? Try to find that. We will find that and then make an assessment of what are the right policies to put in place so that it doesn't happen again and then implement those policies. It would be inappropriate for me at this stage to offer my views on what the answers might be. I simply can't do that. Vice Chair Bar is leading this and I think he's testifying next week. But that will be up to him. So that's really where it is. The review is going to be thorough and transparent. It is clear to you really to your last question. It's clear that we do need to strengthen supervision and regulation and I assume that there will be recommendations coming out of the report and I plan on supporting them and supporting their implementation. I just, and the final point, can we feel confident that these weaknesses don't exist elsewhere given that they've omitted this bank? These are not weaknesses that are at all broadly through the banking system. So this was a bank that was an outlier in terms of both its percentage of uninsured deposits and in terms of its holdings of duration risk. And again, supervisors did get in there and they were, as you know, obviously, they were on this issue but nonetheless this still happened. So that's really the nature of the interview of the review is to discover that. Michael McKeith from Bloomberg Radio and Television, you've been very consistent in saying that the Fed would be raising interest rates and then holding them there for quite some time. Following today's decision, the markets have now priced in one more increase in May and then every meeting the rest of this year, they're pricing in rate cuts. Are they getting this totally wrong from the Fed or is there something different about the way you're looking at it given that you're now thinking that moves might be appropriate as opposed to ongoing? So we published an SEP today as you will have seen it. It shows that basically participants expect relatively slow growth, a gradual rebalancing of supply and demand in labor market with inflation moving down gradually. In that most likely case, if that happens, participants don't see rate cuts this year. They just don't. I would just say as always, the path of the economy is uncertain and policy is going to reflect what actually happens rather than what we're right down in the SEP. But that's not our baseline expectation. Well, if I could follow up and ask, as you look forward into the rest of the year here, are you saying that what you see and the 5.1% basically consensus is based on being, it will be sufficiently restrictive or is it leavened by the idea of you don't know what's going to happen? In other words, what should people think about in terms of how the Fed thinks about how far it is from the terminal? It's going to depend. Remember, we're looking for purposes of our monetary policy tool. We're looking at what's happening among the banks and asking, is there going to be some tightening and credit conditions? And then we're thinking about that as effectively doing the same thing that rate hikes do. So in a way, that substitutes for rate hikes. So the key is we have to have policies need to be tight enough to bring inflation down to 2% over time. It doesn't all have to come from rate hikes. It can come from tighter credit conditions. So we're looking at, and we're, it's highly uncertain how long the situation will be sustained or how significant any of those effects would be. So we're just going to have to watch. In the meantime, you know, and obviously at the end of the day, we will do enough to bring inflation down to 2% and no one should doubt that. Go to Rachel Segal. Hi, Chair Powell. Rachel Segal from the Washington Post, thank you for taking our questions. I know we've talked a bit about how Silicon Valley bank was unique to a certain sector of the economy. But there's also growing concern that there are financial stability risks from the commercial real estate market and loans that will begin to roll over later this year and next. And that smaller regional banks also disproportionately hold those loans. Is there a risk that could mimic the kind of what we saw with SVB to banks that disproportionately are focused on commercial real estate? So, you know, we've well aware of the concentrations people have in commercial real estate. I really don't think it's comparable to this. The banking system is strong. It is sound, it is resilient, it's well capitalized. And I really don't see that as at all analogous to this. And one other question. Would you be open to an independent investigation separate from the Fed's probe? I welcome. It's 100% certainty that there will be independent investigations and outside investigations and all that. So, we welcome. When a bank fails, they're investigations and of course we welcome that. Edward. Thank you, Mr. Chairman. Edward Lawrence from Fox Business. Inflation has been rather sticky. So, do you need help from the fiscal side to get inflation down faster? We don't assume that. We don't give advice to the fiscal authorities and we assume that we take fiscal policy as it comes to our front door, stick it in our model along with a million other things. And we have responsibility for price stability. The Federal Reserve has responsibility for that and nothing is going to change that. So, we will get inflation down to 2% in time. And if I can follow on that, but they're working, the spending that's happened is working against what you are doing, right? So, it's prolonging inflation. You know, you have to look at the impulse from spending because spending was of course tremendously high during the pandemic and then as the pandemic programs rolled off spending actually came down. So, the sort of fiscal impulse is actually not what's driving inflation right now. It was at the beginning, perhaps, part of what was driving inflation, but that's not really the story now. It's going to Neil Irwin. Hi, Chair Powell. Neil Irwin with Axios. Two questions about aspects of the government's response on Silicon Valley Bank two weekends ago. First, why is this new bank funding facility done under emergency 133 authority as opposed to expansion of the discount window, changing the terms of the discount window that's been around a long time? And second, can you discuss the federal and the FDIC guarantee of uninsured depositors and why there's $143 billion on your balance sheets last week supporting that deposit guarantee? Sure. So, 133 seemed like the right. We have a little more flexibility on under section 133. We've done quite a lot under the discount window as well. We need to do a special facility that was designed a certain way. So we did it under 133. Really no magic to that. It's only available in unusual and ex-circumstances and it has to be meet certain requirements, but it seemed to be the right place. So, with the FDIC, we're lending to the, in effect, we're lending to the bridge bank. So that's where the funds came from. And it's alone that's 100% guaranteed by the FDIC, so there's no risk for us. Chris Regaber. Thank you, Chris Regaber and Associated Press. The SEB, SEP suggests one more rate hike as does the change in the language in the statement and which suggests that you're perhaps nearing the end of a cycle of rate hikes. Do you feel though that if inflation remains high, you'll be able to resume additional hikes as needed or have you somewhat tied your hands here with these signals about rate hikes coming to an end? Thank you. Absolutely not. If we need to raise rates higher, we will. I think for now though, we, as I've mentioned, we see the likelihood of credit tightening. We know that that can have an effect on the macro economy, on demand, on labor market, on inflation, and we're going to be watching to see what that is. And we'll also be watching what's happening with inflation and in the labor market. So we'll be watching all those things and of course we will eventually get to tight enough policy to bring inflation down to 2 percent. We'll find ourselves at that place. Hi. Hi Chair Powell, thanks for taking the question. Kyle Campbell with American Banker. I have a couple questions about the balance sheet. This fall I'm curious.",-0.0032112718129993,0.004822950246145405
2023-03-22 18:30:00,2023-03-22 19:00:00,2023-03-22 19:10:00," At what point the financial supports that the Fed is extending through the discount window and through its enhanced lending facility might be at odds with the objective of reducing the balance sheet. And I'm also curious what your thoughts are on the not just the availability of reserves but the distribution of them throughout the banking system. And at what point you might be concerned about it being scarce for certain banks. So people think of QE and QT in different ways. So let me be clear about how I'm thinking about these recent developments. So recent liquidity provision that has increased the size of our balance sheet but the intent and the effects of it are very different from what we from when we expand our balance sheet through purchases of longer term securities. Large scale purchases of long term securities are really meant to alter the stance of policy by pushing down pushing up the price and down the rates longer term rates which supports demand through channels we understand fairly well. The balance sheet expansion is really temporary lending to banks to meet the special liquidity demands created by the recent tensions. It's not intended to directly alter the stance of monetary policy. We do believe that it's working. It's having its intended effect of bolstering confidence into the banking system and thereby forstalling what might otherwise have been in abrupt and outsized tightening and financial conditions. So that's working. In terms of the distribution of reserves we don't see ourselves as running into reserve shortages. We think that our program of allowing our balance sheet to run off predictably and passively is working. And of course we're always prepared to change that if that changes but we don't see any evidence that that's changed. Hi Chair. A lettering a survival with Bloomberg news. The minutes of the January February meeting the last meeting indicate that you discuss the possibility of runs on non bank financial institutions and the impact of large unrealized losses on bank portfolios. Can you talk a little bit more about that discussion kind of what was talked about in light of that. And then why didn't the Fed do anything about that at that point to ultimately prevent what happened this month. I mean to be honest I don't recall the specifics of that. It's been quite an interesting seven weeks. But I will tell you though that we have there have been presentations about interest rate risk. I mean it's been in all the newspapers. It's not a surprise that there are institutions that have that have had unhedged long positions in long duration securities that have lost value as as longer term rates have gone up due to our rate increases. So that's that's not a surprise. I think as you know as is as is now on the public record the supervisory team was apparently engaged very much engaged with the bank. Repeatedly and was escalating but you know nonetheless what happened happened. And so that's really the purpose of one way to think about the review that Vice Chair Bar is conducting is to try to understand how that happened and try to understand how we can do better and what policies we need to change. I mean one one thing is the speed of the come back to that the speed of the run it's it's very different for what we've seen in the past. And it does kind of suggest that there's a need for possible regulatory and supervisory changes just because supervision regulation need to keep up with what's happening in the world. Can you confirm whether or not the board knew about these escalations by the exam examiners in San Francisco. I will have to come back to you on that. I don't know. Simon or Brinavitch with the economist thank you very much. Chair Powell you've stated twice today that all depositors savings in the banking system are safe. Are you saying that de facto deposit insurance covers all savings. Shouldn't Congress have a say in that. And just by way of example if a bank with less than a billion dollars in assets failed are you promising to be allowed all of its depositors. Well I'm not saying anything more than I'm saying so but what I'm saying is you've seen that we have the tools to protect depositors when there's a threat of serious harm to the economy or to or to the financial system. And we prepare to use those tools and I think depositors should assume that they're that their deposits are safe. Thank you Chair Powell. Greg Robb from Markerwatch. I was wondering if you could give us a little bit more color you gave just a little bit of color you said during the first week of the Silicon Valley weekend you said the question you guys asked was how did this happen when you saw Silicon Valley bank. So I was wondering if you could go to the credits we merger I mean wasn't that the big gorilla in the room aren't you didn't you breathe a sigh of relief when that. Merger happened thanks. Sure so you know we that that was really this with government we of course we're following it over the course of the weekend and we were engaged with their authorities in the way that you would expect all the ways that you would expect. It seems to have been a positive outcome in the sense that the transaction was agreed to and it has been the markets have accepted it and. It seems to have seems to have gone well and I think there was a concern that it might not go well so coming coming into the middle of this week yes I would say that that has gone well so far. Nicole. Hi thank you chair pal Nicole good kind with CNN business in the summary of economic projections that FMC sees the unemployment rate increasing to 4.5% this year I'm wondering how you anticipate preventing this from snowballing while using the admittedly blunt tools at your disposal. The estimate of what will happen as as demands slows and as conditions soften in the labor market and it's just it's it's a highly uncertain estimate and I mean I was really we we have to bring inflation down to 2% the costs of bringing it down there are real costs to bring it down to 2% but the costs of failing are much higher and if you read your history as you I'm sure you have you can see that if if central bank doesn't get inflated. It doesn't get inflation back in place get inflation make sure that inflation expectations remain anchored you can have a long series of years where inflation is high and volatile and it's hard to invest capital it's hard for an economy to perform well and that's we're looking to avoid that and you know and to get back to where we need to be back to where we were for a quarter century and get there as quickly as we can. The question is this briefly it's hard to. Historically it's been hard to contain unemployment and I'm the question is do you worry about some sort of snowball effect and how do you factor that into your projections and your thoughts. It depends on whether you we so recessions tend to be non-linear and so they're very hard to model you know the models all work in a kind of linear way if you have more of this you get more of that but when when our recession happens the reactions tend to be not linear and that's what it so we don't know whether that'll happen this time we don't know if so we don't know what the how significant it will be and so you know we're we're very focused on getting inflation down and because we know in the longer run. And that that is the thing that will most benefit the people we serve that's how we can have a long you know we've had very strong labor markets through these long expansions that we've had four of the five longest or three of the four longest expansions in US history have been really since the high inflation period and the reason was inflation wasn't forcing the central bank to come in and stop an insipient or you know an expansion you can have very very long expansions without high inflate. And we had several of those and they're very good for people you see late in expansion you see low unemployment you see the benefits of wages going to people at the lower end of the wage spectrum it's it's just a place that we should try to get back to. Jean. Hi chair Powell, Jean young with market news I just wanted to ask with all the events of the past two weeks do you still see a possibility of a soft landing you as economy. You know it's it's too early to say really whether whether these events have had much of an effect I it's hard for me to see how they would have helped the problem the possibility but I guess I would just say it's it's too early to say whether there really have been. And the question will be how long this period is sustained the longer it's sustained then the greater will be the the the likely. Declines in in or tightening credit standards credit availability so we'll just have to see I do still think though that there's a there's a pathway to that I think that pathway still exists and you know we're certainly trying to find it. Hi chair Powell Nancy Marshall Genser with Marketplace just wondering how many financial institutions have been issued matters requiring attention or matters requiring immediate attention citations at this point how many I don't know. But those are serious those are.",-0.0040395423524689,0.005670362903225807
2023-03-22 18:30:00,2023-03-22 19:10:00,2023-03-22 19:13:31," regulatory, particularly immediate attention. That's, I guess, there were six of them. So. And getting to the seriousness of it, how are you going to ensure that banks comply with these citations take them seriously? How we enforce them? That is a great question. And is right in the heart of what the review will be doing under Vice Chair of Barr's leadership. So I think that's what you think about. What can we do to make sure that? But again, that's not for me to answer today. Do you have specific thoughts on that? Well, I see if I did, I wouldn't share them, because I really, this review is going on. And I want nothing other than us to find out what happened and why, figure out what we can do to do better, and then implement those changes. That's all I want. It's for me to be giving you my half-form to or partially informed thoughts. It just isn't appropriate. There's a real serious review going on with people from all of the Federal Reserve system who are not connected to this work, not connected to this bank. And under, again, Vice Chair of Barr's leadership, and I'm confident that it will produce a satisfactory result. OK. We'll go to Jennifer for the last question. Thank you, Chair Powell, Jennifer Sean Berger with Yahoo Finance. Carrie, how do you view financial conditions right now? If credit becomes expensive enough, choking off growth, as you said you're watching for, would that situation warrant a rate cut? What situation would warrant a rate cut? And have the bank failures prompted any discussion around changing the implementation of the balance sheet runoff? Thank you. So we haven't really talked about changing the balance sheet implementation. That's not something we've discussed yet. As I mentioned, we're always willing to change that. If we conclude that it's appropriate, we're really not seeing any signs there. Sorry. Then the question before that was just give me a... Carrie, how you view financial conditions now, and if credit were to tighten enough, if that would prompt a rate cut. So financial conditions seem to have tightened. And probably by more than the traditional indexes say, because the traditional indexes are focused a lot on rates and equities, and they don't necessarily capture lending conditions. So we think that, though. So there are other measures, which, if they're focused on bank lending conditions and things like that, they show some more tightening. The question for us, though, is how significant will that be and how will we be the extent of it, and will be the duration of it? And then once you know that, there's a fair amount of research about how that, with broad uncertainty bands, how that works its way into the economy over what period of time. And so we'll be looking to see the first part of that, how serious is this, and does it look like it's going to be sustained? And if it is, it could easily have a significant macroeconomic effect, and we would factor that into our policy decisions. I mentioned with rate cuts. Rate cuts are not in our base case. And so that's all I have to say. So thank you very much.",0.0022444141826801,0.00442008486562942
