original_time,start_time,end_time,speech,price_change,volatility
2024-06-12 18:30:00,2024-06-12 18:30:00,2024-06-12 18:31:00," Good afternoon. My colleagues and I remain squarely focused on achieving our dual mandate goals of maximum employment and stable prices for the benefit of the American people. Our economy has made considerable progress toward both goals over the past two years. The labor market has come into better balance with continued strong job gains and a low unemployment rate. Inflation has eased substantially from a peak of 7% to 2.7%, but is still too high. We are strongly committed to returning inflation to our 2% goal in support of a strong economy that benefits everyone. Today, the FOMC decided to leave our policy interest rate unchanged and to continue to reduce our securities holdings. We are maintaining our restrictive stance of monetary policy in order to keep demand in line with sub...",0.0,0.0018077845415975246
2024-06-12 18:30:00,2024-06-12 18:31:00,2024-06-12 18:32:00," and reduce inflationary pressures. I'll have more to say about monetary policy after briefly reviewing economic developments. Recent indicators suggest that economic activity has continued to expand at a solid pace. Although GDP growth moderated from 3.4% in the fourth quarter of last year, to 1.3% in the first quarter, private domestic final purchases, which excludes inventory investment, government spending, and net exports, and usually sends a clearer signal on underlying demand. Grue at 2.8% in the first quarter, nearly as strong as the second half of 2023. Growth of consumer spending has slowed from last year's robust pace, but remains solid. An investment in equipment and intangibles has picked up from its endemic pace last year. Improving supply conditions have supported resilient demand, and the strong performance of the U.S. economy over the past year.",0.0,0.0
2024-06-12 18:30:00,2024-06-12 18:32:00,2024-06-12 18:33:00," In our summary of economic projections, committee participants generally expect GDP growth to slow from last year's pace with a median projection of 2.1 percent this year and 2.0 percent over the next two years. In the labor market, supply and demand conditions have come into better balance. Payroll job gains averaged 218,000 jobs per month in April and May, a pace that is still strong but a bit below that scene in the first quarter. The unemployment rate ticked up but remains low at 4 percent. Strong job creation over the past couple of years has been accompanied by an increase in the supply of workers, reflecting increases in participation among individuals aged 25 to 54 years and a continued strong pace of immigration. Non-always growth has eased over the past year and the jobs to workers gap has narrowed. Overall, a broad set of indicators suggests that conditions in the labor market have returned to about where...",0.0009769427100751,0.0
2024-06-12 18:30:00,2024-06-12 18:33:00,2024-06-12 18:34:00," they stood on the eve of the pandemic, relatively tight but not overheated. FOMC participants expect labor market strength to continue. The median unemployment rate projection in the SEP is 4.0 percent at the end of this year and 4.2 percent at the end of next year. Inflation is eased notably over the past two years but remains above our longer-run goal of 2 percent. The global PCE prices rose 2.7 percent over the 12 months ending in April, excluding the volatile food and energy categories. Core PCE prices rose 2.8 percent. The consumer price index which came out this morning and tends to run higher than the PCE price index rose 3.3 percent over the 12 months ending in May. And the core CPI rose 3.4 percent. The inflation data received earlier this year were higher than expected though more recently, the readings have eased somewhat. Longer term.",0.0,0.0
2024-06-12 18:30:00,2024-06-12 18:34:00,2024-06-12 18:35:00," inflation expectations appeared to remain well anchored, as reflected in a broad range of surveys of households and businesses and forecasters as well as measures from financial markets. The median projection in the SCP for total PCE inflation is 2.6 percent this year, 2.3 percent next year, and 2.0 percent in 2026. My colleagues and I are acutely aware that high inflation imposes significant hardship as it erodes purchasing power, especially for those least able to meet the higher costs of essentials like food, housing, and transportation. Our monetary policy actions are guided by our dual mandate to promote maximum employment and stable prices for the American people. In support of these goals, the committee decided at today's meeting to maintain the target range for the federal funds rate at 5.25 to 5.5 percent and to continue reducing our securities holdings. As labor market tightness has eased, inflation has declined over the past year.",0.0,0.0
2024-06-12 18:30:00,2024-06-12 18:35:00,2024-06-12 18:36:00," risks to achieving armor deployment and inflation goals have moved toward better balance. The economic outlook is uncertain, however, and we remain highly attentive to inflation risks. We stated that we do not expect it will be appropriate to reduce the target range for the federal funds rate until we have gained greater confidence that inflation is moving sustainably toward 2%. So far this year, they'd have not given us that greater confidence. The most recent inflation readings have been more favorable in earlier in the year, however, and there has been modest further progress toward our inflation objective. We'll need to see more good data to bolster our confidence that inflation is moving sustainably toward 2%. We know that reducing policy restraint too soon, or too much, could result in a reversal of the progress that we've seen on inflation. At the same time, reducing policy restraint too late or too little could unduly weaken economic activity and employment.",0.0,0.0024369080805657505
2024-06-12 18:30:00,2024-06-12 18:36:00,2024-06-12 18:37:00," considering any adjustments to the target range for the federal funds rate, the committee will carefully assess incoming data, the evolving outlook, and the balance of risks. In our SCP, FOMC participants wrote down their individual assessments of an appropriate path for the federal funds rate based on what each participant judges to be the most likely scenario going forward. If the economy evolves as expected, the median participant projects that the appropriate level of the federal funds rate will be 5.1% at the end of this year, 4.1% at the end of 2025, and 3.1% at the end of 2026. But these projections are not a committee plan or any kind of a decision. As the economy evolves, assessments of the appropriate policy path will adjust in order to best promote our maximum employment and price stability goals. If the economy remains solid, an inflation persists, or prepared to maintain the current target range for the federal funds rate as long as appropriate.",0.0,0.0
2024-06-12 18:30:00,2024-06-12 18:37:00,2024-06-12 18:38:00," If the labor market were to weaken unexpectedly or if inflation were to fall more quickly than anticipated, we're prepared to respond. Policy is well positioned to deal with the risks and uncertainties that we face in pursuing both sides of our dual mandate. We'll continue to make our decisions meeting by meeting based on the totality of the data and its implications for the outlook and the balance of risks. The Fed has been assigned two goals for monetary policy, maximum employment and stable prices. We remain committed to bringing inflation back down to our 2% goal and to keeping longer term inflation expectations well anchored. Restoring price stability is essential to achieving maximum employment and stable prices over the long run. Our success in delivering on these goals matters to all Americans. We understand that our actions affect communities, families and businesses across the country. Everything we do is in service to our public mission. We get to federal do everything we can to achieve our maximum.",-0.0024960037994408,0.0
2024-06-12 18:30:00,2024-06-12 18:38:00,2024-06-12 18:39:00," employment and price stability goals. Thank you. And I look forward to your questions. Thank you, Mr. Chairman. Steve Liesman, CNBC. Just wondering if you could walk me through the committee's average inflation forecast. Core PCE is now forecast to be 2.8% by the year end. It's already 2.75. And after today's number, there were several forecasts on the street that it would be 2.6 at the end of this month. Does that tell you that the average official expects no further progress in inflation? And in fact, it's going to get worse. And if you have this wrong, doesn't it mean that you sort of you could have wrong the outlook for rates there? Yeah, so what's going on there is that we had very low readings in the second half last year, June through December, really. And we're now lapping those. So as you go through the 12 month.",0.0,0.0
2024-06-12 18:30:00,2024-06-12 18:39:00,2024-06-12 18:40:00," window, a very low reading drops out, and a new reading comes in, the new reading gets added to the 12 month window. So it's just a slight element of conservativeism that we're assuming a certain level of incoming monthly PCE and core PCE numbers. We're assuming a good but not great numbers. And if you put that on top of where we are now, you get a very slight increase in the 12 month reading. Now do we have high confidence that that's right? No, it's just a kind of conservative way for forecasting things. If we were to get more readings like today's reading, then of course that wouldn't be the case. So it's just a forecasting device. I think let me say that we welcome today's reading and then hope for more like that. But if it comes in just to follow up, it comes in the way you forecast it. It would seem strange for you to be cutting rates at all in context of a rising core PCE. Thank you.",0.0,0.0
2024-06-12 18:30:00,2024-06-12 18:40:00,2024-06-12 18:41:00," What we said is that we don't think it will be appropriate to reduce rates and begin to lose in policy until we have more confidence that inflation is moving back down to 2% on a sustainable basis. And that's the test we've applied. I don't know that this rules that in or out. I mean, really, it's a forecast, a fairly conservative forecast month by month that would lead to slightly higher, you know, 12 months rates by the end of the year. If we get, you know, good, better ratings in that, then you will see that come down or remain the same. If you're at 2.6, 2.7, you know, that's a really good place to be. Nick. Nick, Timer, also the Wall Street Journal. Chair Powell, if I look at the rate projections, I see 15, the 19 that are anticipating either one or two cuts this year, fairly evenly split between the two. And so I wonder if...",0.0,0.0026774997691811388
2024-06-12 18:30:00,2024-06-12 18:41:00,2024-06-12 18:42:00," If you could explain a little bit more the nuances of the differences there, would two or three more inflation readings like the one that we saw this morning make a September interest rate cut possible? So as far as the SCP part of that is concerned, as you know I talk to all of the other participants on the FMC every cycle and we talk about their summer of economic projections and the dot plot and everything and what I hear and see is that people are looking at a range of plausible outcomes and in many cases they are thinking I can't really distinguish between two of these. They are so close for me. These are very close calls but we ask them to write down the most likely one so they do. And as you said, there are 15 of the 19 are kind of clustered around one or two so I think I would look at all of them as plausible but I look at them.",0.0,0.0
2024-06-12 18:30:00,2024-06-12 18:42:00,2024-06-12 18:43:00," So I think that does tell you kind of what the committee thinks, but what everyone agrees on is it's going to be data dependent. No one brings to this or takes away from it that is on the committee a really strong commitment to a particular rate path. It's actually just their forecast and it's a combination of their forecast and their own reaction function. But again everyone would say that this is very data dependent and I don't hold it with high confidence. And I think if you're looking for and don't really think that they're not trying to send a strong signal that this is what I think is the right thing. It's just what they think at a given moment in time subject to data. In terms of future meetings we haven't tried to, we don't make decisions about future meetings until we get there. I think in terms of what we need to see I mentioned it earlier we want to gain further confidence. Certainly more good inflation readings will help with that. I'm not going to be specific about how many because really it's going to be not just.",0.0012052512373186,0.0
2024-06-12 18:30:00,2024-06-12 18:43:00,2024-06-12 18:44:00," the inflation rating, it's going to be the totality of the data. What's happening in the labor market, what's happening with the balance of risks, what's happening with the forecast, what's happening with growth. You look at all of that and you ask, are we confident? Have we reached an appropriate level of confidence that inflation is moving down sustainably to 2 percent? Or alternatively, do we see really unexpected signs of weakness in the labor market that would call for a response, which is another thing that could happen? But again, we don't see that. And we do see today's report as progress and as building confidence. But we don't see ourselves as having the confidence that would warrant, that would warrant beginning to loosen policy at this time. And if I could quickly follow up, did you or any of your colleagues change your interest rate projections after 830 or whatever you got the inflation numbers today? So this happens too often, but it does happen.",0.0,0.0
2024-06-12 18:30:00,2024-06-12 18:44:00,2024-06-12 18:45:00," to this, you know, data came, I think it happened a couple of meetings ago, a few meetings ago. So when that happens, when there's an important data print during the meeting, first day or second day, what we do is we make sure people remember that they have the ability to update, we tell them how to do that and some people do, some people don't, most people don't. But I'm not going to get into the specifics, but you have the ability to do that. So that, you know, what's in the SEP actually does reflect the data that we got today, to the extent you can, you know, reflect it in one day. I think we'll, you know, you will see PPI tomorrow, we'll know more about the PCE reading as the month goes on, but the initial CPI reading and it's, you know, kind of first level translation to PCE, we did have this morning, we were briefed about it and people were able to consider whether they should make changes. And as I said, you know, some people generally do, but most people generally don't.",0.0,0.0
2024-06-12 18:30:00,2024-06-12 18:45:00,2024-06-12 18:46:00," Hi Chair Powell, Janelle Marte from Bloomberg. As you noted, the labor market is now in many ways back to where it was before the pandemic. I wondered if you could comment on how officials are viewing that. So do you think that there still needs to be more cooling in the labor market to bring inflation all the way down to 2% or is there any sense that maybe the labor market is more vulnerable now to higher rates now that many of those imbalances have eased? Sure, so by so many measures the labor market was kind of overheated two years ago. And we've seen it gradually move back into much better balance between supply and demand. So what have we seen? We've seen labor force supply come up quite a bit through immigration and through recovering participation. That's ongoing mostly now through the immigration channel, but still we've had some increases in prime age labor force. In terms of on the demand side.",0.0,0.001588356973995087
2024-06-12 18:30:00,2024-06-12 18:46:00,2024-06-12 18:47:00," You know, we've seen, well, we've seen quits moving down. We've seen job openings moving down. We've seen wage increases moving from very, very high levels, a couple of years ago, back down to more sustainable levels. We have seen unemployment creep up now six tents over the course of a year or so, very, very gradually. So we put all that together, which you have is still low unemployment, still 4% unemployment historically low. But it's moved up a little bit. It's softened a bit. And that's an important statistic. But more than that, you've got strong job creation. You have payroll jobs still coming in strong, even though there's an argument that they may be a bit overstated, but still they're strong. So that's what we see. We watch the labor market, of course, in the economy as a whole, but the labor market very carefully. And that's what we see. We see gradual cooling, gradual moving toward better balance. We're monitoring it carefully for signs of something more than that, but we really don't see that.",0.0,0.0
2024-06-12 18:30:00,2024-06-12 18:47:00,2024-06-12 18:48:00," As a quick follow up the surveys that make up the job support are showing different tales. There's been some divergence especially we saw in the last report that we got on Friday. So how do you interpret that and how does it change your view on the labor market? So sometimes it's you can't reconcile the differences you just have to have to look at it and try to understand and that's why it always makes sense to look at a series you know in six and three six and twelve months of things rather than just one report. You're right to point to the last report where there was your job losses in the household survey, job gains, big job gains in the establishment survey. So I mean we're left with ambiguous results and we have to deal with that uncertainty around data. Nonetheless the overall picture is one of a strong and gradually cooling, gradually rebalancing labor market. Job openings while they've come way down are still you know greater than the number of unemployed people. The job's workers gap is still a significantly positive.",0.00054424443104904,0.0
2024-06-12 18:30:00,2024-06-12 18:48:00,2024-06-12 18:49:00," positive number greater than it was before the pandemic. So overall, we're looking at what is still a very strong labor market, but not the superheated labor market of two years ago, or even one year ago. Thanks, Dr. Powell. Neil Irwin with Axios. Back on the rates path, the SEP showed quite large shift of rate cut expectations relative to March. That's a period in which the economic data flow hasn't been that dramatic a shift. How can you provide some color on what changed attitudes on the committee of the last three months to see a much shallower path of rate cuts this year? Yeah, the big thing that changed was the inflation forecast. So the inflation forecast moved up several tents for the end of the year. And as I mentioned earlier in the, you know, what, what did we take away from this? We had really, really good inflation data in the second half of last year than kind of a pause in progress in the first quarter. And what we took away from that was that it's probably going to take.",0.0,0.0
2024-06-12 18:30:00,2024-06-12 18:49:00,2024-06-12 18:50:00," longer to get the confidence that we need to begin to loosen policy. So the sense of that is that rate cuts that might take place in, might have taken place this year, take place next year. You know, we, we, there are fewer rate cuts in the median this year, but there's one more next year. So, so you really, if you look at year end 2025 and 26, you're almost exactly where you would have been, just it, just it's moved later because of that progress. Now you get another, you get data, different data today. So we'll have to see where the data light the way. You know, we're, we're at, the economy has, you know, repeatedly surprised forecasters in both directions and today was certainly a better inflation report than almost anybody expected. And we'll just have to see what, what, what the incoming data flow means brings and how that affects the outlook and the balance of risks. Yeah.",0.0,0.0
2024-06-12 18:30:00,2024-06-12 18:50:00,2024-06-12 18:51:00," Thank you. Gina Smiley, thank you for taking our questions. In the summary of economic projections, the long run interest rate forecast moved up a bit. I wonder if we should read that as a sign that you think that policy is not as restrictive as we previously expected. How should we interpret what that means about how the committee views its current policy setting? So two things about that. One is this. You're right, it did move up. But I want to remember to point out that long run neutral rate of interest is a long run concept. It really is a theoretical concept can't be directly observed. And what it is is the interest rate they would hold the economy at equilibrium, maximum employment and price stability, potentially years in the future where there are no shocks. So it's a little bit, it's not something we observe today. Today we've got a very specific economy with all kinds of shocks. We're still getting over from the pandemic.",0.0,0.0018293358956354801
2024-06-12 18:30:00,2024-06-12 18:51:00,2024-06-12 18:52:00," I don't think that the concept of our starts very important concept in economics and in what we do. But honestly, it doesn't really get you where you need to be to think about what appropriate policy is in the near term. But back to your original question, people have been gradually writing it up because I just think people are coming to the view that rates aren't going to are less likely to go down to their pre-pandemic levels, which were very low by recent history. Now, we can't really know that. That's an interesting dispute and discussion to have now. But ultimately, we think that things like the neutral rate are driven by longer-run slow-moving forces. And, you know, there's a really good question about whether those really have changed or whether instead rates and the economy are experiencing a series of persistent, but ultimately temporary shocks. That's been the debate. And we can't know.",0.0,0.0
2024-06-12 18:30:00,2024-06-12 18:52:00,2024-06-12 18:53:00," in the meantime, we're making policy with the economy that we have, with the distortions that we have. And I also, to your other point, I think it is the case that as time has gone by, the question of how restrictive is policy has become one that everyone's asking, and we're asking it too. And, you know, my answer has been, the policy is restrictive, the question of whether it's sufficiently restrictive is going to be one we know over time. But I think for the reasons I talked about the last press conference and other places, I think the evidence is pretty clear that policy is restrictive and is having, you know, the effects that we would hope for. Well, thanks, Chair Powell. How is time with the writers. Just to carry that a little further, should we read this as a conclusion that the combination of tipping to one cut this year and acknowledging further progress on inflation as kind of a mark to market on the level of restrictiveness that you need, that you in fact have concluded that you...",0.0015784488428928598,0.0
2024-06-12 18:30:00,2024-06-12 18:53:00,2024-06-12 18:54:00," weren't quite there yet. I'd be reluctant to try to draw that conclusion. I think this is about looking at the incoming data and asking how much progress are we making on inflation and how is the rest of the economy doing? Is the labor market still strong? That's what we're thinking about. You can translate it into the language you're talking about. But to me, the focus is more on we have a goal which is price stability and another goal which is maximum employment. How are we doing there? We think we've got a good strong labor market still. We think we've been making progress toward the price stability goal. And then for a while there was a pause and we look at today's thing and we think, well, that's a good reading. And we hope we get more like that. And in the meantime, we're asking you, is our policy stance about right? And I think we think, yes, it's about right. We're prepared to adjust it as appropriate. But we think we're getting this...",0.0,0.0
2024-06-12 18:30:00,2024-06-12 18:54:00,2024-06-12 18:55:00," things that we would want to get broadly speaking. And that's why we've been to this policy right now for almost a year. So just to follow up on that, I think what curious thing here is you've got now this restrictive policy in place and virtually no change in any of the major things for all of this year. You've got growth that stays above long run potential throughout the forecast period. Pun employment that never goes above the long run estimate, right, of 4.2. So this isn't a story of slack improving inflation. So where's the improvement in inflation coming from that it's going to pick up pace so much in 2025? Well, it's been coming, where's it been coming from? We'll start with that. Clearly, some of what we've been getting is just the reversal of the unwinding of the pandemic-related distortions to both supply and demand. And that is complemented by an amplified, supported by restrictive monetary policy. So those two things have been working together. We've also had a very positive supply shock.",0.0,0.0
