original_time,start_time,end_time,speech,price_change,volatility
2024-11-07 18:30:00,2024-11-07 18:30:00,2024-11-07 18:31:00, Good afternoon. My colleagues and I remain squarely focused on achieving our dual mandate goals of maximum employment and stable prices for the benefit of the American people. The economy is strong overall and has made significant progress toward our goals over the past two years. The labor market has cooled from its formerly overheated state and remains solid. Inflation has eased substantially from a peak of 7% to 2.1% as of September. We are committed to maintaining our economy's strength by supporting maximum employment and returning inflation to our 2% goal. Today the FOMC decided to take another step in reducing the degree of policy restraint by lowering our policy interest rate by a quarter percentage point.,0.00038659271945750003,0.000622392679316385
2024-11-07 18:30:00,2024-11-07 18:31:00,2024-11-07 18:32:00," We continue to be confident that with an appropriate recalibration of our policy stance, strength in the economy and the labor market can be maintained, with inflation moving sustainably down to 2%. We also decided to continue to reduce our securities holdings. I'll have more to say about monetary policy after briefly reviewing economic developments. Foreign indicators suggest that economic activity has continued to expand at a solid pace. GDP rose at an annual rate of 2.8% in the third quarter, about the same pace as in the second quarter. Growth of consumer spending has remained resilient, and investment in equipment and intangibles has strengthened. In contrast, activity in the housing sector has been weak. Overall, improving supply conditions have supported the strong performance of the US economy over the past year.",3.3457948690229e-05,0.0002691427802448664
2024-11-07 18:30:00,2024-11-07 18:32:00,2024-11-07 18:33:00," The labor market conditions remain solid. Pay-roll job gains have slowed from earlier in the year, averaging 104,000 per month over the past three months. This figure would have been somewhat higher where not for the effects of labor strikes and hurricanes on employment in October. Regarding the hurricanes, let me extend our sympathies to all the families, businesses, and communities who have been harmed by these devastating storms. The unemployment rate is notably higher than it was a year ago, but has edged down over the past three months and remains low at 4.1% in October. nominal wage growth has eased over the past year, and the jobs to workers gap has narrowed. Overall, a broad set of indicators suggest that conditions in the labor market are now less tight than just before the pandemic in 2019. The labor market is not a source of significant inflationary pressures.",0.000269323153823771,0.00021870794078061146
2024-11-07 18:30:00,2024-11-07 18:33:00,2024-11-07 18:34:00," Inflation has eased significantly over the past two years. Total PCE prices rose 2.1% over the 12 months ending in September, excluding the volatile food and energy categories. Core PCE prices rose 2.7%. Overall inflation has moved much closer to our 2% longer run goal, but core inflation remains somewhat elevated. Our 2% longer-term inflation expectations appear to remain well anchored, as reflected in a broad range of surveys of households, businesses and forecasters, as well as measures from financial markets. Our monetary policy actions are guided by our dual mandate to promote maximum employment and stable prices for the American people. We see the risks to achieving our employment and inflation goals as being roughly in balance, and we're attentive to the risks to both sides of our mandate. At today's meeting, the committee decides...",-0.0003032777313777,0.0003028365691980719
2024-11-07 18:30:00,2024-11-07 18:34:00,2024-11-07 18:35:00," to lower the target range for the federal funds rate by a quarter percentage point to 4.5% to 4.3% and 3.4%. This further recalibration of our policy stance will help maintain the strength of the economy and the labor market and will continue to enable further progress on inflation as we move toward a more neutral stance over time. We know that reducing policy strength to restraint too quickly could hinder progress on inflation. At the same time, reducing policy restraint too slowly could undo a weakened economic activity and employment. In considering additional adjustments to the target range for the federal funds rate, the committee will carefully assess incoming data, the evolving outlook, and the balance of risks. We are not on any preset course. We will continue to make our decisions meeting by meeting. As the economy evolves, monetary policy will adjust in order to best promote our maximum employment and price stability goals.",0.00014346338199233255,0.000201860480764386
2024-11-07 18:30:00,2024-11-07 18:35:00,2024-11-07 18:36:00," If the economy remains strong and inflation is not sustainably moving toward 2%, we can dial back policy restraint more slowly. If the labor market were to weaken unexpectedly, where inflation were to fall more quickly than anticipated, we can move more quickly. Policy is well positioned to deal with the risks and uncertainties that we face in pursuing both sides of our dual mandate. The Fed has been assigned two goals for monetary policy. Maximum employment and stable prices. We remain committed to supporting maximum employment, bringing inflation sustainably to our 2% goal and keeping longer-term inflation expectations well anchored. Our success in delivering on these goals matters to all Americans. We understand that our actions affect communities, families, and businesses across the country. Everything we do is in service to our public mission. We get the Fed will do everything we can to achieve our maximum employment.",8.410400636926745e-05,0.0002683242770386651
2024-11-07 18:30:00,2024-11-07 18:36:00,2024-11-07 18:37:00," and price stability goals. Thank you. I look forward to our discussion. Thank you. Given the expectation that the election outcome will produce policies that would meaningfully impact the US economy next year, how is the committee taking these proposals into account for upcoming decisions, including potentially the next one in December? And can you give us any more sense of how proactive or reactive the Fed is prepared to be, to changes in economic policies with the next administration? Sure. So let me say that in the near term, the election will have no effects on our policy decisions. As you know, many, many things affect the economy and anyone who writes down forecasts in their job. We'll tell you that the economy is quite difficult, the forecast looking out past the very near term. Here, we don't know what the timing and substance of any policy changes will be. We therefore don't know what the effects on the economy would be, specifically what...",0.0001008995443367,0.00025231286795622754
2024-11-07 18:30:00,2024-11-07 18:37:00,2024-11-07 18:38:00," and to what extent those policies would matter for the achievement of our goal variables, maximum employment and price stability. We don't guess, we don't speculate, and we don't assume. Now just in principle, it's possible that any administration's policies or policies put in place by Congress could have economic effects over time that would matter for our pursuit of our dual mandate goals. So along with countless other factors, forecasts of those economic effects would be included in our models of the economy and would be taken into account through that channel. Nick. Chair Powell, Nick Timmeros from the Wall Street Journal. Roughly one year ago, when the tenure treasury was flirting with 5% and 30% of your mortgage rates when you were 8%, you noted how higher borrowing costs, if they were sustained, could weigh on economic activity. Even that you've said you believe policy is restrictive and the Fed has now dialed.",-0.0001619753856790067,0.00026069040911570903
2024-11-07 18:30:00,2024-11-07 18:38:00,2024-11-07 18:39:00," back that restriction. Are the growth risks presented by higher U.S. Treasury yields today? Any different from those you identified one year ago when inflation was still meaningfully above your target? So we just say this, we've watched the run-up in bond rates and it's nowhere near where it was of course a year ago. I guess the long-gone rates are well below that level. So we're watching that. Things have been moving around and we'll see where they settle. I think it's too early to really say where they settle. Ultimately I'm sure we've all read these decomposition of what you know and I certainly have but it's not really our job to provide our specific decomposition. I will say though that it appears that the moves are not principally about higher inflation expectations. They're really about a sense of more likely that of stronger growth. It perhaps less than the way of downside risks. So that's what they're about.",-2.303686203276135e-05,0.00015975381096924705
2024-11-07 18:30:00,2024-11-07 18:39:00,2024-11-07 18:40:00," you know, we do take financial conditions into account if they're persistent and if they're material, then we'll certainly take them into account in our policy. But I would say we're not at that stage right now. It's just something that we're watching. And again, these things don't really have mainly to do with fed policy, but to do with other factors in the economy. If I could follow up. Is the September SEP, are those rate projections still valid? They still seem relevant given where we are now? You know, you get halfway through the cycle between the last set and the next set. I wouldn't want to comment one way or the other. You know, people are, let's talk about the data we've gotten since the last meeting. So in the main, the economic activity data have been stronger than expected. The NIPAA revision was stronger. Certainly the September and Plumber report was stronger. The October report, not stronger, retail sales stronger. So overall, though, I think you take away a sense of...",-0.000563281240595832,0.00011770442736785379
2024-11-07 18:30:00,2024-11-07 18:40:00,2024-11-07 18:41:00," of some of the downside risks to economic activity having been diminished with the NIPA revisions in particular. And so overall feeling good about economic activity. So I think we would factor that in. At the same time, we got one inflation report which was, it wasn't terrible, but it was a little higher than expected. So I think really the question is December and you know, by December we'll have more data. I guess one more employment report, two more inflation reports and lots of other data and you know, we'll make a decision as we get to December. Gina Smiley from the New York Times, thanks for taking our question to Chair Powell. When it comes to December, what will you be looking at specifically as you try to make that decision? And then as of the Fed's economic projections in September, you had written down for quarter point interest rate cuts in 2025.",0.0005044130440109059,0.0005721737167183351
2024-11-07 18:30:00,2024-11-07 18:41:00,2024-11-07 18:42:00," Do you still think that those are likely, is that sort of the baseline outlook at this point or has that shifted and if it shifted at all, can you give a little bit of detail as to why? We don't fill out an SEP and I can't characterize one that wasn't filled out today. So I can't really speak for exactly where the committee is. I would just say for December we're going to be, again, in every meeting we're gonna be looking at the incoming data and how that affects the outlook. As you know, we're in the process of recalibrating from a fairly restrictive level at 5.33%. After today's move, we're down 75 basis points and we're asking ourselves is that where we need to be? You know that we're trying to steer between the risk of moving too quickly and perhaps undermining our progress on inflation or moving too slowly and allowing the labor market to weaken too much, we're trying to be on a middle path where we can maintain the strength in the labor market and also enable...",-2.523666373629592e-05,0.0002019012366450821
2024-11-07 18:30:00,2024-11-07 18:42:00,2024-11-07 18:43:00," for their progress on inflation. We think that's where we are, but that's the question we're gonna be asking in September and in other meetings. And again, I can't really update you on the committees thinking because we don't fill out an SEP at this meeting. Yeah, totally appreciate that. I guess when it comes to your own thinking, do you think that that a full percentage point of rate cuts in 2025 is a reasonable outlook? Again, we're gonna wait and see how things come in in December. I mean, I, it's just, I would put it this way. We're on a path to a more neutral stance. And that's very much where we're on. That has not changed at all since September. And we're just gonna have to see where the data leads. We have a whole six weeks of data to look at to make that decision in December. Obviously, I'm not ruling it out or in, but I would say, I would say that, you know, again, we didn't update.",0.00010094460322898516,0.000353410410460818
2024-11-07 18:30:00,2024-11-07 18:43:00,2024-11-07 18:44:00, the SEP so I'm not going to characterize where the committee would be. Thanks Howard Schneider with Reuters. I wanted if you could please elaborate and explain a little bit the two changes in the language of the statement here in the first paragraph when you say inflation has made progress dropping the word further progress and in the second paragraph dropping the sentence at the committee again greater confidence that inflation was progressing towards its 2% goal. Is there any policy substance behind either of those changes in language? Is it meant to open the door to a December pause? Is it meant to communicate anything about the stickiness of core inflation the last three months? Not really no. So let me tell you what we were thinking. So the test of gaining further confidence was our test for the first rate cut. And so we...,-5.888651607020608e-05,0.0002860219395651778
2024-11-07 18:30:00,2024-11-07 18:44:00,2024-11-07 18:45:00," We net that test in September, and therefore we take that test out. If you leave it in, then it's new forward guidance. It's brand new forward guidance. What do you mean by it? Are you making it, you're requiring yet further, we have to say yes or no at every meeting, whether we've made further progress. The point is we have gained confidence that we're on a sustainable path than a 2%. So that I would tell you is what that's really all about. It's not meant to send a signal. Neither of those is meant to send a further signal. Saying further progress, it becomes a test. We don't want to be, we don't think it's a good time to be doing a lot of forward guidance. There's a fair amount of uncertainty in that, in what I've said, the path that we're on, we do know where the destination is, but we don't know the right pace and we don't know exactly where the destination is. So the point is to find that, to find the right pace and the right destination as we go. And I think there's a fair amount of uncertainty.",0.00016825074745821096,0.00019350984796858258
2024-11-07 18:30:00,2024-11-07 18:45:00,2024-11-07 18:46:00," Certainly about that, you don't want to tie yourself up with guidance. You want to be able to make sensible decisions as you go. Steve. Steve Lee Smith, CNBC, Mr. Chairman, you talked about higher rates, perhaps from an expectation of higher growth. You didn't talk about it in terms of expectations of higher deficits. Is that something you think might be behind the recent rise in interest rates? And is that our rising deficits are concerned to you? So we know common in fiscal policy. And again, I don't have a lot more to say on what's driving bond yields. In terms of policy changes, though, let me give you a sense of how this works in the ordinary case. Let's say Congress is considering a rewrite of the tax laws, doesn't matter what's in the content. So we would follow that. At a certain point, we'd think we see the outlines. So we'd start to model it. And then we'd wait and we'd wait. And that it's a certain point to staff would breathe.",-0.0004710544854544,0.0002019012366450821
2024-11-07 18:30:00,2024-11-07 18:46:00,2024-11-07 18:47:00," the FOMC and say, you know, these are the likely effects. There's lots and lots of literature on the effects of tax policy changes on various parts of the economy. So we try to get smart on that and then the law actually passes and you know, you start to put it, you probably run an alternative simulation before that happens just to keep people trying to understand it. Then it actually passes, it goes into the model along with a million other things. So you know, we have a very large economy, many things are affecting at a given time. And you know, a law change of some kind would go in there, but it would go in. But it would, you know, it's a process that takes some time. Clearly the legislative process takes a lot of time. And of course, the real question is not the effect of that law. It's all of the policy changes that are happening. What's the net effect? And you know, the overall effect on the economy at a given time. So I think that's a process that takes a lot of time and that we go through all the time with every administration.",0.0004290082907475,0.00031973075305015495
2024-11-07 18:30:00,2024-11-07 18:47:00,2024-11-07 18:48:00, constantly and I just this will be no different and but you know right now we're there's nothing to there's nothing to model right now we're it's such an early stage we we don't know what the policies are and once we know what they are we won't we won't have a sense of you know when they'll be implemented or or all those sorts of things so I think I would just say we're not doing that now and all that will take time and it will be very much regular order when we when we do do that if I could just follow up on next question are the current rates something you feel like you need to lean against in that they go against the direction of policy by being adding restrictions to the economy or do you just take them as a given a perhaps a signal that you should do less I look I just think the first question is how long will they be sustained if you remember the 5% 10 year people were drawing were massively important conclusions only to find you know three weeks later the 10 year was 50 basis points lower so you know it's what its material changes,-5.065666504347031e-05,0.00012620950778299616
2024-11-07 18:30:00,2024-11-07 18:48:00,2024-11-07 18:49:00," financial conditions that last, that are persistent, that really matter. And we don't know that about these. What we've seen so far, we're watching it, we're reading, we're doing the decomposition and reading others, but right now it's not a major factor in how we're thinking about things. Chris. Thank you, Chris Regaber, an associated press. You mentioned the positive economic data that we've seen since the September meeting, including the revisions to things like savings, higher GDP growth. We saw stock market jump yesterday. That's renewed some of the questions about why, why do many cuts at all in this, with this backdrop? So you're right, as I mentioned, as you mentioned, the latest economic data have been strong and that's of course a great thing and highly welcome. But of course our mandate is maximum for employment and price stability. And we think that even with today's cut policy is still restrictive. We understand.",0.0001433464199420703,0.00019350007992377006
2024-11-07 18:30:00,2024-11-07 18:49:00,2024-11-07 18:50:00," It's not possible to say precisely how restrictive, but we feel that it is still restrictive. And if you look at our goal variables, the labor market has cooled a great deal from its overheated state of two years ago and is now essentially in balance. It is continuing to cool, albeit at a modest rate, and we don't need further cooling, we don't think to achieve our inflation mandate. So that's the labor market. And inflation has moved down a great deal from its highs of two years ago, and we judged, as I mentioned, that it's on a sustainable path back to 2%. So the job's not done on inflation, but if you look at those two things, we judged in September that it was appropriate to begin to recalibrate our policy stance to reflect this progress, and today's decision is really another step in that process. Overall, as I mentioned, we believe that with an appropriate recalibration of our policy stance, we can maintain strength in the labor market even as our policy stance enables further progress toward our inflation goal.",0.00020163789175890002,0.00020223777273278642
2024-11-07 18:30:00,2024-11-07 18:50:00,2024-11-07 18:51:00," Great. And just to follow up, what might cause you to pause rate cuts in December? What kind of economic data would lead you to that path? Thank you. So we haven't made any decision like that at all. So we're in the process, as I mentioned, of moving policy down our stance down over time to more neutral level. And as a general matter, as we move ahead, we are prepared to adjust our assessments of the appropriate pace and destination as the outlook evolves. So for example, if we were to see the labor market deteriorating, we'd be prepared to move more quickly. Alternatively, as we approach levels that are plausibly neutral or close to neutral, it may turn out to be appropriate to slow the pace at which we're dialing back restriction. Again, haven't made any decisions about that, but that's certainly possibility. If you can think of it as similar to what we do with asset, with asset runoff with QT. So we reach a point where we...",-0.00037007923940685555,0.0004794065451608841
2024-11-07 18:30:00,2024-11-07 18:51:00,2024-11-07 18:52:00," slow the pace, much like an airplane reaching the airport slows down. And so we're thinking about it that way, but it's something that we're just beginning to think about. Thanks, Sherpa. So with the noise and the jobs reports that we've seen, and you look at the Fed's favorite inflation, PC inflation, overall, it's 2.1 percent, very close to the Fed's target, but core inflation is 2.7 percent, and it's been that way since July. So why doesn't this data give fuel to a rate pause for this meeting? Well, so I think if you look at the three and six month, you're quoting the 12 month. So we look at all of them, right? But if you look at the three and six month core PCE, you'll see there are around 2.3 percent. So we look at all of them, and we look at 12 as well. But what it's telling us is that we really have made significant...",0.00017653890073635552,9.248049502278379e-05
2024-11-07 18:30:00,2024-11-07 18:52:00,2024-11-07 18:53:00," in progress. And we expect there to be bumps. For example, you know, the last three months of last year, the core PCE readings were very, very low, probably unsustainably low. So that's why you see, that's why forecasts generally see a couple of upticks toward the end of the year. On the other hand, the January reading certainly looks like an example of residual seasonality, so that that we saw last year. So when that falls out of the 12-month calculation in February, we should see a thing down. So we'll literally be a bump up and then down. We understand that. Overall, you see the progress on inflation, and you also look at the economy and you say, what's, what is the inflation story now? Where's it coming from? So I point to a couple of things. One is the non-housing services and goods, which together make up 80% of that of the core PCE index. Are back to the levels they were at the last time we had some...",-0.0003110277185475,0.00028583438419497114
2024-11-07 18:30:00,2024-11-07 18:53:00,2024-11-07 18:54:00," sustained 2% inflation, which happens to be in the early 2000s for period of 5, 6, 7 years. So they're back to that level. What's not is housing services. So let's talk about housing services. Housing services is higher. What's going on there is market rents, newly signed leases are experiencing very low inflation. And what's happening is older leases that are turning over are taking several years to catch up to where market leases are, market rent leases are. So that's just a catch up problem. It's not really reflecting current inflationary pressures. It's reflecting past inflationary pressures. So that's one thing. The other thing is I'd say look at the labor market, not a source of inflationary pressures. Where's it coming from? It's not a very tight economy. What is the story about inflation? You see that catch up inflation also in insurance in several other areas. So you're seeing we're not, we're not declaring victory obviously, but we feel like the story is very consistent with inflation.",0.0004374274845295,0.00019335205205375035
