original_time,start_time,end_time,speech,price_change,volatility
2024-06-12 18:30:00,2024-06-12 18:55:00,2024-06-12 18:56:00," on the labor side and also you get a positive supply shock when the supply conditions unwind and return to normal. So you've had above trend potential growth and at high growth and yet you've had the benefit of inflation coming down, you know, really fast actually last year and you will see what the rest of this year brings. So these dynamics can continue as long as they continue. I mean, ultimately the question is ultimately, are you down to demand? We don't know that though. I mean, we're looking at today's report, you know, if we see more like that, you know, we can't know what the future holds. But in the meantime, we've made pretty good progress on inflation with our current stance. Michael McKee from Bloomberg Radio and television. The base case of the committee seems to be that there is going to be at least one rate cut this year, but your growth forecast doesn't see any.",0.0,0.0022066902416280573
2024-06-12 18:30:00,2024-06-12 18:56:00,2024-06-12 18:57:00," down in the rest of the year, in order to the unemployment forecast, see any significant weakening of the labor market, and your inflation forecast basically average out to no change. So if at the end of the year there is no change from conditions now, why would you anticipate cutting rates? What would be the point for a rate cut? Well, we think policy is restrictive. And we think ultimately that if you just set policy at a restrictive level, eventually you will see real weakening in the economy. So that's always been the thought is that since we raise rates this far, we've always been pointing to cuts at a certain point, not to eliminate the possibility of hikes, but no one has that as their base case. So no one on the committee does. But so that's how we think about it, and that's what we've been getting. That's what we've been getting is good progress on inflation with growth at a good level.",0.0,0.0
2024-06-12 18:30:00,2024-06-12 18:57:00,2024-06-12 18:58:00," And with a strong labor market. Now, ultimately, we think rates will have to come down to continue to support that. But so far, they haven't had to. And that's why we're watching so carefully for signs of weakness. We don't really see that. We kind of see what we wanted to see, which was gradual cooling in demand, gradual rebalancing in the labor market, while we're continuing to make progress on inflation. So we're getting a good results here. Well, to follow up, is there any kind of concern for the housing industry or financial stability banks in leaving rates where they are for too long at this point? Well, in housing, housing situation is a complicated one. And you can see that's a place where rates are really having a significant effect. I mean, ultimately, the best thing we can do for the housing market is to bring inflation down so that we can bring rates down so that the housing market can continue to normalize. There will still be a national housing shortage.",-0.0008871369724572999,0.0
2024-06-12 18:30:00,2024-06-12 18:58:00,2024-06-12 18:59:00," as there was before the pandemic, there will still be one, but the distortions that we see now with lock-ins and things like that, low mortgages. In terms of banks, the banking system has been, you know, solid, strong, well-capitalized, lending. You know, we've seen good performance by the banks. We had the turmoil early at last year, but, you know, banks have been focusing on bringing up their liquidity, bringing up their capital and having risk management plans in place. So the banking system, you know, seems to be, seems to be in good shape. Chris. Thanks. Chris Regaber at Associated Press. I was wondering if we can read on inflation. If you can tell us a little more about where you see inflationary pressure in the economy, you mentioned labor markets coming into better balance and inflation expectations appear to be well anchored. You're seeing, you know, anecdotal stories of the large chains like Walmart and Target are announcing price.",0.0,0.0
2024-06-12 18:30:00,2024-06-12 18:59:00,2024-06-12 19:00:00," cuts McDonald's announcing a $5 meal deal. So, you know, people may still be unhappy about prices at the grocery store, but it doesn't seem like there's a lot of inflationary pressure left in this economy. And what if you could tell us more about it? So I think that's true. That inflationary pressures have come down, but we still have, we're still getting high inflation reading. So, you know, and I think you can see it in various places in, you know, in some parts of non-housing services, you see elevated inflation still, and that's probably to do with, it could be to do with wages. Goods prices have kind of fluctuated. There's been a surprising increase in import prices on goods, which is kind of hard to understand. And, you know, mate may, we've taken some signal from that, but, you know, and of course, housing services, you're seeing, you're continuing to see high readings there to some extent that's, you know, catch up inflation from earlier pressures. But, I mean, overall, your...",0.0,0.0
2024-06-12 18:30:00,2024-06-12 19:00:00,2024-06-12 19:01:00," Right, inflationary pressures have come down. As I mentioned, the labor market has come into better balance. Wages are still running, I would say, above a sustainable path, which would be that of trend inflation and trend productivity. You're still seeing wage increases moving above that. We haven't thought of wages as being the principle cause of inflation, but at the same time getting back to 2% inflation is likely to require return to a more sustainable level, which is somewhat below the current level of increases in the aggregate. Rachel. Hi, Chair Powell, Rachel Siegel from the Washington Post. Thanks for taking your questions. There's obviously a lot of focus on how many cuts could be expected this year, but can you give us a sense of what one cut by the end of the year would actually do to the economy, what you think would be a meaningful difference if there was a cut by the end of the year or even two? I think if you look back in 5 or 10 years and try to pull out the significance to the...",0.0,0.0016223590575568665
2024-06-12 18:30:00,2024-06-12 19:01:00,2024-06-12 19:02:00," U.S. economy of one 25-based point rate cut. You'd have quite a job on your hands. So that's not how we look at it. You know, really the whole rate path matters. And I do continue to think that when we do start to lose in policy, that will show up in a significant loosening and financial market conditions. And the market will price in what it prices in. I don't have no way of saying, we're not at that stage. So I don't know what we'll be thinking about at that time. But it's a consequential decision for the economy. And you know, you want to get it right. And fortunately, we have a strong economy and we have the ability to approach this question carefully. And we will approach it carefully. While we're very much keeping an eye on, you know, downside economic risks, should they emerge? And you've been talking about this clear sense that it's just going to take longer to have the confidence that's needed for rate cuts. Is there something about what happened in the first couple of months of the?",0.0,0.0
2024-06-12 18:30:00,2024-06-12 19:02:00,2024-06-12 19:03:00," that you're seeing differently now with more time or hindsight. Do you still characterize it as expected bumpiness or something more lasting that is affecting your policy for the rest of the year? You know, we always want to avoid the tendency to dismiss the parts of inflation that we don't like and just make it go away. So, but we had a quarter where inflation was running higher and yes, I could stand here and say, it's stuff we shouldn't have taken signal from, but it is what it is. You know, you have to, you know, low inflation is low inflation high. So, if you have a quarter where it's higher, we tried not to take signal from the first couple of months, but we got a third month and we said, okay, the signal we're taking is that, you know, we think it's going to take longer to get confidence that inflation is moving systemably on 2%. That's what we said. I think that was the right thing to do. I still think that's the right thing to do. Now, we have today's inflation reading, which is very different, very much more positive. We're going to have to see what the trend is, what's going to be the data going forward. We're looking for something that gives us confidence that inflation.",-0.000488600471049,0.0
2024-06-12 18:30:00,2024-06-12 19:03:00,2024-06-12 19:04:00," is moving sustainably down to 2%. And readings like today's, you know, that's a step in the right direction, but you know, one reading isn't, it's just, it's the only one reading, you don't wanna be too motivated by any single data point. Jolyne. Hi, Chair Powell. Thank you for taking our questions. I'm Jolyne Kent with CBS News. What's your message to Americans who are seeing, encouraging economic data, but don't feel good about this economy? I don't think anyone knows, has a definitive answer why people are not as happy about the economy as they might be, and we don't tell people how they should think or feel about the economy. That's not our job. We, you know, people experience what they experience. All I can tell you is what the data show, which is we've got an economy that's growing at a solid pace. We've got a very strong labor market with unemployment at 4%. It's been a long time.",0.0,0.0
2024-06-12 18:30:00,2024-06-12 19:04:00,2024-06-12 19:05:00," since we've had a long stretch of time with unemployment at or below 4% very long time. We had a period of high inflation. Inflation has come down really significantly, and we're doing everything we can to bring that inflationary episode fully to a halt and fully restore price stability. We're confident that we'll get there. And in the meantime, it's going to be painful for people. But the ultimate pain would be a period of long, a long period of high inflation. It is people who lower income, people people who put the margins of the economy who have the worst experience, who experience the most pain from inflation. So it's for those people for all Americans, but particularly for those people that we're doing everything we can to bring inflation back down under control. That's just a quick follow up here. You've indicated one interest rate cut sometime this year. And I know you don't have a crystal ball up there, but a lot of people are watching and see borrowing money remains very...",0.0,0.0
2024-06-12 18:30:00,2024-06-12 19:05:00,2024-06-12 19:06:00," expensive for everybody who's out there waiting on a rate cut about when can consumers expect some relief? Well, you know, I don't have a precise date for you, but what we said is that we want to make sure that we're confident that inflation is actually moving back down to 2%. And when we are, then we can look at loosening policy. So having that kind of confidence, the inflation will be at 2%. It just pays benefits to the whole economy to all Americans for a long period of time. We had that period for a very long time. We very much want to get back to a place where people cannot think about inflation. It's just not a concern in the everyday economic decisions that they make. We were there for a long time, and our goal is to get back to that place. And we've made good progress, and we're in the phase now of just sticking with it until we get it done. Clear.",0.0,0.0012719128463196388
2024-06-12 18:30:00,2024-06-12 19:06:00,2024-06-12 19:07:00," our Jones financial times. Just drawing on the change and the statement on the being more disfur the progress on inflation. Halfway through the year and after today's CPI release, what have you and other committee members found that has been particularly encouraging to you? Just in terms of the conservatism, how much of that is about stickiness and shelter inflation in particular. Thank you. So encouraging has been that growth, you know, the growth clearly that we had last year, particularly the second half of last year, and we continue to see still strong growth, solid growth this year. That's been very encouraging. If you go back a year, there was a real concern about, you know, very much slowing growth and recession. Many forecasters had that and that's not what happened. Instead we got the US's anyway and it's in it's in sharp distinction with many other advanced economies around the world. So",0.0,0.0
2024-06-12 18:30:00,2024-06-12 19:07:00,2024-06-12 19:08:00," That's been encouraging. I would say that today's inflation report is encouraging, but it comes after several reports that were not so encouraging. You ask about, your second question was really about shelter inflation. So I think if you go back a couple of years, we know that there were renters, and then there are people who own their houses, and we have OER, which is, and there's equivalent rent. And so when market-based rents go up sharply, as they did at the beginning of the, when the economy reopened, they really went up sharply. Those play into roll over rents much more slowly for existing tenants than they do for new tenants. And so what we found now, that there are big lags. So there's sort of a, there's a bulge of high past increases in market rents that have.",0.0006261928159261999,0.0
2024-06-12 18:30:00,2024-06-12 19:08:00,2024-06-12 19:09:00," has to get worked off and that may take several years. Nonetheless, as long as market rents remain or going up at relatively low levels and they still are, this is just going to happen. It's just going to happen more slowly than we thought. We also do this thing where we impute rental value to owned homes. And many countries around the world do that. Some do it differently than us. It's something that the price experts have regularly looked at. It is not something that we're the only country that does. And it's not something we're looking at changing or we'd look at changing anytime soon. But it's true. It's one of the very hardest things in inflation and in prices is how to think about the services that someone is getting by living at home, that they could rent, but they're actually living in it. And some countries should just ignore that. That's not how we do inflation.",0.0,0.0
2024-06-12 18:30:00,2024-06-12 19:09:00,2024-06-12 19:10:00," here. We do it the way we do it and we've been very transparent about it and you know it's true that we're we're seeing delays in realizing what's happening economically but we understand that you know we understand that very well. Edward Lawrence with the Fox Business thank you for taking the question and chair file so I want to go back to jobs and the consumer. The last jobs report showed that over the past year 634,000 more people took multiple jobs. That's up 8.2% and since January of 2021 we've seen prices rise 19%. So people are using their credit cards to pay for their lifestyle. What pressure points will signal to you that the slowing economy could maybe break companies in terms of hiring or break the consumer in terms of spending? So you know we monitor all the things you mentioned and more you know we're seeing is basically spending was going up faster than disposable income during big parts of next year.",0.0,0.0
2024-06-12 18:30:00,2024-06-12 19:10:00,2024-06-12 19:11:00," year, so last year rather. And so what that you'd expect to see is people spending more on their credit cards that it that has been happening. Credit card balances have been going up. Credit card defaults have been going up. They're not at high levels. We remember that after the pandemic, people were cooped up. They couldn't spend money. They couldn't go out to spend money. They could spend money from home. But households were in very, very strong, historically strong financial shape. They've now worked off a lot of that. So we're watching that carefully. And what do we see? That's what we see. We see the same data that everybody else sees. But you still got household sector that's in pretty good shape. But nonetheless, it's not in the kind of shape it was in a year or two ago. And we're carefully watching that. So how close then are we to that point where the consumer can't continue to spend as a spending or companies can't hire? Like they're hiring. Consumer spending is still growing. It's not growing at the pace it was growing at a year or so ago. But it's still growing solidly. And by the way,",0.0,0.0012713503952240357
2024-06-12 18:30:00,2024-06-12 19:11:00,2024-06-12 19:12:00," other parts of the economy are picking up spending on equipment and intangibles has picked up quite a bit in the wake of all the construction that we saw of new tech plants. So overall the economy is exhibiting solid growth and something around 2%, which is a good pace of growth for the U.S. economy. But you're right though. We do see the same thing other people see, which is increasing financial pressures on more lower income people. The best thing we can do is to foster a very strong jobs economy, which we think we have done, ultimately to get inflation under control because those people experience inflation very directly, very painfully. And once we get inflation of a control rates can come down, which will also improve things.",0.0,0.0
2024-06-12 18:30:00,2024-06-12 19:12:00,2024-06-12 19:13:00," You've mentioned that unexpected weakening in the labor market would bring rate cuts sooner. And I was just wondering, can you talk a little bit about what that would look like? Is it more of like a quicker pace of people losing jobs? Is it more the level of the unemployment rate if it were to start to go above 4.2 or something like that? How are you thinking about what you're looking for to see the job market unexpectedly weakened? You know, when I say unexpectedly, the first thing is more than kind of is in our forecast or in common forecasts. So something more than that. But we'll be looking at everything. The labor market has the ability, has the tendency sometimes to move to weaken quickly. So waiting for that to happen is not what we're doing. We're watching very carefully. We're looking at the balance of risks. I always point out the balance of risks. And also the fact that we look at all of the whole...",4.539609427130003e-05,0.0
2024-06-12 18:30:00,2024-06-12 19:13:00,2024-06-12 19:14:00," situation. So, you know, a decision to begin to, you know, to loosen policy could have several reasons associated with it at a given time. But, you know, we monitor all the labor market data and if we saw troubling weakening more than expected, then that would be something we'd consider responding to. But we look at the broader context of what's going on, too. So, something like negative payroll numbers would be... I'm not going to... Yeah, I mean, I can take up things that would... many things would make it on that list, but I don't think I'll... I'll butter them here. Thank you, Chair Powell. Simon Urbanovich with the Economist. May I ask you mentioned with the slightly higher PC readings earlier this year, that it wasn't one or two months, but three months that tipped you to be a bit more cautious in the rate outlook. Should we take from that, that, you know, it looks like May will be quite...",0.0,0.0
2024-06-12 18:30:00,2024-06-12 19:14:00,2024-06-12 19:15:00," good for PC as it was for CPI does that imply that kind of two more good months would reensteal the confidence that rate cuts could be coming sooner than you currently project? You know I don't actually have that kind of mechanical thing in my thinking. I get that as many good ones as we had bad ones but it's not like that. It's the whole, it's going to be the totality of the data. Labor market data, the growth data in terms of inflation. You know you'd want to see real progress that build your confidence that we are a path down to 2% and I don't want to try to give you specific numbers of things because that points to a date and I just don't think we're not at a point of being able to do that. Thank you for doing this. I'm Kostya Takami with Nikkei. I would like to know about the impact of a stronger dollar on US economic growth and prices and I have a note.",0.0,0.0
2024-06-12 18:30:00,2024-06-12 19:15:00,2024-06-12 19:16:00," So that market should determine the exchange rate, but Japan and some emerging market suffering from the strong data. So I want to know if it is having a positive impact on US economy in total. Thank you. So we don't actually, it's our finance ministry, the Treasury Department, that has a responsibility for thinking about and if it sees fit, doing things about the level of the dollar. So for us, it's just another financial variable and you write the dollar has exhibited some strength over the course of the last year or so because the US economy is very strong. We don't think of it as benefiting or hurting the US. We don't, again, we don't manage the level of the dollar that's not our job. It's not, you know, for our economy, what we're trying to foster is maximum employment and price stability and we feel like we've made good progress on both of those goals over there.",0.0,0.0012333406965612972
2024-06-12 18:30:00,2024-06-12 19:16:00,2024-06-12 19:17:00," course of the past year. Jennifer. Jennifer. Thank you, Chair. Paula Jennifer-John Burger with Yahoo Finance. You said you would cut rates before inflation falls to 2%. Your forecasting inflation to end the year at 2.8% on Core PCE or at 2.8% of course on Core PCE. Right now, you said the inflation forecast is conservative and that if you got 2.6 to 2.7 on PCE, that would be a good place to be. You also indicated the job market has mostly normalized. So why not cut rates this summer just once, you're well above neutral to try to preserve the soft landing rather than risking waiting too long and the quest for confidence for inflation? You know, so we are well aware of the two-sided risks here. Let me just say we understand that if we wait too long, that could come at the cost of economic activity of employment of the expansion. We understand that if we move too.",0.0,0.0
2024-06-12 18:30:00,2024-06-12 19:17:00,2024-06-12 19:18:00, quickly we could end up undoing a lot of the good that we've done and have to then start over and it could be very disruptive. So we're extremely aware of both of those risks and just basically trying to manage them. And what we said is that we don't think it will be appropriate to begin to loosen policy until we're more confident that inflation is moving down to 2% over time on a sustainable basis. That's kind of been our test. Or there's another test which is unexpected deterioration in labor market conditions. So I think that's the right way for us to think about it. That's our dual mandate there. And we have a strong economy. We've got growth. All forecasts are very commonly around 2%. That's a strong growth rate for our economy. The labor market continues to print jobs at a pretty high rate and the employment is still low. So we have the ability.,-0.003797882361592,0.0
2024-06-12 18:30:00,2024-06-12 19:18:00,2024-06-12 19:19:00," Now, to approach this question carefully, and that's what we're doing. Just to follow Chair Powell, do you need to be ahead of a week in the labor market? Otherwise, is it too late, given that the labor market is a lagging indicator, right? When you look at the monthly jobs data. Yeah, we completely understand that that's the risk, and that's not what we're, that's not our plan. It's to wait for things to break and then try to fix them. We're trying to balance these two goals in a way that is consistent with our framework. And we think we're doing that. Evan. Thank you, Chair Powell. Evan Riser with Market News International. You have mentioned before the framework review process will start in the latter half of the year. At this point, do you have any specific time frame for the start of that? Who will lead it? Will it be you or a member of a committee group of your peers? What will be the parameters?",0.0,0.0
2024-06-12 18:30:00,2024-06-12 19:19:00,2024-06-12 19:20:00," Do you anticipate the review will consider changes communications going forward? So what we've been thinking is that we would announce and commence the review later or late in the year. In the meantime, as that time approaches, we will be devoting a lot of careful thought and planning to the contours of it. Within scope would certainly be communications generally. I'm not gonna say that we'll look at this or that particular thing and all the other details. We don't wanna get prematurely into a conversation until it's really time to have it. And so I'm gonna leave pretty much everything else to a later in the year. Good and Nancy for the last question. Hi, Chair Powell, Nancy Marshall, Genser with Marketplace. Just one more question on housing. Can you still cut rates with shelter prices high?",0.0,0.0
