original_time,start_time,end_time,speech,price_change,volatility
2024-11-07 18:30:00,2024-11-07 18:54:00,2024-11-07 18:55:00," and continuing to come down on a bumpy path over the next couple of years and settling around 2%. That story isn't tacked and it won't be one or two really good data months or bad data months aren't going to really change the pattern at this point now that we're this far into the process. So you're quickly trying to get to that neutral rate that you see or do you use forcey that you have some time to get there? Nothing in the economic data suggests that the committee has any need to be in a hurry to get there. We are seeing strong economic activity. We are seeing ongoing strength in the labor market. We're watching that carefully. But we do see maintaining strength there. And so we think that the right way to find neutral, if you will, is carefully, patiently. Again, that does not meant to have a specific meaning other than we, to the extent the economy remains strong. We have the ability to take advantage of that as we try to navigate that middle path between the two risks.",-0.000370178557413903,0.00040349697377271203
2024-11-07 18:30:00,2024-11-07 18:55:00,2024-11-07 18:56:00," Hi, Chair Powell, Craig Taurus from Bloomberg. Two questions today. Did you learn anything about what Americans think about the economy from the election results? First question. Second question. I want to talk about some labor market indicators. And I do so with great respect for your attentiveness to the maximum employment side of the mandate, Chair Powell. So the unemployment rate has been at 4% or higher for six months. One of the broadest measures of unemployment is up about a half a point from a year ago. Compensation gains are sliding back. The quits rate, a signal of labor market dynamism, has been heading down to that bad neighborhood of the 20 teens. So you have put a marker at Jackson Hole saying, any further cooling is unwelcome. It is cooling generally a little bit further. So at what point do we reach what you would describe?",3.3443683469401e-05,0.00021848739495797554
2024-11-07 18:30:00,2024-11-07 18:56:00,2024-11-07 18:57:00," as a shortfall from maximum employment. Thank you. Sure. So on your first question, I'm not going to talk about anything that relates directly or indirectly to the election. On the second one, you know, this is the great question and so when we think about all the time. So I'll just say a couple of things. You know, nothing really surprising here. What we know is that the unemployment rate is low. You also know that it's come down significantly, sorry, moved up significantly from a year or so ago. So we've seen a big change upward and unemployment. Sometimes that has meant bad things so far. It doesn't appear to be, it appears that the, I wouldn't say that the labor market has fully stabilized. Because I do think it's continuing to very gradually cool. But it seems to be in a good place and our policy, of course, is designed to keep it in that good place to maintain the strength in the labor market while also enabling further progress on inflation. You know, you mentioned...",-0.00015126050422989803,0.00018489259421101278
2024-11-07 18:30:00,2024-11-07 18:57:00,2024-11-07 18:58:00," a bunch of indicators and you're right, you know, the openings to an employment rate is back to a normal level. I would characterize it more broadly as normalizing. You mentioned wages. Wages are still running just a bit above where they would need to be consistent with 2% inflation. Less productivity is going to remain at this high level. If we see productivity, more sustainably at these high levels, then that would sustain higher wage gains. So I would say, in fact, you can say it the other way, that wage increases are now consistent with 2% inflation, given current productivity readings. But of course, the lower on productivity readings is, whenever you see high readings, you should assume they're going to revert pretty quickly to the longer term trend. That has always been the case for 50 years. But it may be that wefully少ved day gains.",-0.00016795283721150002,0.00028007531437027896
2024-11-07 18:30:00,2024-11-07 18:58:00,2024-11-07 18:59:00," We're now five years, if you look at the NIPPA revisions that came out a month ago. We're five years into a nice set of productivity readings which are sustained and very healthy. But overall it's a good labor market. We can talk about 20 different data series. We'll be looking at all of them, of course. But we don't want the labor market to soften much from here. We don't think we need that to happen to get inflation back to 2%. Victoria. Hi, Victoria, we know with Politico. Some of the President's election advisors have suggested that you should resign. If he asked you to leave, would you go? No. Can you follow up on, do you think that legally he did not require to leave? No. What? That's Michael McEw from...",0.0004811409216798,0.0003361358103016241
2024-11-07 18:30:00,2024-11-07 18:59:00,2024-11-07 19:00:00," from Blueburg Radio and television. You talk a lot about what the data are telling you and how you are dependent on the data, but in terms of forward looking assessments of the economy, what are you hearing from CEOs or other officials around the country? What did you hear today from the regional bank presidents about what companies and consumers think about where the economy is going from here rather than looking backwards? And does that match up with what your forecasts have been and what you think the appropriate policy paths should be? So it's hard to characterize a really interesting set of discussions we had, and of course, you'll see them in the minutes in three weeks. But I would say this. I think the comments from our reserve bank colleagues and from the CEOs that they talked to are pretty constructive on the economy right now, pretty constructive, feeling that the labor market is.",-0.0003633466545037,0.0003195264281991399
2024-11-07 18:30:00,2024-11-07 19:00:00,2024-11-07 19:01:00," is back to normal to the point where it's no longer that much a discussion topic in their world. Whereas two years ago, it was all they were talking about. So they feel like the labor markets in balance, people feel good about where the economy is. Demand is obviously pretty strong. And you're seeing what, 2.8% growth in the third quarter estimated maybe the years, two and a half. This is a strong economy. It's actually remarkable how well the US economy has been performing with strong growth, a strong labor market inflation coming down. We're really performing better than any of our global peers. And I think that is reflected in what you hear from what I hear people hear from CEOs. I don't get to talk to a lot of CEOs in my job, but I hear what others summarize from those. And of course, I hear the Reserve Bank presidents do a lot of that. And it's pretty constructive overall. Now that's not to say there are areas of cost.",0.0004728511358186,0.002019522046448892
2024-11-07 18:30:00,2024-11-07 19:01:00,2024-11-07 19:02:00," and things like that, but ultimately overall pretty positive. The follow-up, the areas of caution, if there were black clouds on the horizon that you identified as something you're watching, what would they be? I think it's things like clearly geopolitical risks around the world are elevated, and just as clearly they've had relatively little effect on the U.S. economy. Now, that can change through the price of oil or otherwise, but people talk about those as something that's on the horizon all the time. But ultimately, if you look at the U.S. economy, its performance has been very good, and that's what we hear from business people, and expectation that that will continue. If anything, people feel next year, I've heard this from several people that next year could even be stronger than this year. Andrew.",-0.00035533151738912483,0.0008579936407530004
2024-11-07 18:30:00,2024-11-07 19:02:00,2024-11-07 19:03:00," Hi, it's Andrew Ackerman with the Washington Post. I just wanted to follow up on the discussion earlier on fiscal policy. Your predecessor's green span and vulgar spoke up loudly when they thought large budget deficits, endangered financial economic or financial stability. Will you do that too? And right now we're in a period of full employment. We have large budget deficits and debt at historic highs that are end rising. Is that something you'd speak out against? So, you know, I have said many times, no more, no less than what the predecessors you mentioned have said. And what that is is that the US federal government's fiscal path, fiscal policy is on an unsustainable path. The level of our debt relative to the economy is not unsustainable. The path is unsustainable. And we see that and you know, you've got a very large deficit at, you're at full employment.",-0.00013450803685517514,0.00048770643436137973
2024-11-07 18:30:00,2024-11-07 19:03:00,2024-11-07 19:04:00," and that's expected to continue. So it's important that we, you know, that to be dealt with, it is ultimately a threat to the economy. Now I can say that. I don't have oversight. We don't have oversight over fiscal policy. I've said it on many occasions. Just said it again. Okay, thank you. I guess the other way or the question is, to follow up on Victoria's question, do you believe that the president has the power to fire or to moat you and it has the Fed to determine the legality of a president demoting out will any of the other governors with leadership positions? Not permitted under the law. Not what? Not permitted under the law. Thank you. Courtney. Courtney Brown from Axios. In response to Howard's question, you said it wasn't an ideal time to give forward guidance because of the economic uncertainties. Can you lay out what some of those uncertainties are and whether or not includes some of the proposals that the president elect has?",0.0003531288429897,0.0005551536766314637
2024-11-07 18:30:00,2024-11-07 19:04:00,2024-11-07 19:05:00," put out on the campaign trail, tariffs, for instance. No, I was not referring to the new administration's policies at all, nor will I today. So what I'm just saying is, as we look ahead, we know, as I mentioned this in my statement that the risks are two-sided. I guess I should start by saying that we think that the economy and we think our policy are both in a very good place, a very good place. But as you look forward, you say, what are the risks? And one risk is that we would move too quickly and find ourselves having moved too quickly and inflation comes back and we lost our chance to get inflation back to 2%. So we have to avoid that risk. And to avoid that risk, that means you want to move carefully. The other risk is that we move too slowly and that we allow the labor market to weaken too much and do unnecessary damage to the labor market and the people's working lives.",-3.382176035569999e-05,0.00033641149854509675
2024-11-07 18:30:00,2024-11-07 19:05:00,2024-11-07 19:06:00," That says don't get behind the curve. So these are two things, the two risks that we have to manage. And so we're in the middle there. We try to be in the middle and deal with both of the manage, both of those. Again, the idea is to maintain support the strength we have in the labor market and in the economy, but also with somewhat less restrictive but still restrictive policy, enable further progress toward our 2% inflation goal. And so there's, you know, this is a thing we're meeting by meeting we're going to be making our assessment of what the right path is. You know, it's not as important. The precise timing of these things is not as important as the overall arc of them. And the arc of them is to move from where we are now to a sense of neutral, a more neutral policy. We don't know exactly where that is. We only know it by its works. We're pretty sure it's below where we are now. But as we move further, there will be more uncertainty about where that is. And we're going to move carefully.",0.00026919667755470004,0.0007739417188236697
2024-11-07 18:30:00,2024-11-07 19:06:00,2024-11-07 19:07:00," as this goes on so that we can increase the chances that we will get it right. Simon. Thank you, Chair Powell, Simon and Minovitch with the economist. I know you don't want to share your decomposition of bond yields, but if you look at the break evins, it is clear that longer term inflation expectations do seem to have risen up at about 2.5% for example, on the five year, that's up half a point from when you cut in September. Do you have any concern at all that longer term inflation expectations are de-anchoring or put another way are anchoring at a slightly higher level? Thanks. So we would be concerned if we saw, if we thought we saw longer term inflation expectations anchoring at a higher level. That's not what we're seeing. We're still seeing between surveys and market readings broadly consistent with, you know, I looked at the five year, five year earlier.",-0.0003432001206864255,0.0007905803195963453
2024-11-07 18:30:00,2024-11-07 19:07:00,2024-11-07 19:08:00," today and it's probably moved but it's just kind of right where it's been and also it's pretty close to consistent with 2% PCE inflation. So that's one that's been a traditional one that we look at a lot but overall expectations seem to be and have really have throughout this in a place that's consistent with 2% inflation but you're right to say we watch that very carefully and we will not allow inflation expectations to drift upward but that's really why we reacted so sharply back in 2022 was to avoid that. Kelly. Hi Chair Powell, Kelly O'Grady, CBS News. We just talked about what you've heard from business leaders on the economy but many average Americans are still not feeling the strength of the economy in their wallets so what's your message to them on when they might expect relief? So you're right that we say the economy is performing well.",0.0002086055899115255,0.0003024748970216542
2024-11-07 18:30:00,2024-11-07 19:08:00,2024-11-07 19:09:00," and it is, but we also know that people are still feeling the effects of high prices, for example. And we went through the world, went through a global inflation shock, and inflation went up everywhere, and you know, it stays with you because the price level doesn't come back down. So what that takes is it takes some years of real wage gains for people to feel better. And that's what we're trying to create. And I think we're well on the road to creating that. Inflation has come way down the economy is still strong here. Wages are moving up at a sustainable level. So it's just, I think what needs to happen is happening, and for the most part has happened. But it'll be sometime before people regain their confidence and feel that. And we don't tell people how to feel about the economy. We respect completely respect what they're feeling. Those feelings are true, they're accurate. We don't question them. We respect them. And just a quick follow up, President-elect Trump has been critical of your performance.",-0.00023550173389819113,0.0005043288223921232
2024-11-07 18:30:00,2024-11-07 19:09:00,2024-11-07 19:10:00," any concern about his influence on the Fed's independence? I'm not going to get into any of the political things here today, but thank you. Hi, Chair Powell, Nancy Marshall-Gencer with Marketplace. What is your plan if we start to see Stagflation? So the whole plan is not to have Stagflation, so we don't have to deal with it. That is actually our plan. It's of course a very difficult thing because anything you do with interest rates will hurt one side or the other either the inflation mandate or the employment mandate. I would just say that we've been able to see inflation come down a whole lot much closer to our goal without the kind of sharpening.",-0.0003694055562373088,0.00023533366952426687
2024-11-07 18:30:00,2024-11-07 19:10:00,2024-11-07 19:11:00," increasing unemployment that has often accompanied programs of disinflation. So not going wood, we've gotten this far without seeing a real weakening in the labor market. We believe we can complete the inflation task while also keeping the labor market strong and that of course is exactly what we're trying to do. Can you rule out an interest rate hike next year? No, I wouldn't rule anything out of him that far away. But that's certainly not our plan. I mean our baseline expectation is that we'll continue to move gradually down towards neutral that the economy will continue to grow at a healthy clip and that the labor market will remain strong if you look at our, that will not change from the September SEP, you know, that is our baseline forecast and short of some exogenous event that will continue to be our forecast for the foreseeable future. But ultimately, you know, we're not in a war where we can afford to rule things out.",0.00042001074233303235,0.0004201482169927028
2024-11-07 18:30:00,2024-11-07 19:11:00,2024-11-07 19:12:00," four-year in advance. It's just too much uncertainty in what we do. Good, a team for the last question. Hi, Chair Powell, Jean Young with M&I Market News. I wanted to go back to a comment that you had made about Americans being quite unhappy about the cumulative price level rises over the past few years, even though now inflation is back on a path to 2%. Would it be appropriate for the Fed to undershoot for a while on its inflation goal under the average inflation targeting regime so people have a chance to catch up? No, that's not the way our framework works. We're aiming for inflation at 2%. We do not think it would be appropriate to deliberately undershoot. And part of the problem there is that low inflation can be a problem too. But that's not part of our framework. And it's not something we're going to be going to.",0.00015130458165066765,0.00025220680958382055
2024-11-07 18:30:00,2024-11-07 19:12:00,2024-11-07 19:12:09, be looking at in our framework with you. Thank you very much.,0.0,0.0002689979825152688
