id,sentence
698,Shares traded flat Wednesday.
699,"IBD Big Cap 20 stock Ulta Beauty is building a flat base with 429.58 buy point, but is below its 50-day line after Tuesday's 4.1% tumble."
700,The base comes in the wake of a failed breakout past a cup with handle's 426.93 entry in June.
701,Ulta shares rose almost 1% Wednesday.
702,Verra Mobility is trading about 5% below a cup with handle's 16.83 buy point in the wake of Tuesday's 4.3% slide.
703,The stock's RS line continues to show tremendous strength as it hit a another new high last week.
704,Verra shares were unchanged Wednesday.
705,"IBD Leaderboard stock Vertex Pharmaceuticals found support around a cup-with-handle's 279.23 buy point amid a two-day win streak, according to IBD MarketSmith chart analysis."
706,The biotech leader is in the 5% buy area that goes up to 293.19 amid Tuesday's 1.6% rise.
707,Vertex stock was unchanged Wednesday.
708,"Join IBD experts as they analyze leading stocks in the current stock market rally on IBD Live
 Tesla Stock
 Tesla stock skidded 3.6% Tuesday, falling for a second-straight session and giving back a part of last week's earnings-fueled 13.4% surge."
709,"Shares briefly reached their highest level since early May, but are still about 38% off their 52-week high."
710,Shares rallied about 2% Wednesday morning.
711,"Dow Jones Leaders: Apple, Microsoft
 Among Dow Jones stocks, Apple shares declined 0.9% Tuesday, extending a losing streak to three sessions."
712,Apple remains above its 50-day line after bullish action in recent weeks.
713,"Still, shares remain below their long-term 200-day line, which looms as a resistance level to watch."
714,The stock is about 17% off its 52-week high.
715,Apple shares moved up 0.8% Wednesday.
716,"Microsoft sold off 2.7% Tuesday, falling further below its 50-day line."
717,The stock closed about 28% off its 52-week high.
718,Microsoft traded up 3% Wednesday after the company's earnings results and guidance.
719,Be sure to follow Scott Lehtonen on Twitter at @IBD_SLehtonen for more on growth stocks and the Dow Jones Industrial Average.
720,"YOU MAY ALSO LIKE:
 Top Growth Stocks To Buy And Watch
 Learn How To Time The Market With IBD's ETF Market Strategy
 Find The Best Long-Term Investments With IBD Long-Term Leaders
 MarketSmith: Research, Charts, Data And Coaching All In One Place
 How To Research Growth Stocks: Why This IBD Tool Simplifies The Search For Top Stocks
 
 
 It's the Federal Reserve task to tame inflation that is running at a pace not seen in four decades."
721,"To do so, it has been hiking interest rates at a fast pace."
722,Top officials at the Federal Reserve were seeing inflation data come in very hot for months before policymakers moved to wind down monetary policies that were stimulating the economy.
723,"A chorus of analysts, economists and former policymakers have chimed in, saying that was a mistake."
724,"""The forward guidance, overall, slowed the response to the Fed to the inflation problem"" former Federal Reserve Chair Ben Bernanke told CNBC."
725,"Treasury Secretary Janet Yellen also acknowledged the misdiagnosis coming from her own department, and that of current Fed Chair Jerome Powell."
726,"""Both of us could have probably used a better word than 'transitory,'"" she told senators in June when asked about their remarks about inflation last year and their slow response to price pressures."
727,It's the Fed's task to tame inflation that is running at a pace not seen in four decades.
728,"To do so, it has been hiking interest rates at a fast pace."
729,"Reining in inflation may take more aggressive monetary policy moves than the central bank has embraced in recent years, according to economists like Judd Cramer."
730,His research indicates that the Fed may need to hike rates to levels not seen in decades to force rising prices into retreat.
731,"""If inflation is going to be high and remain higher, that means that the neutral rate in the economy is also going to be higher because the price of goods are going up,"" he said to CNBC."
732,A June survey of inflation expectations from the New York Federal Reserve suggests the price hikes aren't over yet.
733,"The group predicts that by June 2023, prices will have risen approximately 6.8% from their current levels."
734,Maintaining stable prices and maximizing employment are the Fed's top responsibilities.
735,"Jobs appear plentiful in the U.S., which may give the central bank cover to raise interest rates at an aggressive pace through 2023."
736,The Federal Reserve was contacted for comment but is in a media blackout before the expected rate announcement later today.
737,"Watch the video above to learn more about the Fed's missteps on inflation, along with its plan to get the economy back on track."
738,The Federal Reserve is expected to announce an increase of up to three-quarters of a percentage point in its benchmark interest rate.
739,"Global stocks, oil prices higher before likely US interest rate hike to cool surging inflation
 The Federal Reserve on Wednesday is expected to announce an increase of up to three-quarters of a percentage point in its benchmark interest rate, triple its usual margin."
740,Major global stock markets and Wall Street futures advanced Wednesday as traders prepared for a possible sharp interest rate hike by the Federal Reserve to cool surging inflation.
741,London and Frankfurt opened higher.
742,Tokyo and Sydney gained while Shanghai declined.
743,Oil prices rose.
744,"The Fed on Wednesday is expected to announce an increase of up to three-quarters of a percentage point in its benchmark interest rate, triple its usual margin."
745,Investors worry such aggressive action by the Fed and other central banks in Europe and Asia to control inflation that is at multi-decade highs might derail global economic growth.
746,"""The main risk at this stage is in fact an inflation 'overkill' with monetary tightening too abrupt, unnecessarily pushing up the unemployment rate,"" Thomas Costerg of Pictet Wealth Management said in a report."
747,Costerg said most economic indicators and lower commodity prices already point to slower inflation ahead.
748,"In early trading, the FTSE 100 in London rose 0.5% to 7,345.81."
749,"The DAX in Frankfurt rose 0.3% to 13,136.88 and the CAC 40 in Paris advanced 0.3% to 6,230.48."
750,The future for Wall Street's benchmark S &P 500 index was up 0.9% and that for the Dow Jones Industrial Average added 0.4%.
751,"On Tuesday, the S &P 500 fell 1.2% after Walmart warned inflation that has spiked to a four-decade high of 9.1% hurts American consumer spending."
752,The Dow dropped 0.7% and the Nasdaq composite closed 1.9% lower.
753,"In Asia, the Shanghai Composite Index lost less than 0.1% to 3,275.76 while Tokyo's Nikkei 225 advanced 0.2% to 27,715.75."
754,"The Hang Seng in Hong Kong sank 1.4% to 20,620.10."
755,"Sydney's S &P-ASX 200 added 0.2% to 6,823.20 after data showed Australian inflation rose to 6.1% in the latest quarter from 5.1% but the increase was smaller than forecast."
756,"The Kospi in Seoul gained 0.1% to 2,415.53 and India's Sensex rose 0.8% to 55,715.95."
757,New Zealand declined while Southeast Asian markets advanced.
758,"On Wall Street, other major retailers also fell Tuesday following Walmart's profit warning."
759,"Target dropped 3.6%, Macy's slid 7.2% and Kohl's fell 9.1%."
760,Tech stocks retreated.
761,"Microsoft fell 2.7%, Amazon slid 5.2% and Facebook owner Meta Platforms dropped 4.5%."
762,General Motors fell 3.4% after its second-quarter profit fell 40% from a year ago.
763,"U.S. sales fell 15% after shortages of processor chips and other components left the company unable to deliver 95,000 vehicles during the quarter."
764,"In energy markets, benchmark U.S. crude rose $1.17 to $96.15 per barrel in electronic trading on the New York Mercantile Exchange."
765,The contract fell $1.72 on Tuesday to $94.98.
766,"Brent crude, the price basis for international oils, added 94 cents to $100.40 per barrel in London."
767,"The dollar rose to 136,90 yen from Tuesday's 136.00 yen."
768,The euro gained to $1.0138 from $1.0120.
769,U.S. stock futures pointed to a higher open Wednesday as investors geared up for a major decision from Federal Reserve policymakers on interest rates.
770,U.S. stock futures pointed to a higher open Wednesday as investors geared up for a major decision from Federal Reserve policymakers on interest rates.
771,"Contracts tied to all three major indexes rose in early trading, lifted by gains in Microsoft and Alphabet after earnings reports from the tech giants late Tuesday."
772,"Futures tied to the S&P 500 advanced 0.8%, while futures tied to the Dow Jones Industrial Average added 120 points, or roughly 0.4%."
773,Nasdaq futures jumped 1.4%.
774,"Shares of Microsoft (MSFT) rose 3% ahead of the open, buoyed by a rosy outlook for its cloud business despite unveiling earnings for the fiscal fourth quarter that missed Wall Street estimates."
775,"The company maintained its guidance for solid revenue growth in the new fiscal year despite the impact of headwinds from war in Ukraine, an unfavorable foreign exchange rate environment, and prolonged COVID shutdowns in China on its most recent financials."
776,"Alphabet (GOOG, GOOGL) shares climbed nearly 4% premarket after a modest beat on ad revenue offered some relief to investors Tuesday following a dismal report from Snap (SNAP) last week that raised concerns about the digital advertising market."
777,"The reports serve as curtain raisers for more Big Tech results this week, with figures from Meta Platforms (META) due out after Wednesday’s close, and Apple (AAPL) and Amazon.com (AMZN) on deck to report Thursday."
778,"Google, Amazon and Apple logos are seen behind a silhouette of a hand holding a mobile phone."
779,"(Photo Illustration by Pavlo Gonchar/SOPA Images/LightRocket via Getty Images)
 The Federal Reserve is expected to issue another 75 basis point increase on its benchmark interest rate at the conclusion of its two-day policy-setting meeting Wednesday afternoon."
780,Investors will also tune in to remarks from Federal Reserve Chair Jerome Powell after the U.S. central bank’s policy decision comes out at 2:00 p.m.
781,ET.
782,"If the U.S. central bank follows through on the hike market participants are largely anticipating, the move will bring rates to a range of 2.25%-2.5%, or a ""neutral"" level estimated to be the point at which any further rate increases would be “restrictive” to economic activity."
783,"Story continues
 “The market can begin to firm once it believes the Fed is going to toggle down expectations,” Christopher Harvey, head of equity strategy at Wells Fargo Securities told Yahoo Finance Live on Tuesday (video above)."
784,"“You’re not going to get that on Wednesday, but I do think you get a pretty good probability of that occurring in September."""
785,"—
 Alexandra Semenova is a reporter for Yahoo Finance."
786,"Follow her on Twitter @alexandraandnyc
 Click here for the latest stock market news and in-depth analysis, including events that move stocks
 Read the latest financial and business news from Yahoo Finance
 Download the Yahoo Finance app for Apple or Android
 Follow Yahoo Finance on Twitter, Facebook, Instagram, Flipboard, LinkedIn, and YouTube
 
 
 The Federal Reserve will look to tackle high inflation by boosting interest rates, economists expect."
787,"Why the Fed Raises Interest Rates: 'Front-Loading'
 The Fed has been upping interest rates at an incredible pace recently, as policymakers look to cool an overheated economy."
788,"In June, its last increase, was the steepest rise since 1994—raising the rate three-quarters of a percentage point."
789,That came after a quarter-point rise in March and a half-point rise in May.
790,The idea?
791,"To reduce spending and encourage saving, thus slowing down inflation that has resulted in prices rising at a rate not witnessed in four decades."
792,"The approach is commonly referred to as ""front-loading."""
793,"The Fed is far from alone in deploying the tactic, with central banks around the world announcing ever-sharper interest rate increases."
794,The Federal Reserve is on track for another steep interest rate hike Wednesday despite growing fears its fight against inflation could push the U.S. into a recession.
795,(The Hill) – The Federal Reserve is on track for another steep interest rate hike Wednesday despite growing fears its fight against inflation could push the U.S. into a recession.
796,"Fed officials are expected to announce another 0.75 percentage point interest rate hike Wednesday as both job growth and price growth rose, according to federal data."
797,The Fed has aggressively boosted interest rates since March to bring prices down after waiting in vain for months for inflation to decline.
798,"The bank has already hiked its baseline interest rate range by 1.5 percentage points this year, including a 0.75 percentage point hike in June."
799,"“To the Fed, obviously job No."
800,"1 is getting inflation down, and hopefully down without setting the economy in recession, but that isn’t a prerequisite,” said Mark Zandi, chief economist at Moody’s Analytics."
801,"“That’s really hard because a lot of inflation is coming from things that are out of their control.”
 The U.S. economy has shown signs of slowing under the pressure of higher Fed interest rates, which is a key step in the bank’s goal of bringing inflation down."
802,"Housing sales have plunged as mortgage rates rise, stock values have dropped and businesses are pulling back on plans to hire and expand with profit margins narrowing."
803,"But the war in Ukraine and ongoing supply chain issues driven by the pandemic have kept up pressure on food and energy prices, pushing the Fed to go even further with rate hikes."
804,"Karen Shaw Petrou, a managing partner at Federal Financial Analytics, said the pressures facing the Fed “have only gotten” worse since the bank raised rates in June, forcing the Fed to make tough choices."
805,"“You got no meaningful curb on inflation, even with a sharp rate rise."
806,"At the same time, financial market stresses and the impact of this inflation on household spending are curbing economic growth,” Petrou said, arguing the Fed should have begun hiking much sooner."
807,“It’s the worst of both worlds.
808,"There’s no good answer.”
 Federal Reserve Chairman Jerome Powell and other top officials at the central bank have stressed for months that they will raise interest rates as high as necessary to bring inflation down."
809,"While Powell said the U.S. may be able to avoid a recession in the process, he acknowledged it has become harder for the Fed to avert a downturn."
810,Powell previously said reducing inflation back to the Fed’s target range is far more important to the long-term health of the economy.
811,“We fully understand and appreciate the pain people are going through dealing with higher inflation.
812,"We have the tools to address that and the resolve to use them,” Powell said last month."
813,"“The process is likely — highly likely — to involve some pain, but the worst pain would be from failing to address this high inflation and allowing it to become persistent.”
 How much pain the economy feels depends largely on how far the Fed believes it needs to go to curb inflation."
814,And economists say that’s far from clear.
815,Inflation has steamed ahead throughout the summer even as the broader economy slows under the weight of higher interest rates and shock waves from the war in Ukraine.
816,"Prices rose 9.1 percent annually in June and 1.2 percent last month alone, according to Labor Department data released last week, even though gross domestic product likely declined for the second straight quarter."
817,Weekly unemployment claims still remain low but have risen to their highest level since November as a growing number of companies shed jobs amid a slowing economy.
818,"Consumer confidence in the economy has also fallen sharply, and while retail spending has grown, further pressure from inflation and interest rate hikes could soon lead to a nosedive in spending."
819,"“Consumers’ increased pessimism is consistent with our view that consumer spending and the broader economy are downshifting to a much slower growth path amid high inflation, rapidly-rising interest rates, and financial market volatility,” Lydia Boussour, lead U.S. economist at Oxford Economics, wrote in a Tuesday analysis."
820,"“While we still see strong economic fundamentals preventing the US economy from slipping into recession this year, the pathway to a softish landing is narrowing.”
 Most economists do not believe the U.S. is in a recession yet despite mounting signs of the economy slowing."
821,"The country has added 2.5 million jobs since the start of 2022, including 372,000 in June alone, with an unemployment rate of 3.6 percent."
822,"In fact, the resilience of the job market and a record ratio of open jobs to unemployed workers are among several factors preventing the Fed from bringing inflation down."
823,"Zandi said the U.S. is “not even close” to being in a recession right now because of the strength of the job market, but he acknowledged that the risks of a recession are rising."
824,“We’re on the precipice.
825,"It won’t take a lot to push us over,” Zandi said."
826,Zandi said the Fed should signal that it won’t be hiking interest rates as fast in the future.
827,"Some left-leaning policy experts and lawmakers, including Sen. Elizabeth Warren (D-Mass."
828,"), have urged the Fed to stop hiking rates entirely, insisting it would doom the economy."
829,"“Rising costs are an urgent problem, and interest rates play a key role in maintaining price stability."
830,"But urgency is no excuse for doubling down on a dangerous treatment,” Warren wrote in a Monday op-ed for The Wall Street Journal."
831,"But Petrou said the Fed has no choice but to push ahead with interest rate hikes to curb inflation, insisting job losses and deep despair would visit the economy no matter what if the bank doesn’t get prices under control."
832,"“Households are already starting to curb discretionary spending, and they will do so more and you’re going to have higher unemployment anyway."
833,"That’s the devil the Fed has created.”
 
 
 The Federal Reserve's latest interest rate announcement and everything else to watch for in markets on Wednesday, July 27
 This article first appeared in the Morning Brief."
834,Get the Morning Brief sent directly to your inbox every Monday to Friday by 6:30 a.m.
835,ET.
836,"Subscribe
 Wednesday, July 27, 2022
 Today's newsletter is by Brian Cheung, an anchor and reporter covering the Fed, economics, and banking for Yahoo Finance."
837,You can follow him on Twitter @bcheungz.
838,The Federal Reserve is trying to land a plane from the high skies of strong economic activity and elevated inflation.
839,"Starting today, it is time — or maybe it has been time — for investors to buckle their seatbelts, stow away their tray tables, and return seats to the upright position."
840,"Because the answers on whether this swoon becomes a ""hard"" or ""soft"" landing for the economy are about to start rolling in."
841,"Fed Chairman Jerome Powell, our proverbial economic pilot, has already begun descent of the plane through rate hikes in March, May, and June."
842,"By raising interest rates another 0.75% today, the Fed will bring rates to a range of 2.25%-2.5%, or a ""neutral"" level estimated to be the point at which any further rate increases would be “restrictive” to economic activity."
843,"In September, economists expect the Fed to bring rates into this territory."
844,"U.S. Federal Reserve Board Chair Jerome Powell testifies before a House Financial Services Committee hearing in Washington, U.S., June 23, 2022."
845,"REUTERS/Mary F. Calvert
 “The Fed has told us they’re unlikely to let up on the brakes until they see a convincing shift in the trajectory of monthly inflation readings that would signal progress towards the Fed’s 2% target,” PGIM Fixed Income Lead Economist Ellen Gaske wrote in a note Friday."
846,"With interest rates at “neutral,” further rate hikes could have a more substantial bite into inflation, which clocked in at 9.1% on a year-over-year basis in June."
847,And the Fed suspects investors will find out just how many more rate hikes do the trick.
848,The central bank's own projections from June estimate the Fed will need to raise rates to roughly 3.8% next year to pull off a slowdown in inflation.
849,"But Fed watchers are all over the place on this estimate — Deutsche Bank thinks the Fed will be forced to lift rates to 4.1%, but Goldman Sachs thinks the Fed will not be able to push rates past 3.5%."
850,"Story continues
 The ideal landing for the economy is one where higher borrowing costs lower inflation but not at the cost of squeezing employers into laying off their employees."
851,"Ask employees in the tech sector, however, and you're likely to hear the dream of this scenario has already passed us by."
852,That’s why Powell’s commentary in today’s press conference will prove critical.
853,"Powell's comments could signal how the Fed may move in the central bank’s three remaining scheduled meetings, set for September, November, and December."
854,And how much economic and financial market discomfort the Fed is willing to endure.
855,"“The pace of hikes remains uncertain as we get into the fall,” wrote UBS' Solita Marcelli on Monday."
856,Whether the next hikes are 0.50% or 0.75% or 1.00% in those fall meetings will depend on how employment and inflation data come in.
857,"One more wrinkle making this landing a bit trickier: monetary policy operates with a lag, meaning timing may be difficult for the Fed to nail in a rapidly evolving economic environment."
858,"As a reminder, the seat belt sign is turned on."
859,The Fed statement is due at 2 p.m.
860,"ET, followed by the chairman’s press conference at 2:30 p.m."
861,ET.
862,Buckle up.
863,"What to Watch Today
 Economic calendar
 MBA mortgage applications (week ended July 22)
 Durable goods orders (June)
 Retail inventories (June)
 Wholesale inventories (June)
 Pending home sales (June)
 FOMC statement
 Fed Chair Jerome Powell press conference
 Earnings
 Meta Platforms (META), Boeing (BA), Ford (F), Etsy (ETSY), Qualcomm (QCOM), T-Mobile (TMUS), Bristol-Myers Squibb (BMY), Kraft Heinz (KH), Hilton Worldwide (HLT), Boston Scientific (BSX), Sherwin-Williams (SHW), Fortune Brands (FBH), Flex (FLEX), Hess Corporation (HES), Norfolk Southern (NSC), Netgear (NTGR), Cheesecake Factory (CAKE), American Water Works (AWK), Ryder System (R), Genuine Parts (GPC), Waste Management (WM), Community Health Systems (CYH), Molina Healthcare (MOH), Owens Corning (OC)
 Yahoo Finance Highlights
 —
 Click here for the latest economic news and economic indicators to help you in your investing decisions
 Read the latest financial and business news from Yahoo Finance
 Download the Yahoo Finance app for Apple or Android
 Follow Yahoo Finance on Twitter, Facebook, Instagram, Flipboard, LinkedIn, and YouTube
 
 
 Cryptos have shown themselves to be sensitive to macro forces."
864,Digital assets are expected to react to the Federal Reserve's latest monetary policy decision.
865,Bitcoin and other cryptocurrencies were rising Wednesday ahead of the Federal Reserve’s latest decision on interest rates.
866,Digital assets appear to be at the mercy of the central bank and wider markets amid salient fears around inflation and recession.
867,"The price of Bitcoin has risen 1% over the past 24 hours to $21,300, grinding higher after the largest crypto took a leg downward on Monday."
868,"Bitcoin has made a slow but steady rally from its recent June bottom below $18,000, topping out above $24,000 last week before sliding back as markets braced for a turbulent week."
869,BEIJING (AP) — Major global stock markets and Wall Street futures advanced Wednesday as traders prepared for a possible sharp interest rate hike by the Federal Reserve to cool surging inflation.
870,London and Frankfurt opened higher.
871,"Global stocks, oil prices higher before likely US rate hike
 A currency trader walks near the screens at a foreign exchange dealing room in Seoul, South Korea, Wednesday, July 27, 2022."
872,Asian stock markets followed Wall Street lower Wednesday as traders prepared for a possible sharp interest rate hike from the Federal Reserve to cool inflation.
873,"(AP Photo/Lee Jin-man)
 A currency trader walks near the screens at a foreign exchange dealing room in Seoul, South Korea, Wednesday, July 27, 2022."
874,Asian stock markets followed Wall Street lower Wednesday as traders prepared for a possible sharp interest rate hike from the Federal Reserve to cool inflation.
875,"(AP Photo/Lee Jin-man)
 BEIJING (AP) — Major global stock markets and Wall Street futures advanced Wednesday as traders prepared for a possible sharp interest rate hike by the Federal Reserve to cool surging inflation."
876,London and Frankfurt opened higher.
877,Tokyo and Sydney gained while Shanghai declined.
878,Oil prices rose.
879,"The Fed on Wednesday is expected to announce an increase of up to three-quarters of a percentage point in its benchmark interest rate, triple its usual margin."
880,Investors worry such aggressive action by the Fed and other central banks in Europe and Asia to control inflation that is at multi-decade highs might derail global economic growth.
881,"“The main risk at this stage is in fact an inflation ‘overkill’ with monetary tightening too abrupt, unnecessarily pushing up the unemployment rate,” Thomas Costerg of Pictet Wealth Management said in a report."
