id,sentence
0,"John Netto, author of ""The Global Macro Edge,"" joins Yahoo Finance's Jared Blikre for a discussion about the Federal Open Market Committee meeting decision and press event by Federal Reserve chair Jerome Powell."
1,"Reuters
 Sales at Italian luxury group Moncler rose 46% at constant exchange rates in the first half of the year, once again beating analysts estimates, despite a slowdown in the second quarter due to lockdowns in China."
2,"Moncler, which acquired smaller rival Stone Island in 2020, said on Wednesday it was confident about the second part of the year, the most important season for a brand known for its warm puffer jackets."
3,"It sees no ""significant consequences"" from the Ukraine conflict on full-year results and does not expect ""at the moment"" any impact on profitability from rising costs."
4,"The stock market surged in advance of the 2:00 p.m. Federal Reserve rate decision, led by positive outlooks from Google and Microsoft."
5,The stock market rallied Wednesday morning in advance of the Federal Reserve's expected interest-rate hike.
6,Stocks also surged on Alphabet's (GOOGL) and Microsoft's (MSFT) earnings and outlook announcements.
7,"X
 The Nasdaq composite led major indexes, up 2.5%, while the S&P 500 gained 1.4%."
8,The Dow Jones Industrial Average rose 0.4%.
9,Volume fell on the Nasdaq and the NYSE vs. the same time on Tuesday.
10,The small-cap Russell 2000 index gained 0.9%.
11,The Fed's two-day meeting concludes with a policy decision at 2:00 p.m.
12,"ET, followed by a press conference with Fed Chairman Jerome Powell at 2:30 p.m. Wall Street anticipates the central bank will raise interest rates aggressively through the end of the year — and then reverse gears and start cutting them in six months."
13,"U.S. Stock Market Today Overview Index Symbol Price Gain/Loss % Change Dow Jones (0DJIA) 31918.83 +157.29 +0.50 S&P 500 (0S&P5) 3977.95 +56.90 +1.45 Nasdaq (0NDQC ) 11862.75 +300.17 +2.60 Russell 2000 (IWM) 181.06 +1.73 +0.96 IBD 50 (FFTY) 27.42 +0.36 +1.33 Last Update: 12:00 PM ET 7/27/2022
 Seventy-six percent of polled economists now expect a 0.75% Fed rate hike, while 24% are looking for a 1% hike, according to CME Group's FedWatch tool, which tracks interest rate futures."
14,"The 10-year U.S. Treasury yield continued to slide Wednesday, falling 2 basis points to 2.78% while the price of crude oil rose to $97.38 a barrel."
15,"Durable Goods Rise, Feeding Stock Market Gains
 In other economic news, June durable-goods orders rose 1.9%, beating the consensus forecast for a 0.5% decline."
16,"Ex-transportation, orders rose 0.3% vs. views for 0.2%."
17,The core capital goods change was 0.5% vs. the expected 0.2%.
18,"""Durable goods orders continue to show strong gains, with the year-over-year change holding steady in the 10% range,"" said Peter Essele, Head of Portfolio Management for Commonwealth Financial Network."
19,"""Of particular note in this morning's release is the fact that the amount of unfilled orders continue to decline."
20,"If the current trend continues, inflation should begin to moderate in the coming months as the imbalance of supply and demand swings to the former."""
21,Google owner Alphabet reported June-quarter earnings and revenue that missed Wall Street targets as YouTube and the cloud-computing business fell short of expectations.
22,Shares rallied more than 6% despite the shortfall.
23,"Software leader Microsoft also missed analyst expectations for its fiscal fourth quarter, blaming unfavorable foreign-exchange rates and weak PC sales."
24,"Nonetheless, the company's upbeat guidance for the current fiscal year boosted the stock, up 4.8%."
25,"Mexican fast-food chain Chipotle (CMG) jumped 15.5%, on pace to beat the stock's largest percentage increase since March 19, 2020, when it rose 15.25%."
26,"Chipotle reported earnings after the close on Tuesday, beating profit estimates but coming up a tad short on sales."
27,Shares rallied into the 200-day moving average and well above the 50-day line.
28,"Spotify, Boeing, Enphase Surge on Earnings
 Digital media platform Spotify (SPOT) rallied 15.7% in the first half of Wednesday's stock market after reporting better-than-expected Q2 monthly active users (MAUs) of 433 million and beating on sales."
29,Shares rose even though the quarterly loss was worse than expected.
30,E-commerce firm Shopify (SHOP) reported a loss for the June quarter while revenue and gross merchandise volume missed estimates.
31,"SHOP stock is trading 6% higher, erasing some of Tuesday's losses."
32,"Yesterday, the CEO confirmed it will cut roughly 1,000 workers, or 10% of its workforce."
33,Boeing (BA) was up 0.4% after reporting a sales shortfall and a larger-than-expected Q2 loss.
34,The aviation giant beat free-cash-flow expectations by a wide margin.
35,IBD 50 component Enphase Energy (ENPH) easily beat second-quarter estimates and guided higher for the current quarter as shares surged more than 15%.
36,Teva Pharmaceuticals (TEVA) announced a $75 million deal to settle opioid claims in West Virginia on Wednesday.
37,Teva stock skyrocketed nearly 20%.
38,"The Innovator IBD 50 ETF (FFTY) climbed 1.3%, with Enphase being the best-performing component."
39,"Follow Michael Molinski on Twitter @IMmolinski
 YOU MAY ALSO LIKE:
 Time To Tweak Your Investments To An Inflationary Environment?"
40,"Get Full Access To IBD Stock Lists And Ratings
 Is XOM A Buy Now After Q1 Earnings?"
41,"Get Free IBD Newsletters: Market Prep | Tech Report | How To Invest
 Market Skids With Fed Rate Hike Due; Hot Stock Pops Late
 
 
 Stocks rose Wednesday ahead of the Federal Reserve's afternoon interest rate decision."
42,"Every weekday the CNBC Investing Club with Jim Cramer holds a ""Morning Meeting"" livestream at 10:20 a.m."
43,ET.
44,Here's a recap of Wednesday's key moments.
45,"Alphabet, Microsoft rally ahead of Fed Cramer: Now could be the time to buy Humana Earnings tonight: Qualcomm, Meta, Ford The Fed is winning against inflation 1."
46,"Alphabet, Microsoft rally ahead of Fed Stocks rose Wednesday ahead of the Federal Reserve's afternoon interest rate decision, buoyed by better-than-feared earnings reports from Club holdings Alphabet (GOOGL) and Microsoft (MSFT)."
47,"But whether the market, especially Wednesday's strong Nasdaq , can hold on to those gains depends on whether the Fed hikes rates the expected 75 basis points, as it did last month, or goes for a more aggressive move or posture."
48,"Google-parent Alphabet, in particular, has distinguished itself as a best-in-class platform for advertisers from the Snap (SNAP), which fell markedly short of expectations last week and saw its stock crushed."
49,"""This is proving to be the phrase for tech: better than feared,"" Jim Cramer said during Wednesday's ""Morning Meeting."""
50,We'll see if that proves the case when Club holdings Meta Platforms (META) and Qualcomm report earnings after the bell.
51,Club holdings Amazon (AMZN) and Apple (AAPL) report results after the closing bell Thursday.
52,2.
53,"Cramer: Now could be the time to buy Humana Humana (HUM) reported an earnings beat of $8.67 versus an expected $7.67, but failed to get investors excited after raising the full-year outlook by just 25 cents."
54,"While the company could have raised its forecast even more, we believe that Humana's decision to instead invest 75 cents earnings per share into supporting its 2023 Medicare Advantage membership growth is ultimately positive for the future of the company."
55,"Despite the upbeat quarter, the stock fell around 4%."
56,Cramer said he believes the stock is a buy at these levels since the Medicare Advantage business is the most lucrative at Humana.
57,"However, the Club recently trimmed its holding of HUM at $488 near an all-time high, when UnitedHealth Group (UNH) drove healthcare stocks higher after reporting its quarterly results."
58,3.
59,"Earnings tonight: Ford, Qualcomm, Meta Club holdings Ford (F) as well as the aforementioned Qualcomm and Met report earnings after the closing bell Wednesday."
60,"We believe that Ford could see a boost from declining commodity costs, though the automaker's warranty costs are still a noticeable headwind."
61,"While Qualcomm CEO Cristiano Amon has a track record of delivering great quarters, the company's handset exposure in China could be a tough obstacle to overcome."
62,This is a pivotal quarter for Meta.
63,Some things we want to hear are that Reels is upending Tiktok and that spending is down.
64,"CEO Mark Zuckerberg must also say they're slowing hiring, if they don't want to rock investors' confidence in the company."
65,4.
66,The Fed is winning against inflation The Fed will announce its latest interest rate hike Wednesday afternoon at 2 p.m.
67,"ET, followed 30 minutes later by a news conference with central bank Chairman Jerome Powell."
68,"As we mentioned earlier, analysts largely expect a 75-basis point rate increase to fight inflation."
69,Cramer is OK with 75 but he's been calling for a 100 basis points for a while now.
70,Cramer has said repeatedly that he believes the Fed is winning its battle against inflation because commodity prices have largely rolled over but have not shown up in the monthly economic numbers.
71,"Inflation has been a common problem for companies, especially for retailers with a number of them preannouncing profit warnings ahead of issuing quarterly numbers."
72,"(Jim Cramer's Charitable Trust is long F, GOOGL, HUM, META, MSFT and QCOM."
73,See here for a full list of the stocks.)
74,"As a subscriber to the CNBC Investing Club with Jim Cramer, you will receive a trade alert before Jim makes a trade."
75,Jim waits 45 minutes after sending a trade alert before buying or selling a stock in his charitable trust's portfolio.
76,"If Jim has talked about a stock on CNBC TV, he waits 72 hours after issuing the trade alert before executing the trade."
77,"THE ABOVE INVESTING CLUB INFORMATION IS SUBJECT TO OUR TERMS AND CONDITIONS AND PRIVACY POLICY , TOGETHER WITH OUR DISCLAIMER ."
78,"NO FIDUCIARY OBLIGATION OR DUTY EXISTS, OR IS CREATED, BY VIRTUE OF YOUR RECEIPT OF ANY INFORMATION PROVIDED IN CONNECTION WITH THE INVESTING CLUB."
79,NO SPECIFIC OUTCOME OR PROFIT IS GUARANTEED.
80,"Getty Images; Reuters
 
 
 With inflation at a four-decade high, the job market strong and consumers still spending, the Federal Reserve is under pressure to continue raising interest rates aggressively."
81,"WASHINGTON (AP) — With inflation at a four-decade high, the job market strong and consumers still spending, the Federal Reserve is under pressure to continue raising interest rates aggressively."
82,"When it ends its latest policy meeting Wednesday afternoon, the Fed is expected to impose a second consecutive three-quarter-point hike in its benchmark interest rate, raising it to a range of 2.25% to 2.5%."
83,It will be the Fed’s fourth rate hike since March.
84,"Since then, the central bank has tightened credit ever more aggressively."
85,"A news conference that Chair Jerome Powell will hold Wednesday — and whatever signals, if any, he sends about the Fed’s next steps — will draw intense interest."
86,"By raising borrowing rates, the Fed makes it costlier to take out a mortgage or an auto or business loan."
87,"In turn, consumers and businesses will likely borrow and spend less, cooling the economy and slowing inflation."
88,"The Fed’s hikes have already led to a doubling of the average rate on a 30-year fixed mortgage in the past year, to 5.5%, and home sales have tumbled."
89,The central bank is betting it can slow growth just enough to tame inflation yet not so much as to trigger a recession — a risk that many analysts fear may end badly.
90,Some analysts point to signs that the economy is slowing and might even have shrunk in the first half of the year.
91,"As a result, they worry that the Fed could end up tightening credit too much, too fast, and end up causing a downturn that would lead to layoffs and rising unemployment."
92,"In the meantime, the surge in inflation and fear of a recession have eroded consumer confidence and stirred public anxiety about the economy, which is sending frustratingly mixed signals."
93,"With the November midterm elections nearing, Americans’ discontent has diminished President Joe Biden’s public approval ratings and increased the likelihood that the Democrats will lose control of the House and Senate."
94,"On Thursday, when the government estimates the gross domestic product for the April-June period, some economists think it may show that the economy shrank for a second straight quarter."
95,That would meet one longstanding assumption for when a recession has begun.
96,But economists say that wouldn’t mean a recession had started.
97,"During those same six months when the economy might have contracted, employers added 2.7 million jobs — more than were gained in most entire years before the pandemic."
98,"Wages are also rising at a healthy pace, with many employers still struggling to attract and retain enough workers."
99,"The definition of recession that is most widely accepted is the one determined by the National Bureau of Economic Research, a group of economists whose Business Cycle Dating Committee defines a recession as “a significant decline in economic activity that is spread across the economy and lasts more than a few months.”
 The committee assesses a range of factors before publicly declaring the death of an economic expansion and the birth of a recession — and often does so well after the fact."
100,"As investors await another jumbo-sized rate increase from the Federal Reserve, they are taking the temperature of a weeks-long U.S. stock market rally that followed a vicious first-half selloff."
101,"NEW YORK, July 27 (Reuters) - As investors await another jumbo-sized rate increase from the Federal Reserve, they are taking the temperature of a weeks-long U.S. stock market rally that followed a vicious first-half selloff."
102,"Even after Tuesday's sharp fall, the S&P 500 remained up 7% from its June 16 low, buoyed in part by expectations that the Fed will pause its aggressive rate hikes early next year and a recent decline in commodity prices that investors hope will help ease inflation."
103,"So far, the bounce has its share of doubters."
104,"Three rallies of comparable magnitude have already wilted this year, with stocks sliding to new lows each time."
105,"Blackrock, the world’s largest asset manager, on Monday warned investors that more volatility lay ahead and said it was underweight developed market equities on expectations that inflation will stay tenacious."
106,"Register now for FREE unlimited access to Reuters.com Register
 ""We think this is a bear market suckers' rally,"" said Steve Chiavarone, senior portfolio manager at Federated Hermes, who believes the Fed will remain hawkish longer than expected and has reduced his equity exposure as the S&P pushed higher over the last few weeks."
107,Expectations that the Fed will end its market-bruising rate hikes sooner than forecast have helped power stocks higher.
108,"Nearly two-thirds of investors now believe the Fed funds rate will stand at 3.5% or lower by March 2023, up from just a third a month ago with that view, according to CME."
109,"read more
 Investors expect the Fed to deliver another 75 basis points of tightening Wednesday, after already raising rates by 150 basis points so far this year."
110,"FEDWATCH Hopes for moderation after that could be dashed if consumer prices remain stubbornly high in coming weeks - repeating a scenario that dragged stocks lower this year, Blackrock’s strategists wrote."
111,"""Inflation data could surprise to the upside – and cause markets to rapidly price a higher rate path once again."
112,"Result: another equities sell-off,"" BlackRock strategists wrote."
113,Data from the Wells Fargo Investment Institute showed the severity of the current bear market - which saw the S&P 500 fall as much as 23.6% below its January high - may depend on whether the economy is in a recession.
114,"read more
 Bear markets accompanied by a recession have lasted an average of 18 months, during which stocks fell an average of 35.8%."
115,"Without a recession, bear markets lasted an average of 5.9 months with an average decline of 27.9%, the bank’s data showed."
116,"On Sunday, U.S. Treasury Secretary Janet Yellen acknowledged the risk of a recession but said it was not inevitable."
117,"read more Still, parts of the market have continued to reflect investor unease, even as broader averages have bounced."
118,"More stocks have posted new lows than new highs on the Nasdaq Composite Index for 76 straight days, the longest such stretch in 20 years, said Willie Delwiche, investment strategist at All Star Charts."
119,The index is up nearly 9% from its June low.
120,"""Until that relationship changes, it's premature to say that a bottom is in place,"" Delwiche said."
121,"More optimistic investors point to an array of signals indicating bearish sentiment may have reached a crescendo in recent weeks, potentially exhausting sellers and making it easier for stocks to rebound."
122,"A fund manager survey from BoFA Global Research last week showed expectations for global growth and profits at all-time lows and cash levels at their highest in two decades, two contrarian indicators the banks' strategists said could indicate greater stock gains ahead."
123,"Short interest in the S&P 500, meanwhile, recently stood at its highest level since the depths of the coronavirus selloff in 2020, a signal that has occurred during past market bottoms, the bank's strategists wrote."
124,"""We think it’s possible that the S&P 500 has already bottomed, and if it hasn’t, will find a bottom during the third quarter,” said Lori Calvasina, head of U.S. equity strategy at RBC Capital Markets, in a note to investors."
125,"Calvasina recently added stock exposure, betting that a possible recession has already been baked into prices."
126,"read more
 Christopher Murphy, co-head of derivatives strategy at Susquehanna International Group, believes this week’s earnings reports - which include results from heavyweights such as Apple Inc and Meta Platforms– could play a key part in determining whether stocks can continue rallying."
127,"read more
 For the time being, ""the risks to the market are very well known right now"" and already reflected in prices, he said."
128,"Register now for FREE unlimited access to Reuters.com Register
 Reporting by David Randall; Editing by David Gregorio
 Our Standards: The Thomson Reuters Trust Principles."
129,The S&P 500 has moved higher after the Federal Reserve's first three rate hikes in 2022.
130,Rate hikes have not been so scary for markets in 2022.
131,"In fact, Wall Street appears to be cheering an aggressive Federal Reserve, at least in the short term."
132,"After each of the central bank's three rate hikes this year, stocks have finished the day solidly higher."
133,"That is a departure from the previous decades, when the market's reaction to hikes was more tepid."
134,"""Historically, the average performance of the S & P 500 on days that the Fed has raised rates has been weaker than if policymakers decided on other actions."
135,"However, the current tightening cycle has seen much more positive reactions by equities to rate hikes,"" Bespoke Investment Group said in a note to clients on Wednesday."
136,"Prior to this Fed cycle, rate hikes since 1994 were greeted with an average increase of 19.1 basis points by the S & P 500, according to Bespoke."
137,A basis point is equal to 0.01%.
138,"The market moves this cycle, however, have pushed that average gain to 33.6 basis points."
139,Part of the reason for the abnormal reactions in 2022 could be the decades-high inflation rate.
140,"While rate hikes can slow growth and make future cash flows look less attractive, inflation is the top worry for many investors."
141,"""The biggest risk to the US economy is not the Fed raising rates."
142,"It is inflation which is hurting consumer and business confidence and pricing consumers out of a new home, a car, gas and meals on the table,"" billionaire hedge fund manager Bill Ackman said in a series of tweets Tuesday ."
143,"If the Fed can bring inflation under control quickly, the reasoning goes, the U.S. economy and stock market can get back on a more normal growth path and avoid a long period of so-called ""stagflation."""
144,"Some traders have now even started to bet on rate cuts next year, suggesting that some on Wall Street expect the Fed to quickly focus on supporting the economy once inflation starts to retreat."
145,"To be sure, the positive reaction to the Fed's hikes has not been long lasting."
146,"After both the May and June hikes, the gains for the S & P 500 were erased in the following session."
147,"The Fed has also been signaling its rate hike plans ahead of time, so investors may have been pricing in those moves in between meetings."
148,And that may be contributing to the S & P 500 sliding more than 16% year to date.
149,The Fed is expected to hike rates by another by 75 basis points on Wednesday afternoon.
150,"(75 basis points equals 0.75%)
 
 
 As investors prepare for another rate increase from the Federal Reserve on Wednesday, recent history shows these stocks have won big on such days
 As investors prepare for another likely three-quarter point increase from the Federal Reserve on Wednesday, a glance at recent history indicates that certain stocks have been winning big on such days and could triumph again."
151,Markets have recently grown comfortable with the prospect of a three-quarters point move that's expected from the central bank as it tries to tame rocketing prices.
152,"At the same time, investors are closely watching Fed Chairman Jerome Powell for clues as to what the central bank might do at its next meeting in September, with many anticipating a still tougher Fed in the months ahead ."
153,"If history is any indicator, markets have liked recent rate hikes from the Fed ."
154,"The S & P 500 rallied 2.24%, 3% and 1.46%, respectively, on the last three days that the Fed tightened policy."
155,"Those reactions have been stronger than the responses seen in 1994, with the 3% rally in May ranking as the fifth best Fed day out of a total of 228, according to an analysis from Bespoke Investment Group."
156,"Should that pattern persist, these stocks that won big during the last three hiking days may triumph again on Wednesday."
157,"To find potential winners this time around, CNBC Pro used FactSet data to search for names with the biggest median move on the last three Fed days and that consistently gained at least 1% in the subsequent market rallies."
158,"The screen uncovered a host of beaten-up stocks tied to the consumer, which might benefit from the Fed quashing surging prices and dampening economic growth."
159,"But to be sure, while many of the stocks do benefit when the market rallies, the list also turned up several highly volatile and risky names."
160,"Here are 20 stocks that saw the largest Fed Day moves, on average: Several beaten-up technology stocks made the cut, including battered chip stock Advanced Micro Devices , Tesla and social media giant Meta Platforms ."
161,"Shares of all three companies are trading at least 35% off their 52-week highs, with Meta Platforms down a whopping 57%."
162,"On average, the stocks added 5.5%, 5.4% and 4.8%, respectively, over the last three Fed decision days."
163,Some popular consumer-focused stocks such as Norwegian Cruise Line and Starbucks also made the cut and rallied an average of more than 5% each.
164,"The cruise line company enjoyed a median move of 5.5% during those last three Fed days, with shares rising the most on March 16 (5.9%)."
165,Starbucks soared nearly 10% alone on May 4.
166,Enphase Energy on average saw the biggest median gain (7.6%) within the group and Tuesday reported strong quarterly results .
167,Shares of the solar energy equipment company have rallied more than 36% this year as natural gas prices surged.
168,A recent note from Goldman Sachs called Enphase one of a number of solar names that could outperform and beat expectations this earnings season.
169,"Etsy , Moderna and Boeing also made the list of Fed day winners."
170,"Loonie at 77.72 U.S. cents
 The Canadian dollar CADUSD strengthened against its U.S. counterpart on Wednesday as oil prices rose, but the move was limited as investors braced for another oversized interest rate hike by the Federal Reserve."
171,"The price of oil, one of Canada’s major exports, climbed as a report of lower inventories in the United States and cuts in Russian gas flows to Europe offset concern about weaker demand and a looming U.S. rate hike."
172,U.S. crude prices were up 0.7% at $95.66 a barrel.
173,"Investors widely expect the Fed to increase interest rates by another 75 basis points later on Wednesday, with focus likely to shift to how deeply signs of an economic slowdown have registered with the central bank’s policymakers."
174,Investors are anticipating that rapid tightening by the Fed and the Bank of Canada will hurt economic growth.
175,"Both the U.S. and Canadian yield curves have inverted in recent weeks, sending a potential signal of recession risk ahead."
176,"Canada’s GDP data for May, which is due to be released on Friday, could offer clues on the strength of the domestic economy."
177,"The Canadian dollar was trading 0.1% higher at 1.2867 to the greenback, or 77.72 U.S. cents, after trading in a range of 1.2848 to 1.2893."
178,The loonie’s modest gain came as upbeat quarterly reports from Microsoft and Alphabet lifted sentiment on Wall Street.
179,"The Canadian 10-year yield eased 5.6 basis points to 2.769%, trading about 34 basis points below the Canadian 2-year yield."
180,Be smart with your money.
