id,sentence
772,"The six rate hikes the Fed has already imposed this year have raised its key short-term rate to a range of 3.75 per cent to 4 per cent, its highest level in 15 years."
773,"Cumulatively, the hikes have led to much costlier borrowing rates for consumers as well as companies, ranging from mortgages to auto and business loans."
774,Worries have grown that the Fed is raising rates so much in its drive to curb inflation that it will trigger a recession next year.
775,Yet with price increases still uncomfortably high – inflation was 7.1 per cent in November compared with a year earlier – Powell and other Fed officials have underscored that they expect to keep rates at their peak for an extended period.
776,"With inflation pressures now easing, though, most economists think the Fed will further slow its hikes and raise its key rate by just a quarter-point at its next meeting early next year."
777,"“The data (Tuesday) kind of fits with our idea that the Fed will downshift further in February,” said Matthew Luzzetti, an economist at Deutsche Bank and a former research analyst at the Fed."
778,"“Downshifting helps to maximize their prospects of a soft landing,” in which the Fed’s rate hikes would slow growth and tame inflation but not tip the economy into a recession."
779,"On Wednesday, members of the Fed’s rate-setting committee will also update their projections for interest rates and other economic barometers for 2023 and beyond."
780,"Most analysts have forecast that they will pencil in a peak range of at least 4.75 per cent to 5 per cent, or even 5 per cent to 5.25 per cent, up from their September forecast of 4.5 per cent to 4.75 per cent."
781,Despite Powell’s recent hard-line remarks – he said late last month that “we have not seen clear progress on slowing inflation” – he and other Fed officials have made clear that they’re ready to dial down the pace of rate hikes.
782,"In doing so, they will have time to assess the impact of the increases they’ve already imposed."
783,"Those hikes have sent home sales plummeting and are starting to reduce rents on new apartments, a leading source of high inflation."
784,Fed officials have also said they want rates to reach “restrictive” levels that slow growth and hiring and bring inflation down to the their annual target of 2 per cent.
785,"“What policy rate is sufficiently restrictive we will only learn over time by watching how the economy evolves,” said Lisa Cook, one of seven members of the Fed’s Board of Governors."
786,"“Given the tightening already in the pipeline, I am mindful that monetary policy works with long lags.”
 Fed officials have stressed that more important than how fast they raise rates is how long they keep them at or near their peak."
787,"In September, the Fed forecast it would do so through 2023."
788,Yet Wall Street investors are now betting that the Fed will reverse course and start cutting rates before the end of next year.
789,"In remarks late last month, Powell said he was tracking price trends in three different categories to best understand the likely path of inflation: Goods, excluding volatile food and energy costs; housing, which includes rents and the cost of home ownership; and services excluding housing, such as auto insurance, pet services and education."
790,"In his speech, Powell noted that there had been some progress in easing inflation in goods and housing but not so in most services."
791,"Some of those trends extended into last month’s data, with goods prices, excluding food and energy, falling 0.5 per cent from October to November, the second straight monthly drop."
792,"Housing costs, which make up nearly a third of the consumer price index, are still rising."
793,But real-time measures of apartment rents and home prices are starting to drop after having posted sizzling price acceleration at the height of the pandemic.
794,Powell said those declines will likely emerge in government data next year and should help reduce overall inflation.
795,"As a result, Powell’s biggest focus has been on services, which he said are likely to stay persistently high."
796,"In part, that’s because sharp increases in wages are becoming a key contributor to inflation."
797,"Services companies, like hotels and restaurants, are particularly labour-intensive."
798,"And with average wages growing at a brisk 5 per cent-6 per cent a year, price pressures keep building in that sector of the economy."
799,How the Fed will slow a robust labour market to help bring down inflation could prove perilous.
800,Powell and other Fed officials have said they hope their rate hikes will slow consumer spending and job growth.
801,"Businesses would then remove many of their job openings, easing the demand for labour."
802,"With less competition for workers, wages could begin to grow more slowly."
803,Powell has even named a wage target: He regards annual pay growth at a rate of about 3.5 per cent as compatible with 2 per cent inflation.
804,"Right now, average pay is growing about 5 per cent-6 per cent a year."
805,"Three months ago, the Fed’s policy-makers estimated that the unemployment rate would rise to 4.4 per cent next year, from 3.7 per cent now."
806,"On Wednesday, the policy-makers may forecast a higher unemployment rate by the end of 2023."
807,"If so, that would suggest that they foresee more layoffs and likely a recession."
808,Here's a quick look at the multiple variables that will come into play when this week's Fed meeting concludes Wednesday.
809,"U.S. Federal Reserve Board Chairman Jerome Powell holds a news conference after Federal Reserve raised its target interest rate by three-quarters of a percentage point in Washington, September 21, 2022."
810,"Kevin Lamarque | Reuters
 Rates
 Particularly in light of Tuesday's softer-than-expected consumer price index inflation report, it would be a shock if the FOMC does anything other than raises the fed funds rate a half point, taking the overnight borrowing benchmark to a targeted range of 4.25%-4.5%, the highest level in 15 years."
811,"While the committee vote is likely to be unanimous or close to it, not everyone is on board."
812,"""I'm hoping Jay Powell will stand firm and continue to do what needs to be done,"" said former FDIC Chairman William Isaac."
813,"""I'm hoping they go up at least a point."""
814,Then there's the other side.
815,"""This hiking cycle should be over right now,"" wrote Tom Porcelli, chief U.S. economist at RBC Capital Markets."
816,"""We have been fond of saying over recent months that the Fed is fighting yesterday's war on inflation ..."
817,"There is no need at this point to continue hiking rates but, of course, they will."""
818,"Communications
 Behind that unanimous or near-unanimous vote on rates will be a vigorous debate on where monetary policy should go from here."
819,That should be reflected in both the post-meeting statement and in Powell's news conference.
820,"One area where markets are looking for change is in phrasing saying the FOMC ""anticipates that ongoing increases in the target range will be appropriate"" to something more generic like ""some increases"" could be needed."
821,"That gives the Fed flexibility for its next move, with some in the markets anticipating that February could be the last rate hike for a while."
822,The Fed's next rate decision after this one is due Feb. 1.
823,Powell will be looked at to bring clarity to where the committee views the future of its inflation fight.
824,"""Traders will be closely monitoring Jay Powell's Q&A as we seek guidance on February potentially only being a 25 [basis point] increase and what the FOMC's plan is to get to a higher terminal rate yet over a longer period,"" said Victor Masotti, director of repo trading at Clear Street."
825,"The 'dot plot' and the 'terminal rate'
 That ""terminal rate"" of which Masotti spoke references the expected end point for the Fed and its current-rate hiking cycle."
826,"When the Fed last updated its dot plot — a chart in which each FOMC member gets an anonymous ""dot"" to project rate moves over the next few years — the terminal rate was pegged at 4.6%."
827,"With inflation still rising, notwithstanding recent reports, the endpoint is likely to grow as well."
828,But perhaps not by as much as market feared.
829,"Goldman Sachs said it's ""a close call between 5-5.25% and a smaller rise to 4.75-5%."
830,We continue to expect three 25bp hikes in 2023.
831,"At the margin, [Tuesday's CPI] report reduces the risk of a 50bp hike in February."""
832,"Signaling a softer approach could be dangerous, said Isaac, who was FDIC chair back in the early 1980s when inflation was raging and then-Fed Chairman Paul Volcker had to raise rates dramatically and pull the economy into recession."
833,"""People have to have confidence in the Fed, and that's what Volcker brought."
834,"You knew he meant what he said,"" said Isaac, chairman of Secura/Isaac Group, a global advisory firm."
835,"""If you don't have confidence in the government and the Fed in particular, it's going to be a long, hard slog."""
836,"Powell presser
 
 
 (For a Reuters live blog on U.S., UK and European stock markets, click or type LIVE/ in a news window.)"
837,"* Futures: Dow, S&P flat; Nasdaq down 0.09% Dec 14 (Reuters) - U.S. stock index futures were muted on Wednesday as investors stayed away from placing big bets ahead of the Federal Reserve's much-anticipated decision on interest rates."
838,"(For a Reuters live blog on U.S., UK and European stock markets, click or type LIVE/ in a news window.)"
839,"*
 Futures: Dow, S&P flat; Nasdaq down 0.09% Dec 14 (Reuters) -
 U.S. stock index futures were muted on Wednesday as investors stayed away from placing big bets ahead of the Federal Reserve's much-anticipated decision on interest rates."
840,The central bank is widely expected to hike the fed-funds rate by half a percentage point to 4.25-4.50%.
841,The decision will be announced at 2 p.m.
842,ET (1800 GMT) and will be followed by Chair Jerome Powell's press conference.
843,"Data on Tuesday showed that U.S. consumer prices grew at their slowest pace in about a year in November, sparking an early rally on Wall Street, with the S&P 500 jumping as much as 2.8% to a three-month high."
844,"The benchmark index, however, closed sharply off its high on concerns over the central back remaining aggressive."
845,"""This CPI release ultimately cements the case for a downshift in the pace of Fed rate hikes on Wednesday,"" BCA Research said in a note."
846,"""Although it raises the odds of a pause in H1, labor market dynamics remain too hot to call for rate cuts in the near term."""
847,"Strategists at Morgan Stanley are expecting the central bank to increase rates by another 25 basis points at its February meeting, but see no further increases in March, leaving the peak fed-funds rate at 4.625%."
848,"In contrast, money market participants are expecting two more 25 basis-point hikes next year, keeping the terminal rate at 4.82% by May 2023."
849,At 6:06 a.m.
850,"ET, Dow e-minis were down 1 point, S&P 500 e-minis were down 1.25 points, or 0.03%, and Nasdaq 100 e-minis were down 10.75 points, or 0.09%."
851,"Among stocks, Tesla Inc slipped 1% in premarket trading after a Goldman Sachs analyst trimmed the price target for the electric vehicle maker's stock."
852,(This story has not been edited by Devdiscourse staff and is auto-generated from a syndicated feed.)
853,"Euro zone bond yields rose on Wednesday, as investors cashed in on a rally the day before following U.S. inflation data that fuelled expectations for the Federal Reserve to signal it may raise rates more slowly."
854,"Euro zone bond yields rose on Wednesday, as investors cashed in on a rally the day before following U.S. inflation data that fuelled expectations for the Federal Reserve to signal it may raise rates more slowly."
855,The Fed releases its decision on interest rates later on Wednesday.
856,The central bank is expected to increase the federal funds rate by 50 basis points to a range of 4.25-4.50%.
857,"Meanwhile, The European Central Bank (ECB) expects inflation to remain above its 2% target for the next three years, signalling its fight against runaway prices is far from over."
858,"Data on Tuesday showed U.S. inflation rose by 7.1% in November, slowing for a fifth straight month, along with a moderation in the core rate, which excludes food and energy prices."
859,"The Fed is one of a number of major central banks, including the Bank of England and the ECB, that releases its final monetary policy decision of the year this week."
860,"Investors expect to see central banks deliver smaller rate hikes for the first time in months, as inflation is showing signs of having peaked and, as a result, the U.S. dollar has retreated."
861,The greenback has shed 10% in value since hitting two-decade highs in October.
862,"""Markets will look for the relative degree to which the central banks signal that they are ready to declare at least a pause in the hiking cycle soon,"" strategists at Saxo Bank said in a note."
863,"""With the late dollar weakness, a dovish shift is more likely,"" they added."
864,"German 10-year yields, which fell by as much as 8 basis points (bps) after the U.S. inflation figures, were last up 9 bps at 1.99%, their highest since Nov. 28."
865,The ECB is grappling with double-digit inflation across the euro zone that is hammering the economy.
866,"It's expected to raise interest rates by half a point to 2.00%, which would bring total increases this year to a cumulative record 250 bps."
867,But this has done little to reassure investors that headline inflation is going to come down any time soon.
868,"A key market-based gauge of long-term inflation expectations for the euro zone has steadily risen to around 2.4% from closer to 1.8% at the start of the year, largely because of the surge in energy prices in the region since Russia's invasion of Ukraine squeezed natural gas supply."
869,"Euro zone inflation eased more than expected in November, but underlying price growth is still stubbornly high."
870,"Similarly, data on Wednesday showed UK inflation has eased from 41-year peaks, but much of this was driven by a decline in the cost of motor fuels."
871,"""We don't know if the peak in the headline is behind us or ahead of us and, there have been downward surprises in the UK this morning and in the euro zone in November due to energy prices."
872,"Energy prices have gone down, but they may well go back up,"" ING senior rates strategist Antoine Bouvet said."
873,"The ECB's benchmark rate is expected to peak around 2.8% by next July, according to interest rate futures."
874,The performance among peripheral bonds was broadly in line with that of Germany.
875,"Spanish bond yields rose 1 bp to 2.987% following data that showed inflation slowed to 6.7% in November, the smallest annual increase this year."
876,"Italy's 10-year yield rose 12 bps to 3.92%, its highest since Nov. 28."
877,(This story has not been edited by Devdiscourse staff and is auto-generated from a syndicated feed.)
878,"Central bankers are still fighting inflation, but are poised to slow to a rate increase of half a percentage point at their final meeting of 2022."
879,"Federal Reserve officials appear poised to finish the most inflationary year since the 1980s on an optimistic note: They are expected to slow their campaign to cool the economy at their meeting on Wednesday, just as incoming data offer reasons to hope that price increases will fade next year."
880,Central bankers are expected to lift interest rates by half a percentage point to a range of 4.25 to 4.5 percent.
881,"That would be a slowdown from their past four meetings, where they raised rates in three-quarter-point increments."
882,"Officials will also release a fresh set of economic projections, their first since September, which will offer a glimpse at how high they expect rates to rise in 2023 and how long they plan to hold them there."
883,"Fed policymakers have lifted borrowing costs at the fastest pace in decades this year to slow demand in the economy, hoping to tamp down inflationary pressures and prevent rapid increases from becoming a permanent feature of the American economy."
884,"While inflation is now showing signs of slowing, it remains much faster than usual, and central bankers have made clear that they have more work to do in ensuring that it returns to normal."
885,U.S. stock futures hovered below the flatline ahead of the open Wednesday as investors face the Federal Reserve’s seventh and final interest rate increase of 2022.
886,U.S. stock futures hovered around the flatline ahead of the open Wednesday as investors face the Federal Reserve’s seventh and final interest rate increase of 2022.
887,The central bank is expected to deliver a half percentage point hike at the conclusion of its two-day policy meeting at 2:00 p.m.
888,ET.
889,"The increase is set to bring its key federal funds rate to a new range of 4.25% to 4.5%, the highest level since December 2007."
890,Futures tied to the S&P 500 (^GSPC) and Dow Jones Industrial Average (^DJI) were just below breakeven.
891,Contracts on the technology-focused Nasdaq Composite (^IXIC) declined 0.1%.
892,"In other markets, U.S. Treasuries dipped after climbing on Wednesday, and the U.S. dollar index retreated."
893,West Texas Crude Oil (WTI) futures rose 1% to trade above $76 per barrel.
894,Investors will assess remarks from Fed Chair Jerome Powel at 2:30 p.m.
895,ET in the aftermath of the rate announcement.
896,Economic projections from policymakers and the latest dot plot showing each member’s forecast for the U.S. short-term interest rate will also serve as guidance to investors on the Federal Reserve’s path forward.
897,"The decision will follow Wednesday’s closely-watched November Consumer Price Index (CPI), which rose at an annual 7.1% clip last month, the second consecutive downside surprise in inflation data."
898,"Stocks closed higher following the report, but Wall Street’s reaction was underwhelming, with uncertainty still ahead around how much higher rates need to go to quell prices that remain persistently high."
899,"While a downshift in inflation was welcome, equity markets pared sizable gains as traders thought, “what now?,” BMO Wealth Management’s Chief Investment Strategist Yung-Yu Ma said in an emailed note."
900,"“The Fed is still going to focus on the labor market imbalance, a dovish pivot is still a long way off, and in the meantime, companies and consumers have to recalibrate to the impact of higher interest rates and a slowing economy,” Ma added."
901,"“It’s all a balancing act, which we believe points to near-term choppy markets even though the improving inflation backdrop adds a positive bias.”
 Story continues
 WASHINGTON, DC - NOVEMBER 30: Chair of the U.S. Federal Reserve Jerome Powell speaks at the Brookings Institution, November 30, 2022 in Washington, DC."
902,"Powell discussed the economic outlook, inflation and the labor market."
903,"(Photo by Drew Angerer/Getty Images)
 That view was echoed by other Wall Street strategists, including Bank of America Chief U.S."
904,"Economist Michael Gapen, who indicated that although November’s consumer price report reflected a faster retracement in core goods inflation than expected, services inflation remains sticky."
905,"For investors, crosscurrents in the data
 “This is unlikely to affect the Fed's December decision – we continue to expect them to hike by 50 basis points – however, it may bring up discussions of another downshift in February,” Gapen said in a note penned along with his team at BofA."
906,"“We still think they go by 50 basis points given the tightness in the labor market and elevated wage growth, but the debate should be livelier especially if we get another soft December inflation report.”
 This week marks what is perhaps the last week of major U.S. economic events of the year for investors, with the government’s retail sales report also on the docket for Thursday."
907,"Even as a jam-packed economic calendar keeps traders busy domestically, traders will watch moves by central banks overseas, with policymakers from the U.K. Bank of England, Mexico, Norway, the Philippines, Switzerland, and Taiwan, all set to carry out their own rate decisions on Thursday."
908,"The U.K. received its own inflation reading Tuesday: a rapid rise in consumer prices decelerated slightly to 10.7% from a year earlier in November, down from a 41-year high of 11.1% during the prior month."
909,U.K. equities retreated as investors awaited the U.S. Federal Reserve's messaging later today and the Bank of England's rate decision Thursday.
910,The pound traded near its highest level since June.
911,"Back on this side of the Atlantic, all eyes were on the latest developments in cryptoworld, with former CEO of fallen cryptocurrency exchange FTX Sam Bankman-Fried facing a wave of criminal charges for his handling of customer and investor assets."
912,"On the corporate front, earnings from companies including Lennar (LEN), Trip.com (TCOM), and Weber (WEBR) are scheduled for release on Wednesday."
913,"—
 Alexandra Semenova is a reporter for Yahoo Finance."
914,"Follow her on Twitter @alexandraandnyc
 Click here for the latest trending stock tickers of the Yahoo Finance platform
 Click here for the latest stock market news and in-depth analysis, including events that move stocks
 Read the latest financial and business news from Yahoo Finance
 Download the Yahoo Finance app for Apple or Android
 Follow Yahoo Finance on Twitter, Facebook, Instagram, Flipboard, LinkedIn, and YouTube
 
 
 U.S. stock futures hovered below the flatline ahead of the open Wednesday as investors face the Federal Reserve’s seventh and final interest rate increase of 2022."
915,U.S. stock futures hovered around the flatline ahead of the open Wednesday as investors face the Federal Reserve’s seventh and final interest rate increase of 2022.
916,The central bank is expected to deliver a half percentage point hike at the conclusion of its two-day policy meeting at 2:00 p.m.
917,ET.
918,"The increase is set to bring its key federal funds rate to a new range of 4.25% to 4.5%, the highest level since December 2007."
919,Futures tied to the S&P 500 (^GSPC) and Dow Jones Industrial Average (^DJI) were just below breakeven.
920,Contracts on the technology-focused Nasdaq Composite (^IXIC) declined 0.1%.
921,"In other markets, U.S. Treasuries dipped after climbing on Wednesday, and the U.S. dollar index retreated."
922,West Texas Crude Oil (WTI) futures rose 1% to trade above $76 per barrel.
923,Investors will assess remarks from Fed Chair Jerome Powel at 2:30 p.m.
924,ET in the aftermath of the rate announcement.
925,Economic projections from policymakers and the latest dot plot showing each member’s forecast for the U.S. short-term interest rate will also serve as guidance to investors on the Federal Reserve’s path forward.
926,"The decision will follow Wednesday’s closely-watched November Consumer Price Index (CPI), which rose at an annual 7.1% clip last month, the second consecutive downside surprise in inflation data."
927,"Stocks closed higher following the report, but Wall Street’s reaction was underwhelming, with uncertainty still ahead around how much further rates need to go to quell prices that remain persistently high."
928,"While a downshift in inflation was welcome on Wednesday, equity markets pared much of the gains that came immediately following the print as traders thought, “what now?,” BMO Wealth Management’s Chief Investment Strategist Yung-Yu Ma said in an emailed note."
929,"“The Fed is still going to focus on the labor market imbalance, a dovish pivot is still a long way off, and in the meantime, companies and consumers have to recalibrate to the impact of higher interest rates and a slowing economy,” Ma added."
930,"“It’s all a balancing act, which we believe points to near-term choppy markets even though the improving inflation backdrop adds a positive bias.”
 Story continues
 WASHINGTON, DC - NOVEMBER 30: Chair of the U.S. Federal Reserve Jerome Powell speaks at the Brookings Institution, November 30, 2022 in Washington, DC."
931,"Powell discussed the economic outlook, inflation and the labor market."
932,"(Photo by Drew Angerer/Getty Images)
 That view was echoed by other Wall Street strategists, including Bank of America Chief U.S."
933,"Economist Michael Gapen, who indicated that although November’s consumer price report reflected a faster retracement in core goods inflation than expected, services inflation remains sticky."
934,"“This is unlikely to affect the Fed's December decision – we continue to expect them to hike by 50 basis points – however, it may bring up discussions of another downshift in February,” Gapen said in a note penned along with his team at BofA."
935,"“We still think they go by 50 basis points given the tightness in the labor market and elevated wage growth, but the debate should be livelier especially if we get another soft December inflation report.”
 This week marks what is perhaps the last week of major U.S. economic events of the year for investors, with the government’s retail sales report also on the docket for Thursday."
936,"Even as a jam-packed economic calendar keeps traders busy domestically, traders will watch moves by central banks overseas, with policymakers from the U.K. Bank of England, Mexico, Norway, the Philippines, Switzerland, and Taiwan, all set to carry out their own rate decisions on Thursday."
937,"The U.K. received its own inflation reading Tuesday: a rapid rise in consumer prices decelerated slightly to 10.7% from a year earlier in November, down from a 41-year high of 11.1% during the prior month."
