id,sentence
0,"Wall Street stocks inched up ahead of the US Federal Reserve’s meeting
 Traders on the New York Stock Exchange."
1,"Wall Street stocks inched up in early trading, while government bonds and the dollar were muted ahead of the US Federal Reserve’s meeting later in the day and central bank decisions in Europe and Britain on Thursday."
2,"Photograph: Spencer Platt/Getty Images
 European shares were subdued on Wednesday after hitting near one-week highs in the previous session, as investors treaded cautiously ahead of the US Federal Reserve’s interest rate decision."
3,"Concerns about the future trajectory of rate hikes kept optimism in check, as investors worried about the prospects of the US economy being tipped into a recession from sharp interest rate hikes."
4,Both the Bank of England and the European Central Bank will announce interest rate decisions on Thursday.
5,"Dublin
 The Iseq finished flat in line with the moribund mood across European markets."
6,"Ryanair fell for the third consecutive session, declining 1.4 per cent to €12.85, while Paddy Power owner Flutter Entertainment slipped 0.7 per cent to €139.70."
7,"READ MORE
 Insulation maker Kingspan also went into reverse, dropping 1.5 per cent to €53.50, while Bank of Ireland was down 1.1 per cent at €7.82."
8,"But AIB added 1.3 per cent to €3.21, building materials giant CRH rose almost 0.7 per cent to €38.06 and food group Kerry gained 1.65 per cent to €87.36."
9,"London
 The UK’s main stock indexes closed lower as investors took little relief from softer-than-expected UK inflation."
10,"The export-oriented FTSE 100 slipped 0.1 per cent, while the domestically focused FTSE 250 shed 0.3 per cent."
11,"Sterling benefited from weakness in the dollar and positivity surrounding a sharper-than-expected slowdown in inflation, which dipped from 11.1 per cent to 10.7 per cent in November."
12,"UK housebuilders fell 1.2 per cent as JPMorgan analysts published a cautious note on the sector, downgrading several stocks, citing a “seasonal lull” for the next few months."
13,"Among single stocks, TUI fell 8 per cent after the world’s largest holiday company said it planned to repay Covid support through a capital raise next year."
14,"BT Group was a bright spot, up 2.1 per cent, after the telecoms and network provider submitted its new Equinox 2 wholesale fibre offer to the British communications regulator Ofcom."
15,"Europe
 The region-wide STOXX 600 closed flat."
16,The index had rallied more than 1 per cent on Tuesday after softer-than-expected US inflation data raised hopes of the Fed shifting to smaller rate hikes.
17,"Euro zone borrowing costs rose amid hawkish remarks from European Central Bank sources, while investors were cashing in on a bond rally the day before fuelled by US inflation data."
18,"Rate-sensitive technology stocks declined 0.9 per cent, while banks fell 0.5 per cent."
19,"Defensive stocks such as Nestle and Unilever added 1 per cent each, capping losses on STOXX 600."
20,"Travel and leisure stocks fell 1.4 per cent, dragged lower by London-listed shares of TUI, which fell 8 per cent after the world’s largest holiday firm said it planned to repay Covid-19 support through a capital raise next year."
21,"Meanwhile, Zara owner Inditex rose 3.1 per cent after the world’s biggest fashion retailer posted a 24 per cent increase in net profit for the first nine months of its fiscal year."
22,"US
 Wall Street stocks inched up in early trading, while government bonds and the dollar were muted ahead of the US Federal Reserve’s meeting later in the day and central bank decisions in Europe and Britain on Thursday."
23,The subdued price moves followed a rally in stocks and a sharp drop in the US dollar in the previous session when consumer prices data showed a slowdown in inflation.
24,That lifted hopes that central banks will stop raising interest rates in early 2023.
25,"Mega-cap growth stocks like Microsoft, Apple, Mastercard and Qualcomm gained between 0.9 per cent and 1.1 per cent in the morning, while Tesla slipped 2 per cent after a Goldman Sachs analyst trimmed the price target for the electric-vehicle maker’s stock."
26,Delta Air Lines advanced 2 per cent as the Atlanta-based carrier is expecting to nearly double its profit next year.
27,"Additional reporting: Reuters
 
 
 The Federal Reserve reinforced its inflation fight Wednesday by raising its key interest rate for the seventh time this year and signaling more hikes to come."
28,But the Fed announced a smaller hike than it had in its past four meetings at a time when inflation is showing signs of easing.
29,WASHINGTON (AP) — The Federal Reserve reinforced its inflation fight Wednesday by raising its key interest rate for the seventh time this year and signaling more hikes to come.
30,But the Fed announced a smaller hike than it had in its past four meetings at a time when inflation is showing signs of easing.
31,"The Fed boosted its benchmark rate a half-point to a range of 4.25% to 4.5%, its highest level in 15 years."
32,"Though smaller than its previous three-quarter-point hikes, the latest move will further heighten the costs of many consumer and business loans and the risk of a recession."
33,The policymakers also forecast that their key short-term rate will reach a range of 5% to 5.25% by the end of 2023.
34,That suggests that the Fed is prepared to raise its benchmark rate by an additional three-quarters of a point and leave it there until the end of next year.
35,Some economists had expected that they would project only an additional half-point increase.
36,The central bank’s latest rate hike was announced one day after an encouraging report showed that inflation in the United States slowed in November for a fifth straight month.
37,"The year-over-year increase of 7.1%, though still high, was sharply below a recent peak of 9.1% in June."
38,Fed officials have indicated that they see some evidence of progress in their drive to defeat the worst inflation bout in four decades and to bring inflation back down to their 2% annual target.
39,"The national average for a gallon of regular gas, for example, has tumbled from $5 in June to $3.21."
40,"Many supply chains have unraveled, helping reduce goods prices."
41,"The better-than-expected November inflation data showed that the prices of used cars, furniture and toys all declined last month."
42,So did the costs of services from hotels to airfares to car rentals.
43,"Rental and home prices are falling, too, though those declines have yet to feed into the government’s data."
44,"And one measure the Fed tracks closely — “core” prices, which exclude volatile food and energy costs for a clearer snapshot of underlying inflation — rose only slightly for a second straight month."
45,"Inflation has also eased slightly in Europe and the United Kingdom, leading analysts to expect the European Central Bank and the Bank of England to slow their pace of rate hikes at their meetings Thursday."
46,Both are expected to raise rates by half a point to target still painfully high prices spikes after big three-quarter-point increases.
47,"Inflation in the 19 countries using the euro currency fell to 10% from 10.6% in October, the first decline since June 2021."
48,The rate is so far above the bank’s 2% goal that rate hikes are expected to continue into next year.
49,Britain’s inflation also eased from a 41-year record of 11.1% in October to a still-high 10.7% in November.
50,"At the Fed, Chair Jerome Powell has made clear that the central bank isn’t close to declaring victory over high inflation."
51,Fed officials will likely want to see further moderate inflation readings before they would be comfortable suspending their rate hikes.
52,One reason for caution is that inflation gauges can sometimes reignite after initially slowing.
53,"In 2021, for example, core price increases slowed for a couple of months in the summer before accelerating again and reaching new heights."
54,"Cumulatively, the Fed’s hikes have led to much costlier borrowing rates for consumers as well as companies, ranging from mortgages to auto and business loans."
55,"The hikes have sent home sales plummeting and are starting to reduce rents on new apartments, a leading source of high inflation."
56,The officials have said they want rates to reach “restrictive” levels that slow growth and hiring and bring inflation down to their annual target of 2%.
57,Worries have grown that the Fed is raising rates so much in its drive to curb inflation that it will trigger a recession next year.
58,The policymakers have stressed that more important than how fast they raise rates is how long they keep them at or near their peak.
59,Wall Street investors are betting that the Fed will reverse course and start cutting rates before the end of next year.
60,"Housing costs, which make up nearly a third of the consumer price index, are still rising."
61,But real-time measures of apartment rents and home prices are starting to drop after having posted sizzling price acceleration at the height of the pandemic.
62,Powell said those declines will likely emerge in government data next year and should help reduce overall inflation.
63,"Powell’s biggest focus has been on services, which he said are likely to stay persistently high."
64,"In part, that’s because sharp increases in wages are becoming a key contributor to inflation."
65,"Services companies, like hotels and restaurants, are particularly labor-intensive."
66,"And with average wages growing at a brisk 5%-6% a year, price pressures keep building in that sector of the economy."
67,How the Fed will slow a robust labor market to help tame inflation could prove perilous.
68,Powell and other Fed officials have said they hope their rate hikes will slow both consumer spending and job growth.
69,"Businesses would then remove many of their job openings, reducing the demand for labor."
70,"With less competition for workers, wages could begin to grow more slowly."
71,The Federal Reserve's final policy meeting of 2022 is expected to see the central bank raise its benchmark interest rate by 0.50%.
72,"The Federal Reserve is expected to slow the pace of its aggressive interest rate hike campaign this afternoon, as consumer prices have shown signs of cooling for two straight months."
73,"The central bank is expected to raise its benchmark interest rate by half a percentage point to a new range of 4.25% and 4.5%, marking the highest level since December 2007."
74,The Fed will announce its policy decision at 2 p.m.
75,"ET, followed by Fed Chair Jerome Powell’s press conference at 2:30 p.m."
76,ET.
77,"This move will usher in a slower phase of rate hikes after the central bank, which has raised the target range for its benchmark interest rate by 0.75% at each of its last four policy meetings."
78,"Federal Reserve Board Chairman Jerome Powell holds a news conference after Powell announced the Fed raised interest rates by three-quarters of a percentage point as part of their continuing efforts to combat inflation, following the Federal Open Market Committee meeting on interest rate policy in Washington, U.S., November 2, 2022."
79,"REUTERS/Elizabeth Frantz
 Fed Chair Jay Powell set the table for a 50-basis point rate hike last week, saying in a speech it, ""makes sense to moderate the pace of our rate increases as we approach the level of restraint that will be sufficient to bring inflation down."""
80,"Wednesday, all eyes will be on a new set of interest rate projections, cluing investors into how high officials see rates rising."
81,"Investors will also get a new set of estimates on the Fed’s outlook for inflation, GDP, and unemployment."
82,Inflation has shown signs of slowing down the past few months after hitting a 40-year high this spring.
83,"The Consumer Price Index, excluding the more volatile food and energy components, rose 0.2% month-on-month in November, down from 0.3% in October and 0.6% in September and August."
84,"The top questions on investors’ minds: Will the Fed slow down rate hikes further, how much higher will the Fed raise rates, and when will the Fed halt its rate hikes and hold rates steady."
85,"Click here for the latest economic news and economic indicators to help you in your investing decisions
 Read the latest financial and business news from Yahoo Finance
 Download the Yahoo Finance app for Apple or Android
 Follow Yahoo Finance on Twitter, Facebook, Instagram, Flipboard, LinkedIn, and YouTube
 
 
 Wall Street's main indexes rose on Wednesday ahead of the Federal Reserve's monetary policy decision and economic projections for clues on the path of interest rates."
86,The U.S. central bank is expected to raise its key rate by 50 basis points to 4.25-4.50% at its last meeting of 2022 after four straight 75 bps increases following a surprise drop in inflation.
87,Wall Street's main indexes rose on Wednesday ahead of the Federal Reserve's monetary policy decision and economic projections for clues on the path of interest rates.
88,The U.S. central bank is expected to raise its key rate by 50 basis points to 4.25-4.50% at its last meeting of 2022 after four straight 75 bps increases following a surprise drop in inflation.
89,"The decision, scheduled for 2 p.m."
90,"ET, will be followed by Chair Jerome Powell's press conference."
91,"Fed officials will also issue new projections showing just how close that endpoint of rates may be, with Tuesday's data showing cooling inflation data for November triggering bets across stock and bond markets it may be closer than expected."
92,"""Markets are looking for what they've already discounted and that is a 50 basis point hike, but going forward the focus will be on the dot plot which may indicate the Fed's terminal rate,"" said Peter Cardillo, chief market economist at Spartan Capital Securities LLC in New York."
93,"""If it's between 4% and 5%, well that's already priced in."
94,"If it's higher, that could be a little bit of a negative surprise."""
95,"Money market participants expect two more 25 basis-point hikes next year, taking the terminal rate to 4.82% by May."
96,"The U.S. central bank, in its battle against decades-high inflation, has raised its policy rate by 375 basis points so far this year to a 3.75%-4.00% range from near zero, the fastest pace of rate hikes since the 1980s."
97,Fears that aggressive interest rate increases by major central banks could tip the global economy into a recession have hammered risk assets such as equities this year.
98,"The S&P 500 and the Nasdaq have lost 15.2% and 27.6%, respectively, this year and are on track for their worst annual performance since the 2008 financial crisis."
99,The rate-sensitive S&P 500 real estate sector index and growth index have posted double-digit drops this year.
100,At 12:08 p.m.
101,"ET, the Dow Jones Industrial Average was up 208.24 points, or 0.61%, at 34,316.88, the S&P 500 was up 22.32 points, or 0.56%, at 4,041.97, and the Nasdaq Composite was up 61.82 points, or 0.55%, at 11,318.64."
102,All the 11 major S&P 500 sectors were in the green.
103,"Gains were led by defensive sectors, often preferred in times of economic uncertainty, such as healthcare, utilities and industrials."
104,"Megacap growth stocks such as Microsoft Corp, Apple Inc, Mastercard Inc and Qualcomm Inc gained between 1.1% and 1.7%."
105,Tesla Inc slipped 1.1% after a Goldman Sachs analyst trimmed the price target for the electric-vehicle maker's stock.
106,Charter Communications Inc slid 13.7% as brokerages cut their price targets following the telecom services firm's mega spending plans on higher-speed internet upgrade.
107,Pfizer Inc gained 2.4% following an agreement with China Meheco Group Co Ltd to import and distribute the U.S.-based company's oral COVID-19 treatment Paxlovid in mainland China.
108,Advancing issues outnumbered decliners by a 1.89-to-1 ratio on the NYSE and 1.51-to-1 ratio on the Nasdaq.
109,"The S&P index recorded five new 52-week highs and one new low, while the Nasdaq recorded 56 new highs and 136 new lows."
110,(This story has not been edited by Devdiscourse staff and is auto-generated from a syndicated feed.)
111,"After four straight three-quarter-point interest rate hikes, the Federal Reserve is set to announce a smaller half-point increase in its key rate Wednesday, a first step toward dialing back its efforts to combat inflation."
112,"After four straight three-quarter-point interest rate hikes, the Federal Reserve is set to announce a smaller half-point increase in its key rate Wednesday, a first step toward dialing back its efforts to combat inflation."
113,"At the same time, the Fed is expected to signal that it plans more hikes next year than it had previously forecast to try to conquer the worst inflation bout in four decades."
114,"And most economists think Chair Jerome Powell will stress that the Fed will likely keep its benchmark rate at its high point through next year, even after the hikes have ended."
115,"Advertisement
 The Fed’s decision Wednesday will follow a government report Tuesday that provided hopeful signs that inflation is finally easing from chronically high levels."
116,"Gas prices fell, the cost of used cars, furniture and toys declined, and the costs of services from hotels to airfares to car rentals dropped."
117,"The six rate hikes the Fed has already imposed this year have raised its key short-term rate to a range of 3.75% to 4%, its highest level in 15 years."
118,"Cumulatively, the hikes have led to much costlier borrowing rates for consumers as well as companies, ranging from mortgages to auto and business loans."
119,Worries have grown that the Fed is raising rates so much in its drive to curb inflation that it will trigger a recession next year.
120,"Advertisement
 Yet with price increases still uncomfortably high — inflation was 7.1% in November compared with a year earlier — Powell and other Fed officials have underscored that they expect to keep rates at their peak for an extended period."
121,"With inflation pressures now easing, though, most economists think the Fed will further slow its hikes and raise its key rate by just a quarter-point at its next meeting early next year."
122,"“The data (Tuesday) kind of fits with our idea that the Fed will downshift further in February,” said Matthew Luzzetti, an economist at Deutsche Bank and a former research analyst at the Fed."
123,"“Downshifting helps to maximize their prospects of a soft landing,” in which the Fed’s rate hikes would slow growth and tame inflation but not tip the economy into a recession."
124,"On Wednesday, members of the Fed’s rate-setting committee will also update their projections for interest rates and other economic barometers for 2023 and beyond."
125,"Most analysts have forecast that they will pencil in a peak range of at least 4.75% to 5%, or even 5% to 5.25%, up from their September forecast of 4.5% to 4.75%."
126,Despite Powell’s recent hard-line remarks — he said late last month that “we have not seen clear progress on slowing inflation” — he and other Fed officials have made clear that they’re ready to dial down the pace of rate hikes.
127,"In doing so, they will have time to assess the impact of the increases they’ve already imposed."
128,"Those hikes have sent home sales plummeting and are starting to reduce rents on new apartments, a leading source of high inflation."
129,Fed officials have also said they want rates to reach “restrictive” levels that slow growth and hiring and bring inflation down to the their annual target of 2%.
130,"“What policy rate is sufficiently restrictive we will only learn over time by watching how the economy evolves,” said Lisa Cook, one of seven members of the Fed’s Board of Governors."
131,"“Given the tightening already in the pipeline, I am mindful that monetary policy works with long lags.”
 Fed officials have stressed that more important than how fast they raise rates is how long they keep them at or near their peak."
132,"In September, the Fed forecast it would do so through 2023."
133,Yet Wall Street investors are now betting that the Fed will reverse course and start cutting rates before the end of next year.
134,"Advertisement
 In remarks late last month, Powell said he was tracking price trends in three different categories to best understand the likely path of inflation: Goods, excluding volatile food and energy costs; housing, which includes rents and the cost of homeownership; and services excluding housing, such as auto insurance, pet services and education."
135,"In his speech, Powell noted that there had been some progress in easing inflation in goods and housing but not so in most services."
136,"Some of those trends extended into last month’s data, with goods prices, excluding food and energy, falling 0.5% from October to November, the second straight monthly drop."
137,"Housing costs, which make up nearly a third of the consumer price index, are still rising."
138,But real-time measures of apartment rents and home prices are starting to drop after having posted sizzling price acceleration at the height of the pandemic.
139,Powell said those declines will likely emerge in government data next year and should help reduce overall inflation.
140,"As a result, Powell’s biggest focus has been on services, which he said are likely to stay persistently high."
141,"In part, that’s because sharp increases in wages are becoming a key contributor to inflation."
142,"Services companies, like hotels and restaurants, are particularly labor-intensive."
143,"And with average wages growing at a brisk 5%-6% a year, price pressures keep building in that sector of the economy."
144,How the Fed will slow a robust labor market to help bring down inflation could prove perilous.
145,Powell and other Fed officials have said they hope their rate hikes will slow consumer spending and job growth.
146,"Businesses would then remove many of their job openings, easing the demand for labor."
147,"With less competition for workers, wages could begin to grow more slowly."
148,Powell has even named a wage target: He regards annual pay growth at a rate of about 3.5% as compatible with 2% inflation.
149,"Right now, average pay is growing about 5%-6% a year."
150,"Advertisement
 Three months ago, the Fed’s policymakers estimated that the unemployment rate would rise to 4.4% next year, from 3.7% now."
151,"On Wednesday, the policymakers may forecast a higher unemployment rate by the end of 2023."
152,"If so, that would suggest that they foresee more layoffs and likely a recession."
153,The Federal Reserve reinforced its inflation fight Wednesday by raising its key interest rate for the seventh time this year and signaling more hikes to come.
154,But the Fed announced a smaller hike than it had in its past four meetings at a time when inflation is showing signs of easing.
155,WASHINGTON (AP) — The Federal Reserve reinforced its inflation fight Wednesday by raising its key interest rate for the seventh time this year and signaling more hikes to come.
156,But the Fed announced a smaller hike than it had in its past four meetings at a time when inflation is showing signs of easing.
157,"The Fed boosted its benchmark rate a half-point to a range of 4.25% to 4.5%, its highest level in 15 years."
158,"Though smaller than its previous three-quarter-point hikes, the latest move will further heighten the costs of many consumer and business loans and the risk of a recession."
159,The policymakers also forecast that their key short-term rate will reach a range of 5% to 5.25% by the end of 2023.
160,That suggests that the Fed is prepared to raise its benchmark rate by an additional three-quarters of a point and leave it there until the end of next year.
161,Some economists had expected that they would project only an additional half-point increase.
162,The central bank’s latest rate hike was announced one day after an encouraging report showed that inflation in the United States slowed in November for a fifth straight month.
163,"The year-over-year increase of 7.1%, though still high, was sharply below a recent peak of 9.1% in June."
164,Fed officials have indicated that they see some evidence of progress in their drive to defeat the worst inflation bout in four decades and to bring inflation back down to their 2% annual target.
165,"The national average for a gallon of regular gas, for example, has tumbled from $5 in June to $3.21."
166,"Many supply chains have unraveled, helping reduce goods prices."
167,"The better-than-expected November inflation data showed that the prices of used cars, furniture and toys all declined last month."
168,So did the costs of services from hotels to airfares to car rentals.
169,"Rental and home prices are falling, too, though those declines have yet to feed into the government’s data."
170,"And one measure the Fed tracks closely — “core” prices, which exclude volatile food and energy costs for a clearer snapshot of underlying inflation — rose only slightly for a second straight month."
171,"Inflation has also eased slightly in Europe and the United Kingdom, leading analysts to expect the European Central Bank and the Bank of England to slow their pace of rate hikes at their meetings Thursday."
172,Both are expected to raise rates by half a point to target still painfully high prices spikes after big three-quarter-point increases.
173,"Inflation in the 19 countries using the euro currency fell to 10% from 10.6% in October, the first decline since June 2021."
174,The rate is so far above the bank’s 2% goal that rate hikes are expected to continue into next year.
175,Britain’s inflation also eased from a 41-year record of 11.1% in October to a still-high 10.7% in November.
