id,sentence
349,"Another part of the curve that compares the yield on three-month Treasury bills and 10-year notes has flattened dramatically over the past few weeks, from nearly 220 basis points in May to around 15 basis points this week although it steepened after Powell's remarks."
350,"Separately, futures contracts tied to the Fed's policy rate showed this week that benchmark U.S. interest rates will peak in January 2023, earlier than the February reading they gave last week."
351,"read more
 ""Inverting yield curves, rising inflation, weakening housing data, and slumping surveys have all driven the increase (in recession probability) in the US,"" wrote Credit Suisse analysts in a research note on Tuesday, forecasting that the probability of the United States being in recession 6 and 12 months ahead is approximately 25%."
352,"""It is likely recession probabilities rise further in the coming months if policy rate hikes cause further curve inversion and cyclical data continue to deteriorate,"" they added."
353,"Register now for FREE unlimited access to Reuters.com Register
 Reporting by Davide Barbuscia; additional reporting by Gertrude Chavez-Dreyfuss and Dan Burns; editing by Megan Davies and Sandra Maler
 Our Standards: The Thomson Reuters Trust Principles."
354,The Federal Reserve is expected to raise interest rates by another 0.75% on Wednesday afternoon.
355,The Federal Reserve is expected to again raise interest rates this afternoon as it continues actions to tame multi-decade highs in inflation.
356,The central bank will likely ratchet short-term borrowing costs up another 0.75% at the conclusion of its meeting Wednesday.
357,"Doing so would lift the federal funds rate to a target range between 2.25% and 2.5%, matching highs from its most recent rate hiking cycle, which ended in mid-2019."
358,"By making it more expensive to borrow, Fed Chairman Jerome Powell and his colleagues at the central bank hope to dampen the economic activity that has, in part, led price increases."
359,"Inflation remains at levels unseen since the early 1980s, with prices rising 9.1% in June."
360,The question investors will be asking on Wednesday is: How much further will interest rates have to rise to cool inflation back to the Fed's 2% target?
361,And: can the Fed raise interest rates without tightening economic activity so much that it triggers its own recession?
362,The Fed will release its policy statement at 2 p.m.
363,ET followed by Powell's press conference at 2:30 p.m.
364,ET.
365,"Federal Reserve Board Chairman Jerome Powell speaks to reporters in Washington, U.S., June 15, 2022."
366,"REUTERS/Elizabeth Frantz
 Brian Cheung is a reporter covering the Fed, economics, and banking for Yahoo Finance."
367,You can follow him on Twitter @bcheungz.
368,"Click here for the latest economic news and economic indicators to help you in your investing decisions
 Read the latest financial and business news from Yahoo Finance
 Download the Yahoo Finance app for Apple or Android
 Follow Yahoo Finance on Twitter, Facebook, Instagram, Flipboard, LinkedIn, and YouTube
 
 
 The Federal Reserve hiked interest rates by an additional three-quarters of a percentage point."
369,An economist explains what this means for the economy.
370,"The U.S. Federal Reserve hiked its benchmark interest rate by a further three-quarters of a percentage point on July 27, 2022."
371,"The jump was expected by most economists, although some had thought the central bank would go further in its attempts to put the brakes on soaring inflation and impose a full point increase."
372,"The Conversation asked Arabinda Basistha, an economist at West Virginia University, to cast an eye over the Fed’s announcement and provide three key takeaways about what it tells us about the economy and future monetary policy."
373,1.
374,"More hawkish on monetary policy
 On the surface, the headline decision to raise the interest rate by three-quarters of a percentage point is very much in line with what was expected."
375,"But a careful reading of the accompanying statement by the rate-setting Federal Open Market Committee (FOMC) reveals a slightly more hawkish Fed – one that’s more willing to act more aggressively in attempting to calm inflation – than in the last such meeting in June, when it likewise raised rates by three-quarters of a percentage point."
376,"On that occasion, the vote was not unanimous – Kansas City Fed President Esther George opted to go for a half-point raise but was outvoted by colleagues who wanted the more aggressive 0.75% hike in a bid to bring down inflation."
377,"But this time the vote was unanimously in favor of the three-quarter point rise, an indication that the Fed thinks it needs to act more decisively in the face of stubborn cost of living increases."
378,A notable change in the FOMC statement was the removal of any reference to supply chain disruptions due to COVID-19 in China.
379,"That line was in June’s statement, so its absence this time may indicate an easing of the supply chain issues that have contributed to inflation hitting a 40-year high."
380,"That aside, Fed Chairman Jerome Powell stuck a downbeat note on inflation in the U.S., acknowledging in a news conference accompanying the announcement that June’s Consumer Price Index hitting 9.1% was “worse than expected.”
 2."
381,"Expect a further rate hike in September
 There is now a clear indication that that the FOMC will impose another rate hike when it meets in September."
382,"Powell noted in the news conference that another 0.75 percentage point rise in September “could be appropriate.”
 At the same time, he acknowledged that with the latest increase, the Fed’s rate was pretty much in line with what economists call the “neutral” rate of interest – that is, a rate which neither stimulates the economy nor slows it down."
383,The “neutral rate” is assumed to be around 2.5%; the latest FOMC hike puts the Feds’ policy rate up to a range of 2.25% to 2.5%.
384,"So if there were to be another fairly sharp rise in the benchmark interest rate in September, it would push the Fed rate above the neutral rate – a move that would restrict economic growth."
385,"Again, this is an indication that the Fed is striking a more hawkish tone on monetary policy."
386,"Powell did mention that a more moderate rate rise in September is possible, but that will likely depend on there being clear data showing price stabilization and an overall softening of the labor market."
387,"The job market has been strong for a while, with healthy monthly gains."
388,"The Fed will be looking for a decrease in the current high number of job vacancies, along with lower wage inflation, to signal a softening labor market before it can ease back on aggressive rate hikes."
389,3.
390,"Economic output is slowing, but no recession (yet)
 In the statement accompanying the FOMC rate decision, the Fed noted that recent data showed “spending and production have softened.” Powell expanded on that a little, noting that business fixed investment – that is, how much companies spend on things like machines or factories – had gone down."
391,"This acknowledgment that expenditure is softening wasn’t in June’s statement and is a clear sign that Fed officials believe the economy is slowing down, something Powell acknowledged."
392,"Yet at the same time, the Fed chair said the strength of the labor market indicated robust overall demand."
393,"As such, it would seem Powell does not see the U.S. heading into recession, but rather, there will be some slowing down of the economy throughout the second half of this year."
394,Second-quarter results reveal that major banks are already benefiting from the Federal Reserve’s interest rate hikes.
395,"Big U.S. banks have begun to reap the rewards of higher interest rates as the Federal Reserve combats inflation with a series of hikes, as evidenced by second-quarter results earlier this month."
396,"Thanks to higher rates and good loan growth, banks posted a 9% surge in second-quarter net interest income on a quarterly basis."
397,"This is a ""key driver"" for revenue that should continue into the third quarter, JPMorgan banking analysts led by Vivek Juneja said Wednesday in a note."
398,"In fact, the team recently updated their bank EPS estimates to ""reflect a faster pace of Fed rate hikes"" equal to two more 75 basis point increases through the end of the year."
399,(The Fed is widely expected to raise its benchmark rate by 75 basis points later Wednesday.)
400,"While that could've made the sector attractive to investors, the problem is that banks are trading off whether the U.S. economy can avoid a recession."
401,"Parts of the yield curve have inverted in recent months, signaling concern that the Fed will induce a downturn."
402,"The KBW Bank Index has lost 20% this year, worse than the roughly 16% decline of the S & P 500, on concern that a recession will result in higher loan defaults."
403,"""Bank stocks remain attractively valued, but the key concern remains whether there will be a hard or soft landing and what impact Fed tightening will have,"" Juneja said."
404,"""We expect markets and bank stocks to remain choppy until there are clearer signs of the impact of persistently high inflation."""
405,"Given that reality, Juneja prefers Regions Financial and PNC Financial Services Group , relatively smaller players which will benefit from higher rates while also having less of the Wall Street operations that have been affected by a collapse in investment banking revenue."
406,"JPMorgan Chase, Bank of America and Citigroup all have sizable investment banks in addition to large retail operations."
407,"""We prefer Regions due to less reliance on markets-related revenues and its excess liquidity, and PNC due to strong credit profile,"" the analyst said."
408,"Regions can gain from rising net interest income because of its ""high level of liquid assets and conservative"" assumptions around deposits, Juneja said."
409,The analyst hiked the year-end price target on Regions to $24.50 from $23.50.
410,"PNC has a good track record of managing interest rates and credit risk well while also building ""higher multiple fee-generating businesses,"" according to Juneja, who has a year-end price target of $191 on the bank."
411,"Both of the regional banks are rated ""overweight"" by the JPMorgan analysts."
412,"—With CNBC's Michael Bloom
 
 
 WASHINGTON (AP) — With inflation at a four-decade high , the job market strong and consumers still spending , the Federal Reserve is under pressure to continue raising interest rates aggressively."
413,"FILE - Federal Reserve Chairman Jerome Powell speaks to the Senate Banking, Housing and Urban Affairs Committee, as he presents the Monetary Policy Report to the committee on Capitol Hill, on June 22, 2022, in Washington."
414,"With inflation raging at a four-decade high and the job market strong, the Fed is under pressure to raise interest rates aggressively."
415,"(AP Photo/Manuel Balce Ceneta, File)
 FILE - Federal Reserve Chairman Jerome Powell speaks to the Senate Banking, Housing and Urban Affairs Committee, as he presents the Monetary Policy Report to the committee on Capitol Hill, on June 22, 2022, in Washington."
416,"With inflation raging at a four-decade high and the job market strong, the Fed is under pressure to raise interest rates aggressively."
417,"(AP Photo/Manuel Balce Ceneta, File)
 WASHINGTON (AP) — With inflation at a four-decade high , the job market strong and consumers still spending , the Federal Reserve is under pressure to continue raising interest rates aggressively."
418,"When it ends its latest policy meeting Wednesday afternoon, the Fed is expected to impose a second consecutive three-quarter-point hike in its benchmark interest rate, raising it to a range of 2.25% to 2.5%."
419,It will be the Fed’s fourth rate hike since March.
420,"Since then, with inflation setting new four-decade highs, the central bank has tightened credit ever more aggressively."
421,"A news conference that Chair Jerome Powell will hold Wednesday — and whatever signals, if any, he sends about the Fed’s next steps — will draw intense interest."
422,"By raising borrowing rates, the Fed makes it costlier to take out a mortgage or an auto or business loan."
423,"In turn, consumers and businesses will likely borrow and spend less, cooling the economy and slowing inflation."
424,"The Fed’s hikes have already led to a doubling of the average rate on a 30-year fixed mortgage in the past year, to 5.5%, and home sales have tumbled ."
425,The central bank is betting it can slow growth just enough to tame inflation yet not so much as to trigger a recession — a risk that many analysts fear may end badly.
426,"ADVERTISEMENT
 Some analysts point to signs that the economy is slowing and might even have shrunk in the first half of the year."
427,"As a result, they worry that the Fed could end up tightening credit too much, too fast, and end up causing a downturn that would lead to layoffs and rising unemployment."
428,"In the meantime, the surge in inflation and fear of a recession have eroded consumer confidence and stirred public anxiety about the economy , which is sending frustratingly mixed signals ."
429,"With the November midterm elections nearing, Americans’ discontent has diminished President Joe Biden’s public approval ratings and increased the likelihood that the Democrats will lose control of the House and Senate."
430,"On Thursday, when the government estimates the gross domestic product for the April-June period, some economists think it may show that the economy shrank for a second straight quarter."
431,That would meet one longstanding assumption for when a recession has begun.
432,But economists say that wouldn’t mean a recession had started .
433,"During those same six months when the economy might have contracted, employers added 2.7 million jobs — more than were gained in most entire years before the pandemic."
434,"Wages are also rising at a healthy pace, with many employers still struggling to attract and retain enough workers."
435,"The definition of recession that is most widely accepted is the one determined by the National Bureau of Economic Research, a group of economists whose Business Cycle Dating Committee defines a recession as “a significant decline in economic activity that is spread across the economy and lasts more than a few months.” The committee assesses a range of factors before publicly declaring the death of an economic expansion and the birth of a recession — and often does so well after the fact."
436,"The Federal Reserve is under pressure to continue raising interest rates aggressively with inflation at a four-decade high, the job market strong and consumers still spending."
437,"FILE - Federal Reserve Chairman Jerome Powell speaks to the Senate Banking, Housing and Urban Affairs Committee, as he presents the Monetary Policy Report to the committee on Capitol Hill, on June 22, 2022, in Washington."
438,"With inflation raging at a four-decade high and the job market strong, the Fed is under pressure to raise interest rates aggressively."
439,"(AP Photo/Manuel Balce Ceneta, File)
 WASHINGTON – With inflation at a four-decade high, the job market strong and consumers still spending, the Federal Reserve is under pressure to continue raising interest rates aggressively."
440,"When it ends its latest policy meeting Wednesday afternoon, the Fed is expected to impose a second consecutive three-quarter-point hike in its benchmark interest rate, raising it to a range of 2.25% to 2.5%."
441,It will be the Fed's fourth rate hike since March.
442,"Since then, with inflation setting new four-decade highs, the central bank has tightened credit ever more aggressively."
443,"A news conference that Chair Jerome Powell will hold Wednesday — and whatever signals, if any, he sends about the Fed’s next steps — will draw intense interest."
444,"Ad
 By raising borrowing rates, the Fed makes it costlier to take out a mortgage or an auto or business loan."
445,"In turn, consumers and businesses will likely borrow and spend less, cooling the economy and slowing inflation."
446,"The Fed's hikes have already led to a doubling of the average rate on a 30-year fixed mortgage in the past year, to 5.5%, and home sales have tumbled."
447,The central bank is betting it can slow growth just enough to tame inflation yet not so much as to trigger a recession — a risk that many analysts fear may end badly.
448,Some analysts point to signs that the economy is slowing and might even have shrunk in the first half of the year.
449,"As a result, they worry that the Fed could end up tightening credit too much, too fast, and end up causing a downturn that would lead to layoffs and rising unemployment."
450,"Ad
 In the meantime, the surge in inflation and fear of a recession have eroded consumer confidence and stirred public anxiety about the economy, which is sending frustratingly mixed signals."
451,"With the November midterm elections nearing, Americans' discontent has diminished President Joe Biden's public approval ratings and increased the likelihood that the Democrats will lose control of the House and Senate."
452,"On Thursday, when the government estimates the gross domestic product for the April-June period, some economists think it may show that the economy shrank for a second straight quarter."
453,That would meet one longstanding assumption for when a recession has begun.
454,"Ad
 But economists say that wouldn’t mean a recession had started."
455,"During those same six months when the economy might have contracted, employers added 2.7 million jobs — more than were gained in most entire years before the pandemic."
456,"Wages are also rising at a healthy pace, with many employers still struggling to attract and retain enough workers."
457,"The definition of recession that is most widely accepted is the one determined by the National Bureau of Economic Research, a group of economists whose Business Cycle Dating Committee defines a recession as “a significant decline in economic activity that is spread across the economy and lasts more than a few months.” The committee assesses a range of factors before publicly declaring the death of an economic expansion and the birth of a recession — and often does so well after the fact."
458,The Federal Reserve raised its benchmark interest rate by a hefty three-quarters of a point for a second straight time in its most aggressive drive in three decades to tame high inflation.
459,"FILE - Federal Reserve Chairman Jerome Powell speaks to the Senate Banking, Housing and Urban Affairs Committee, as he presents the Monetary Policy Report to the committee on Capitol Hill, on June 22, 2022, in Washington."
460,"With inflation raging at a four-decade high and the job market strong, the Fed is under pressure to raise interest rates aggressively."
461,"(AP Photo/Manuel Balce Ceneta, File)
 WASHINGTON – The Federal Reserve on Wednesday raised its benchmark interest rate by a hefty three-quarters of a point for a second straight time in its most aggressive drive in three decades to tame high inflation."
462,"The Fed’s move will raise its key rate, which affects many consumer and business loans, to a range of 2.25% to 2.5%, its highest level since 2018."
463,"The central bank’s decision follows a jump in inflation to 9.1%, the fastest annual rate in 41 years, and reflects its strenuous efforts to slow price gains across the economy."
464,"By raising borrowing rates, the Fed makes it costlier to take out a mortgage or an auto or business loan."
465,"Consumers and businesses then presumably borrow and spend less, cooling the economy and slowing inflation."
466,"The Fed is tightening credit even while the economy has begun to slow, thereby heightening the risk that its rate hikes will cause a recession later this year or next."
467,"The surge in inflation and fear of a recession have eroded consumer confidence and stirred public anxiety about the economy, which is sending frustratingly mixed signals."
468,"Ad
 With the November midterm elections nearing, Americans’ discontent has diminished President Joe Biden’s public approval ratings and increased the likelihood that the Democrats will lose control of the House and Senate."
469,"The Fed’s moves to sharply tighten credit have torpedoed the housing market, which is especially sensitive to interest rate changes."
470,"The average rate on a 30-year fixed mortgage has roughly doubled in the past year, to 5.5%, and home sales have tumbled."
471,"At the same time, consumers are showing signs of cutting spending in the face of high prices."
472,And business surveys suggest that sales are slowing.
473,"Ad
 The central bank is betting that it can slow growth just enough to tame inflation yet not so much as to trigger a recession — a risk that many analysts fear may end badly."
474,"In a statement the Fed issued after its latest policy meeting ended, it acknowledged that while “indicators of spending and production have softened,” “job gains have been robust in recent months, and the unemployment rate has remained low.” The Fed typically assigns high importance to the pace of hiring and pay growth because when more people earn paychecks, the resulting spending can fuel inflation."
475,"On Thursday, when the government estimates the gross domestic product for the April-June period, some economists think it may show that the economy shrank for a second straight quarter."
476,That would meet one longstanding assumption for when a recession has begun.
477,But economists say that wouldn’t necessarily mean a recession had started.
478,"During those same six months when the overall economy might have contracted, employers added 2.7 million jobs — more than in most entire years before the pandemic."
479,"Wages are also rising at a healthy pace, with many employers still struggling to attract and retain enough workers."
480,"Ad
 Still, slowing growth puts the Fed’s policymakers in a high-risk quandary: How high should they raise borrowing rates if the economy is decelerating?"
481,"Weaker growth, if it causes layoffs and raises unemployment, often reduces inflation on its own."
482,"That dilemma could become an even more consequential one for the Fed next year, when the economy may be in worse shape and inflation will likely still exceed the central bank’s 2% target."
483,"“How much recession risk are you willing to bear to get (inflation) back to 2%, quickly, versus over the course of several years?” asked Nathan Sheets, a former Fed economist who is global chief economist at Citi."
484,"“Those are the kinds of issues they’re going to have to wrestle with.”
 Economists at Bank of America foresee a “mild” recession later this year."
485,Goldman Sachs analysts estimate a 50-50 likelihood of a recession within two years.
486,"Among analysts who foresee a recession, most predict that it will prove relatively mild."
487,"The unemployment rate, they note, is near a 50-year low, and households are overall in solid financial shape, with more cash and smaller debts than after the housing bubble burst in 2008."
488,"Ad
 Fed officials have suggested that at its new level, their key short-term rate will neither stimulate growth nor restrict it – what they call a “neutral” level."
489,Chair Jerome Powell has said the Fed wants its key rate to reach neutral relatively quickly.
490,"Should the economy continue to show signs of slowing, the Fed may moderate the size of its rate hikes as soon as its next meeting in September, perhaps to a half-point."
491,"Such an increase, followed by possibly quarter-point hikes in November and December, would still raise the Fed’s short-term rate to 3.25% to 3.5% by year’s end -- the highest point since 2008."
492,"The Fed’s move will raise its key rate, which affects many consumer and business loans, to a range of 2.25% to 2.5%, its highest level since 2018."
493,The Federal Reserve on Wednesday raised its benchmark interest rate by a hefty three-quarters of a point for a second straight time in its most aggressive drive in three decades to tame high inflation.
494,"The Fed’s move will raise its key rate, which affects many consumer and business loans, to a range of 2.25% to 2.5%, its highest level since 2018."
495,"The central bank’s decision follows a jump in inflation to 9.1%, the fastest annual rate in 41 years, and reflects its strenuous efforts to slow price gains across the economy."
496,"By raising borrowing rates, the Fed makes it costlier to take out a mortgage or an auto or business loan."
497,"Consumers and businesses then presumably borrow and spend less, cooling the economy and slowing inflation."
498,"The Fed is tightening credit even while the economy has begun to slow, thereby heightening the risk that its rate hikes will cause a recession later this year or next."
499,"The surge in inflation and fear of a recession have eroded consumer confidence and stirred public anxiety about the economy, which is sending frustratingly mixed signals."
500,Stay informed about local news and weather.
501,Get the NBC10 Boston app for iOS or Android and pick your alerts.
502,"With the November midterm elections nearing, Americans’ discontent has diminished President Joe Biden’s public approval ratings and increased the likelihood that the Democrats will lose control of the House and Senate."
503,"The Fed’s moves to sharply tighten credit have torpedoed the housing market, which is especially sensitive to interest rate changes."
504,"The average rate on a 30-year fixed mortgage has roughly doubled in the past year, to 5.5%, and home sales have tumbled."
